subreddit,selftext,title,created_utc
books,,Any nosey ideas?,1617059969
books,"Hi guys,

I'm looking for two types of book.

First, I'm looking for very powerful books that have a great sense of depth and meaning behind them. The type of book that leaves you thinking about it for a while. However, not something that's too long. I have a very short attention span so anything from like 200-400 pages would be great. 

And second, something similar to Donna Tartt's Secret History. I fucking loved that book and love the whole dark academia genre. 

Thanks in advance.",Book Recommendations,1617059025
books,"I just finished reading Parable of the Sower by Octavia Butler. I really enjoyed it but some of the content was hard for me to read (I.e. cannibalism, rape, constant murders, and people being skinned). Has anyone read anything else by her? I’m curious to read more of her work but am unsure if I can stomach reading any more tough/gory things like cannibalism/rape/etc. It was a bit much for me to stomach and I can’t read more of that kind of stuff. 

Has anyone read Parable of the Talents, or Fledging? How’s the content?",Has anyone read “Parable of the Talents” or “Fledging” by Octavia Butler? How’s the gory content?,1617058847
books,"“I’ve been in twelve European countries; I’ve seen Moscow, Paris, and London, among other cities, and experienced Bolshevism, Parliamentarianism, and Fascism close up, as an ordinary person among ordinary people. Are there differences? Yes, substantial ones. But from what I can tell the distinctions are mostly ones of form and coloration, of the rules of play, not differences in the greater or lesser fortunes of common people, which Candide is so concerned about. And the individuals I encountered who were meek, subservient, and uninterested in any existence other than the one they were born to didn’t seem any unhappier in Moscow than they did in Paris or Berlin—all of them lived by adjusting their souls to the prevailing conditions.”",Reading “A Woman in Berlin” has been absolutely heartbreaking and has changed much of how I view the world. This passage in particular has left me feeling rather hopeless.,1617058518
books,"So like everyone else on the planet I studied the Great Gatsby at school. I loved it, and have read it a few times since. I’ve always had a great appreciation for Fitzgerald’s skill at conveying a national mood in a story, but my recent re-reading was a totally new experience.

The parallels between the 1920s and 2020s are a cliche at this point, and it’s only 2021, but I do think this last year gives a new kind of reading to the book where you feel the atmosphere so readily it’s almost dizzying. I did some academic reading recently about the cultural amnesia of the 1918 influenza pandemic, because (along with WW1 of course) it was this staggering global trauma, but it undoubtedly contributed to the glorious, dangerous hedonism explored in Gatsby. 

Between the traumatised hedonism and rampant socio-economic inequality that, imo, form the axes of the Great Gatsby, I honestly think the collective experience of the last year(s) lends a whole new dimension to reading this classic.",Re-read The Great Gatsby the other day and the last year has completely changed how I read it,1617058217
books,[removed],Books like Shuggie Bain,1617057830
books,"I recently just finished reading Far From You and it has to be the best book iv read in a long while, if not the best book iv read period, this book made me truly feel for it and it’s characters, there were some chapters where I was in tears. 
I highly recommend this book to anyone looking for something to read",Far From You by Tess Sharpe is the best book I have read in a while,1617057368
books,[removed],Harry Potter/J.K.,1617057323
books,[removed],Books in regard to committing crimes/criminals,1617056723
books,[removed],What is your favorite grim children's moral-of-the-story lesson from when you were a child?,1617056679
books,"I didn’t understand all of Benjy’s chapter, but after googling some background information (what the italics meant, family trees, etc.) I felt I had a fair grasp on what was happening. But now I’m at Quentin’s chapter... it’s even harder than the first part! There are whole paragraphs where I only seem to make sense of a sentence or two. Am I reading it wrong?? Help???",I’m reading “The Sound and the Fury” for the first time and I’ve just got to Quentin’s part - what. is. going. on.,1617055228
books,[removed],Already Hit My 2021 Reading Goal!,1617054949
books,[removed],Salem And The Sphinx War: The Beginning (Dragon Friends Of Delmore Book 1),1617054690
books,"”The secret of the Old Woods is a book by Buzzati that I was recommended by my Italian friend. All his short stories and novellas were collected into a volume called “60 Racconti” or ”Sessanta Racconti (""sixty stories"")”. I am not exactly sure if it has been translated into English, however. It has been translated into Turkish, so I'll definitely read it when I have the opportunity to read it. Italo Calvino is also on my list. I can't wait to read his works as well. I am currently reading Cervantes' Don Quixote for a literature class. And I'm reading The Forked Garden (El Jardín de senderos que se bifurcan) by Jorge Luis Borges. I am also reading Slavoj Žižek's The Art of the Ridiculous Sublime: On David Lynch's Lost Highway. In this mess, I hope I can focus on reading the books I want or find time to write. 

And what are you all reading these days?","Just wanted to share who I am reading books by (Borges, Cervantes, Calvino, Buzzati, Zizek)",1617053569
books,,Books Every American Should Read,1617053028
books,[removed],The Dissension Process Kindle Edition,1617052936
books,[removed],"I sometimes start a book and take a while to come back to it, are there any useful sites/apps/resources that are good at chapter summaries?",1617052912
books,[removed],Custom book services for online comics and PROSE stories?,1617052699
books,"Prior to my reading of the book, I had heard many folks raving about this book and how fantastic it was, so naturally I decided to give it a try. My fellow Redditors, I was not prepared for the feelings this novel engendered in me. It just radiated warmth, charm and whimsy.  

Story-wise this is defintely a unique one. It follows a man who has a job that entails writing reports on orphanages that house magical children. One day he is given a task of going off to an orphanage where the ""dangerous"" magical children stay...
The book sparks discussions about whether we should condemn groups of people based on their exterior or look deeper and if objectivity is really the best way of going about matters that have to do with people's livelihood. It shows the negligence of bureaucratic control  and the corrupt nature of people fearing what they cannot understand. There are parallels that could be made between some situations in this book and our world which adds to just how much of a good layered story this book is. The writing is brilliant.

The characters are all fantastic (well not all but the main characters). Linus Baker you poor bastard, how many times did you have to suffer an almost heart attack at the sight of Anti-Ch-, sorry, _Lucy_? But in all seriousness I loved reading from his pov and his self-deprecating disposition and his desire to flee certain situations but finding himself unable to made me cackle alot. This book is flipping funny yall! Its crazy the amount of times I burst out laughing! 

Talia is my favourite character out of all the kids. I love every single one of them though. They are all unique, loveable, charming and absolutely brave. 

Overall this is a story I will be revisting in the future and one that is sure to stay with me.",The House In The Cerulean Sea is a wonderful and warm book,1617051656
books,"I finished *Snow Crash* a few days ago, a book I’d been meaning to read for a long time, and I largely enjoyed it—even if the experience of reading it was, as I’ve found with a lot of foundational cyberpunk novels, not exactly mind-blowing because of much of what they describe has more or less come to pass. I suppose that’s mind-blowing in its own way.

But something that really took me by surprise was the extended and detailed sex scene between Y.T. and Raven, and I’m still trying to work out what to think about it.

Just as a recap of it’s not familiar and/or stale in your memory: at a fairly late point in the book, one of the two POV protagonists, Y.T., a fifteen-year-old girl, has sex with one of the antagonists, Raven, whose precise age isn’t mentioned but is implied to be around 30.

As I was reading and growing increasingly uncomfortable, I started trying to figure out why the scene was in the book at all—or at least why it was described in as much detail as it was. 

I first thought about *Lolita*, which is one of my favorite books, but Nabokov renders those sex scenes in such a way that they’re either implicitly or explicitly gross, and Stephenson doesn’t seem to be going for that effect.

I thought about its plot function, but from what I can tell, it mainly works in that sense to moot Raven, whose role in the plot had for the moment run its course (until the very end of the novel).

It seems possible that it’s there because Stephenson is using this structure of history repeating itself, what with the long exegesis scenes about Sumerian mythology. Given that he emphasizes the incidences of father/daughter incest in that mythology, there could be something there, but I haven’t tried to map the Sumerian references to the novel’s plot beyond what Stephenson explicitly does.

I guess I’m looking for a reason that what I certainly perceived as an icky scene but one which really didn’t seem to be intended as such has a purpose beyond titillation, especially because it’s the only scene of its kind in the book (while there is a lot of gory violence throughout). 

And I wonder if anybody has thoughts about that?",The sex scene in Snow Crash,1617051573
books,[removed],Just finished Fear &amp; Loathing in Las Vegas. Such a great book. Really makes you think about the whole 60s scene and it’s lasting effects on people’s minds and culture.,1617051311
books,[removed],Starting Point for Ancient Greece/Rome?,1617050741
books,"Im pretty sure I read a prediction someone posted in this sub a week or so back about how they thought Fox was going to jump to the defense of the ""OOK and CLUK"" book that the author Dave Pilkey along with the publisher voluntarily decided to pull from shelves. Well it looks like it was pretty accurate. I recommend reading some of the comments of the article if you want to have a bad time.","Fox is pretending ""Captain Underpants"" was Canceled",1617049597
books,"I picked up this book March 28th. Today, March 30th, at 1:42 am, I started continuing what I finished the past 2 days.

I used to write. I used to love literature more than anything. How damn lucky am I to pick up good books to make me fall in love all over again with reading?

I cannot stop crying for the last 80 pages of the book. I have not seen the movie nor do I intend to watch it. I know very well that most movie adaptations of books aren't as good. Especially when it's from netflix. I wish this book stayed as a book, and no movie franchise. It could've been our little secret. ""Secrecy is life.""

No matter how confusing Finch's character was, I still somehow understood him. I felt his pain... with just words that I read. He could've had a good life with Violet. He just had a very bad childhood, a very traumatic past... He deserved happiness for once after a while. He deserved love. Even someone as he who thought he couldn't be loved, could be loved after all. I cried for the bits and pieces whenever Finch talked negatively about himself. As someone who's an expert to self-loathing, I understood it too well. I wanted to tell him the opposite of the things he said about himself. I wanted to hug this fictional character so bad. You're not too bad Finch. Please, live. Stay.

If only I could change the outcome of the story.

As for Violet, I couldn't feel anymore sympathetic. She lost two important people besides her parents. Two different situations too. She's unbelievably, undeniably so fucking strong. I was proud when she started slowly started living again during Finch was alive. And I'm glad she still kept living after his death. I don't think I'd be able to myself if I were here. Grief is too much. It consumes you, until you're empty just like she was for some time. That's why I say she's strong. She took all that negative energy to help others in a similar situation of Finch and herself.

Non-spoiler summary:
I give it a 9/10 only because it hit too close to home for me. It may seem the cliché ""oh the popular girl falls in love with the weird boy"" thing, but you need to trust ths story line. They're both weirdos, just in different degrees. Both are lost wanderers who seek for what it's like to have a perfect day after all the bullshit they went through. It's a YA adult book that deals with these warnings: depression, suicide, traumas, and abuse.

Let me know what you think.","Why I can't stop crying over ""All The Bright Places"" by Jennifer Niven",1617049593
books,[removed],Fiction books recommendation,1617049515
books,[removed],"As expected Fox is pretending ""Captain Underpants"" was Canceled",1617049129
books,[removed],I need to find more books,1617048860
books,[removed],Looking for a good book on nutrition (or potentially general physical wellness),1617048601
books,,Let’s hope the latest book TikTok controversy is the last,1617048494
books,"Jaycee is such a brave person and I admire her for everything she’s survived but this book is so disturbing. It’s like an actual image of hell. Reading about this innocent sweet little girl and the horrific things she goes through actually made me fucking cry. It shook my faith in god that someone could suffer like this and no god stepped in. Reading it is so painful I had to skip whole chapters, I mean I’d just come off reading Hope by Amanda Berry and that didn’t really disturb me. 

Please don’t read this book if you value your own sanity",A stolen life by Jaycee Lee Dugard is the most disturbing thing I’ve ever read in my life I can barely recover,1617048340
books,"I just spent the last 7 months reading, struggling but mostly loving Robert Jordan's and Brandon Sanderson Wheel of time. Up until this 14 book long behemoth, the only books I'd ever read were YA fantasy which I loved but for me, epic or high fantasy (I'm not sure what the correct term is) is my favorite genre. I'm busy suffering major sadness and happiness after finishing such a great collection of books (mostly) and am desperate for something new. (not looking for suggestions as that's not allowed for some reason) I am so looking forward to exploring further into this genre. I'm not very familiar with what is considered to be the best series at the moment so what are your guyses favorite fantasy books?",I just finished my first epic fantasy series and I loved it! Robert Jordans Wheel of Time.,1617048055
books,"When I read Wuthering Heights, particularly when I watch film depictions (because it's ultimately a point the directors and writers have to measure and come to a decision on), I contemplate how extensive Heathcliff and Cathy's intimacy went before she married Edgar in the book. As per the time period, the book doesn't mention anything indicative one way or another so there is a lot of mystery to me about whether their romantic love was reinforced by intimate sexual love. Personally, I prefer the idea that their relationship was passionate yet unrealized physically, because so much of the emotion I feel emerges as Cathy realizes her regrets as she is dying. At the same time, I'm not gonna lie, part of me likes to imagine they were doing the dirty in her childhood bedroom. But I can't imagine her making the choices she made with Edgar if they had already been so intimate. 

If I were to theorize, I'd say that Heathcliff and Cathy were platonic through to her marriage, but Heathcliff developed sexual feelings (obviously) well before Cathy did. It took her dying to realize that she wanted Heathcliff all along?

Tell me what you think!!",Wuthering Heights: How far do you think Cathy and Heathcliff's intimacy went before her marriage to Edgar,1617046278
books,[removed],Anyone else cry at the end of where the red fern grows,1617046064
books,"Hey everyone!

I'm currently in the army, frequently enough to visit the library but not enough to return the books, so this hobby is almost dying. I'm not making enough money to buy books neither, since they are costly here (Even if I did buy some, they are taking important space).

Recently one of the people here brought his Kindle tablet, which seemed at first pretty ridiculous until he let me had it for a few hours. I was astound honestly!

I was looking around the web, and it showed promise. People liked it and whatnot. But instead of the reviews I wanted to ask you all - do you think Kindle is worth it?

Thanks in advance!",Should I buy Kindle?,1617045990
books,"I often complain about screen adaptations of books because they aren't looks like I was imaginaning during reading. But despite this I still like moment when I watch movie and I can see how other people imagined books scenes.

So, which book that wasn't adapted to screen, could be great movie/TV series? Me, as Metro 2033 fan, I wish that Dmitry Glukhovsky book will be adaptated as movie or TV series. Maybe it can be hard to show exposure and everything about whole Metro community but I think that add a few more threads and dialogues could help.",Which books could be great movie/TV series and why?,1617045119
books,[removed],Is there any English,1617045074
books,,AYT Kimya 11. Sınıf Ders İşleyiş Modülleri Modül 1 Modern Atom Teorisi%20,1617044193
books,"I think this novel works on three different levels. 1. The love story triangle trope: there are enough references to the Notebook that it’s clear she picks Wyatt. 2. The Quantum Physics level: one Timeline chooses Wyatt and the other timeline chooses Brian. 3. The Egyptian level: she’s dead and this is her journey through the Netherland in search of Osiris. After the challenges and the demons, she gets everything she wants for eternity: she gets them both.",The ending of The Book of Two Ways,1617043268
books,[removed],Can I straighten out books that are warped due to humidity?,1617043092
books,[removed],Estate sale find,1617042727
books,"I have been asked to write an analysis on the main characters of The Great Gatsby, and I wrote my analysis  on Gatsby, Nick, Daisy, and Tom. I mainly see Gatsby as the overall main character, with Nick not far behind because he is narrating. Would it be wrong if I cut Daisy and Tom from my analysis? They are obviously very important, but the further I got into the novel, the more I realized they were being affected by Gatsby and not actually the focus. 

P.s. this is for online grade 11. I can't really ask my teacher because it takes him days to get back to me with a reply, so I am just looking for some opinions to help me make my decision. The work itself is already complete.",The Great Gatsby: Are Daisy and Tom considered main characters?,1617042529
books,[removed],How to fix wavy pages in a book?,1617041806
books,[removed],Files of amr13155,1617041356
books,[removed],Book in which the first person narrator dies,1617041283
books,[removed],You guys should read The Edge Chronicles,1617041164
books,"Hi all,

So when I was in 6th-8th grade I read a book for school in the summer. Now I really wanna read it (I’m in college now but like to re read old books). I can’t remember the name what so ever. What I do remember is that Vikings kidnapped a teen boy and he went on a “journey” with them and returned home at the end of the book and that at the end there was a revelation that his sister or mother turned into a crow and actually accompanied him the entire way in the journey. Any help is appreciated.",Need help finding a book,1617041107
books,[removed],"Finished reading ""The Curse of Lono"" by Hunter S. Thompson",1617040309
books,,"Cracking the Case of London’s Elusive, Acrobatic Rare-Book Thieves",1617039505
books,,"The Drowning Kind, a review by Sherry",1617038962
books,,"Mexican Gothic, a review by Cat",1617038959
books,[removed],Help! I'm trying to find this book.,1617038829
books,"Delete if not allowed:
I recorded a podcast episode about George R. Stewart's 1949 sci-fi classic, ""Earth Abides"".
https://podcasts.apple.com/nz/podcast/earth-abides-w-geordie-guy/id1513079729?i=1000514793323
We discuss how many horror films have stolen the premise of a survivor waking up in the aftermath (looking at you, Walking Dead), the pros and cons of a flawed narrator-protagonist, and why pants have no place in the future utopia.",Earth Abides: Genre Discussion Review and Analysis,1617038798
books,[removed],is Dexter Morgan in the novels by Jeff Lindsay as intelligent as the tv show Dexter?,1617038783
books,"I'm tired of the same old description and dialogue rhythm that goes on in every book. You hear someone talk, another person replies, and then you spend a couple paragraphs inside the pov character's head. Isn't there any author doing something else? Like, I don't know how to change that but there must be someone doing something different, right?",I wish Books would do something new,1617038733
books,[removed],i have a question about Dexter novels by Jeff Lindsay,1617038326
books,[removed],is Dexter Morgan from the books as intelligent as the tv show Dexter?,1617038181
books,[removed],WHAT CHALLENGES DO ASPIRING AUTHORS FACE?,1617038160
books,[removed],Which male book character would you be concerned to see your daughter bring home?,1617037212
books,[removed],is book Dexter Morgan as intelligent as the Dexter from the tv show?,1617037121
books,[removed],Looking for good science fiction (but not military science fiction) or thriller in Kindle Unlimited with free Audible narration,1617036906
books,This isn’t necessarily about books but it is something that steamed from a book club I am in on Facebook. I don’t want to sound insensitive I am just ignorant and need answers. Someone posted a picture of covers and didn’t say the title in the text part of the post. Another person said “Can you put the titles so that visually impaired people can see?” the creator obviously did but it got me thinking how could someone not see the picture but read the words of the caption? Again I am not trying to be insensitive I am just IGNORANT.,Descriptions,1617036858
books,[removed],Tarzınıza Göre Harika Tasarımlar Yapabileceğiniz Ücretsiz Siteler,1617036689
books,"The common assumption is the more books you read, the better. That especially takes the form in a books-per-year metric; you see posts here all the time where people outline the 150 books they read in a given year and how it was such a great, enriching experience. I know many of those posts are made purely out of a passion for reading, but a lot of times it's reduced to a contest to race through as much content as possible.

As the years have gone on, I've tried to increase the number of books I read every year. I'm not going to great lengths; I think in 2015 I was at 30, and last year I read 38. So this year, I picked 40. That's immediately put me in this mindset that I have to read about a book a week, so I can give leeway to longer or more difficult reads. 

However, picking most the books I read based on ""how quickly can I read this?"" has been a drag. I still like most of what I read, but I'm choosing based on length, genre, and how contemporary/readable the prose seems. I'll log a book and it'll say I'm now one behind, so the next one has to be even more readable. And the reading itself is less fun when you're calculating ""ok, I really need to push through another 20 pages before bed or I'll fall behind.""

Earlier this month, I picked up Warlock, by Oakley Hall. It's a great read. The prose is excellent, the characters have great depth, and I'm excited to see it all unfold in front of me. 

But last night, two weeks in, I cracked page 100. Of \~470. I'm enjoying it. I'm not putting it off. It's just a slow read, pure and simple. 

I want to get back to reading on a whim, and just letting the book I'm in be the book I'm in. Heck, maybe this year I'll just read two more books.",Fetishizing reading metrics has trained me out of stopping and enjoying the book,1617036183
books,,Lord Of The Rings Book Publisher Sold To News Corp For $349 Million,1617035621
books,"So I've been working my way through Murakami's ""The Elephant Vanishes""; it's my first experience of his work and I'm thoroughly enjoying it. I couldn't resist coming somewhere to gush about the short story ""A Slow Boat to China"" because God damn it might be one of the most subtly beautiful pieces of literature I've ever read. 

All of the familiar Murakami themes are there (memory, direction, depression, relationships, childhood, etc) but something about this story in particular just seemed to reach right down into my soul, I'm not exaggerating when I say it gave me actual goosebumps, something not many stories can do. There's a description near the end of city living and let's just say I read it multiple times.

So yeah, I just wanted to gush really and if anyone reads this who's yet to try his work I'd strongly recommend it. I'll certainly be moving onto his novels after this.",Haruki Murakami- A Slow Boat to China,1617035079
