subreddit,selftext,title,created_utc
books,"I know that every outlet and social media outlet has been inundated with thoughts about Rooney so I’ll keep this focused on the novel. 

I just want to know if anyone else has the same issues as me. I haven’t seen the show, I actually picked the book up because I’d read online a short of her’s ""[Mr Salary](https://www.irishtimes.com/culture/books/mr-salary-a-short-story-by-sally-rooney-1.3016223)"" which moved me. 

Unfortunately everyone is reading Rooney and I had no luck in the library and had to buy one of those terrible post-adaptation editions with the advertisement for the Hulu show on the front. 

Anyway --

I'm ignoring the pugnacious hype around Rooney  - ""greatest new millennial writer"", et al - and just focusing on the book in a vacuum.

I'll say outright that isn't really literary fiction, in the most core sense. It's not really a YA novel or a romance novel either and being ""genre"" isn't bad at all, I just think it's been fundamentally miscategioried.

I devoured the book in  day or two, the same way I would with a lightweight thriller. This, to me, shows it as a compelling read, but also not one that requires study. Rooney uses the exclusive third-person point-of-view of the two main characters as her prose and they are both analytical and intelligent, if bad at communicating (more on communication later). Normal People is filled with ""Marianne thought x"" and ""Connell felt y"" which meant that any requirement for analysis of the text by readers was gone  the characters did it for us. I know Connell ditches Marianne for the prom for another mean girl because the prose tells us - Connell felt anxious about his friends seeing him with Marianne, the allegedly frumpy high school he'd been sleeping with. Except this had already been established - we know this is what Connell wants and that he values he friend's views over Marianne. Having it read back to us an explanatory footnote for why a MC acted poorly is lazy.

To her credit, this is the only way that Rooney generally dumps info on the reader. Other parts of the story unfold at a more leisurely and natural pace, especially Marianne's abusive family, which we finally see the brunt of in the final chapters.

Some of the professional feedback I've read says this is ""class-conscious"" romance, and, while Rooney sets several scenes where characters discuss their different economic needs, she actually relies on the power imbalance developed by Connell (the economically deprived character) refusing to acknowledge Marianne in high school as the catalyst for conflict. There is one major conflict that arises due to class issues -- Connell loses his university job and can't pay rent. He's too embarrassed to ask to move in Marianne, who has a free apartment from her mother, and they break up (again). Another possible example is that Connell has to go to borrow money from Marianne at one point,.

But for the most part, the central conflict between Connell and Marriane is the fact that there was a time when Connell was embarrassed by her and (in her eyes) continues to be in some way. This is only resolved at the end when he decided to touch her in publics in front of their old high school friends.

This also (partly) informs Marianne's submissiveness to men , because her first relationship is with a guy who wants her as secret. She keeps getting in relationships with bad men who beat her in bed and berate her outside it. The book is unclear whether Marianne has a fetish for submissive roleplay or whether this is her low self-esteem; BDSM communities have criticized this as being inaccurate and said that sub/dom relationships can be consensual and safe. I don't know that was Rooney's point, exactly, but she could have been more clear about Marianne's engagement in BDMS play as an actual sexual preference rather than a character trait borne from trauma. It is important to note that the novel mostly ends with Marianne being ""saved"" from BDSM by engaging in thoughtful and safe sex with Connell, whose most submissive sexual action in the book is informing her quietly during sex ""you're all mine"" - and the book is unclear whether Connell is just doing this to please her.

Rooney's primary thesis, I suppose, is that these characters would have ended up together if they'd communicated properly. Which is a fine thesis; communication in relationships is important. However, the nature of the miscommunications Connell and Marianne experience are almost sitcom-level, and it makes you want to scream. When you have main characters who are supposed to be in their twenties who cannot verbally express themselves to one another properly (but their internal monologues are succinct, verbose and very clear), it's an irritating tool to re-use throughout.  


Regardless - this is enjoyable. it has been massively overhyped. it's unique in it's commitment to framing Marianne and Connell's passing by of each other at each stage of their life a primary plotting tool, something that is used rarely outside pure romance, to attempt (but, in my opinion, fail) to make some larger comments about barriers posed by class and communication. 

Thoughts?","Yes, another Sally Rooney ""Normal People"" post. But I do think I have a new discussion point.",1605364282
books,[removed],Rain doesn’t dampen a parade up the leaderboard during Masters’ first round,1605364269
books,,4 games Indians have played more after PUBG Mobile ban in India.,1605364229
books,[removed],How do you find a book that doesn’t appear to be on sale anywhere anymore?,1605363867
books,[removed],Looking for book,1605363801
books,[removed],"Is Carol Dweck's ""Mindset"" worth reading? Or is it just an elongated blog post like many self development books?",1605362916
books,"OK. So, as an aspiring writer, I was drawn to Romance fiction because it is virtually the bestselling genre in ebook stores. And after a lot of hesitation on my part, I decided to look at romance novels and short stories. What is so unique about them that attracts so many buyers?

What I've resolved so far about self-published romance is that they're mostly terrible. And here are two reasons why.

**1. Poor Writing**

If like me you've been spoilt by beautiful stained glass prose common in classics and literary fiction, you'd be turned off by the bland and monotonous prose of self-published fiction. To be fair, though this applies to most fiction published today. Even the traditionally published books. Widely successful and popular authors like Stephen King and David Patterson write very bland prose. 

With the Romance I've read, I'm amazed at the apparent lack of creativity on the writer's part. I mean, in order genre, the writers try to be creative in their writing, but rarely so for Romance writers. And this is because Romance writers have to publish rapidly in order to keep up with the insatiable demand of ravenous readers. So authors just type, edit grammar and spellings, and click publish.

**2. Harmful love stories**

Characters instantly falling in love with strangers whom they've only met. Then having sex very shortly after the first meeting. Often times the sex is unprotected, there is no fear of unwanted pregnancy or STI between the lovers. Note that most of the readers of these books are girls as young as 15, subconsciously learning about boys, love, and sex from these books. 

Learning about boys, love, and sex from Romance fiction is a recipe for disasters. It can bring about poor decision makings among these girls, culminating in rape, unwanted pregnancies, and STIs. STIs like Herpes, which is incurrable may be transmitted even with condoms, yet these romance writers are writing explicit scenes of unprotected sex as love stories for young girls.","Why Self-Published Romance Fiction Are Mostly Bad, Very Bad",1605362847
books,"I am an avid reader and have read almost every day since I could read...it’s how I manage my anxiety and depression....but lately I’ve been in a hole of just reading books that pass time and really don’t make me feel anything.

I want book recommendations that will destroy me emotionally or that will expand my consciousness. 

I need books that will entrap me page for page until I am consumed. 

I’m in a rut and need the help of my fellow literary lovers to point me in the right direction",Help me out of this hole,1605362469
books,[removed],Does anyone keep a handwritten book journal?,1605362151
books,[removed],Romance novel recommendations,1605362135
books,[removed],"Don’t upvote this, I just want a quick easy answer from anyone who knows... does House of Leaves have body horror?",1605361351
books,"I tried reading the first chapter but it was so dull that I couldn't get into it and gave up. I really liked the story plot though so a week later I opened the book in the middle and started reading, not really expecting to get caught up in it. Well, I got hooked because that was the sport all the action was happening and I continued to read a fair amount of pages. Problem now is a bunch of stuff happened before this and I want to know what yet I also want to keep going from the spot I started. So I've split my mind in half by starting the book in the middle because I'm too far in to start over yet I want to know how everything started.",Anyone ever start reading a boo in the middle and regret it?,1605361238
books,,Handcuffed: A Prison Scenario Book,1605360693
books,"Just finished Kite Runner. Can we just say that Khaled Hosseini is one of the best writers alive. Although it was not better than Thousand Splendid Suns.
After reading some of the lines, I just took a break and stared at the wall in contemplation. And after finishing my daily dose of reading, I didn't feel like doing anything. Just lay on my couch and thought about it for like 10-20 minutes. And isn't it weird that I learned more about the history of Afghanistan because of Hosseini's novels and not because of school or documentaries. At first I hated Amir for exploiting And never standing up for Hassan, but loved how he just redeemed himself, and the twist that Hassan was actually his half-brother was shocking, and the part when we came to know that Hassan died, was heart breaking. 
Planning to read And the Mountains Echoes afterwards as well",Kite Runner,1605360034
books,[removed],What's you book story—how did you fall in love with reading.,1605360006
books,[removed],What's your book story?—How did you fall in love with reading?,1605359834
books,[removed],a streetcar named desire,1605359448
books,"Despite the internet making information more accessible than any other time in human history, political and cultural polarization is at the forefront of national conversation. Each side does not understand--and more importantly, refuses to understand--the other, ignoring millions upon millions of web pages that detail exactly why one side feels a certain way.  According to a 2014 Pew Research study, those who identified as Republican or Democrat felt animosity toward the opposing party at twice the reported amounts from 1994. Now, as America looks back the 2020 election and its consequences, violent rhetoric has been mounting, and actual attempts on politicians’ lives have been planned. Why and how does everyone feel that they are so unquestionably right? How can one side call Trump the worst president ever while the other side calls for his face to be placed on Mount Rushmore, even when both have access to the same information? Moral psychology and the refusal of an individual to admit that their side is the “wrong one” is the subject of Jonathan Haidt’s 2012 The Righteous Mind: Why Good People are Divided by Politics and Religion, a book that has proved to be more and more relevant with each passing year and news cycle.

A book that judges psychology and its relationship to political and personal life is destined to one of two futures: prophecy or pseudoscience. Although seemingly brilliant at the time of their conception, ideologies that do not prove to be accurate save for a few situations can be deemed unsuccessful. The head and the heart’s relationship, or how emotions and reason interact, has been the subject of different philosophers’, politicians’, and psychologists’ speculations. Many of these theorizations are analyzed by Haidt in his first chapters along with their shortcomings. He ties each to political movements and schools of thought, where they came from, and where they do not succeed. As he does so, Haidt charts his own journey from a graduate student running experiments to his first pieces of published research, all the while developing the reader’s understanding of moral psychology along with his. As such, he contextualizes his argument in his field and the reader’s mind. He states that the grounds for morality are not just avoiding harm and promoting fairness, but that they are expansive, intuitive, and the foundations upon which people build their logic. In politics and religion, reason comes as justifications for gut feelings of respect and disgust. Individuals then align reason and logic with that feeling, and construct or join a hive around it. Often these hives are assigned from family or friend groups, and lead to further polarization and less critical thinking.

In the past eight years, Haidt’s work has proven to be growingly relevant. Disgust and distaste for the other side has become palpable enough to ignite far left and right groups, and politicians are unlikely to vote for another side’s policy out of principle, regardless of actual thought. When President Clinton was impeached in 1998, Alan Dershowitz (R) stated the following:

&gt;“It certainly doesn't have to be a crime if you have somebody who completely corrupts the office of president and who abuses trust and who poses great danger to our liberty, you don't need a technical crime.”


That is, in spite of acknowledging that the actions of the then-President were not a crime, Dershowitz (R) said that the President should be impeached regardless. This was almost certainly justified in his mind. The opposition, being wrong, should be impeached. Later, he served as President Trump’s attorney for his own impeachment. While this was happening, he said that quid pro quo wouldn’t matter, because as long as the President thought that his election was in the best interest of the country, he couldn’t be impeached. His hypocritical attitude isn’t one that acts alone, however. Rosa DeLauro (D), in Clinton’s 1998 impeachment, stated the following:

&gt;“Benjamin Franklin spoke of impeachment as an alternative to assassination. Today this body is contemplating a constitutional assassination, driven by a naked partisanship, almost without lawful and civil bounds, the Republican majority is moving to impeach an elected president of the United States”


She said that impeachment was a contemptible act, only happening when the opposition wished the current President dead. DeLauro (D) later voted to impeach President Trump in 2020. This, again, was likely fully justified in her mind. When impeachment happened to a candidate from her own party, it was an attack. When her hive was looking to impeach President Trump, it felt like a logical action based off of justice. Each side has constructed a hierarchy deeply separated from the other by moral reason, which, Haidt states, comes from a sense of loyalty to one community and their process of reason, rather than a commitment to truth. Different communities believe that they’re correct because of different logic rooted in different gut instincts. 

To prove this, Haidt presents studies he has conducted and compares the reactions of different nations, political communities, and individuals to hypothetical situations. He found that each of these groups understood morality in fundamentally different ways. When presented with situations that violate social rules or guidelines, the subject reacts in ways that align with a small set of certain values, including care, fairness, loyalty, authority, sanctity, and liberty, each of which then falls into different higher-order categories. Although Haidt states that these elements are subject to change, a person’s sensitivity to each can predict their political ideology. As such, a person’s opposition seems to be fundamentally blind to the world, as they don’t hold the values that the person understands to be true.

Empathy is tossed by the wayside, Haidt says, and apathy is taken in. This process of hypocrisy and thought-after-judgement constitutes the reality into which Haidt writes. Emotions, driven by disgust and disrespect, assign a core piece of morality upon which logic can be built. This thought process by which each one of us constructs our worldview--intuition before consideration and the subsequent animosity of the opposition--is what he is looking to battle. In Haidt’s introduction, he states that “[his] hope is that this book will make conversations about morality, politics, and religion more common, more civil, and more fun, even in mixed company” (xii). Instead of creating enemies of straw, Haidt asks his readers to consider them as people. One must fundamentally understand that those they speak with understand reality in a different way that they do, and they must be willing to be compassionate to--and listen to--those whose views are not in line with their own. Climbing deeper into one’s own throats inevitably leads to choking. We must reject our reactive tendencies to silence that which is disagreeable, Haidt says. Instead, we must engage. If we do not, we risk losing that which has made us understand each others’ condition: empathy.

I very much recommend this book for any and all, and would love to hear other thoughts.","Looking back on Jonathan Haidt's prophetic 2012 book, The Righteous Mind: Why Good People are Divided by Politics and Religion",1605358356
books,[removed],Eyes of dragon episode one,1605358327
books,,Kilroy Was Here - Absolutely Entertaining!,1605357667
books,,"Hey, I write books, and I’m trying to gain publicity so it’ll be easier to publish. Can you help me?",1605357230
books,,"A recently discovered archive of previously unseen letters, drawings and poems by Ted Hughes and Seamus Heaney - two of the great post-war poets - has been acquired by Pembroke College, Cambridge, which will put them on public display.",1605356891
books,,Are Rereadings Better Readings? — The New Yorker,1605353479
books,"SPOLIERS AHEAD:

East of Eden

I teach grade 3 and I only ever saw descriptive writing as a means to enrich a text. After East of Eden I appreciate it as a means unto itself. I read page after page of enjoyable description.

I do feel like the characters are a bit binary, born either good or bad. I know that's kinda the point of the book but I think the real world is a bit more complicated than thatm

Anna Karenina - My favourite

I loved Anna Karenina. I loved how Anna was so loved but so simple. I loved how the characters are all different but you can appreciate their point of view and how their upbringing/circumstance made them who they are. Levin's growth was fantastic. 

The Count of Monte Cristo

I enjoyed the philosophy of this book. I liked comparing characters and their response to similar situations. I like the theme of joy and misery only existing in comparison with each other. I like the central message of wait and hope.

I was a bit bored through the central chapters and I found the different names used by characters confusing. I disagreed with the count as an agent of Providence, my personal opinion is that forgiveness is a more meaningful emotional response than revenge.

I'd love to know if you had similar thoughts or not to these books :)",This year I read some r/books classic recommendations. Here are my thoughts,1605353044
books,"So here’s the deal.  In the YA section, I feel as if the books are either too juvenile or I’ve already read them.  My all time favorite series is A Court of Thorns and Roses by Sarah J Maas. 
So I’m looking for fantasy books with awesome “book boyfriends” but I do NOT want books that are basically nsfw steamy romance paperbacks. I want actual plot and suspense and lots of angst! 
I am a sucker for angst and whump. I like heroes/heroines in captivity because it adds to the whump. 
Abused characters also! With the significant other finding out about the abuse later and being all shocked/protective/enraged.
Or one character being forced to watch the torture/beating of the one they loved for whatever reason
Transformation by Carol Berg would have been an all time favorite book if the prince had fallen in love with the main character (don’t shame me for saying that😬)
I want plot, but I want to focus on the relationships of all the characters.
Give me pain, sweet whump angst pain
... Can anybody help me out?","Medieval Fantasy books with romance, Bonus for angst and whump",1605352608
books,"I just finished reading Yevgeny Zamyatin's ""We"" translated by Clarence Brown. He also provided an introduction to the novel which I read BEFORE reading the story. The reason why I want to stress the ""before"" is that he for some reason saw it fit to include a major spoiler to the story in his introduction (which turned out to be true). I won't spoil this twist to those who haven't read the novel, but those who have read it perhaps know what I am talking about (concerning I-330).

I was infurtiated - why should Clarence Brown write such an introduction in which he assumes that the reader is already familiar with the story? Now I am questioning whether in future I should read introductions only after finishing the main story or whether I should read them at all.","Do you read the introductions to books? Why, or why not?",1605352464
books,,was scrolling for book summary n saw this awesome blog let's make this popular.,1605351599
books,[removed],Is Gomerghast worth picking up?,1605349733
books,,Margaret Atwood: the forgotten dystopia that inspired George Orwell,1605348543
books,[removed],What are some unusual places you like to read in?,1605348234
books,"Welcome readers, 
        
Have you ever wanted to ask something but you didn't feel like it deserved its own post but it isn't covered by one of our other scheduled posts?  Allow us to introduce you to our new Simple Questions thread!  Twice a week, every Tuesday and Saturday, a new Simple Questions thread will be posted for you to ask anything you'd like.  And please look for other questions in this thread that you could also answer!  A reminder that this is not the thread to ask for book recommendations.  All book recommendations should be asked in /r/suggestmeabook or our Weekly Recommendation Thread.
        
Thank you and enjoy!","Simple Questions: November 14, 2020",1605348014
books,[removed],How to start with non fiction books as a newbie,1605347791
books,"I’m trying to remember the name of this fantasy book/series I read when I was younger as can’t quite remember what it was called. 

I think I remember a character was a bookmaker or book binder. 
They would write stories and those stories would come to life in the real world with good and bad consequences. 
I think I remember that there was fairytales written which then the characters came to life from that. 

Does anyone know what fantasy book I could be thinking of? I thought it could be his dark materials but reading a synopsis I don’t think its what I’m thinking off.  

Thanks in advance.",I can’t remember what book this was that I read when I was younger. Do you know what it is from my short description.,1605347482
books,[removed],"1,001 Nights Translation",1605345989
books,[removed],Dr Seuss Enterprises lapse in judgement,1605345540
