subreddit,selftext,title,created_utc
books,"Just curious what people like to do when they’re reading books and finish one! 
For me, it depends on the book. Sometimes I feel like if I go right to the next one I’ll get bored of the characters too quickly and it’ll become redundant. Maybe I just haven’t found a series to really captivate new in awhile. Wanna hear your thoughts!",When you finish reading a book do you immediately go to the next one in the series? Or do you start a completely different book?,1587772761
books,"What a ride! This translated French classic novel was nothing short of grand and satisfying. At its core, it is a revenge tale but offers many layers of commentary and charectisation. 

Initially, I was intimidated by taking the task of reading this book due to its enormous size  (you can imagine my shock when I saw that it exceeded a thousand pages!) Also I typically do not lean towards picking up classics as they do not suit my reading tastes, not to mention my complete lack of connectivity with characters and the overall story. But Mr. Quarantine freed up my schedule and i found myself on the edge of a ledge, ready to take reading risks and take a leap of faith. And boy was I pleasantly surprised with the outcome.

Something about the author of this novel conveying much of the story through dialogue rather than endless narration hooked me. It was like watching a dramatization at some points. 

Given the sheer size of the book, i did not feel boredom or ennui (a word i learned from the book which means boredom or sadness caused by boredom). The plot was exciting, I rooted for the main character and was always amazed by the intelligance in which he constructed his plan for revenge. 
It had a satisfying ending too. 

In conclusion, I loved this book and i recommend it! 

*P.S I hope you are taking reading risks in this time of Ample Time bcz look how it turned out for me. 
Adieu!",I just finished the longest book I've ever read: The Count Of Monte Cristo,1587772114
books,,Exclusive cover reveal for Jim Butcher's BATTLE GROUND!,1587771957
books,,W88 Indonesia | Situs Judi | Link Alternatif,1587771754
books,"



Locked away in jail is my hell and I can’t do anything but think about my freedom, sustaining and maintaining it so that I don’t relive my past . My past ... I record it now for the memories While inadvertently making it my history. I write to sooth and subdue the pain while never been able to forget how stress constantly pours on my sole like rain. Although, STILL I RISE like a bird trying to escape the cage, the bars, stereotypes, and the grave... Because it’s not about the storm it’s about dancing in the rain.",My life inside these prison walls,1587771617
books,[removed],Please read my book &lt;3,1587771353
books,[removed],Seeking Wisdom: From Darwin to Munger,1587771331
books,"I have been reading more and more classics this last year. I read a lot of American and British classics in college. After college, I was really only into modern novels. But now, I go back to classics (French and Russians). I started with Anna Karenina over Xmas break and then War and Peace over the summer.
There is just something about the quality of the story and the writing that is so compelling.
Do you also have different phases in your reading taste?
PS: currently reading Aurélien d'Aragon.",Reading classics,1587770985
books,[removed],"If someone has ebook of The Social Construction of Reality by Peter L. Berger and Thomas Luckmann, please share. I am halfway done, and then it got blocked on the app I was using.",1587769315
books,,Printable Planners,1587769207
books,,"Food Journal, Printable Cookbook, Digital Files- PDF Instant Download",1587769156
books,,😱 Desafio Da Marmita FIT (-10 kg) [PEGUE O SEU!],1587769106
books,"**Anyone else read Aurora Rising?**

(spoilers)

&gt;!idk about you but i really dislike auri for getting cat killed' !&lt; also I don’t see a problem with the book, I love it. It’s one of my favourites, so if you wanna have a discussion in the comments about the book (no hate on it I can’t be stuffed to have an argument Rn) so if you wanna talk about it then sure, also only if you’ve read the whole things there’s going to be spoilers .",Anybody wanna discuss Aurora Rising? (Spoilers) No hate on the book btw can’t be stuffed to argue lmao,1587769099
books,"So I just got around to reading RPO and haven’t seen the movie. I liked the premise and enjoyed the 80’s references at first. But as the book progressed, it seemed very self congratulatory with all the references and got old quick for me. It also repulsed me that there was some transphobic rhetoric sprinkled in. 

I really wanted to like this story but the writing was getting on my nerves with all the “I looked at this”, “I knew immediately when I saw this”, and “I did this” every other sentence. The descriptions of things were over the top and the toxic gamer culture was lame to see glorified. Don’t even get me started on the dialogue at the end chapters of the book. 😑
It felt like an amateur rudimentary fanfic rather than a novel.",Sigh...Ready Player One,1587768652
books,[removed],Are there any fans of EM Forster here?,1587768333
books,[removed],Author of Scared of Dick,1587767959
books,im a new librarian,Hi I'm about to establish a new books business and I don't know where to get English books to sell from!:) Could you please connect me with publishers and suppliers from UK or US that have cool books! Thanks.,1587767760
books,[removed],Looking for a new fantasy story,1587767677
books,[removed],Scared of Dick,1587767221
books,[removed],Looking for a book title,1587765959
books,,The Silent Library - Cambridge University Library abandoned during Coronavirus lockdown,1587765584
books,[removed],A Gentleman in Moscow - Thoughts?,1587764926
books,What do you guys think?,Currently Read 'A Man Called Ove'. not a fan so far.,1587764638
books,What do you guys think of the book?,Currently Read 'A Man Called Ove'. not a fan so far.,1587764551
books," 

I've been reading the English translation by Henning Koch for a while now. Feels very tedious and heavy handed.

I'm 120 pages in, but struggling to enjoy the book.

Did anyone else feel like the English translation just isn't as funny as the book thinks it is? and Also, boring?

Please tell me if I'm missing something",Currently reading 'A Man Called Over'. Not a fan so far,1587764001
books,[removed],A Man Called Ove - Disappointing??,1587763891
books,"So I have to read the book ""47 Ronin"" by  Jennifer Bassett and I do not have the book

Can you help me answering this questions?

 

1.Using chapter 1 of the book: Describe Lord Asano by using the sentences of chapter 1 ; write 3-5 sentences). Describe his death.

2.Using chapter 1 of the book: Describe the daimyo using the sentences of chapter 1( write 4-6 sentences).

3.Write a summary, in your own words, of Chapter 2.

&amp;#x200B;

 I would appreciate it a lot","Hello Lads, I need your help to complete my homework",1587763279
books,,Murder Most Unladylike,1587763232
books,"""The riders pushed between them and the rock and methodically rode them from the escarpment, the animals dropping silently as martyrs, turning sedately in the empty air and exploding on the rocks below in startling bursts of blood and silver as the flasks broke open and the mercury loomed wobbling in the air in great sheets and lobes and small trembling satellites and all its forms grouping below and racing in the stone arroyos like the imbreachment of some ultimate alchemic work decocted from out the secret dark of the earth's heart, the fleeing stag of the ancients fugitive on the mountainside and bright and quick in the dry path of the storm channels and shaping out the sockets in the rock and hurrying from ledge to ledge down the slope shimmering and deft as eels."" That's a single sentence. I mean, come on.","Just finished Blood Meridian by Cormac McCarthy. It's definitely his magnum opus, but did anyone feel like it was somewhat of a chore to finish?",1587762825
books,I read same book again that I read 2 years ago. I did this because I don't know what new book to read and I want to try understand again just make sure my understanding is correct.  I wonder if people do this? Why?,Do you re-read books that you read 3-5 years ago?,1587762687
books,,"Alaska school district bans 5 classics from high school curriculum including Gatsby, Invisible Man and Catch-22. Reasons range from “anti-white messaging” to “sexual references.”",1587762594
books,,Cleaner reorganises library books in size order,1587762065
books,"The man dynamites a building to maintain his own ego? I think the book is fine; it's good not great. Some decent points are made, but it's deeply flawed...and that ending.

The whole book was leading up to what could have a been an epic philisophical showdown between Roark/Dominique/Gail vs Toohey and his gang. But instead it just throws itself off a cliff basically and becomes very declarative.

Poor thing when a book has a horrible ending.

Side note, I understand why the book is polarizing for some, but not for me I guess. Thought it was just better than okay. A real slog to get through at the end.",I just finished The Fountainhead and is that...really...how it ends? [spoilers],1587762063
books,"One example given in the title. Another I'm considering is making the start of each chapter be a full page illustration. 

I feel like the professional book critics will see this as a gimmick-y way of drawing attention to the book. What do you all think about things that can be done to books to add flourish?",Would it be frowned upon if I write my young adult book series with gimmicks like the first word of every chapter spelling out an interesting sentence?,1587761898
books,"I'm a reader who's read a lot of Ya and still do so, but as a adult in my twenties, some things about Ya frustrate me and  I'm looking for some suggestions to help me get into more adult fiction",Adult fiction suggestions for readers who are used to Ya?,1587761753
books,"So, I'm a bookseller and had to spend the last few months in the children's/teen's section of our store. It was quite... harrowing as I severely dislike children and had to spend christmas there. Not a good combination.

Anyway, one good thing came of it. I found out about the Murder Most Unladylike series by Robin Stevens and fell in love immediately.

The series is set around the middle of the 1930s and starts off in an English boarding school for young ladies.

It's an utterly fabulous series and fits perfectly into the ""golden age of mystery"", both drawing from and referencing a great number of amazing detective novels and authors.

Despite it being for children (around the age of 10-12), it is exceedingly intelligent and brilliant, and I can't wait for the next installment to come out (apparently it will be set on a Nile river cruise).

Has anybody here read it?",Murder Most Unladylike,1587761414
books,I don't want to buy the book and it's offered for free on Google books but as of lately most of my reading is done on my phone are computer which is a serious problem because it's leading to eye strain. Actually it's known as computer vision syndrome (just looked it up). I am desperate to continue reading but this strain seriously boggles me down. How is your experience with the Kindle? Does it fix the eye strain issue? Are there any other recommendations you guys have for me?,Would like to read Emanuel Swodenberg's Heaven and He'll but I need a Kindle to do it,1587761185
books,"So, I'm a bookseller and had to spend the last few months in the children's/teen's section of our store. It was quite... harrowing as I severely dislike children *and* had to spend christmas there. Not a good combination.


Anyway, one good thing came of it. I found out about the Murder Most Unladylike series by Robin Stevens and fell in love *immediately*.


The series is set around the middle of the 1930s and starts off in an English boarding school for young ladies. 



It's an utterly fabulous series and fits perfectly into the ""golden age of mystery"", both drawing from and referencing a great number of amazing detective novels and authors.

Despite it being for children (around the age of 10-12), it is exceedingly intelligent and brilliant, and I can't wait for the next installment to come out (apparently it will be set on a Nile river cruise).

Has anybody here read it?",Murder Most Unladylike,1587760495
books,"Shadow of the Wind is beautifully written. Zafón's phrasing and plot weaving is some of the best I've ever read. ***However***, I feel like no one is talking about how he treats women vs men in his novels. I find it extremely toxic (as a man) the way he writes about women.

**Every single woman** that is introduced in his novels is fully described by their physical appearance, as well what role their sexuality fulfills for another man; while most men are described by only their character traits, with no physical traits mentioned at all.

I couldn't tell you what Daniel, *the main character*, looks like. But I can tell you that every single woman has their figure greatly described, or their breasts, or their ""yummy"" thighs being pinched - only to be later called out by **another woman** that men should be validly excused for their behavior, because they are ""too manly"" to resist touching a woman (in this case it is Fermin's nurse he aggravates, and his significant other of all people is the one excusing his behavior - no female author would write this passing comment into a scene).

Any time a woman is mentioned, Zafón rambles in what *reeks* of a teenage boy who has never been with a woman. Every woman is ""mysterious"" and an ""angel"" simply because of their superficial looks. Before any woman has even interacted with a character in his novel, they are placed on a mountain of a pedestal, simply because the male characters can't see females as real people: the female's only role is to be beautiful, and it's extremely degrading to normalize that line of thought.

Reading reviews on GoodReads by women who praise the book so highly is astonishing to me, there is no regard among them of this subject in Zafón's writing. No woman would or should consent to every single female character being extremely sexualized by a male author (Murikami reeks of this toxicity as well). I want to reiterate that as a man writing this, the novel reflects a huge problem of social conditioning - essentially the ""boys will be boys"" nonsense that has permeated our daily life. Women have thoughts, feelings, character traits **- depth** beyond their projected male sexuality. Not one female receives the respect and command Zafón gives his male characters in the otherwise great *Shadow of the Wind*.",I just finished Zafón's Shadow of the Wind - can we talk about male vs female roles in this book?,1587760464
books,"Hi all!
So I am very seriously considering buying my first e-reader (leaning towards Kobo at the moment). However, I'm a huge supporter of my local library and am wondering if I won't be supporting it as much/as effectively by borrowing books on my Kobo rather than borrowing physical books. Can anyone shed some light on this?

Thank you!",E-readers and supporting libraries!,1587760408
books,I’m looking for more adult more mature books to read. I’m looking to read some fantasy romance like books that are better written that have less cliches then the typical ya read.,Looking for good fantasy that’s not ya,1587760116
books,"This was a really good book for an un-educated monkey like me. I learned plenty of stuff, while a lot of the info I had heard a little bit about before. Being from 2006 I could tell that some of the information could use a little updating.  

Are there similar books that have released recently that anyone can recommend?  

Review:  

It was a very informative book that shows the comical, fickle, harsh, and a lot of the time absolutely brutal nature of scientists throughout our history of learning about the earth. The author presented information clearly and simply for the layman like me. It made roused my curiosity for what’s out there in our oceans, forests and what’s out in space. (I was already curious but this compounded it) I recommend this book for anyone who doesn’t have a great knowledge of our past.",I just finished Bill Bryson’s *A Short History Of Nearly Everything and I’m curious if there is anything like it that is up-to-date,1587760046
books,[removed],How to write a Book summary | Book synopsis,1587759591
books,[removed],How to write a Book summary | Write a book synopsis,1587759268
books,[removed],The Little Prince,1587759240
books,,How to write a book summary | Book synopsis | write a book summary,1587759200
