subreddit,selftext,title,created_utc
books,,"In Nov, I made a calendar note to myself that says ""November 2020, what a year. Apparently there's a vaccine? How are you now in April of 2021?"" w/ a link to ""The Hitchhiker's Guide to the Galaxy Illustrated edition"" which was meant to be released today, now 4th May. Art in comments.",1619718156
books,[removed],What book has been equivalent to a red pill (matrix) for you?,1619718127
books,[removed],What book has been equivalent to a red pill (matrix) for you?,1619717851
books,[removed],"Hi, r/Books! I'm Dr. Batra, author of the book Animal, and I invite you to join me for an AMA session tomorrow.",1619717773
books,[removed],Books About Human Life on Other Planets?,1619717722
books,[removed],What book has been equivalent to a red pill for you?,1619717704
books,"Use this post to recommend best books, that can help to every student/learner, who wants to improve their skills, develop their good qualities, learn about things, that will help them to become the people they want to be! It would be interesting to know, how much time do you devote to reading per day? Personally I try to read for 2-3 hours if I have time, orr at least 1 hour, if I have other work/university projects to do.",Books about becoming a better student and better human being!,1619717464
books,"The books I'm talking about are ones I usually see in the back of used book stores or library fundraiser sales. You find 10-15 books in the Executioner series, or the Longarm western series, or something like that. 

They're usually about the length of a harlequin romance novel, and obviously the same type of formulaic format, but just geared toward men. It's always been fascinating to me to see these books with #200 something written on the spine like you've gotten two hundred books into this series.  

Is this still a viable publishing format that I'm just not aware of anymore (most of the books I see were published in the 70s or 80s), or is it to the point where romance novels are the only ones that can reliably make money in these monthly releases?",Has anybody here ever read a significant amount of any of those ridiculously long series?,1619717230
books,[removed],Books about becoming a better student and better human being!,1619717142
books,[removed],Books about becoming a better student and better human being!,1619717095
books,"Fellow readers,

I’m very interested in reading work by Terry Pratchett.  Will you folks please briefly provide some book recommendations for me?  I want to begin with one of his best books.   I don't need to begin with his very first book, and I don't want to start a book that is in the middle of an integrated story line or series... unless it really, *really* stands out.

Any recommendations would be greatly appreciated.  And, some context or explanation for your choice would be very welcome.

Thanks very much- 

Squid Flotilla",Where to get started with work by Terry Pratchett?,1619716646
books,[removed],Life changing books,1619716613
books,"Anyone have any insight? I found it at a local Salvation Army earlier this week. I can't seem to find this cover art anywhere. It says this version was printed in December 1982 but Googling ""Warner books"" or ""Time Warner"" alongside it yields different cover art, which is what's tripping me up.

Is this some kind of limited run or special edition? Is it particularly rare or valuable?

[Pictures](https://imgur.com/gallery/AIdbfWX)",What are the details on this edition of To Kill A Mockingbird?,1619716421
books,"So I'm thinking about deleting my goodreads account. I'm only using it to sort through my books, but there's just so many messages and friend requests from porn bots that I just don't want it on my phone anymore. 

Is this a me problem? Is there any way to stop people from messaging or adding you as friends?",Goodread and porn accounts,1619716282
books,[removed],Should I read the Harry Potter series?,1619716058
books,"It's my Maths textbook, that has like 600 pages and its short (shorter than A4). 
Whenever I sit for solving some questions, I keep my book in front of Me and idk what it is but the pages keep closing themselves, it's like some force in the binding of the book that pulls them and it closes.
I can't really use my hands to keep it from closing coz I will be ofcourse solving maths.
Why my book is like this? Is it the binding? Any hacks to solve this?
Thanks.",My book keeps closing itself. How do I fix it?,1619715717
books,[removed],1970s LA book suggestions?,1619715317
books,"I'm currently over halfway through the third book in the Mistborn trilogy. I've loved the series so far and, although I don't think the writing is great, the story, world and magic systems are. I'm just wondering what the general opinion is on the repetition  I've noticed in these and other books that are part of a trilogy or series?

For example, a character has abilities that are specific to one of three branches of 'magic'. This is explained in some detail in book one and since then is regularly repeated. I'm halfway through book three and a whole page is explaining what's already been explained multiple times before. Why do writers do this?

I understand little reminders early on in each book because the reader might have had a break in between each entry in the series / have waited 10+ years for the next installment. But to repeat the same thing a number of times in the book just makes me roll my eyes and skip a page. 

Is this just bad writing? Do the authors not expect their readers to keep up? Is it some weird thing editors/publishers want their writers to do? I can't figure it out.",Repetition in a Book Series,1619715229
books,[removed],I Ordered a New Book and It Came Ripped—Help?,1619715129
books,"I vividly recall trudging through this novel on a hot summer afternoon, unaware of the beautiful figurative language and nuances in Plath's writing, foraging for the 'plot.'After doing a great deal of research on the poetry and life of Sylvia Plath, I have grown to worship her.  


It is stunning how Plath manipulates similes - for instance 'a summer calm laid its soothing hand over everything, like death' - as they are reminiscent of her tendency to turn the somewhat positive into haunting imagery, almost as though her personal discontentment hangs as a shadow over her writing.  


'I saw my life branching out before me like the green fig tree in the story. From the tip of every branch, like a fat purple fig, a wonderful future beckoned and winked. I saw myself sitting in the crotch of this fig tree, starving to death, just because I couldn't make up my mind which of the figs I would choose. I wanted each and every one of them, but choosing one meant losing all the rest, and, as I sat there, unable to decide, the figs began to wrinkle and go black, and, one by one, they plopped to the ground at my feet.'  


The fig tree comparison is yet another example where this 'shadow' can be seen, one of my favourite pieces of writing ever; it coincides so deeply with Esther's ambiguity and the enigma: what is she going to do with her life?",thoughts on the bell jar by sylvia plath,1619715078
books,"Ok so my wife wants to watch Lord of the Rings (neither of us has seen it) but I have a pretty strict rule that I must read the books first, which amazingly I’ve never read. I’m about 1/4th through the first book and I love it. 

My question is, are the storylines of the movies pretty true to the book? For example, if I watch Fellowship after reading the book, will it spoil my reading of the second book? Should I read all three before watching any of the movies? 

Thanks!",Lord of the Rings - books and movies,1619714779
books,[removed],What happened to you is a MUST read! Listening to the book with my s/o - we have shared many a-ha moments. So amazing!!,1619714701
books,,‘Fatima’s Great Outdoors’ Is an Adventure Tale for All: Ambreen Tariq’s new children’s book tells the story of an immigrant family’s first camping trip and expands the canon of outdoor literature for kids,1619714637
books,,Great read!,1619713925
books,"I’m working on my dissertation for my masters degree in Information Science Library Management. I decided to make it a passion project... books! 

If you are over 18 years old and read books in any format, your contribution to my research would be wonderful. It should only take 10 minutes to complete and it will really help my research. 

https://forms.gle/eiHVmcqWnW8KZD5Q9

I love books, print, eBook and audiobooks. I always have. I remember listening to The X Files Eugene Tooms episodes at 2am as a teenager on cassette (gasp!) and being freaked out. I find sometimes a book in print is ok, but the audiobook is phenomenal and vice versa. 

I cohost a book discussion podcast called Fictional Hangover and found that in order to read a book a week for the episode AND for my own pleasure I needed to listen to more as audiobooks. 

As I’ve gotten involved in book groups and discussions I realised there was a stigma or perception of audiobooks. Everyone is allowed their option, but I wanted to find out why. When it came time to pick my research topic I struggled. Like, long painful, lying awake at night struggle until I talked to one of the senior lecturers. Within 2 minutes she had me talking about reading habits and audiobooks and I knew I had my topic.

So while I really appreciate your help with my research survey, I think it would be great to hear on this thread your thoughts on reading habits and print v eBook v audiobooks. 

(Survey link posted with admin approval)",Reading with the Ears: An exploration of audiobooks as a reading experience,1619713873
books,"So, I want to practice building stories so coming up with something completely unique isnt something I'm concerned about. 

I was wondering if there were any processes/procedures one can use to take an idea and flesh it out. Like some sort of barebones logical story flow that you can just apply a skin to make it look like something.",Are there any formulas one can use to develop a story?,1619713399
books,,Review of The Midnight Library,1619713335
books,[removed],H.P. Lovecraft has kickstarted my desire to read (FINALLY!),1619713296
books,"Have you ever been in a Reader's Block?
That is, when you have this strong desire to continue reading the book you've been reading; BUT, for some reason you are not able to squeeze in time to read the book. Or, when you do get the time to read, and you finally take the book in your hands, it feels as if you're injected with serotonin; but the feeling is so utterly profound that you don't find the required concentration and end up not even reading a single page. Well, I don't even know if such a feeling is common or naming it a ""Reader's Block"" is a just thing.

Even so, that overwhelming feeling is there. In fact, here I am typing this post, where I could be reading The Stand or The Shining right now. But it just doesn't seem to be happening. I so desperately want to read them.

Have you ever been in ""a Reader's Block"" or in a similar situation?
How did you manage?",A Reader's Block,1619713119
books,,"Mary Roach announced her next book on Twitter. Fuzz: When Animals Break the Law, coming September 14, 2021.",1619713106
books,,Review of Midnight's Library,1619712708
books,[removed],Alias Grace by Margaret Atwood OR Heart of Darkness by Joseph Conrad?,1619712534
books,[removed],If you had to do a report about the theme “resilience” – would you choose ‘Alias Grace’ by Margaret Atwood OR ‘Heart of Darkness’ by Joseph Conrad?,1619712375
books,[removed],Evlilik Öncesi Çiftlerin Birbirine Mutlaka Sorması Gereken Sorular,1619712089
books,"*Lolita* is one of my favorite novels, mostly for the writing itself. Recently, I listened to the audiobook version, read by Jeremy Irons, which is fantastic. He gives a brilliant performance. Anyway, it got me thinking about another novel I read a while back, Iris Murdoch’s *The Sea, The Sea*. I had an audible credit I needed to use, so I decided to listen to that one as well.

It occurs to me now how similar these books are, as far as the narrators go. Both are obsessive and narcissistic, fixated on some original *lost love* from the past, prone to lyrical flights of fancy and overwrought descriptions, manipulative and self-deluding, viewing other people mostly as objects in their dream. They rarely consider the feelings of others (although they think they do), and only care about them to the extent that they can play a role in the fantasy. Otherwise they’re expendable or merely a nuisance. Obviously, in the case of *Lolita*, Humbert Humbert being a pedophile adds a whole extra disturbing layer to it. 

Thing is, I understand why someone wouldn’t want to be trapped for 300+ pages with a narrator like this (pedophilia in *Lolita* aside), but when it’s done well I find it super entertaining. Maybe it’s because there is a pretentious/overly romantic side to my own personality, and so I find totally unhealthy depictions of it to be darkly funny in a way, although I can’t relate to the more destructive elements. For example, the way Charles Arrowby forces himself into people’s lives, creating chaos and drama, his casual cruelty and sense of entitlement, his constant push/pull dance with people he senses he has emotional power over.

I do enjoy his fussy descriptions of meals (“Fresh apricots are best of course, but the dried kind, soaked for twenty-four hours and then well drained, make a heavenly accompaniment for any sort of mildly sweet biscuit or cake.”). He’s insufferable but it genuinely makes me laugh out loud at times. 

I’m trying to think of other novels with this kind of narrator. I might put Ignatious from *A Confederency of Dunces* in a similar category, but he doesn’t quite have that melancholic “starring as Hamlet in the tragic play of my life” thing.","Nabokov’s “Lolita,” Iris Murdoch’s “The Sea, The Sea,” and other novels with obsessive, self-absorbed, pretentious and/or overly romanticizing narrators (mild spoilers)",1619711651
books,"I'm not talking about friends we have online, I mean your own friends and family in person, do they actually read or you the lone book worm?  My own personal circle says they are just not good readers so they don't read books which leaves me all alone when it comes to discussing books except for reddit. I'm wondering if most people aren't really that into reading compared to watching movies and TV shows?",Does your own personal circle read?,1619711497
books,"The Rhythm Section is a 1999 spy thriller in series written by British author Mark Burnell. The main character is Stephanie Fitzpatrick, basically, the plot is that a bomb brings a plane down and the majority of her family is killed. It’s similar to the movie but that was horrible. Anyway, you don’t actually get into the plot until a hundred pages later, the first 100 pages are her being a prostitute because of her depression, and a journalist that follows her. After that, the plot gains speed and shes contracted as an assassin to get her family back.   


That’s the beginning part, for me the story is pretty good, lots of character development and plot twists, but the best part, the best part, the \*\*writing\*\*, it’s so \*goddamn good\*. The author‘s description of the environment and objects are so amazing that it’s unlike anything I’ve ever read. Take this paragraph for example

\*’An hour later, Proctor hurried along Shaftesbury Avenue. The falling drizzle was so fine it hung in the air like mist but its wetness penetrated everything. Those who were heading across Cambridge Circus toward the Palace Theater for the evening’s performance of *Les Miserables* looked suitably miserable, shoulders curved and heads bowed against the damp chill. The traffic on the Charing Cross Road was solid. Red tail lights shivered in puddles.’\*

It’s like this for every scene and object, and the subsequent books. Take another one

\*’The doors parted to reveal a carpeted hall with cream wallpaper. On the walls, there were prints of engravings depicting idyllic rural scenes. The man showed her into a room. There was a single bed by one wall, a TV, a desk, two armchairs, a full bookcase and a door leading through to a small bathroom.‘\* 

i read some reviews on some other sites and some people didn’t like the long, drawn out explanations and details in the book, but to each their own. 

Now, the character development, over the course of the book, Stephanie develops from a miserable wreck into a cold and trained assassin. The most major turning point is when she goes to a place to train, the author really emphasis her consciousness and the technological aspects of 1999.   


So, to those who read the book, what is your opinion his the book and specifically the writing style?",Thoughts on the Rhythm Section by Mark Burnell?,1619711460
books,"Whenever I read books, I remember them for some weeks and then start forgetting. Now I know it is natural for that to happen but then I get confused. I don't know whether to re-read the book (because some books were so amazing!) or to read another. I quite often choose the latter but it's just frustrating! Ah, the problems of having a normal human memory. Do you relate?",Does anyone forget books quickly?,1619711389
books,[removed],Books about becoming a better student and better human being!,1619710945
books,[removed],Books about becoming a better student and better human being!,1619710799
books,[removed],Preorder and collect from waterstones,1619710651
