subreddit,selftext,title,created_utc
books,,Finding a book I lost...,1607126172
books,,I made my own book and published it!!,1607125736
books,[removed],Question on Christopher Moore,1607125034
books,[removed],Can someone tell me what book I’m thinking of?,1607124656
books,,If you want or need a good book in this uneasy time,1607124264
books,"I can think of only one advantage of e-books over real books: you can adjust the print size, so if you want large print, you can have it. Other than that, it seems like e-books are a total waste.  

\--You don't absorb the text as completely on a screen (whether that is from ""screen overload""--we spend all day on a screen--or something else, I don't know.)

\--You don't really own the book. You can't give it to a friend when you're done. It's just data. You pay your money, and you don't get anything real. Your system could crash and it all disappears.

\--Illustrations on a kindle? Graphs? Annotations? Forget about it.

\--The sense of completion as one nears the end of a book. The percentage icon just doesn't cut it for me.

\--The more e-readers, the less real books. Do we really want a future without books? I don't.

People sometimes say that they like their kindles for vacations because they can store lots of books on it and it's more convenient than carrying real books. I don't know how much you read, but if you're reading more than two or three books on vacation, then you are doing too much reading, and not enough living. You can read at home.

By the way, I'm encouraged by younger people increasingly buying actual books, seeking a more ""real"" experience. It seems like most people reading books on kindles or similar devices are older.

Do YOU still read on a kindle? If so, WHY??","Throw away your kindle, because they are terrible. Here's why.",1607123082
books,,Books to Read,1607122955
books,,"Commentary: Critics Love the Book, Hate the Movie. What Gives with 'Hillbilly Elegy'?",1607122940
books,[removed],The Lost Island of Tamirind,1607122904
books,[removed],Confessions by Kanae Minato,1607122386
books,[removed],"MY MESSAGE TO THE PERPETRATORS OF DEATH AND DESTRUCTION, THE RUSSIAN FEDERATION MOTHERFUCKERS WHO ALL HAVE FUCKED THEIR MOTHERS AND MI6 AND THE CIA HAVE THE VIDEOS",1607121911
books,[removed],Mysterious books with viscous atmosphere,1607120969
books,[removed],Murakami books,1607120779
books,,"Hello everyone, has anyone here read ready player two yet? I read it but no one I know has read it yet and I'd really like to talk about it!",1607120514
books,[removed],"I am reading a new book “GhostCityGirl”, what a great book! Wanting to discuss...",1607120354
books,[removed],Reading the Arthurian Legends,1607118006
books,"I am currently working my way through the Dark Tower Series and finished book #5 today. All I can say is WOW. 

King is a legit genius. I honestly cannot recall an author that has so many intertwined references to other books and just the depth he goes to in all his books is incredible. I adore Stephen King and sadly just started reading his books this year, but I have been productive (see below). 

I am greatly looking forward to the last two books and am honestly sad it will end. I am going to read “The Long Walk” after this thanks to you all. 

I have read the following:

The Dark Tower Books 1-5

The Shining

11/22/63

Dr. Sleep

IT

Pet Semetary (my favorite)

The Stand

The Institute

What is your favorite King book? What is a must read by him?",Stephen King,1607117941
books,[removed],I need to find a book about Frankensteins son,1607117420
books,[removed],Help i’m desperate,1607116556
books,,E-Books for college students,1607116489
books,"I would give it 4/5 stars. 

I read it because of recommendations saying it was the best psychological thriller of all time. I don’t agree with that, but I found other things to love!

I thought it was written very well. Daphne du Maurier paints scenes vividly, both externally and internally. She does a great job describing Manderley, as well as what is happening in the mind of our heroine. 

The book is sort of creepy, but I was expecting more spookiness. There are a few moments that were chilling though, particularly when Mrs Danvers went off on her recollections of Rebecca. 

I had read people say things like “there are seven mind blowing twists!”. I was a bit disappointed in that regard. There was one incredible twist, and it reframed the whole novel. But it wasn’t mind blowing. 

That being said I found the last ~150 pages to be thrilling, with some twists that kept my attention. 

Even without the twists, it was an engrossing story, and made me feel quite a bit for the unnamed heroine. Nevertheless I did feel the first 2/3 of the novel dragged. 

Would love to hear what everyone else thought!",I just finished Rebecca and would love to discuss it!,1607115712
books,If anyone is looking for an amazing book to read I would direct you to “The Name of The Wind” by Patrick Rothfuss. My personal favorite series of all time (I just finished reading The Wise Mans fear which is the second book). There is only one thing I would warn you of before reading it though and that is that the last book has been in the works for a while now and is not going to come out soon so you will have to join the many people awaiting the release of its pub date. If you are interested check out r/Kingkillerchronicle.,Kingkiller Chronicles,1607115434
books,"Books that are looked down upon by popular media and public opinion but are not all that “trashy” when you actually read them. 

I recently read the Twilight Saga for the first time and it got me thinking about this. I’m a bit too old for the series but anyhow decided to see how it goes out of curiosity and it’s honestly...pretty good? Obviously not high literature but an exciting and fast read. 

When I hear the “omg twilight is so cringe and inappropriate” type commentary I realize people probably have just never even opened the books. 

Any other books like that? What’s your defense for them?",What books are widely considered trashy but aren’t actually all that bad?,1607115206
books,[removed],"Dune, should I read the book before I see the movie?",1607113898
books,[removed],Christmas Present Recommendations,1607113896
books,,"Ready Player Two, a review by Cat",1607113753
books,,Christmas Present Recommendations,1607113439
books,,Sahih-Al-Bukhari Hadith No #01 || In the Statement of Revelation || Uswae Hasana,1607112998
books,[removed],It's been one year since I made a commitment to read more books.,1607112834
books,,"As of today, it's been one year since I made a commitment to read more books.",1607111877
books,,The Imperialist Anxieties of Christopher Nolan,1607110604
books,[removed],"As of today, it has been one year since I made a commitment to read more books.",1607110381
books,,How to Incorporate the Entire “Star Wars” Expanded Universe Into Canon,1607110275
books,[removed],books like Man's search for meaning,1607109053
books,,I work for a library and made this little series of children reviewing their favorite books. It's adorable,1607108339
books,[removed],"Buy Facebook Ads Accounts - USA,UK Old Facebook Accounts",1607108292
books,[removed],Should I read anything else by Terry Pratchett before diving into Small Gods?,1607108202
books,"So my girlfriend and I are both big Agatha Christie fans.  We often find ourselves apart from each other, and when we do, we like to read the same Agatha Christie book and try to see who can guess the culprit.  We decided that we could make this into an ongoing game (we are both far too competitive for our own goods).  Here is what we have come up with thus far:

Lets assume there are 30 chapters in every book.  

*If at any time during your reading you have a guess to who committed the crime, you (let's call this person ""Mark"") tell the other person, ""Hey, I have a guess at Chapter 8"".  

*The other person (""Mary"") tells where in the book they currently are.  If they are past Chapter 8, Mary says so, and then Mark tells his guess.  If Mary has not reached Chapter 8, she gets until Chapter 8 to make any guess she wants.  If she waits and wants to guess at Chapter 8, the two parties say their guess at the same time.

*This game is played in aggregate, over the course of many Agatha Christie mysteries.  If someone guesses at Chapter 8, and is correct, they get 22 points, since they guessed 22 Chapters before the end of the book.

*Every player gets 3 guesses per book.  Players can guess any person at any time.  This includes:
      *The same person as your partner later on, in an attempt to reduce the deficit in this book, if you think your partner is right.
      *The same person as yourself later on (""doubling down""), if you think your earlier guess was correct.  However, often these books takes wild twists and turns, so putting all your eggs in one basket may not be the smartest idea.

*In the end, you count how many points each player received (most often only one player receives one point value), and mark it down.  Then, you wait until you want to crack open another mystery and play again.

I hope some reading fans find this as a nice way to share a hobby.  Also, if anyone has any thoughts on how to make this game better, please share!",For fans of Agatha Christie: A game suggestion,1607108143
books,"I've seen as well as participated in discussions about movie adaptations of books. But discussions of movie novelisations don't happen that often. 

One of the best examples in this category I've come across is The Revenge Of The Sith novelisation by Matthew Stover. The book in itself is a fantastic read with a unique writing style. However, the book does a lot more with respect to the movie. It adds a lot of great context to events, adds value to and expands the story arc, and talks about the lightsaber battles in more detail too! What I found the book did best was to allow the reader to get inside the heads of the characters to explore their motivations, doubts, and fears in a way that a movie would find it very hard to. It is a worthy addition to the Star Wars universe and an excellent read for fans, but also a wonderfully written book independent of the movie. 

Which other novelisations do you think have added value to the movie? How did they do it?",We talk more often about movie adaptations of books. How about movie novelisations? Which is the best movie novelisation you've read and what made it great?,1607107947
books,[removed],First story book how,1607107869
books,[removed],First story book how,1607106967
books,,Ket Vectors Book Club - Does anyone wants to join a book club ?,1607105152
books,[removed],WiP need feedback,1607104887
books,[removed],ISO books for a 4yr old,1607104774
books,"I started reading this book, and let me tell you, for the first quarter of the book I was extremely excited. I had read ""Ready Player One"" before, and I thought that this took the VR thing to a whole new level.

Halfway through the book now, and honestly it is the rare occasion where I cannot bring myself to read another page. Is it perhaps my expectations? Based on the blurb I was expecting something more dark or sinister/dystopian to happen, maybe a corporation taking over the gamers, or trapping society in the VR etc...

So far, there is only narration about what characters do in the video-game. Is that all? Should I keep reading and something will eventually happen, or am I better off to go play the MMORPGS I already play and focus on my own character's story?","""Ascend Online"" Is it just video-game narration?",1607104544
books,,FREE LEGO® Harry Potter™ Monster Book of Monsters with $75 LEGO® Harry Potter™ Purchase,1607104221
books,[removed],Traveling CNA,1607104015
books,"I want to organize a book drive for my kids teachers at their school. I wanted to get every teacher a new book to read for over Christmas break. (I am also going to put a t-shirt and a book mark and a thank you with the gift!)  I was making an amazon wishlist but I thought I would try my luck here before feeding the Amazon machine. If you have a book that is new or like new and you want to donate it. I know it would make a great group of teachers and staff very happy. There are 100 teachers. 

Bonus: Our independent local book store would love the business if anyone is willing! Thanks and happy holiday! #BooksAreAwesome 

[https://www.downboundbooks.com/?q=h.tviewer&amp;using\_sb=status](https://www.downboundbooks.com/?q=h.tviewer&amp;using_sb=status)

Ship to:

Fairview Clifton German Language School - Attention: BOOK DRIVE

3689 Clifton Ave.

Cincinnati, OH 45220

If this isn't allowed please delete.",Teacher Gift from an Independent Book Seller,1607102698
books,[removed],What are some good slice of life books?,1607102458
books,[removed],Searching Book,1607100952
books,[removed],Where can I find the first print book Joy fielding Missing Pieces,1607100848
books,,APH De EXCELÊNCIA Bônus RCP Dea | APH De EXCELÊNCIA 2021,1607100420
books,"What do you think causes film adaptions of books to be bad? Do you think it’s because it doesn’t cover everything in the book? Is it not how you imagined it? What do you think makes books in most cases better than the film? 

The example I can give from my experience is The Shining by Stephen King. I liked the book but the film was a massive disappointment.",What makes film adaptions of books bad?,1607100196
books,[removed],How do you take notes and save your highlights?,1607099214
books,"Hi all, I just started Lonesome Dove, and I feel like the preface spoiled everything.

The author explains how the book is about unacknowledged fatherhood. Then he says how the closest the dad comes to acknowledging his son is when he gives him his horse. Then he even spoils how the son ends up dying because of said horse! And how the father can never acknowledge him after that.

Why would the author do that? I feel like it doesn't make sense to read the book anymore, now that I know about the two main events. Should I still read it? Is it even good? It feels like a random flow of thoughts so far.",Spoilers in preface? Lonesome Dove,1607098202
books,,Haynes Manuals Will Stop Publishing New Print Workshop Guides - The company that provides service manuals for almost every car will no longer offer print manuals.,1607097720
books,[removed],Epub Reader for Windows,1607097658
books,,I want to intro myself.. I am newbie but I want to give value first...,1607097654
books,,11 Books That Will Shift Your Consciousness And Change Your Life,1607097336
books,"Hi

I'm listening to the audiobooks of Ken Deighton's masterful Bernard Samson novels.  The audio notes always contain a discussion of the artwork of the complete set and how they fit together. I'm thinking that someday when I have more time I'd like to actually read these novels. Does anyone know how I can order the complete set as a set?  I've tried Amazon but it seems I can only order them one by one.

Thanks!",Complete Set of Bernard Samson Novels,1607096931
books,"I read this book in middle school which I really liked at the time but I can’t remember for the life of me what it was called. 
It was set in high school and was from the perspective of this boy named Jeff (I think). The story centred around the fact that he was able to see this girl that no one else could. 
The girl was a high school student that had passed away (a ghost basically) and she presumed the reason why she was still on earth was because of her past crimes which all had to do with theft. 
So the entire plot was based on him returning the stuff she’d stolen and she would guide him through the perils of high school. 
Anyways, if anyone knows what it’s called I’d really appreciate it :)",I can’t find this book I read in middle school and it’s driving me mad.,1607096919
books,,Top 8 Best bookstores in Ho Chi Minh city,1607096161
books,,6 Key Elements of Thesis Writing for Drafting a Professional Paper,1607094885
books,[removed],No book club for November or December?,1607094857
books,,Foreign Affairs' Best Books of 2020--For the geopolitical minded out there,1607094673
books,"I''m thinking of buying an e-reader. Either a Kobo Touch or a Kindle (maybe paperwhite and 7th/8th gen versions).

However, i'm confused as to whether you need the backlight feature to be able to read at night. Or if any e-reader is night-reading-friendly. 

I don't think the Kobo nor the Kindle has backlight features (at least not the ones i'm looking at).

It seems like an obvious answer but i'm still so confused and would like some clarity. Thanks",Would I be able to read at night with an e-reader?,1607094590
books,,David Heska Wanbli Weiden On Exploring A Lakota Worldview Through Crime Fiction,1607094562
books,[removed],Just finished The Queen's Gambit? Give Fever Dream a try.,1607094202
books,[removed],For those who read “Do androids dream of electric sheep?”,1607093910
books,[removed],For those who read “Do androids dream of electric sheep?”,1607093630
books,"This book had so many mixed reviews. All were either people hating it or loving it. 

I started it and then read reviews and was disheartened but I stuck on. The first 30-35% of the book was difficult to be honest. 

But omg I look back at the book and what unfolded was just insane! I mean the way childhood PTSD was put to paper in so much detail without being so explicit! It was almost horrific to read!

The book was excellent in my opinion. Sad and hurtful but excellent. It gives insight into what childhood trauma can do and why this needs to stop.

If any of you all read it, do let me know what you thought.",You let me in - Camilla Bruce,1607093352
books,[removed],What is the page number of the following quote?,1607093341
books,[removed],Please give this a read and leave a comment and/or “like”. Trying to help cheer up a friend who is going through some hard times. Thanks!,1607092731
books,,Blog Tour Review: The Haunting of Gallagher Hotel,1607092170
books,[removed],Are there any apps for free ebooks that have a wide selection?,1607092018
books,,Amazon under pressure to lift ban on e-book library sales,1607091819
books,[removed],I want to find a good book,1607090514
books,"I have an exam on Faust by Goethe, I understood the main themes. However, I was a bit lost of the events that occurred in the second half. I understood that he killed Valentino and left Gretchen, but did he fall in love with a God and was saved again? So we can see that he decided to leave the devil side and join the good one?",Faust,1607090344
books,[removed],The Unknown By Jordan Cockburn,1607088144
books,"Hello all, I'm looking for spoilers in this thread! I just finished These Violent Delights by Micah Nemerever and I found the ending to be a little ambiguous for my tastes.  I suspect what I read was:

Paul thinks he's going to strangle Julian but eventually lets him escape.  When he comes home with his bag packed, his family has already decided to institutionalize him.  They believe that Julian may have died by suicide (the theme of this being carried through the book) but when they arrive at the apartment he has clearly stopped by after escaping Paul and left Paul a note signifying ---what?  That he's leaving his life forever?  That the game is OVER?  I saw someone else say that they assumed Julian had gone off to complete suicide, but he distinctly tells Paul that he doesn't want to die when they take their last walk in the forest.  What actually HAPPENED?

&amp;#x200B;

What do you think?",These Violent Delights - Micah Nemerever - I have questions!,1607087629
books,"unpopular opinion: i just can't seem to connect with ali smith for some reason... admittedly i do think the books of hers that i've read are her more ""intellectual"" over plot books (but then again, i have heard that these are the majority of her books), namely Artful and There but for the, and i can appreciate that she's a very clever and witty writer, and definitely has many insightful thoughts on art, language, thought, etc., but just can't find to emotionally connect / engage and even sometimes understand her insights and ideas.... does anyone feel the same way?",not connecting with Ali Smith,1607086928
books,[removed],What is the best way to right a book summary ?,1607085608
books,[removed],Doctor Zhivago translation,1607085200
books,"I'd been aware of this book for a long time but only read it a few months ago and absolutely loved it. It's now probably one of my favourites. 

The main protagonist (Francie Brady) is so well crafted and given it's his perspective we hear from throughout, I found really fancinating. 

There we so many occasions where his outlook is so painfully and unknownly skewed, it's difficult to see how the people around him didn't run a mile. Some of the things he does and says are totally irrational yet he always provides his own biased justification for them, providing a really interesting insight into the mind of the psychotic. 

I found it quite sad in the end the way a clearly mentally ill boy is treated by his community yet at the same time the hardship and struggles surrounding Francie dooms him to his fate. 

I know there's been a film adaption yet I given the impression the book has left with me, I might swerve it completely. 

What were you thoughts on The Butcher Boy (1992)? 

https://www.goodreads.com/book/show/82965.The_Butcher_Boy",Any thoughts on Patrick McCabe's 'The Butcher Boy'?,1607085118
books,,Please read and leave a comment/ “like”. Im trying to help a friend who who going through a really hard time. Thanks. The Rest of Vincent Black: Chapter 1,1607084099
books,"Hey Guys.  Could you suggest me genuine book which discusses topics of power, influence and wealth?  Of course I am not looking for 'self-help' books or books which run on theme of 'you can do it all you are just being stupid and lazy'.  I am looking for books which go much deeper than that, which explain what is power, what is influence, how wealth is created.  I am follower of Zen way of living. Books which discuss essence of topic are most welcome.","Power, influence and wealth",1607083580
books,I’m really struggling getting into Norse Mythology by Neil Gaiman. I picked it up because I love Greek Mythology and thought I’d give Norse a try. I think the problem is that I cannot pronounce most of the words and it’s so frustrating. It seems like I have to stop every third word to look up how to pronounce things. Most of the sites I’ve looked at don’t really have a comprehensive guide though so I’m needing some help. Does anyone have some tips for how to get through this? I don’t want to give up.,Help with Norse Mythology,1607083365
books,,The most expensive and mysterious books,1607082238
books,,"Hello book lovers! As christmas is approaching so fast, I would love me some books present🎁 from Santa this year🙈❤",1607081913
books,"I’ve been reading a lot of serious and depressing books lately and I think I need a change. I really want to bid a farewell to this year with a happy heart. 




I was just wondering what you guys read when you're depressed, down, lonely, sad, distraught etc. 




Which one book makes you feel better or atleast OK about some of the rough phases of your life?","Looking for feel-good, cozy book to read this festive month",1607081178
books,"Welcome to our weekly recommendation thread!  A few years ago now the mod team decided to condense the many ""suggest some books"" threads into one big mega-thread, in order to consolidate the subreddit and diversify the front page a little.  Since then, we have removed suggestion threads and directed their posters to this thread instead.  This tradition continues, so let's jump right 

**The Rules**

* Every comment in reply to this self-post must be a request for suggestions.

* All suggestions made in this thread must be direct replies to other people's requests. Do not post suggestions in reply to this self-post.

* All unrelated comments will be deleted in the interest of cleanliness.

____

**How to get the best recommendations**

The most successful recommendation requests include a description of the kind of book being sought.  This might be a particular kind of protagonist, setting, plot, atmosphere, theme, or subject matter.  You may be looking for something similar to another book (or film, TV show, game, etc), and examples are great!  Just be sure to explain *what* you liked about them too.  Other helpful things to think about are genre, length and reading level.

____

All Weekly Recommendation Threads are linked below the header throughout the week to guarantee that this thread remains active day-to-day.  For those bursting with books that you are hungry to suggest, we've set the suggested sort to new; you may need to set this manually if your app or settings ignores suggested sort.

If this thread has not slaked your desire for tasty book suggestions, we propose that you head on over to the aptly named subreddit /r/suggestmeabook.
               
- The Management","Weekly Recommendation Thread: December 04, 2020",1607079609
books,,Campaign to buy JRR Tolkien's house backed by Lord of the Rings actors: Ian McKellen and Martin Freeman support £4.5m crowdfunding campaign to turn the Oxford home where Tolkien wrote his most famous books into a museum.,1607078375
