subreddit,selftext,title,created_utc
books,"Does anyone know what this is about?


&gt;!This seemed like a weird scene and I don't know if I missed something before or after that clarified what this meant (if there's even any significance to it)

&gt;Jimmy stepped away from Petrie's shop area and started for the stairs. Something--a half thought or perhaps inspiration--made him turn. He saw Ben across the basement, working under the bright glare of those three lights, hung neatly in a row.

&gt;Somethin...and it was gone.

&gt;He walked back.

&gt;Ben shut off the lathe and looked at him. ""Something else?""

&gt;""Yeah,"" Jimmy said. ""On the tip of my tongue. But it's stuck there.""

&gt;Ben raised his eyebrows.

&gt;""When I looked back from the stairs and saw you, something clicked. It's gone now.""

&gt;""Important?""

&gt;""I don't know."" he shuffled his feet purposelessly, wanting it to come back. Something about the image Ben had made, standing under those work lights, bent over the lathe. No good. thinking about it only made it seem more distant.

&gt;He went up the stairs, but paused once more to look back. The image was hauntingly familiar, but it wouldn't come back. He went through the kitchen and out to the car. The raid had faded to drizzle.&lt;!",I finished reading 'Salem's Lot last night and I have a question about a sequence near the end of the book.,1587748159
books,[removed],"How does the textbook market work, why do they charge exorbitant prices?",1587747571
books,"Just finished rereading this, the second book in his L.A. quartet. When I was younger the only book of his I'd read was L.A. Confidential, and after reading the other three it's eye opening to have background characters in one book become more or less prominent in other books. I love L.A. Confidential by itself, but adding the other 3 books makes the whole thing a brilliant piece of literature.

I could gush for hours but can't seem to find the right words at the moment. I am not familiar with any of Ellroy's other work, so that's my next project.",The Big Nowhere by James Ellroy,1587747039
books,[removed],Author Kevin Mitnick's The Art of Intrusion,1587746683
books,[removed],"I read the Six of Crows Duology by Leigh Bardugo, here are my thoughts (spoilers)",1587746344
books,,Download and get access to millions of books,1587746304
books,,The little book sellers that could: How indie stores managed to take a slice of Amazon business,1587745872
books,,'A coldness that masks a burning rage': South Korea's female writers rise up,1587745816
books,"And boy oh boy what a great book. I've never read anything by Vonnegut but I'm so glad I picked this as my first. As a casual reader, I found myself laughing outloud while curled in a ball contemplating life for the first time since reading Catch 22 by Heller. I couldn't put in down and would highly recommend.

This isn't a review post but merely a reaction and would love to hear anyone else's thoughts on this book/Vonnegut. Thanks for reading!",Just finished The Sirens of Titan by Kurt Vonnegut,1587745540
books,"My primary genre is sci-fi, but I read a bit of horror and western as well. Lately I have been reading more westerns, which I think caused me to get Goodreads recommendations for books from the Hard Case Crime series. I have never really read crime, noir, hard boiled, or pulp books like the ones in Hard Case Crime, but I want to give it a try (I think the covers are what's REALLY drawing me in).

If you are familiar with the series, or have read any of the Hard Case Crime books, please let me know which books you think are best to start with. Or just your general thoughts on the series.

Right now I am thinking about getting some of the John Lange (Michael Crichton) books. I read a lot of Michael Crichton as a teenager and I think his books really got me into reading. Stick with what you know, right? I am also thinking about some of the Lawrence Block books. They seem to get favorable reviews.

Let me know what you think,

Thanks!",Looking for opinions of the Hard Case Crime series,1587745512
books,,7 Mindsets That Will Radically Improve Your Life Right Now,1587745512
books,[removed],Thinking about reading lord of the rings,1587745086
books,,Politeness Theory in ‘A Tale of Two Cities’,1587744432
books,[removed],"I’m Andrea Bartz, the author of the thrillers THE HERD and THE LOST NIGHT. AMA!",1587744223
books,"I am pleasantly surprised when I discover a new author from a movie/tv show adaptation, like Ted Chiang after watching Arrival. I ended up reading and absolutely loving Exhalation. I always wonder about 2 things — 

1.	As a filmmaker, what’s the criteria for selecting a particular book to be adapted? 
2.	As a reader, how do you discover interesting stories sooner before they become popular?","Criteria for movie adaptation, discovering stories early",1587743244
books,[removed],Poet Duet: A Mother and Daughter - by Florence A. Clark and Carolyn Clark,1587742908
books,,"Librarians Under Pandemic Duress: Layoffs, Napkin Masks, and Fear of Retaliation",1587742746
books,,Flash book giveaway this weekend. Keep your sanity when you're locked up at home. Read this book. Free April 25th and 26th.,1587742526
books,,"[crosspost] Andrea Robertson, author of the forthcoming FORGED IN FIRE AND STARS and the Nightshade series, is doing an AMA in r/YAlit!",1587742473
books,The last part of the story made me realize the importance of the self and the power of the mind. To me it was a realization of that to truly live happily a person has to live truthfully to themselves and not focus on the ideals or the standards that is popular but what they themselves believe. I didn't realize how impacted I was by others until I took a hard look at myself. I'm curious what others thought about it.,"Just finished reading Ayan Rand's Fountainhead, anyone else have an opinion on Howard's monologue?",1587742466
books,,Can You Pass This Color Blind Test?,1587742406
books,,Banking Words in Telugu || Learn Telugu || Telugu Words - 03,1587741129
books,"I had that book checked out from my library for such a long time 1-2 months, but with work and all that stuff I hadn't had a chance to read it. I had gotten halfway and didn't find more time. But now because of quarantine, I did lol!

&amp;#x200B;

One thing that I liked about this book was how each chapter, at least at the start, you we're trying to figure out how to connect it back to the main character, Eva. And at the end, the menu that she created for The Dinner seemed to reflect her life (as she said).

&amp;#x200B;

I wanna talk about it!",Has anyone read Kitchens of the Great Midwest? One of the first books I've finished in a while,1587739767
books,"Has anyone read this book before? I just received my copy last night and read the first 50 pages. I’m floored at how smart and engaging this book is. The prose is simple but incredibly smart, and there’s so many layers to each paragraph. I cannot peel my eyes away from the page.

I highly recommend it so far. Curious if others have read it and enjoyed it. I’m surprised it’s not more popular.",A Heart So White by Javier Marias,1587739185
books,[removed],How to read Anna Karenina?,1587739040
books,"During BookSlingers, authors make personalized book recommendations for you! Post some of your favorite authors, books, genres – you name it!—below, and we—Seanan McGuire [A Killing Frost](https://www.penguinrandomhouse.com/books/548424/a-killing-frost-by-seanan-mcguire/) and Sarah Kuhn [Haunted Heroine](https://www.penguinrandomhouse.com/books/623023/haunted-heroine-by-sarah-kuhn/) —will help you pick your next favorite read. 

This AMA is part of the [PRH Virtual Con](https://www.penguinrandomhouse.com/articles/virtual-con/). We’re all unifying under this one banner (u/penguinrandomhouse) but all comments, answers, and opinions here are 100% mine and do not represent Penguin Random House or its affiliates.

Proof: 

 - https://i.redd.it/hj433vt06au41.jpg
 - https://i.redd.it/gxkwabyu5au41.jpg","Hi, we’re authors Seanan McGuire and Sarah Kuhn. Join us for BookSlingers, and we’ll give you personalized reading recs!",1587738601
books,[removed],-,1587738490
books,"Hey guys! Two years ago I read I am pilgrim (by Terry Hayes), and I totally loved it, there was a lot going on, the stories made sense and the storywas super interesting! Now I am reading nomad (by James Swallow) I'm halfway and also love it,althlugh the story is a bit less developed IMO. Which of these options do you think is the best, and why?",Nomad vs. I am pilgrim,1587738475
