subreddit,selftext,title,created_utc
books,,Check out my new books for kids. Thank you!!!,1619739133
books,"Hello,   


I am looking for a specific edition of Stephen Hawking's  **A Brief History Of Time.** It's the one with the grey cover but in hardcover. I know it used to be available on amazon and bookdepository, but they have been unavailable for years. Does anyone know where I can find one even if it's a used copy (well kept preferably) and that ships to Europe!   


I know some more specific information like:  

* **ISBN10** 0553175211
* **ISBN13** 9780553175219

and  

* **Publication date** 01 Apr 1995
* **Publisher** Transworld Publishers Ltd
* **Imprint** Bantam Books (Transworld Publishers a division of the Random House Group)",Looking for an old edition hardcover of A Brief History Of Time,1619738975
books,,Two Brutal Uncles Running to the Beat | Plot Generator,1619738852
books," I don't know if this is the right place to post this, but I'm always interested in works dealing with interesting philosophical/religious/psychological concepts. There are some themes/concepts which are relatively easy to pick up or understand. But then there are works, which are very subtle with the themes they are exploring. And often I need some analysis posts to understand the complexity of these works.

So how do I read books, watch anime, movies etc, in a way where I can understand the hidden/deeper meaning beneath the story. For me, the plot and atmosphere matter the most, but I believe there are certain works l would appreciate more or be more suited to write a comprehensive review of, if I would at least understand or come up with an interpretation of them, without the help of additional sources.

I guess having knowledge of philosophy and psychology might be useful, but are there any other tips?

Also since I also want to incorporate certain concepts in my own work, this knowledge would help me weaving my own themes into my story.","How do I analyze fiction, so I can interpret it or find a deeper meaning/understand its themes.",1619738336
books,"I’ve written a good bit on Reddit but this is by far the most uneasy I’ve felt about a post. I started to create another account but decided that if anything, being able to see my profile and history of activity could help show that this is genuine and not just some one and done account.

So I’m going into a 60-day program, state funded and free (which is amazing), and I’ve a pack list of what I can and can’t bring. All the hygenics, 7 days of clothes, etc. I’ve got. But the line that hits me is the last.

The last line of things to bring are comfort items. “Photos, books, letters”.

I don’t really have any photos or letters, the few I have just make me sad so I figure they’re best left home. But as audible books have been my escape for so long, I feel like books are one thing that could mean a lot. 

I know we’ll have counseling throughout each weekday (not sure about weekends), and a gym to work out in once a day, but due to covid they’ve suspended any visitation from family, any leaving the site, so for 60 days it’s just me and the 13 other people in there with me. I plan and hope to make friends, but even with friends there’s only so much time you can spend before you just want to read a book and escape to another world for a while.

I thought about the library but that’s a no go as there’s no way to return them, or even extend the rental from inside as internet and such is non-grata.

So I was wondering if someone had any advice? I imagine there has to be people with books they wouldn’t care to get rid of, I know when I read Game of Thrones I kept forgetting to bring it to work and I’d just buy another copy cause I couldn’t wait my whole shift to read the next chapter. I must’ve ended up with 2-3 copies of each book and probably four copies of the first one. That was years ago though when I was still working as a paramedic and could afford to buy a book just to avoid having to go all day without reading.

Oh how times have changed.

Any advice, recommendations, or thoughts would be truly appreciated. I’ll be honest, I’m absolutely terrified at the idea of doing this but frankly I’m out of options and this is my last hope of getting things together.

Also, if anyone’s spent time in a similar setting I’d love to hear any advice or thoughts you have.","Going into a rehab program and can only bring books, all my “books” are on audible and I can’t bring anything “smart” to listen on. Not looking for charity, just guidance would be amazing.",1619737978
books,"Just wanted to share something I just encountered for those who use scribd and ever decide to cancel the service. A month or so ago I decided to cancel my membership to Scribd, and went through their account cancellation process. In doing so, I thought I had cancelled my membership, but imagine my surprise when I still saw a charge on my card. 

Turns out that I didn't, in fact, cancel the membership, even though I thought I did. Part of the scribd membership cancellation is a feedback form, which asks for feedback about why you're cancelling. After you submit this form you are taken to a screen thanking you for your feedback, which to me gave me the impression that the cancellation was done. Especially seeing as there was no button to confirm subscription, just a big fat button to contact support. What I didn't realise was that at the bottom of the screen thanking me for feedback, there was a line of text asking me if I was still sure I wanted to cancel, with a text link to complete cancellation. I didn't take a screenshot, unfortunately, but it isn't too far off from the image in [this](https://www.reddit.com/r/assholedesign/comments/atf5sd/scribd_i_thought_i_unsubscribed_from_the_free/) post, where everything but the cancel link is prominent. 

So yea, for anyone that goes to cancel their scribd just be aware.

&amp;#x200B;

**TL;DR:** If you are going to cancel your scribd membership, be aware that the cancellation process is designed in a way that may trick you into believing you've cancelled due to an arguably deceptive design.",PSA: Scribd Cancellation Quirk,1619737951
books,[removed],Fantasy books with relationships with mythical creatures.,1619737348
books,"I used to be an avid reader a few years ago and I’ve fallen behind in the last few years specially after I started college. Long story short, I would like to get back into the habit, and I was wondering if anyone had some good recommendations for someone who is just starting to get back into reading. I’m not looking for fiction stuff and I don’t really want to read about politics either. Other than that I’m open to reading about all sorts of stuff( history, religion, philosophy, psychology, sociology, autobiography etc.) I’ve never read a self help book so I’m also open to trying that if you have some good recommendations.",Book recommendations?,1619737104
books,[removed],"Do you prefer hardcover books, softcover books, or ebooks?",1619736694
books,"So in his book Steal Like An Artist, Austin Kleon talks about “climbing your own family tree”, which he also writes about [on his blog](https://austinkleon.com/2018/10/06/climbing-your-own-family-tree/). I’m stealing this idea and in an effort to improve my Spanish reading comprehension I am going to read as much as I can get my hands on by Mariana Enriquez—I already finished and LOVED _Things We Lost In The Fire_ and just started _Nuestra parte de noche_. When I’m done with that list, I plan to do the same with Silvina Ocampo whom Enriquez cites as a major influence (even writing a book about her called _hermana menor_) and then repeat the process one more time for one of her influences. 

Has anybody else done anything like this? Reading a specific authors whole (or almost whole) body of work and reading what they loved to read? Just curious what your experience was like and who you read (and if you haven’t but would like to, what author and why?)",Climbing the literary tree,1619735260
books,[removed],Infinite Jest / David Foster Wallace withdrawals,1619735207
books,[removed],Kristi noem,1619735147
books,[removed],Life Remixed by Mark Wilkinson (endorsed by Bob Proctor),1619735072
books,[removed],where my bookish butterflies at?,1619734950
books,"Just finished *The Factory* by Hiroko Oyamada and would like to share my thoughts and hopefully hear back from others who have read this quirky little Japanese novella.

I thought it was well-written, with a nice attention to detail, and quite funny. Actually, the humor was my favorite aspect. 

Alternating between three POVs was interesting, especially for such a short book. Deliberately confusing, particularly with the Kafka-style wall-of-text formatting. However I'm not sure I enjoyed reading it in this formatting, I thought it was slightly at odds with the light, somewhat flat tone of the narration. The three narrators tone was very similar—again, a deliberate choice I have to assume.

I enjoyed how elements of the different stories overlapped, which was done cleverly and adeptly, especially with the child's report/study of the factory animals, but I was expecting that aspect to go much further than it did. The allegory with the factory animals was interesting, but I thought the last few lines of the book were over-the-top... didn't need to be underlined so strongly.

Altogether, I didn't think it quite hit the bullseye, but it was an interesting and unique story. What did other people think? Should I read her next one, The Hole?",The Factory by Hiroko Oyamada,1619734354
books,[removed],Я не пам'ятаю назви.,1619732846
books,"So in the past few weeks we have read: less than zero, the rules of attraction, American psycho and the informers and am going to start glamorama tomorrow. 

Maybe this is a bad thing considering the antisocial behavior of almost all of his characters but I just can relate to this kind of writing so much. The way he is really able to put you into the headspace of characters, like I genuinely felt insane at some points of reading American psycho just because of the rapid stream of consciousness style. And I honestly really like that some of his books , at least the ones I have read so far don’t even have a plot, I love that it’s just a deep dive into the minds of certain types of people. Though I have heard that the next one glamorama had much more of a plot which I’m excited for as well. I think Bret Easton Ellis is my favorite author now. 

What do you all think of him and his writing? Can anyone recommend other authors based of my interest in Ellis and these kind of disaffected/passive/antisocial characters?",Bret Easton Ellis!,1619731981
books,,Bermuda Şeytan Üçgeni,1619731474
books,"If there is another reason I really hate how they chose live action for Percy Jackson is because of Viria, the girl whose fan art of the franchise become so beloved that Rick Riordan and his publishers hired her to become the official artist for the books. She brought in new life to the franchise by giving the characters a look so fresh and fun that it can even charm both fans and outsiders to the franchise and it's more lively than any live-action actor would ever do. So, the fact she was ignored and not even consulted by Rick or the producers to have them use her character designs for an animated show makes me feel really bad for her as her work was only relegated to marketing and nothing else. Granted, she may have took the news like a champ and was okay with it but I feel it was a waste of her talents to only resort her designs just to market the books instead of giving PJO new life, only for profit and not for love is what I see. She deserves better than that.",Just watching Viria's artwork of Percy Jackson really breaks my heart,1619730561
books,"do you think the high school literature curriculum is outdated and needs to be changed? since i live in the US i can only speak from experience with our curriculum, and i think many high schools across the country have a similar reading list for high schoolers (to kill a mockingbird, the great gatsby, etc.) now i know these books are considered classics, but i think it’s important to recognize the problematic themes in these books that i wasn’t able to analyze at a younger age. for example, i loved reading to kill a mockingbird when i was a freshman, but i’ve listened to some discourse recently about how it promotes the white savior complex, and now i see the book in a new light and don’t really think it’s the best book to provide high school students to teach them about racism. wouldn’t it be much more effective to have them read a book by contemporary authors who are POC whose stories are more relatable to our social and political climate today? 

also, if you agree that it needs to be changed, what would be on your list of books that should be a part of high school literature curriculum?",Thoughts on High School Literature Curriculum?,1619730383
books,"I’ve been starting to get heavily back igot reading after taking a long 4 year break from regularly daily reading and following a book series.

What are good science fiction books or just good recommendations that are “hot” right now? Really interested into getting back into reading but it’s a bit hard finding something good to read with how many books there are",Good science fiction books?,1619729954
books,[removed],I have a hard time following English novels as a non-native speaker/reader,1619729858
books,[removed],The Underdogs discussion of the Mexican revolution,1619729632
books,[removed],The Underdogs discussion,1619729454
books,[removed],The Beatles' biography suggestions,1619729139
books,[removed],Happiness Power: How to Unleash Your Power and Lead a More Joyful Life,1619728868
books,"Hey everyone, I need some help with my reading. I used be a avid reader going through 2-4 books a week and as I got older I started to read less and less (and play more and more video games, I'm a huge nerd). Now, I don't read at all, I havent finished a book in almost 2 years. I miss reading, but im having a hard time finding something that keeps my attention. So, I've come to reddit to ask for help. I need good book suggestions. I have been out of the game for so long that I'm overwhelmed and don't know where to start. The last book I read from start to finish was IT by Stephen King. I love Fantasy (YA and Adult), historical fiction and non-fiction, and horror. I also liked the occasional romance and light read. Suggest anything you think would keep my attention. I read physical books as well as listen to them in the car, so suggest any good book with a great narrator. I really appreciate any help. I miss books and desperately want to start reading again.",I need some help,1619728676
books,[removed],Westerns,1619728591
books,"This was an utterly uncanny novel. Perhaps I will discover a deeper meaning in it when i am older and therefore wiser. It explores many themes such as desire, fate and (my personal favourite) music. Surely, it is not the best I have read by Murakami because it simply drags on towards the end, however, as I said, i'm just fourteen-year-old.  


Both characters from which perspective the story was told are portrayed as very likeable but i would've immensely appreciated it if Murakami had cut down on the incest. Arguably, the entire novel is centred around it so I'm sure it was a 'the more the merrier' kind of situation for Murakami.  


I understand the concept of it being widely described as a metaphysical novel. It evokes in great detail the nature of consciousness and the relationship between thoughts and actions through Kafka's alter ego: the boy named Crow. I would say that it is literary realism at its best.  


Fate plays a pivotal role in this novel - it is almost as significant as it is in Shakespeare's plays. Notably, there is a thought-provoking simile conjured up towards the beginning of the novel, 'fate is like a small sandstorm that keeps changing direction. You change direction, but the sandstorm chases you.' That being said, i also adore the use of metaphors in this novel. Murakami's writing strikes me as a more refined version of John Green's, especially due to the reoccurring labyrinth-related metaphors.",thoughts on kafka on the shore by haruki murakami,1619728361
books," I  read a book not completely bu at the half of it name jonathan  livingston seagull in which a seagull is trying to masters its art of  flying , while the other seagulls consider him a nutcase that why he is  not trying to fetch food like other and not bother too much with flying,  and considers him a misfit, but he wants to master his art of flying.

So  if you can recommend me books or novels with such characters who  teaches us the importance and can give a fresh prespective on  Excellence.

Thanks in advance.",books/novels on Excellence,1619728223
books,[removed],Hey can Anyone Recommend book or novel that revovles around a character who is chasing Excellence?,1619728160
books,"Hello, I was wondering if any of you have read the book above, I’m considering purchasing it but I don’t know if it’s worth the purchase. I’ve tried to find some reviews on online but there aren’t much, if any of you have read the book would you be willing to share your opinion on it. Is it a good read? Was it interesting? It’s been a book I’ve been considering buying, especially since I’m a Med student. Thank you for taking the time to answer my question(s). :)","Have any of your read Playing God by Dr. Anthony Youn, if so, is it a good read? Thank you",1619727712
books,[removed],"Have any of your read Playing God by Dr. Anthony Youn, if so, is it a good read? Thank you",1619727433
books,,"MONSTROUS GIVEAWAY! One lucky winner (US ONLY) will receive 8 horror novels by some of the biggest names in the #HorrorCommunity. Books by Hunter Shea, Glenn Rolfe, Janine Pipe, Jonathan Janz, Tim Waggoner and Flame Tree Press.",1619726940
books,[removed],Any recommendation on a book related to Indian culture?,1619726602
books,[removed],Who is your countrys Tolkien?,1619726342
books,,Jhumpa Lahiri developed her voice for new novel 'Whereabouts' by first writing it in Italian,1619725802
books,,BOOKISH EXTERIORS: LIBRARIES THAT LOOK LIKE BOOKS,1619725114
books,"I started reading ""The Man Who Lived Underground""; I haven't completed it yet.  What I've read so far; it is a amazing book!  What Richard Wright wrote about over 50 years ago...is STILL going on today.

 If it wasn't for life getting in the way, I would have completed it in one sitting.  I'd like to hear what others who have read or are currently reading this book feel about it.","""The Man Who Lived Underground"" by Richard Wright",1619725059
books,"I don't typically venture into the world of Graphic Novels, occasionally I will pick up a series and give it a read but those are usually more humor based or stray into a comic territory. 

I found a random tweet referencing this book and decided to pick it up...I devoured it. 

The story is science fiction, a group of misfits work in space doing ""odd jobs"" but the story is so much more. It was a beautiful story of found family and growth. The use of colour as an indicator for the varying timelines in the story was absolutely stunning. 

I honestly don't have a single negative thing to say about it. It was like a breath of fresh air. Fantastic representation in the LGBTQ and non binary space. Really emotional story that was conveyed so well. 

So now I am curious has anyone else read it? What were your thoughts and if you read Graphic Novels do you have any other reccomendations for ones with a similar tone?","Just finished On a Sunbeam by Tillie Walden, of the 50+ books I've read in 2021 so far it's already in my top 5!",1619724459
books,,Çok Gezen mi Çok Okuyan mı Bilir?,1619724341
books,,Libraries that look like books!,1619724179
books,[removed],Came across this marvelous quote while reading a book I’ve put off reading for a couple of decades:,1619724061
books,I'm doing an assignment for my English class about the American dream. My plan is to write about people who became extraordinarily successful after they died and I think Melville fits that description pretty well. My issue is that I can't find any numbers related to the total number of times that Moby-Dick has been sold or printed. Does anyone have a source that gives an estimate? I assume the exact number would be pretty hard to figure out because it's in the public domain but anything would be helpful!,How Many Copies of Moby-Dick Exist?,1619723987
books,[removed],Is there a good app or website to keep track of your books like MyAnimeList?,1619722775
books,,How To Check Hard Disk Total Size in Windows 10,1619722703
books,"I know this is very vague but I am very interested in reading more about Roman civilization and government. It seems that many books run the risk of being very dry instead of having a narrative. 

While different by nature, I would love to find books written similarly to Edmund Morris or Robert Caro where there is an engaging narrative along with the history. 

Anyone have any recommendations? 

Thank you!",Recommendations on books about Ancient Rome?,1619722329
books,"""And when I close my eyes I think about the man who tored the book and he looks like me only he looks different and he talks different but I dont think its me because its like I see him from the window"" 

This reminds me of what Smart Charlie wrote about seeing Charlie through a window. I guess that means that Smart Charlie was just an imposter. Viewing Charlie's memories and acting as if Charlie's mom is his. Or I'm just reading too much into it.",I kinda want to say something about what Charlie wrote in Flowers for Algernon,1619721951
books,,Satisfaction( Couplet Poem),1619721877
books,"A novel I have been working on has Aliens, spirit guides/nature spirits and a group of uni students solving an ancient enigma that the spirits reveal and a police dept involved in the investigation of strange deaths in a nearby town and indigenous reserve.

Has there ever been something similar before ?
And if it does exist, which books are similar, for inspiration ?",Are there books like that ?,1619721801
books,,DO WE HAVE FREE WILL? Carl Jung - Aion,1619721710
books,[removed],Does anyone know any books that are YA and based in late 1800 early 1900s?,1619721702
books,[removed],Boy Swallows Universe: Discussion about August (Gus) and maybe the red phone,1619721325
books,[removed],"Boy Swallows Universe: Discussion (spoilers)..How does August know about the future (blue wren Caitlyn Spies, etc) ?",1619720845
books,[removed],Don Quixote,1619720804
books,"I absolutely love the aliens and predator movies. Read 3 of the alien books and all great. Started reading a predator one and I'm 30% into the book and I've just gave up on it because its very boring but I've got a feeling it will get really good around 50-70% into it. 

I've started another book now which I'm getting really into after only a short time but I know by the time I finish this one I will have forgotten most of the other book and never go back to it. 

It makes me feel a bit guilty and I always think should I just push through it or not waste my time. Anyone else think like this and if so how do you handle it?",Do you ever feel guilty for abandoning a book?,1619720532
books,"I read a lot and I follow a lot of booktubers etc, but I still find that a lot of the times I feel kind of indifferent towards books. I mean obviously I know if I really loved something or really hated something, but sometimes I read a book and I just don't feel anything special and I have to read reviews to see which side I'm on. Is that just a lack of experience ? Cause I feel like I read more than most of the people I know lol. It could also just be that I'm NOT a booktuber, so I don't really feel the need to nitpick everything",Do you sometimes feel like you don't have opinions on books,1619719275
books,"I was on over the early in the morning deciding what new books I wanted to get. I'm doing this five hundred book challenge where I want to complete five hundred bucks before making my own quilt based on those books. So I pick up some books just to say I have read them. Pride and Prejudice being one of those books. But when I checked out Pride and Prejudice on my Libby app I swore it was glitched out because it had a play button like an audiobook but I saw the words like an ebook. I intended to just read a sample myself and see if I wanted to wait for the audiobook. When I press to play on the book it started reading the book to me and highlighting the passages as it read. I nearly had an aneurysm open statement. These are like the comprehension book I used to have in school. I wanted to get the software again for myself. So I could be fully immersed in the story with my eyes and my ears. But the software cost $200. I like books but job with me cannot afford that.

Does anyone know what these books are called.? Annie book with a narrator that highlights the passages that they read to you.",Has anyone ever gotten an audiobook mixed with an ebook?,1619718926
books,"I've reread this 1000 page monster for the fifth time and every time I finish it I feel incredibly sad. Not just for the characters, but also mostly for the fact that the story is over. In my humble opinion it''s a perfect book and it ends where it should end, but it still feels unsatisfying in some way and leaves me yearning for more.","Rich man, poor man - Irwin Shaw",1619718272
