subreddit,selftext,title,created_utc
books,"Chinese Civil War Armies 1911–49, by Philip Jowett. Four stars, [GoodReads](https://www.goodreads.com/book/show/1037283.Chinese_Civil_War_Armies_1911_49).

This book is the first of what would become a trilogy from the same author about the Chinese continuous struggle from the overthrow of empire in 1911 to the communist victory in 1949. As the dates on the cover suggest, the timeline covered is far too much for such a tiny book, so it will mostly deal with chronology and uniform details. By the time you reach the end, you already forgot the beginning.

The text is adequate but focus mostly on the Nationalist faction. Given they bore the brunt of the fight from 1928 to 1945, that makes sense but there is a lot of duplication regarding uniforms and 3 (three!) tables of ranks for the Republican Army (followed by the warlords), the Nationalist Army, the Manchukuo Army with lengthy descriptions of colours that could - and should - have been done far more easily in the plates. The soldiers are mainly poor guys forced into one army or another and, as part of the dance of politics, are forced into the armies of the victors (if they are not shot, that is).

The main quality of this book is to give a visual guide and structure of the period, and that I can say it does very well. From the Westernized Imperial Army to the motley Warlord armies, to the more recognizable pro- and anti-Japanese armies of the end of the story. The weapons came from all around the world but there were always more men than guns (artillery was a luxury), so you see lance-armed soldiers in the 1940's. Child soldiers, bandits, beggars, warlord officers that are no more than mafiosos, White Russians, professional soldiers... We have it all. The Warlords dressed like peackocks and ""would design their own awards and hand them out to their officers and friendly fellow Warlords like trinkets"" and ruled like brutal feudal lords.

The creation of the Nationalist Army creates a rethink: the Warlords would never relinquish power and this lead to the idea of an army to enforce the rule of law over all of China. The Nationalists defeated the Warlords in 1928, by being institutionally stronger and becoming the dominant power in China; but would get encroached by the Japanese already in 1931. The Nationalists would be hailed as national heroes for their heroic stand against Japanese bullying in Shanghai in 1932. The author says in a caption they beat-off the Japanese, which they certainly didn't, but their resistance was embarassing for the Japanese. They still lost, but the seed of nationalism was planted.

A very welcome surprise was the introduction of the ""puppet"" armies, with Manchukuo and the other pro-Japanese forces, but beyond uniform and equipment there is very little. The plate of puppet Emperor Pu Yi was a great choice. The organisation was also a good addition. The author then short-sells the Nationalists for the rest of the book and presents the Communists in a way too positive light, omiting the armoured Nationalist forces equipped by the Americans and how those same Americans pushed them in front of the Japanese onslaught in Operation Ichi-Go. There is also nothing about the Nationalist parachute forces created in 1944 - again, space. But the overall product is positive, even if it is just a primer.

The author published the second book covering the 1937-45 timeline, but by shoving the Civil War into it the book was squandered with uniform fluff and repetition. The third book is about the Warlord armies from 1911-1930, that gives a more manageable subject-to-space ratio, which can be augmented by a larger 260-page book *""The Armies of Warlord China 1911-1928""* that is also a good reference; Philip Jowett also wrote *""China's Wars: Rousing the Dragon 1894-1949""* with a larger 400 pages.",Chinese Civil War Armies 1911–49 (My review),1606245245
books,[removed],"I recently read a scary story and it’s not that it’s still scaring me, but when I go to sleep I can’t stop thinking about it and it’s annoying. How do I stop thinking about it?",1606244968
books,,Mystery looms over a valuable set of Charles Darwin notebooks that went from 'lost' to 'likely stolen',1606244664
books,,How German Librarians Finally Caught an Elusive Book Thief,1606244378
books,I am currently going through this time in my life where my immigrant parents are strongly against my relationship. Almost to the point of violence. I really would just love to read a book that is about this kind of situation. Ending doesn’t matter so much. However I would like to give myself some hope lol. Thanks xx,Any book suggestion about love and parents who are unaccepting of the love,1606244222
books,[removed],Recently got into reading and now it's a high I can't come down from,1606244018
books,[removed],The Horus Heresy novels are fantastic and I'd encourage anyone - regardless of interest in Warhammer - to read them.,1606243878
books,"I’ll admit, I’m not a reader. I could never get into it and have always felt less intelligent because of that. Let me tell you, this book will make you laugh, cry, give you goosebumps all within the first 100 pages. I haven’t finished it yet, but I can’t put it down. Wether you’re a fan of him or not, I highly encourage you to learn about him and who he is and get this book. It’s incredible!",A Promised Land by Barack Obama,1606243708
books,"I've been taking a philosophy classe in college and its been very interesting. Learning about Plato, Socrates and all that. I like learning about ancient greek philosophers, but I find it hard to read some of there stuff. Im trying to start reading books more and more and I'm trying to find a book thats's not to hard of a read that's about these philosophers. Any ideas?",Philosophy books for someone that doesn’t read a lot,1606243275
books,"Hello folks,

I was just wondering if we have any Ken Follett fans here.

Maybe you could tell me, in your view is it best to read 'The Evening and the Morning' before of after 'The Pillars of the Earth'.

I'm aware 'Evening' is a prequel to 'Pillars'.. however it was just released recently while Pillars has been out for decades.

I'm curious to know if anyone has read both.. is 'Evening' a prequel in the general sense to give long term fans of the series a prequel to the world they know well... or on the other hand is it more of an afterthought geared towards totally new readers of the books, essentially as a new first book of the series.. to be read prior to Pillars of the Earth?

I've never read any of them.. apart from a first chapter.. I was just wondering which would you say to begin with?

Many thanks in advance",Ken Follett readers! Views on 'The Evening and The Morning'? Best read before or after 'The Pillars of The Earth'?,1606242050
books,"I’m half way through a book that I’m enjoying (it’s a re-read). I expected to be done with it but I haven’t been reading as much. Now my copy of Ready Player Two just arrived and I’m excited to read it. 

What would you do?

A. Read both at the same time 
B. Toss the current book aside and pick it back up later.
C. Exhibit patience, since it’s a virtue, and finish the book you’re reading.","One at a time readers, what would you do?",1606241984
books,"In 1959, Robert Heinlein wrote the classic Starship Troopers, a story set in the fictional Federation Terra (*Terra* means Earth in Latin languages) and its new society is a libertarian power fantasy, with the quality of life being as high as it can possibly be, the State is minimum and the military is minuscule, only 1% of the population. The voting franchise is earned through military service (combat and non-combat) and everybody is allowed to apply in order to become a citizen (as long as they endure the grueling service time). The Terran Federation is opposed by the communist-like Arachnids (the ""Bugs"") and has an ambivalent relation with the Skinnies (that provide a window of understanding with the bugs).

[**The Politics of Starship Troopers**](https://www.youtube.com/watch?v=kVpYvV0O7uI)

Maligned mainly by leftists as a fascist ""pronunciamento"", this argument is very weak and is not supported under the light of the actual narrative (even if we use the movie as a basis).

[RE: Wisecrack's Starship Troopers: How to Make Fascism SEXY](https://www.youtube.com/watch?v=95OQlvEQNRM)

*(While I scoff at Verhoeven's failed attempt at mocking Heinlein, I still like the 1997 movie as a guilty pleasure.)*",The Politics of Starship Troopers,1606241718
books,[removed],Ready Player Two,1606240923
books,I have a writing assignment due where I have to find the hidden meaning in this book and so far I have the social and political differences between the Russians and Americans alongside this I have the overarching theme of trust between people. I was wondering if you have any other ideas for themes in this book?,The hunt for red October,1606240279
books,,Plenty. by BeeLyn Naihiwet,1606240187
books,[removed],"I’m Peter F. Hamilton. SF writer for too many years, but still willing to talk about it on an AMA",1606239489
books,[removed],Las mejores novelas sobre Marte,1606239207
books,"I'm not sure how to title this, nor how do explain it but I'll do my best. I read Ready Player One awhile back, and really enjoyed it. I bought Ready Player Two today, and I'm excited to read it.

Although, I decided to read some reviews of the first book. A lot of people didn't like it for particular, reoccurring reasons. The reasons aren't important, what is, is that I myself don't ever think about any of these things when I read, and I'd like to. 

I don't recognize when characters don't develop (or do so badly), when the plot is poor, sometimes I recognize a few things but nothing deeper.

Is there something that I'm particularly doing wrong, or do I just need to read enough so that I can make those connections?",Inactively reading?,1606239088
books,"If the book has been turned into a movie or a musical, I like to listen to the soundtrack faintly while I read. I usually can't read a book while listening to the audiobook because my eyes will read too fast or too slow for the narration. Sometimes I'll turn on some nature sounds, like rain on a tin roof or fireplace ambiance. 

What about you?",What do you like to listen to while reading?,1606238875
books,"I love the idea of having a Kindle or something similar, but I also do not like getting all my books through Amazon or a major retailer. I like to support my local bookstore! For audiobooks, I use [Libro.fm](https://Libro.fm) — is there something similar for e-readers out there? I just don't have enough room in my apartment for more books lol. And I'd like to continue my unhealthy habit of impulse-buying books.",E-Readers that work with indie bookstores?,1606238418
books,"Hey, I stumbled across this website recently. I don't know how I found it since finding stuff like this on Google can be a *pain*. It looks like the site is promoting a new fantasy romance series? So far, I see only one book which I assume is the first one. It comes out this December.

Plot reads:  

&gt;A Magical Woman Meets a Modern Dragon...  
&gt;  
&gt;Kayli Zarell, daughter of Zarek and Nemony, was attending her grandmother's funeral when an unexplainable vortex pulls her and her family into sleepy small town Blue Ridge, Pennsylvania. Meanwhile, Romulus Travers, resident dragon of Blue Ridge, finds his day interrupted when the same vortex leaves destruction throughout the town. The Travers' open their home to the Zarell's as both families come to terms with the chaotic nature of their new circumstances.  
&gt;  
&gt;One Crazy Proposal Later  
&gt;  
&gt;What seems to be the worst thing to come out of this situation is Rom's and Kayli's immediate attraction to each other. Rom has his responsibilities in Blue Ridge. Kayli and her family have lived in isolation away from human civilization. Not to mention, if a relationship were possible, it would require a great deal of magic to travel between both worlds. These realizations don't stop them, however, and the next thing they know, they are affianced the same day they met.  
&gt;  
&gt;After the proposal, all kinds of trouble seems to be heading the Travers' way. The other town residents are upset by the damages to their homes and businesses - some begin thinking the Zarell's are to blame. Then there are things like kidnapping, past trauma, plots of domination, and murder that threaten to fracture everything the Travers' have built. But maybe, just maybe, a rushed proposal under the stars is exactly the kind of crazy that is needed if the Zarell's and Travers' are to survive.

What do you think? Something to look forward to? Pass? Are there indie or underrated books that have caught your attention?",New Book Series? Author Website,1606238050
books,,"Titolo: Aries Autore: Gemma James Editore: VirgiBooks Genere: Erotic Romance Serie: La Regina dello Zodiaco vol.1 Vuoi ricevere in anteprima le nostre uscite ? Recensione Aries - Gemma James ""Aries"" è un romanzo che fa parte di una serie di ben 12 volumi.",1606237877
books,[removed],Request: A young adult book where the protagonist is a young woman who foregoes being a home maker to create her own path but later does have a family,1606237054
books,,Talking to the chair of the 2020 Booker Prize,1606236894
books,[removed],what makes people charming?,1606236612
books,,Chicago High School Students Get Free Digital Access to Obama's 'A Promised Land',1606236064
books,[removed],Is 'The Scarlet Letter' worth reading?,1606235328
books,,The Effect Of Covid-19 On The Business World,1606235207
books,"A server where we spread love and passion for the community of Toaru.We are welcoming to those who enjoy the series and world within Toaru.

Anti Toxin, amicable community, interesting Toaru bots, and many more to come!! It's called Ultimate Toaru for a reason.

SO what are you waiting for??? Come join us!!!

[https://discord.gg/yPz3C4bnqd](https://discord.gg/yPz3C4bnqd)",A Certain Ultimate Toaru invitatation,1606234960
books,[removed],Please help--Book of vintage futuristic illustrations,1606234725
books,"I read this young adult novel as a kid that I cant find anywhere. It was about this mummy, Pretty sure his name was Loki, and he was trapped inside of a virtual reality video game. This kid starts playing the game and the mummy tries to become real. There was also mention of plague like incidents happening.",Please help!,1606234278
books,[removed],Where can I get free Cain's jawbone e-book?,1606233817
books,[removed],Most Evil female character?,1606233597
books,,EJACULAÇAO PRECOCE COMO CURAR NATURALMENTE! METODO CASEIRO BEBIDA POTENTE!!,1606233085
books,[removed],Babylon 5,1606232737
books,[removed],Looking for a VERY exciting and dramatic romance novel,1606232076
books,[removed],Has anyone read 'Lethal dosage of life' by Vladas Golambiauskas?,1606232031
books,[removed],Has anyone read White Ivy By Susie Yang?,1606232017
books,,Best Comics reading app for iOS.,1606231967
books,,"Audible will change how they pay royalties on returns and exchanges, effective January 1, 2021",1606231653
books,[removed],Does Catcher in the Rye have a faithful movie adaptation?,1606231285
books,[removed],"Hey there, I'm writing a book for the first time and I'm wondering if Amazon publishing is the route to go for it. I'm thinking around the 150 page mark for it. Any suggestions?",1606230920
books,,New Books from Poland 2020,1606230774
books,"My favorite scene in a novel is in Chapter 3 of the Great Gatsby. This is the party scene at Gatsby's house. ""In his blue gardens men and girls came and went like moths among the whisperings and the champagne and the stars"". 

I don't like tragedies. I liked Romeo and Juliet up until the death of Mercutio, and then I stopped liking it. What are some books that are as fun and uplifting as the party scene in the Great Gatsby or the balcony scene in Romeo and Juliet?",Uplifting/Fun Books?,1606230021
books,,Books For Afghanistan,1606229826
books,,"Your Week in Virtual Book Events, Nov. 23rd to Nov. 29th | Literary Hub",1606229663
books,"Good morning 

I am midway through reading you're a badass by Jen Sincero. This book is super good. I was curious about what others thought about it.

 I am also reading The Choice by Dr. Edith Eva Eger just in the beginning cant wait to dive in more to know her story and learn from what she went through and how she is helping others after. Has anyone read these books? what did you think about them? 

I learn and grow from these types of books and will be starting Confident as fuck once done with your a badass. 

Just curious on peoples thoughts 

thanks",Books I am reading,1606229573
books,,'If You Believe in Your Work It's Your Job to Make Others Believe in It Too.' | An Interview With Late Indie Author C M Turner You Might Want to Read,1606229551
books,,The 10 Best Books of 2020 - The New York Times,1606229272
books,,Gregor The Overlander Review,1606229059
books,[removed],2021 Readathon!,1606228456
books,,Deadly Cross : By - James Patterson - GoBookMart,1606227748
books,,"Canadian Publishers, Booksellers Want Bookstores To Be Declared An 'Essential Service' In Ontario",1606227590
books,[removed],Ready Player Two by Ernest Cline,1606226554
books,[removed],Ready Player Two by Ernest Cline,1606226485
books,"Since quarantine I have been reading more (mostly nonfiction) and have recently gotten into fiction to diversify my reading. I feel like I read everything too literally (as well as look at most things in life literally), rather than analytically to get the deeper meanings. Ex. I have been reading 1984 and know there is a ton of symbolism and deeper meanings, but I am just reading the text on the page how it is written. How have you transformed your way of thinking in life/reading?",Reading too literally..feel like I am not getting the meaning from fiction books.,1606226383
books,"BOOK REC: I recently discovered this awesome fantasy book based on Russian and Slavic fairy tales - The Song of the Sirin. I loved seeing Nicholas Kotar's interpretation of Russian fairy tale themes that I had known since childhood. LMK if you've also read this book and recommend some similar books please :D

[https://nicholaskotar.com/book/song-of-sirin/](https://nicholaskotar.com/book/song-of-sirin/)",Russian fairy tale fantasy book ;D,1606225511
books,[removed],Your favorite quotes from Imp in GoT series by Martin?,1606224708
books,,"The Hiding Place, a review by Tanya",1606224579
books,[removed],TOP 1% * 10$ for 24h only*,1606224147
books,[removed],The God of Small Things *[SPOILER ALERT]*,1606223307
books,,The Forty Rules of Love by Elif Shafaq is a very good book 📚 to read before 2020 ends..,1606222313
books,[removed],What is a must read book?,1606221538
books,[removed],Barack Obama,1606220743
books,,The new Haruki Murakami Library at Tokyo's Waseda University will open in 2021,1606220427
