subreddit,selftext,title,created_utc
books,"I've never written a book review or posted on Reddit in my life but I need to put this into the world so here it is:  


I knew *A Little Life* by Hanya Yanagihara was a sad book when I decided to read it. I decided to read it *because* I’d heard it was a sad book—because I’d heard it mentioned in videos as “that one book that makes you cry a lot,” that’s “formative and important,” and that “you can instantly tell is going to be emotional.” A girl I’m subscribed to made a half hour-long video about it. I saw Antoni from Queer Eye wear t-shirts with the characters’ names on them on the show. This is what convinced me to read it: that it is widely regarded as an impactful story that makes those who read it feel very strongly. I thought that if there’s a book that’s so powerful it makes those who read it cry and carry the characters’ names around with them, then that means it must be worth reading. So I bought it off of eBay and read it. 

In hindsight, I chose to read this book at a bad time. It’s April 2020, the pandemic is happening, and I read it over the course of about 12 days in quarantine during which I had nothing but time to sit in my room and read it for hours straight and think about it for days on end. *A Little Life* has been on my mind every single day for over two weeks now. It’s what I can’t stop thinking about when I’m trying to go to sleep. Sometimes it’s the first thing I think of when I wake up, and I know I’ve been dreaming about it. At first, this was because I was in the middle of the story and was immersed in what was going on, anticipating where it would go. Then, it was because I’d finished it and was consumed by how devastating it was. Now, it’s because I’m genuinely angry that I let myself get so emotionally invested in a book that is in actuality terrible in every sense of the word. In short, *A Little Life* has deeply and personally upset me in multiple ways and I’ve come to realize I won’t be able to fully focus on anything else until I put into words why. 

The blurb on the back of the book promises a story that “follows four college classmates—broke, adrift, and buoyed only by their friendship and ambition.” It tells you what you’re about to read is “a hymn to brotherly bonds and a masterful depiction of love in the twenty-first century.” Both of these things are lies and the second one, after a certain point in the book, almost reads like a sick, twisted joke. 

But before that, here is what I initially loved—and still do appreciate—about this book. It is undeniably gripping from the first chapter to the end. Despite having little to no plot, just detailing the lives of the characters for 800 pages, this story kept me up reading until the sun came up more than one time. The first hundred or so pages gives such a solid introduction to (what you are deceived into thinking will be) the four main characters that you become invested in each of their lives, rooting for them individually along with dying to know more about their history and dynamic as a group. I knew *A Little Life* was different from any book I’ve ever read pretty early on when I started to feel it in my chest. It’s a physical ache that makes my chest feel hollow and heavy at the same time. That feeling in my chest has only gone away a few times since I’ve read the book, it keeps coming back, and it’s here right now as I’m writing this. I know this sounds so over the top but it’s true and that chest feeling is honestly the main reason I’m writing this, it makes me feel like it’s hard to breathe and I want it to go away. That feeling started as a combination of genuine love developed for the characters, pain from the truths about friendship and life weaved within the narrative that hit me with an intensity I wasn’t ready for, sick anxiety for what could possibly be waiting in the following hundreds of pages I still had left, revulsion at the scenes I was being made to visualize, and eventually just pure sorrow for Jude and all the people who loved him. It made me cry harder than I ever thought I could cry for a fictional story. Hanya Yanagihara put something into the world that will stay with me forever, and there is absolutely something to be said for that. 

But Hanya Yanagihara did not write a good book. She wrote a moving book, she wrote an unflinching book, she wrote a haunting book. But I’ve learned through reading this and thinking about it nonstop that those things alone do not make a good book. She wrote a book that is not only dark and intense in subject matter, but that is excessive and visceral in its depiction of torture to the point of no longer being believable. The narrative is exhaustingly repetitive of Jude’s pain to the extent that no other characters get the room in the story they need to develop and grow. It becomes clear after reading scene after scene of nauseating violence and abuse that Hanya Yanagihara got carried away with detailing her protagonist’s suffering for what disappointingly seems to be no reason other than shock value and eliciting negative emotions from the reader. She is careless with the reader’s emotions, invoking pain in them just for the sake of it. 

**Here is where I’ll start to spoil the book and won’t stop for the whole rest of the time until the last paragraph.** 

&gt;!Did Hanya Yanagihara think forced childhood prostitution wasn’t traumatic enough? Did she believe all the other horrors were necessary to make Jude’s past experiences warrant his current trauma? Not only does that seem to me like a slap in the face to all real-life sexual abuse survivors, but at a certain point it also begins to warp the narrative into something that is no longer plausible. For me, this point was when Jude hitchhiked from Montana to Philadelphia.  Every single trucker he waved down was a rapist pedophile monster? Not one of them had a heart? Really? And before that, every counselor at the home was either a rapist pedophile monster or turned a blind eye to their rapist pedophile monster coworkers? Then, as an adult, the one guy Jude finally decides to date is the most batshit crazy evil fucker in all of New York City? I’ve never had to stretch my suspension of disbelief so thin as I had to to get through the Caleb part of the book. Jude’s abusers were cartoon villains, not characters, and this cheapened the story so much. !&lt;

&gt;!Out of these cartoon villains, Dr. Traylor especially was entirely unnecessary. He had no motives, no depth, no character; he only served as a vehicle to deliver further suffering to Jude, just to really drive it home that Jude’s childhood was bad, if that wasn’t already clear. Jude’s character already had a central tormentor in Brother Luke. He did not need another to make the reader buy his suffering; the manipulation, physical pain, imprisonment, and perpetual shame he endured at the hands of Luke was enough. It was visceral and painful and hard to read, but it worked within the story because Brother Luke and Jude’s relationship was one that the reader got to see develop and change over time. We understood why Jude trusted Luke, how Luke exploited him, and the horrifying world that Jude was forced into because of him. Again, this was enough. Of course the car injury needed to happen, but that could have easily been worked into Jude and Brother Luke’s storyline. With each bonus villain, Yanagihara unwittingly draws the curtain back and exposes Jude’s life story for what it is: a series of unthinkably awful, unlikely tortures imagined by an author trying to make her book as emotionally taxing as possible just to get a strong response. !&lt;

&gt;!Not only does the excess of Jude’s suffering make the reader doubt the reality of the book’s world, but it diminishes the impact of all the other characters and their experiences. Yanagihara created complex, beautiful characters worth exploring and then threw them to the rats. This, for me, is the most unforgivable part about A Little Life. The bones of a powerful story about close friendship are there, but they are buried beneath the rotting flesh that is what this book actually turned out to be. Did nobody edit it? Did they not say, “Wait, what about those other two main characters? Hanya, did you forget about them? What about JB and Malcolm? Isn’t this their story too?” Even Willem is a victim of this. We meet them as lost twenty-somethings each struggling to make it in their respective careers, and then suddenly—with a brief interlude for JB’s glossed over battle with addiction— they’re all famous and successful and bathing in riches.!&lt;

&gt;!Even though this shift in circumstances was a little jarring, (though did any of their characters ever really grow or change in all those years?) there was still a beacon of hope I looked towards: Part 5. Titled, “The Happy Years.” Seeing that title in the table of contents, I was at first hoping, then at some point just assuming because of the lack of exploration of the friendship group in all the pages I’d already read, that this section would document Jude, Willem, JB, and Malcolm’s college years and I was so excited. Finally, a break from visceral descriptions of child prostitution and self harm, and now we actually get to see these friendships we’ve heard so much about develop. Now we get answers to the driving questions, “Okay, we know JB, Willem, Malcolm, and Jude love each other with every bone in their bodies. But why? Yeah, we know they were randomly put together in a cramped little dorm in Hood Hall, but what made them friends? Why were they known as an inseparable group throughout campus? What did they do together? What emotional connections did each of these boys form with each other that set them apart from the other randomly assembled college kids, and how? What are the first memories they have together? What fights did they have early on, and how did they learn to reconcile? In what ways did they struggle trying to stay connected after leaving the place that brought them together?” I thought, “I know these four very different people love each other, but now I’ll get to see how and why and when and where it all began. Almost 500 pages in, finally.” But you never get any of that. And it's crushing. !&lt;

&gt;!The scenes with all four of them were some of my favorites in the whole book. They were the most powerful; the ones that made me cry for good reasons and for bad. Reading the roof/fire escape scene, I was holding my breath. That was a part of the book where we saw each of the characters' personalities, where we really began to understand how their dynamic works. That scene is one of the only reasons I have an understanding of their dynamic at all. It shows how JB calls the shots, how Malcolm is apprehensive and cautious but ultimately always follows him, how Willem contests JB, how Jude desperately doesn’t want to be pitied by the others, how Willem cares about Jude the most deeply and looks out for him the most, how Jude and Willem each have their own roles within the group and relationships with the others but also have their own separate bond just between the two of them, how Willem will do anything for Jude, how Jude, on the inside, not only appreciates but needs Willem’s support to keep him from falling, literally and figuratively, to a dark, dark place. All that from one scene. !&lt;

&gt;!And the scene in JB’s apartment is the most harrowing of them all. It had me crying harder than any other part of the book. The struggles of every single one of them in that room felt so real; JB’s to maintain some semblance of dignity in front of his friends, Malcolm’s to keep the peace, Jude’s to accept what he’s just heard come from the mouth of a person he loves and is trying to help, and Willem’s to save JB but then to fight for Jude once it all goes down. Those last three lines sting. The whole scene does. !&lt;

&gt;!If there had been even just a few more scenes with the four of them that matched those ones in detail and rawness, A Little Life might have been the book it pretends to be. It’s so deeply disappointing to me that there aren’t. !&lt;

&gt;!Actual big spoilers coming up, if you ever want to read the book stop here, skip to last paragraph!&lt;

&gt;!I tried as hard as I could to accept Willem and Jude’s relationship for the sake of all the time and emotion I’d invested in these characters and their story, but truthfully I could cry thinking about how bad Yanagihara fucked it up. The way their relationship unfolded made me sick. Earlier in the book, she wrote that whole passage about the inherent value of friendship that I can flip to right now in three seconds as I write this because it resonated with me so much I highlighted the page,!&lt;

&gt;!“Lately, he had been wondering if codependence was such a bad thing. He took pleasure in his friendships, and it didn’t hurt anyone, so who cared if he was codependent or not? Why was it admirable when you were twenty-seven but creepy when you were thirty-seven? Why wasn’t friendship as good as a relationship? Why wasn’t it even better? It was two people who remained together, day after day, bound not by sex or physical attraction or money or children or property, but only by the shared agreement to keep going, the mutual dedication to a union that could never be codified…”!&lt;

&gt;!and then she put the characters of the only fully fleshed out friendship in this entire story in a romantic relationship? Not only a romantic relationship, but one that is in its early stages the most sickening, gutting thing to read as Jude is, devastatingly unbeknownst to Willem, made to relive the hundreds of rapes of his childhood by the one person he’s ever truly loved. There were truly beautiful moments in their relationship that I loved so much, but oh god, that part made me so sick. I could almost forgive it if it were done differently. In fact, I could forgive it entirely if it was done differently. If Willem and Jude had, from the beginning, had the seeds of those feelings for each other. If they were anywhere to be found. If we had gotten snippets of Willem feeling attraction towards Jude in college, and in their twenties, but pushing them aside because Jude is his friend, and he can’t feel that way about him, and Jude would never open up to him enough for them to become anything more than friends, and besides, he’s straight...right? And if we’d seen Jude feel inexplicably drawn towards Willem, wanting him in ways he never wanted the others, but he could never do anything about it because Willem is his friend, and he’s the one everyone wants, he’s the gorgeous lady killer and besides, he’s so fucked up from his childhood that he doesn’t ever want to put himself through the horrors of physical intimacy again..but he still can’t shake those feelings for him. If that had been written into the story not only would it have been forgivable, it would have been hard-hitting and powerful. And, if JB and Malcolm had actually gotten to fulfill their spots as main characters, we still could have gotten the friendships in the story that were promised. But, instead of that, what we have is two characters whose relationship was the strongest, most beautiful platonic relationship I’ve ever read, the only relationship in the book—save for Jude and Harold, Jude and Andy, and, upsettingly, Jude and Brother Luke—that was actually explored at length, hastily morphed into a romance for one fucked up reason: so it hurts more when Willem dies.!&lt;

&gt;!Aside from the disappointing friendships and relationships in this book, the other, equally upsetting thing is what followed when I finished the book, closed the back cover, and couldn’t help but question, “What was Yanagihara’s intention in writing this story?” I understand why !&lt;

&gt;!Biggest spoiler yet!&lt;

&gt;!Jude killed himself. It broke me to pieces and made me cry like a child but, given the agony he endured every single day of his life, I will never argue that it didn’t make sense. But it really makes me wonder what her purpose was for putting this story into the world. This is a story about trauma. It’s a story about what a person’s life becomes when, from the very start, they are physically and psychologically broken down in every way imaginable. It’s a story about how that kind of trauma never ever leaves you, and how you have to find your own ways to cope just to make it through your remaining days. So what is her message for the readers out there who are like Jude? The sexual abuse survivors? The human trafficking survivors? The domestic abuse survivors? Those who cut themselves, those with eating disorders, those living with chronic pain? That even if you find an escape, become unimaginably successful, travel the world, and, most importantly, form lasting, meaningful relationships with angelic people who support you and love you from the bottom of their heart, that there is still no hope for you? That life for the abused is a lost cause? From what I understand, her message is that it never gets better. I think Yanagihara did something irrevocably dangerous: she created a book, that has now gained popularity and critical acclaim, in which she wrote suicidal ideation from the perspective of a suicidal person with such conviction that she forces the reader to begin to see his side; that killing himself would in fact end his pain, and at this point the reader loves Jude so much that all we want is for his pain to end. She writes from this perspective and then does not rectify it. Yes, she makes it clear that Willem and Harold and Julia (Julia, who got no characterization but deserved so much) and JB and Malcolm and Andy love him, and that they’re doing what they can—I know they really could have done more, but I’m not going to go off about that because I understand Yanagihara was making a point about the agonizing struggle that is trying to maintain the balance between respecting your loved one’s autonomy/protecting their dignity and knowing when it’s time to cross a boundary in order to keep them safe and having the courage to cross that boundary; it’s part of the tragedy and one of the most realistic parts of the story, so I get it— but in writing what she wrote, she sent the message that unconditional love is not enough. And when Jude kills himself, what she’s said is that in the end, he was right. That suicide was the only thing that made his pain go away. And she is wrong for that. She wrote a devastating story, intentionally making readers connect deeply to her characters just so she could make it hurt when she ruined them, and she neglected to include even a shimmer of hope; the one thing essential to stories like this. In A Little Life there is only misery and no solace. And it is just not worth it. !&lt;

*A Little Life* is a cathartic book to read. It’s unforgettable. Between the despair, there are small pockets of joy and triumph within its pages that made my chest swell with good feelings instead of hollow from bad ones; the first time I cried, it was because of a happy scene. It reveals harsh truths in a way so subtle yet so strong it takes your breath away. It made me feel an aching, powerful love for the main characters. But, for all the above reasons, from the bottom of my heart: fuck this book. Thank you goodnight.",Why A Little Life Is Not Worth Reading,1587750081
books,"I love memoirs- it’s one of my favorite genres. However I’m always curious about how people can remember specifics from so many years ago on seemingly obscure situations. I know that memory is infallible and that many memoirists include a disclaimer that their writing is a reflection of their interpretation/recollection.

HOWEVER, what are some memoirs that you think go beyond that are a deeply fabricated? There’s a lot of talk that A Child Called It by Dave Pelzer is one of those.

Do you have any others?",Memoirs you suspect are fabricated,1587749847
books,"I do not wish to be a published writer - I want to work as a psychologist and writing is a hobby I'm devoted to - it's perhaps the only talent I have. And although it's not something I want to pursue professionally, I still love the idea of getting published in magazines (print/online) and on websites and getting paid for my work, sharing it with my very, very small social circle, collecting acceptances and rejections. I've even published a few times. Now that I have so much time during the lockdown, I've been thinking of reading magazines and submitting again. 

However, there's something I feel sort of ashamed about - I only read magazines when I'm trying to see if they publish the kind of stuff I like to read and write. If I like them, then I'll read dozens of their pieces to get an idea of what I should send them. However, if I do not have the desire to submit to them, such as over the last several months, when I was busy with classes and other stuff, I don't actively   check out magazines to read just for the pleasure of reading. 

And that makes me feel bad - that I read these magazines only when I want to get published in them. It somehow feels like I'm exploiting the efforts of the people who run them. When I do read them for fun, I just do that - simply read. No sharing on social media platforms because, as I said, I have a very, very small circle (and given how easily I get overwhelmed, I like it that way). And I tend to go for online magazines that don't need subscription, because, since I live in India, the exchange rate makes magazine subscriptions a luxury I cannot afford. 

All of this makes me feel selfish and also wonder - do magazines these days perhaps have more writers than readers? And am I exploiting all the hardwork of the magazine staffs by simply reading and submitting and not sharing/subscribing?",Do you read literary magazines?,1587749470
books,"I've taken up reading two books at once. One that I really focus on (Way Of Kings, by Brandon Sanderson, if anyone's wondering) and one that I read a chapter or so, maybe two, a day. 

I kind of want Anna Karenina to be that second book. However, through some unfortunate mishap I cannot quite recall, I know how it ends for the titular character. Would you wisened veterans suggest there's still enough book there that it's worth a read?",Should I Read Anna Karenina If I Know How It Ends? (Spoilers),1587749450
books,"I'm a 21f, and my hypothesis is gender has something to play in this.

But I was just journaling about some of my favorite book characters (Father Captain De Soya from the Hyperion books for anyone looking for suggestions), and I just find myself so enamored with him. His character, the way he's described, the actions he does in the books make me almost swoon. It's so embarrassing to admit haha.

I remember getting crushes on book characters when I was reading schlock YA fiction, but chalked that up to me just going through puberty. Once I grew up I became more into nonfiction reading, yet since getting back into fiction I find myself daydreaming about specific characters.

It's not like I'm crazy and ordering a De Soya body pillow, but I was wondering if anyone else had experiences with this and how you feel about it.",Is it normal to get crushes on book characters?,1587749032
books,"Does anyone know what this is about?


&gt;!This seemed like a weird scene and I don't know if I missed something before or after that clarified what this meant (if there's even any significance to it)

&gt;!&gt;Jimmy stepped away from Petrie's shop area and started for the stairs. Something--a half thought or perhaps inspiration--made him turn. He saw Ben across the basement, working under the bright glare of those three lights, hung neatly in a row.

&gt;!&gt;Somethin...and it was gone.

&gt;!&gt;He walked back.

&gt;!&gt;Ben shut off the lathe and looked at him. ""Something else?""

&gt;!&gt;""Yeah,"" Jimmy said. ""On the tip of my tongue. But it's stuck there.""

&gt;!&gt;Ben raised his eyebrows.

&gt;!&gt;""When I looked back from the stairs and saw you, something clicked. It's gone now.""

&gt;!&gt;""Important?""

&gt;!&gt;""I don't know."" he shuffled his feet purposelessly, wanting it to come back. Something about the image Ben had made, standing under those work lights, bent over the lathe. No good. thinking about it only made it seem more distant.

&gt;!&gt;He went up the stairs, but paused once more to look back. The image was hauntingly familiar, but it wouldn't come back. He went through the kitchen and out to the car. The raid had faded to drizzle.",I finished 'Salem's Lot last night and was wondering if anyone could clear up what is happening in this scene...,1587748403
books,"i really want to find a site kind of like netflix to read books, the only sites i have found only have some no-name online authors. i know i just could buy ebooks but i would prefer something with a flat rate like actual libraries. libraries will be closed for weeks more and i am getting more and more desperate for some good books.

i know this might be the wrong place to ask this but i have searched all over for a place to do it and i cant really find the right subreddit",best online library for quarantine?,1587748389
