subreddit,selftext,title,created_utc
books,"This wasn’t a book I had on my reading list, in fact I had never thought on reading it,but it happened to be in the closet of my house (I don’t know were it came from) so I decided to take a look and I immediately fell in love with the writing style.
The book is divided into two parts that complement each other,the songs of innocence,and the songs of experience. The first part has a happy tone, presents joy ,happy nature and the protection of god, the themes presented might be simple, but they are beautiful and the writing style of William Blake makes reading this poems an amazing experience.
The songs of experience however have a gloom ,dark tone , the themes are poverty, abandonment, melancholy and death, it’s shocking to read this two world visions one after the other.
Through the poems Blake uses recurring symbols like the lamb ( innocence) , the dawn (hope) , grey hair (experience) and nature which is portrayed as a source of beauty and fun but also of danger mainly in boy lost and girl lost.
What I can say for sure is that weather of happiness or melancholy this poems are able to transmit feelings on an unique way .",Songs of innocence and songs of experience,1603092614
books,,"My friend Stephen Hawking was reckless, capricious — and stubborn as hell. Once Hawking went to a restaurant without a disabled toilet and he instructed his carer to wheel him into the kitchen, pee in a bottle and empty it out in front of the chef",1603091271
books,"Because of quarantine, I've been (finally) reading for fun again, and I've noticed some differences in my reading experience as an adult vs. as a teenager. With that, I've also noticed some differences between how I experience a book vs. how I experience a movie. 

1. I dream move vividly when I read books. I'm usually a huge cinephile, binging 2-3 movies a night if I can. But I noticed that in the month that I've picked up reading books again, I've been having much more quirky and complex dreams that stay with me the next day. This didn't happen when I binged watched movies or a show. Books seems to put me in a different head space. They also exhaust me much more than movies, so I go to bed much more mentally fatigued.
2. Reading is private. I’ll have created a whole world and cast of characters in my head, with no proof of them having existed outside of my mind. No one knows how much interpretation of the fictional world looks like but me. I think it's also why I don't remember books as well as I remember movies. I would go through my ""read"" list on goodreads and see titles that I don't remember ever reading. I guess it’s hard to remember something that never truly existed outside our minds. 
3. Reading is intimate. When I read, I can see Elizabeth Bennett while also *being* inside Elizabeth Bennett's head. But when I watch a movie, I see Keira Knightley playing Elizabeth Bennett. It’s one degree removed (i.e., diegesis vs. mimesis).  
I also don’t feel like I have to look over my shoulder, or be afraid that someone is going to burst into my room and catch me watching something racy and scandalous. The images are hidden in the words and pages. 
4. For the same reason, reading makes me forget about myself. I become the characters and I emerge from the books in a daze. I forget where I end and where the characters begin. When watching movies, I’m very aware of who I am and how I measure up to the actors on the screen. 
5. I feel more in control when I read. I can control the speed at which I consume a book. I can plow through a 200-page book in a night if it interests me enough, or I can read it over 2 days, a week, a month, or even a year. I can hold the book/ebook in my hands and will myself to go faster. You can control the speed of an audiobook (and I guess you can control the playback speed of movies too). But it just feels like there’s more agency when reading a book, from how your construct the characters in your mind, to how you pace yourself. 
6. An obvious comparison is that of length. Books are definitely longer because 1) there are usually more scenes and 2) the scenes are more drawn out and filled with descriptions of what the characters are thinking and feeling. BUT, what I think that films do that books arguably don’t do as effectively, is use setting and movement to paint a story. I think of noir films from the 1940s like Casablanca where Rick is often cast in half light and half shadow to reflect his inner conflict that he has in having to choose between the woman he loves and his duty to his country. I think about Wong Kar Wai’s In the Mood for Love where Tony Leung and Maggie Cheung’s characters pass each other silently in the narrow stairwell of their apartment building, an sexually-charged, intimate, claustrophobic, but contact-less interaction that symbolizes longing and loneliness. 

Obviously, both mediums have their strengths. I'm curious to hear about other thoughts about the differences between books and films (whether experiential or technical). 

Disclaimer: Just a note that I carried over this discussion from my tumblr post, so I did some self-quoting.",The Age-old Debate: Books vs. Movies,1603091122
books,,"Stephen Hawking took 80 vitamin pills a day, was always late and revelled in his fame. As this memoir by a close friend reveals, despite his terrible illness he never complained and had a tempestuous and VERY full love life",1603090904
books,,⛥♠⛥ I am stretched on your grave ⛥♠⛥,1603090119
books,[removed],Any recommendations for outstanding customer experience books?,1603089056
books,,Download Statistics Queries with Solutions,1603088342
books,[removed],Best books that explores and talks about loneliness?,1603087574
books,[removed],"Discover Lesser-Known Books Everyday, On Whatsapp",1603083656
books,"I've been reading Never Let Me Go by Kazuo Ishiguro(not done yet) and I'm wondering whether if this book has post-human connotations. I want to use this book for a research project for a class about post-humanism, which is basically ""the study of a person or entity that exists in a state beyond being human."" We've been doing a lot of stuff about AI and stuff, not too sure if never let me go has that but can someone confirm that this book is related somewhat to post-humanism so I know if I should use it or not? thanks",Question About Never Let Me Go and Post-Humanism,1603080519
books,[removed],A good introductory book on stoicism for children?,1603079620
books,[removed],Recommendation,1603079287
books,[removed],"Please help me find any copy of ""The Rotting Goddess""",1603079013
books,[removed],One book!,1603078942
books,"I saw this book mentioned here on a list of 15 Titles Not for the Faint of Heart and I found it extremely captivating.  Especially during a pandemic, a horror story about a highly contagious illness feels quite real and relatable.  I found the detailed description of smells to be greatly adding to the immersion.  For most of the book, I was on the edge of my seat while reading.  I had to take some breaks now and then because it felt too intense.    


Any other book with the same kind of engaging fast paced suspense?",The Troop by Nick Cutter,1603078246
books,[removed],What is the most twisted book you’ve read?,1603076778
books,"The owners of baseball teams have been incredibly stupid throughout the history of the game. They are typically incredibly wealthy businessmen with huge egos who are notoriously stubborn and miserly. Helyar chronicles the history of this stupidity over 600 pages detailing accounts of labor negotiations, contract disputes, advertising and media contracts, etc. While this book focuses on baseball, these same men are owners of fortune 500 companies, lawyers and judges, and often become politicians. It is horrifying how much idiocy exists amongst the most powerful class in America. The only people likely to have the patience for this are hard-core baseball fanatics. As one of those people, I found it very interesting and illuminating.","""Lords of the Realm: The Real History of Baseball"" by John Helyar",1603075687
books,[removed],How to read one book a week?,1603075637
books,"Let me preface this by saying I understand that some people love this book and that is cool. Tastes differ and that's great! 

I picked it up and just could not read beyond a certain point. The writing feels overtly verbose, pretentious and frankly boring to me. 

I just read 3 pages of a character babbling about a vision he had - a vision which has nothing to do with the plot. And then there are all the architectural descriptions. I just don't care about how many sides a building has and how its arches are constructed. Certainly not enough to read paragraphs on paragraphs of it. 

It's the first book in a long time that I've DNFed so violently (I actually went, ""Jesus, who cares about this shit?""). 

Am I missing something here? I like long winded philosophical discourse. I don't mind verbosity. But this book comes off as incredibly smug and pretentious especially because it chooses to babble about details that just do not matter and feels like Eco is fellating his own genius.",The Name of The Rose is the first time I've put down a book while cursing out loud.,1603075453
books,[removed],Do you prefer books with single or dual perspective?,1603072960
books,[removed],Nazi Germany german perspective,1603072527
books,[removed],Amazon hardback books always arrive damaged,1603072435
books,"Just finished Grapes of Wrath by Steinbeck.  It took me a while but it was definitely worth it, an amazing book and just a spectacular ending.  After finishing it I just sat there for a few minutes, it was that good.

The ending made me think a lot about desperation, hope, and the nature of humanity.  The breastfeeding image in the last paragraph reminded me a lot of the theme of a mother's milk in Beloved by Toni Morrison (""they took my milk"").  Both have a mother in terrible terrible circumstances, and the strength that both Rosasharn and Sethe portray is really inspiring.  Beautiful books.",The ending of Grapes of Wrath in connection with Beloved,1603071949
books,[removed],I’m looking for the title of this book...,1603071121
books,"I know I could just look on goodreads for reviews but also wanted to see people’s opinions on here too. Anyways, what did you guys think about this book? Saw a YouTuber recommend it and when I bought it today and flipped through it seemed interesting. I also got another of Stieg Larsson’s books (The Girl Who Played With Fire), so what do you think about the writing style and these books overall? I will begin reading *The  Girl With The Dragon Tattoo first so if youve read it your I would love to hear your opinion! LASTLY NO SPOILERS PLEASE!!",Thoughts on “The Girl With The Dragon Tattoo”?,1603070698
books,"As a kid/teen I used to read a lot, but once I got to college (and majored in English) I just could NOT read for fun anymore. I would read here and there, but never more than two or three books a year. 

Cut to quarantine, I’ve had a LOT of spare time (I live alone and work from home), so its given me a chance to get back into it. Idk what it was, but a switch flipped in me. I’ve read more books in the last six months than I’ve read in the last six years, literally. I guess my point of this post was to just post my little list in hopes some people wanted to talk about these books! And also to see if anyone else has had a similar experience with falling in love with reading again in this new, weird, post-quarantine world. 

A lot of recommendations I got from this sub, so thanks in advance! This list isn’t in perfect chronological order, since I didn’t start tracking books I had read until Sense and Sensibility. 

1. Martian chronicles

2. Invention of Morel

3. Everything I never told you

4. Circe

5. Haunting of hill house

6. Fahrenheit 451

7. Sense and sensibility 

8. Graveyard book

9. Mysterious affair at styles

10. Murder on the links

11. Murder of roger ackroyd 

12. The odyssey (Emily Wilson)

13. Song of Achilles

14. Vanishing half

15. Metamorphosis

16. ABC murders

17. And then there were none

18. Murder on the orient express

19. Slaughterhouse Five

20. The Count of Monte Cristo",Quarantine has reignited my love of reading,1603070443
books,[removed],Just finished Prelude to Foundation and wow,1603070174
books,"I finished reading this book recently and would love to discuss it with someone!

I felt the magic system was unique in that it always kept you at arm's length. You could see that the characters were progressing in their magic and transforming into something other, but the whole process or system was never really explained. I enjoyed that though because I imagined that's what the characters largely felt at first, a kind of muddled confusion.

I was a bit disappointed and confused by the ending so I would love someone else's take on what happened. I was looking forward to reading the next book in the series, but it unfortunately hasn't been translated yet.","""Vita Nostra"" by Marina and Sergey Dyachenko",1603069741
books,"I've been looking for the Famous Five series by Enid Blyton. I know the publishers in 2010 made some updates to the language to bring it into the 21st century which is fine, but I was looking for the original texts with words from the past (yes, shillings and all). Does anyone have any ideas where I can find this? Thank you!!",Famous Five - Enid Blyton books without edits...,1603068905
books,[removed],What's it like to read on an ereader?,1603068669
books,[removed],Test,1603068495
books,"I'm 23 and I'm not ashamed to say that I still read books in the middle grade and young adult sections. This is not the problem. I don't want to leave these books behind completely. However, I find that a lot of the types of young adult books that I used to love in middle school and high school no longer interest me. I have read books marketed to adults that I have loved, but I find that I often have a problem. I'm not in high school anymore and I can't relate to a lot of those problems, but I'm also not married or settled down. I don't believe that you have to relate to every book that you read, but I still crave books with relatable characters and I'm finding it hard to find stuff. I know that New Adult exists, but it's hard to find books marketed for that age that aren't about college or aren't a rom com. (I like romance, but not when it's the whole book. And I don't enjoy detailed sex. I prefer the YA book sex where they just focus on the emotions, but I'd prefer it with adult characters as it's getting weirder and weirder to read about teens having sex as I get older. Lol.)

I don't know if I'm making any sense. But I'm changing as a person and a lot of what I found satisfying before no longer is. I feel like I'm in an ""in between"" stage where I feel like my tastes lie half in YA and half in adult. I want books that combine the best elements of both and I have no idea where to look.",I don't know what I want to read anymore.,1603067458
books,[removed],The Divine Tragedy,1603066971
books,Hi. I’m 27 and forced to work from home due to some recent medical diagnoses. Just started a amazon affiliate program and found out I can send free links of 30 day trials to audible. If your interested then comment what book you want and I can send a link right to it. Thanks for reading and double thanks if you plan on commenting.,Book links ( not spam),1603066479
books,[removed],When We Believed in Mermaids: A Novel,1603066233
books,"Just wanted to vent, because I’m reading this about a year after I read The Handmaid’s Tale, which hit the right balance of mystery, dystopia, and social commentary for me (loved how dreadful “The Wall” was).   

Now, I’m about 2/3 through Testaments and I’m rather bored with it. THT felt mature and serious, with the oppressive atmosphere weighing down on Offred.  Gilead was forbidding and all-powerful, and I loved that I didn’t know the scope of their domain.  Now in The Testaments, they’re training a high school girl in martial arts so that she can infiltrate Gilead and obtain secret documents that will blow the whole operation up in smithereens.  It just feels like someone else wrote a YA novel set in the same universe.

Does this have something to do with the TV series having been produced (haven’t watched it, nor will I bother if it’s more like TT than THT) and Atwood being influenced by it?",Disappointed in The Testaments,1603065900
books,[removed],Then She Was Gone,1603065079
books,[removed],Ever had a book with a very exciting first chapter or two that really let you down?,1603064869
books,,MY FIRST EMOJIS by Melissa Kay Moore,1603064367
books,"Just finished **The October Horse**, the 6th book in McCullough's fantastic Masters of Rome series. It covers the time period from 48-41 BC, so from when Caesar meets Cleopatra to the Battle of Philippi. 

I'm still amazed at how McCullough makes Ancient Rome so engaging. There's multiple characters that have the same name, but she makes each of them distinct. Seeing characters that have been in the series for the last 4-5 books meet their demise hit me harder than I was expecting. I mean, this is actual history so it's not like I didn't see it coming. Caesar's death in particular struck me since it's implied &gt;!that he was actually looking forward to dying due to being worn out from everything.!&lt; The last few hundred pages deal with the rise of Octavian and TBH, I found him one of the most interesting characters in the series. If Caesar is fire, than Octavian is ice. He has similarities with Caesar (which he does intentionally), but he's far more ruthless.

If you're looking for some good Roman historical fiction, then give the Masters of Rome series a try.",One Step Closer To Finishing The Masters of Rome Series By Colleen McCullough,1603064362
books,"Hello everybody, I am currently reading Slaughterhouse-Five for school as out great reads project! I love the book and am trying to find a credential of its language translations. So, I am trying to find out how many languages this novel has been written/translated into. Please let me know if you know how many it has been in. Thank you!

&amp;#x200B;

Hope this is okay to post here",Sluaghterhouse-Five Number of Language Translations,1603064253
books,[removed],A book out there that helps understand the economic jargon,1603064078
books,[removed],7 Things You Should Never Do in the Morning,1603063741
books,[removed],Looking for Harry Potter Order of the Phoenix dust jacket only,1603063529
books,[removed],I would like to see if any of you here owns this book and knows anything of its whereabouts. Also share with me the version that you own!,1603062968
books,[removed],Best E-Reader?,1603061974
books,"I have an original boxset of the Narina books that have been passed down and around my family for 50 years or so and have been VERY well loved.  Like to the point where some of the books are unreadable from the binding being basically gone - some covers aren't attached to the pages, some whole sections of the book are falling out.

I was hoping to get them rebound in the original covers. Is it even possible? Is there somewhere local-ish (I live in Ontario, Canada) so I can one day pass them down as well.",Looking to get an old paperback book rebound,1603061109
books,[removed],What do you like about Norwegian Wood by Murakami?,1603060272
books,[removed],Exotic travel novel recommendation needed,1603059204
books,"I've read a lot throughout this sub about people who want to ""savor"" the books they've read. People tend to look negatively on or question those who read a lot of books in a short period of time. 

I was trying to understand this thought process the other day and I couldn't. When I'm done with one book, I usually start reading another almost immediately, as in the next minute or two. If I finished a book in the morning, I couldn't imagine what I would be doing/thinking about that would ""prevent"" me from reading another that afternoon.

I am the kind of person that doesn't really ruminate on much of anything, let alone a book. They feel more like movies in my head and, once complete, that's about it. If I want to think about it a little more, I'll go online and maybe read some stuff, but that takes me a few minutes. I guess if you're writing a review or reflection or something, I'd get that, but otherwise, I just don't understand.

This brings me to my question. What are you doing after you finish one book and before you start another?",What do you do in between books?,1603058431
books,,Prophetic Money Moves,1603058308
books,[removed],Cult X (Fuminori Nakamura),1603057854
books,[removed],I’m looking for the title of this book...,1603057339
books,[removed],Do you think it's safe getting library books right now?,1603057307
books,"Hello everyone. This is my first time posting here, althought this is one of the first subs I've joined. I've got so many good reads, thanks to you! 

**TL;DR: I was feeling kind of low and wanted to go to the happiest place, book-wise. For me, that would be Ray Bradbury's Dandelion Wine. What is yours, and why?**

I love reading. Since I was a kid, my childhood was surrounded by books, and I think they helped me in lots of ways: I love reading all sorts of things (genre-wise), I love everything they taught and teach me (about life, sentiments, even grammar and vocabulary), I love the fact that they blow up my immagination and allow me to travel to all sort of places and meet all sorts of people and creatures... I don't know how else to describe it, but you know what I mean. Their smell, the sound the page makes when you turn it, reading till you have to turn the lamp on because the sun has come down; all the laughing, fear, joy, mystery, tears... it's just so wonderful I cannot find the words, at least not at all different than you probably already read elsewhere o feel for yourself.

Thing is, for me today was one of these days that you simply want to escape from reality, and my desire was to go to a happy place. So after all this rumbling, may I ask you, what is your happy place, book-wise?

For me, it would be Dandelion Wine, by Ray Bradbury. That book is just... happiness, all around. The summer, the children, the dandelions, the wine, the infinite summer nights, the adventures, the innocence, the joy of a new pair of shoes, the singing, the playing all day up until sunset, the family all together... I immediately knew that, if I was feeling kind of low, that would be the happiest place I could go to to make myself feel better. Besides, I would really like to aknowledge Bradbury as an author, I love his writing! In my opinion, he has wrote great books. But that would be another thread.

So, thanks to all of you who read this and are willing to share with the rest of this great sub which is the happiest place in their shelves. Everyone has their own experience and that's the good thing! It doesn't have to be a book similar to the one I chose. Also, sorry if I made any mistakes while writing, english is not my first language. However, Dandelion Wine is one of the first books I read in english! So it gets extra points for that, too :).",A Book That Makes You Happy,1603057299
books,[removed],Baby Teeth - Zoje Stage,1603056033
books,"I'm a dad of a girl, 6, and we've got a pretty good routine going of reading before bed every night. I read out loud to her some of my old favorites (Roald Dahl, Charlotte's Web, etc) as well as some newer books that she loves (Ivy and Bean, etc.). I recently found my sister's old box set of Laura Ingalls Wilder books and thought it'd be fun to read with my daughter. They're classics which I've never read, so I thought it would be a great experience for both of us.

I was quickly disillusioned when halfway into the first chapter of the first book (Little House in the Big Woods), she goes on a lengthy and extremely (extremely!) detailed description of the father bringing home, butchering, and preserving the meat of a pig. While this isn't an issue of me wanting to hide the details of where meat comes from, it is not at all what I was expecting from the very beginning of a classic children's book!

My question is... is the entire series like this? Based on the first chapter, it seems less like a narrative and more like a very factual, blow-by-blow account of what life was like for the author. While I think that's wonderful, I was definitely looking for something else for storytime. Tips for this series? Or should I just leave them for her to read by herself in a couple years?",Little House on the Prairie series,1603055452
books,"I had to read this book for a summer reading assignment.  My mom said it would be boring at first but become interesting.  Grandma said the same thing too.  Suffice to say, I quit at chapter 50 and never understood anything else cuz I didnt fully read it. If you are bored or this sounds like a good book to you, by all means read it. I'm sure I'll like it when I'm much older",Anyone else dislike reading East of Eden by John Steinbeck?,1603055120
books,[removed],Most overrated classical writer and underrated modern writer,1603053038
