subreddit,selftext,title,created_utc
books,,"How will they move past their troubles? Will they stick together until the end, or will their love fall apart?",1617035058
books,"I recently bought this book because I was curious about it and wanted to see whether it is helpful at all since the title definitely applies to me. I’ve never bought any kind of book like this so I’m looking forward to see what it’ll bring. 

Has anyone read this and how did you find it? Has the book helped you in any way?",Adult Children of Emotionally Immature Parents by Lindsay C Gibson - what is your opinion?,1617034959
books,[removed],"Adult Children of Emotionally Immature Parents by Lindsay C Gibson - has anyone read this book, what is your opinion of it?",1617034731
books,"Looking back on it, reading the entire twilight series and watching the films is a little embarrassing because i didn't consider it a guilty pleasure but rather a work of compelling fiction. Sure I was in high school and you grow and learn about good writing vs not so good writing. So with that said what series are you most embarrassed to admit you were a big fan of and now try to best forget?",Book series you are embarrassed to have loved?,1617034227
books,"I'm 28 and perfectly capable of reading I'm sure...


But when I sit down open a page I get really into the read and about 4/5 pages later I'm done and thats reading done for another 6 months

I don't know what I'm doing wrong

I'm into high fantasy/horror scary stuff and I have quite a few books but it doesn't sink in.

Is there any hope for me reddit?",I'm 28 and I've never read a book in my life,1617034039
books," My literary hero throughout my teen years LOVED coffee and lasagna, HATED Mondays (as every good cat should, right...), and spurted out an everlasting stream of sarcasm perfectly aligned with my sense of humor. Now I'm weeding and evaluating Garfield books for my YA collection, and am thrilled to see that kids (and adults) are still reading them, all these years later. Who were your literary heroes as a teen?",Kids are Still Reading Books about my Childhood Hero! Yay!,1617033799
books,[removed],Nonfiction books with themes of military and war,1617033798
books,"I've been having a lot of trouble with this because no matter how hard I try, I can't picture the characters talking like...*that*. Take this quote from Helen Burns in Jane Eyre:

&gt; Life appears to me too short to be spent in nursing animosity or registering wrongs. We are, and must be, one and all, burdened by faults in this world; but the time will soon come when, I trust, we shall put them off in putting off our corruptible bodies...I hold another creed, which no one ever taught me, and which I seldom mention, but in which I delight, and to which I cling; for it extends hope to all; it makes Eternity a rest—a mighty home, not a terror and an abyss.

Helen Burns is fourteen. FOURTEEN. Try to picture a 14 year old saying that. It just doesn't work. So it has to be embellished, right? Help me out here.","In Victorian literature, was the dialogue embellished, or is that how they actually spoke?",1617033796
books,"Not original texts to the 'story of the Vivian girls and the realms of the unreal of the Gleneco-Angelinian war storm of the child slave rebellion' because obviously that's expensive and prized documents, I'm talking about published copies of the manuscript if that exists... If there is any sources to it that's be very appreciated. 
   I think the concept is very interesting and would love to get my hands on it. 
   Any ideas?",Does anyone have any sources to a copy to the 'Story of the Vivian girls?',1617033511
books,"Literary classics can be quite long can't they? When chosen wisely, they can be incredibly rewarding experiences. There's something quite enjoyable about sitting with a book for a long stretch of time. Now this very well could be my own sentimentalism getting the better of me, but I do enjoy the long journeys that these epics can take one on. Though some book endings feel like saying goodbye to old friends, there's an unshakable feeling of reward that one gets, a wave of satisfaction from completing a goal. In general, the long haul can always be a fond experience to look back on warmly. 

But like any long journey, there can be lulls. And that's where my love for shorter works shine through. 

I almost feel a sense of childlike whimsy when tearing through a shorter book, especially when a longer one gets a bit dull. Maybe it's the naughty feeling of running away from the ""responsibility"" of the book you started. A novella can almost feel like a literary tryst, a quick escape into another world that feels refreshing and exhilarating (when chosen correctly of course). If one *really* sucks you in, you tear through it so quickly that it feels as if BOOM, you look up and realize it's already over! Where did the time go? That feeling of satisfaction also hits you quicker, and it usually leaves me refreshed enough to dive back into the longer work I was originally visiting, but now wide eyed and rejuvenated. 

I've never really read several short works back to back, but I now wonder what *that* experience is like! I'm currently in the long haul with *Crime and Punishment* (I'm a third of the way through; fantastic book so far!), so I might try it afterwards. But I can already feel the thirst for a short work coming! I've been eyeing *Candide* by Voltaire and I do hope it will make a nice getaway when things start to get a bit slow. 

TL;DR - Literary epics can always be incredible, but sometimes things can get a bit slow. Novellas and other shorter works, like a weekend trip, can recharge one's batteries and leave them content and able to conquer their longer books with a new sense of excitement.","In praise of the novella and other ""short books"" (i.e. anything under 200 pages)",1617033488
books,[removed],Has anyone read the cousins?,1617033347
books,"Hey! I just found this sub, and after a little lurking, I hoped that it could provide some help!

As a short recap, I’ve always been a bookworm. I always was reading something, no matter where I was. I remember reading books so good that I would go to the bathroom with them (lol) and get in trouble for staying up too late to read. However, as I started to get older, I started to read less and less. Not because I don’t love reading, but because it’s hard to find a book THAT good anymore. I have a focus deficiency, so it’s hard for me to sit through and finish a book that’s not captivating from start to finish. 

TL;DR: I’m looking for book recommendations that are captivating from start to finish, in any genre.",Feeling discouraged in finding a very good book,1617032835
books,"...and what an amazing book it was! I saw the trilogy a few years ago, I even saw the first movie twice so I decided it might be fun to read through the original novel and I wasn't disappointed at all. It might one of the best books I've ever read. The characters are all memorable, the story is very well writen and it has some very well described and iconic scenes that the movie trilogy adapted flawlessly. I absolutely love Michael Corleone's character development from this naive guy nobody respects and that wants to stay as far away from the family's business to Vito Corleone's sucessor and probably the most powerful man in this world of organized crime. Brilliant book!",I just finished reading The Godfather...,1617032814
books,[removed],"Graphic Novel and Manga readers here, which site do you use to buy them ?",1617032328
books,[removed],"If you could only recommend one book to anyone, what would that book be?",1617032103
books,,"Ligotti fans, we need you. For a bit of discussion on this post, what is your favorite a Ligotti story, and why? Please sign, so this great author can get another great work reprinted.",1617032075
books,,History of Britain - Chapter 01 ENGLISH STORY WITH SUBTITLE #THE VOICE O...,1617031831
books,[removed],Recommendations for science/science-fiction books.,1617031109
books,[removed],Science/Science-Ficition Books,1617031008
books,[removed],Sherlock Holmes Books,1617030861
books,"I know this may be a long shot, and may even break subreddit rules (Low effort?) but I come to you because I do not know where else to turn.

A few years ago, I lost a lot of my posessions to a flooded basement, including a box of books. Unfortunately among them was a copy of a book my mother read to me when I was very young.

Now that my mother is in poor health, I find myself thinking about the book more and more often, I go through our bookshelves every few days thinking maybe I will find it hidden somewhere. 

I'm sure it may seem silly to some, but as someone with aphantasia the physical objects associated with vivid memories are vitally important.

I have gone searching for the book, but geography (UK title, I'm in Canada) and time (1986) have not made it easy. Copies have appeared on the internet, but it seems like it's been a while since any have come through.

If anyone knows of even a damaged copy of this book, I would happily purchase and ship it from you for (almost) any cost. 

Thanks for your time, and if you know of any subreddits that may be more appropriate for this topic, please let me know!

ISBN-10 : 0552523992

ISBN-13 : 978-0552523998

https://www.goodreads.com/book/show/29409168-enormous-blob","A tale of a flooded basement, and lost childhood memories.",1617030440
books,[removed],Which is one book that you have read at least twice and looking forward to reading it once more?,1617030417
books,"i enjoy reading but i struggle at it A LOT. i’d read a sentence, get bored, read the next, forget the previous sentence, forget the paragraph, skip through boring looking paragraphs, skip pages and quit reading the book entirely. i finish 1 in 20 books. i don’t have persistence and my attention keeps wandering. but i’m really interested in the content of the books and pick out really interesting ones that i’m genuinely interested in reading. it really sucks not being able to enjoy these things and it’s extremely stressful. any tips?",any tips for those who want to read but have adhd?,1617030374
books,[removed],ALIEN TAKEOVER BY ANDREW LUCK,1617029724
books,"And jheez... I'm not sure I can finish it. 

I've just read a paragraph on how women haven't contributed anything towards science, philosophy, inventions etc in the past ""100,000"" years and we need to stop pretending that we have. Baring in mind I'd just read Rachel Ignorofskys wonderful book Women in Science. I'm just not sure what message she's aiming for here. Sure men have dominated the sciences, but women *have* contributed to science and *have* been overshadowed and sometimes plagiarised by men. He argument is that we need to stop blaming men for our failures and lack of contribution. I just think it's strange to ignore the work that women have done historically, especially when women have had nobel prizes taken from them by their husbands? Is the aim to be funny? 

One of the first paragraphs in the book states that small grade feminism issues are just as important as FGM or feminism in third world countries which... I don't know how I feel about. I think the book came out as, or just before, the new wave feminism, which unfortunately became very white washed. I get that the book is about her life and of course she won't be able to comment on issues that she hasn't faced - but to make a direct comparison with your life and that of someone who has suffered FGM and to say my issues are just as important? Just don't make the comparison. It's okay to tell your story but don't try and justify it like that.

Maybe if I had read this 10 years ago it would have been revolutionary, but reading this now after beginning to expand my feminist reading by including different voices and backgrounds from my own just feels weird. Even as a white woman I don't really relate to it.

What have other peoples thoughts been on the book? Has anyone read it more recently compared to 2011 when originally published? Let me know your thoughts and opinions. I think I'll stick with it and try and finish, but every chapter atm is making me put it down and have a mental argument for 20 minutes - maybe that's a good thing!",I'm halfway through Caitlin Moran's How to be a Woman,1617029653
books,"I was going to be make a list of books i love like the classics, for my nieces and nephews but I'm worried about subtle racism and sexism in the text that will fly over their heads from modern day books in the last 20 years. I can tell them what The Adventures of Huckleberry Finn is and what year is written so they won't be blind sided but sometimes popular works are missed by me so I am wondering if I should take caution by best sellers right now or at the very least get recommendations that these may be problematic for a teenager.",Books unintentionally racist and sexist?,1617029589
books,[removed],What’s your “point of no return” when reading a book - that place where if you reach it you will finished the book no matter what?,1617028350
books,,"Red Hail, a review by Tanya",1617028314
books,"Book number 2 of my read around the world was Broken April by Ismail Kadare and reflects upon Albania’s famous blood feuds which are still, in some shape or form present to this very day.

Kadare has a simplistic and raw writing style, much like the characters in the novel. This enables the reader to build strong visual imagery of largely uncomplex individuals. Additionally, Kadare also does a fantastic job of building in wider Albanian context including the conflict of tradition and modernisation throughout the industrial revolution of Europe. From a contextual perspective, although unclear, it is suggested that the book is set sometime in the 19th century. Therefore, worth bearing in mind across Europe we are seeing vast industrial revolutions, modernism and wider, more far-reaching education amongst the masses.

The book follows 3 key figures through their respective journeys of a region in Albania called the High Plateau. The High Plateau is governed under the *Kanun* which are ancient rules of life in largely remote areas of Europe, absent from technological and educational reform:

·  Gjorg a young man in Northern Albania is from a remote village governed by the *Kanun,* the reader is guided through his killing of a local rival family member and the following process governed under law, until his ultimate demise (slight spoiler).

·  Diana and Bessian are newly married and honeymooning in the High Plateau. Kadare ensures the reader is aware of their shock and ultimate disgust of the ways in which the mountain people of the High Plateau live their lives, through poverty and blood feud.

The physical crossover of these characters is fairly limited to one brief encounter. However, the connection between Gjorg and Diana is profound and shapes the journeys of the two parties thereafter. Kadare positions the relationship between Gjorg and Diana as intrigue and almost lustful in nature. Personally, I see this as a metaphor between the conflicts of traditional and progressive lifestyles with the mutual intrigue between the two, rather than the foundations of a love story someone may immediately assume.

Kadare seldom uses explicit methods to indicate conflict between traditional society and the on-going modernisation of much of Northern Europe at the time. He does however, make reference to this through the types of literature being published and read within higher society and also the disgust at its existence from uneducated paupers working in the royal dwellings.

Finally, one part I particularly liked within the novel was the importance placed on one’s guest. In Broken April once you accept a guest into your home then their life is quite literally in your hands. If they should be harmed whilst your guest then it is up to you, the host to avenge that harm. How’s that for a burden!?

6.5/10",#002 Albania – Broken April (Ismail Kadare),1617028047
books,[removed],"These children escaped Xinjiang, but their parents are in China and cut off from the world",1617027742
books,[removed],Moby Dick ( full audiobook) if you like audiobooks please subscribe!!!,1617027625
books,"I am looking for a few recommendations for my nephew. He is 12 year old. He read Harry Potter and many other books but he likes to read technical stuff and science blurbs more. So I am thinking what books to introduce him which are science-fiction and fantasy related. Not a lot of sex, drugs and violence but clean fiction.

Any recommendations? Thanks!",Best sci-fi and/or fantasy books for 12 year old kids?,1617027198
books,I (28M) want to buy a book for my gf (24F) and I'm lost. She's Lithuanian and she's not fluent in English. Her English is functional and improving every week. She loves to read (in Lithuanian and Russian) and has recently expressed an interest in reading more books written in English to help her to learn. I want to get her something good but accessible. I'm not a big reader myself which is admittedly most of the reason I'm so lost. Any recommendations?,I want to buy a book for my Lithuanian gf,1617027122
books,,Livraria Lello book store in Porto Portugal opened in 1906,1617027093
books,"Hello everyone, I want to make it in brief, so I'm currently binge reading and already finished one book (self-help book) which really helping me and the fact that it is the hardcopy not the e-book version I read makes it more better for me.

But for constant reading I'm preferring mild ones, which, in my case 200ish pages long, a self-help book, but the content is soft to the point you can just put low effort to read it since the relax element, does anyone has lists or recommendation near to the preference aforementioned ?",seeking for a 'mild' book,1617026596
