subreddit,selftext,title,created_utc
books,"For me, oddly enough, it was Dante's Inferno.

I had this goofy call-center job that had a lot of downtime in evenings. I eventually installed the kindle desktop reader and bought Dante's Inferno. Would often have 10-20 minutes in between calls and realized the time flew by when I was absorbed in literature. You couldn't have phones on the floor and our internet access was pretty limited, but reading made an 8 hour shift fly by. I'd get a call and I just couldn't wait to transport back into whatever world I was immersed in.

Prior to that, I had spent probably 5 years without reading for pleasure. I recall vividly an overwhelming sense of joy when I realized what my life had been missing - and the fulfillment that books were likely going to bring me.

Anyhow, just curious as to what book lead you back into the world of reading for pleasure. Looking forward to your replies :)",What was the book that rekindled your love for reading?,1612902845
books,[removed],Addicting classic books?,1612901732
books,,Does anyone have any thoughts about Crave?,1612901625
books,"- Why did they change the name from Philosopher’s Stone to Sorcerer’s Stone for the American edition? The Philosopher’s Stone is an actual historical myth that many famous alchemists really tried to find. Nicolas Flamel was also a real person (though he did not live to 600 something). This annoys me

- The Dursleys are awful, but if you opened your door one day and found an infant on your steps and you were basically forced to spend years and thousands of dollars taking care of it, you’d probably be a little miffed too

- What kind of a name is Dudley? It literally has the word “Dud” in it

- The fact that the Hogwarts acceptance letters acknowledge that Harry lives under the cupboard means that Dumbledore was aware that Harry was being abused but didn’t do anything. How did he even know in the first place where exactly Harry sleeps? I don’t think it’s ever explained. 

- I love Hagrid, but giving eleven year old Dudley a pig tail was not a nice move

- When Hagrid tells Harry he’s a wizard and Aunt Petunia reveals that she and Vernon have known, she comments that Lily went and “got herself blown up”. This marks the beginning of a franchise-long tradition of various characters making fun of Harry’s parents for being dead

- It’s disturbing knowing that Scabbers the rat on Ron’s lap is actually a thirty plus year old man

- Sometimes I imagine a childfree Harry going off on the Weasleys about how they’re irresponsible for having so many children when the world is overpopulated and they’re short on finances

- I first read the book when I was nine and thought Hermione was pronounced “Her-moin”

- I wonder if anyone ever used Quirrell as an excuse to discriminate against people who wear turbans for religious reasons? Probably

- Why does Draco even offer Harry friendship? His parents literally work for the man who killed Harry’s parents

- Snape is described as having black colored eyes. I wonder if they were actually black or just very dark brown. Probably dark brown, I’ve seen those described as black before. It’s rare for a British person to have eyes that dark though

- The plants that Snape mentions during the first class, wormwood and asphodel, are actually real plants. So is wolfsbane/monkshood 

- Snape’s name was changed to Severus Rogue for the French editions. Weird

- Neville’s last name was changed to something meaning “long balls” in the Norwegian editions. As if Longbottom weren’t a bad enough name

- During the troll scene, Hermione lies to the teachers and says that she was trying to defeat the troll herself to explain why she was in the bathroom. This leads McGonagall to deduct house points. Why didn’t she just say that she was using the bathroom? That makes more sense and also wouldn’t result in point deduction

- Harry and Ron literally just saved Hermione’s life. Why are points being DEDUCTED?!

- After Snape gets bitten by Fluffy, he goes to Filch to help him bandage his leg. Why can’t he do this himself?

- Hermione sets Snape on fire and receives no punishment. Later the kids are caught walking after hours and get sent to the potentially deadly Forbidden Forest. Inconsistent punishments.

- Dumbledore attends the next Quidditch match in order to make sure no one tries to kill Harry again. Ok, but why aren’t you trying to find out who’s behind it?

- The internet would’ve been really helpful in the search for who Flamel is

- Why are eleven year olds sent to the dangerous forest when there is something killing unicorns? Not only that, but two of them aren’t even with Hagrid the whole time but instead only with a dog as a guardian

- What’s the point of having all those obstacles to protect the stone? Wouldn’t it be just as safe in Dumbledore’s office?

- During the chess scene, Ron falls about four feet. He shouldn’t have been knocked unconscious unless he hit his head

- Snape’s obstacle is a logic puzzle. I wonder how many people would be able to solve it? Eleven year old Hermione could, but also many people are not very logical and I wouldn’t be surprised if many people couldn’t solve it

- The fact that Voldemort is on the back of Quirrell’s head is a pretty weird plot twist if you think about it. 

- Harry pretty much cremated Quirrell. It’s in self-defense so it’s justified, but Harry’s really rubbing his death hands all over Quirrell

- People get knocked unconscious so many times in this franchise

- Dumbledore remarks that his Every-Flavor Bean tastes like earwax. Why does he know what earwax tastes like in the first place?

- Harry’s gets rewarded in front of the whole school for cremating his teacher

- Dumbledore is kind of rude to the Slytherins when he just gives all those points to Gryffindor all the sudden","As a fan, here some of my thoughts on the Philosopher’s Stone",1612901353
books,"I just finished [*Barking Up the Wrong Tree*](https://www.goodreads.com/book/show/31706504-barking-up-the-wrong-tree) by Eric Barker. It started promisingly enough, just over halfway through the book fell off a steep cliff - it felt more and more like a series of cobbled together blog posts summarizing what he's read in other books/heard in TED Talks and podcasts while interjecting with ""quirky"" comments. The last two chapters in particular were much longer and rambling than they needed to be. Basically, if you've read any popular self-help/productivity book in the past few years or have listened to TED Talks regularly, you already know most of this book. I thought about dropping it, but decided to skim through the rest of it

I have no problem quitting a book in the opening chapters if I'm not feeling it, but if I'm more than halfway into a book I end up just plowing through anyways. On one hand, I figure I'm already this far in, might as well finish it. But I also remind myself of the sunk cost fallacy and that time I'm wasting time I could be using for another book

Do you move on from a book even if you're far into it? Or do you just grind through to the end?",Do you abandon a book despite being far into it?,1612900839
books,"Mine would be The Time Traveler's Wife. I know not considered a classic by any means, but it was the first book that I really got invested in as a teenager. I've always loved reading but TTTW just really stuck with me then, I reread it so many times when I was young. It gives me happy memories so this is the one I'd choose.","It doesn't have to be your favourite book, but if you had to read one book for the rest of your life, what would it be and why?",1612900511
books,"Taking my first crack at Dostoevsky. Could be this translation (Pevear &amp; Volokhonsky), but I'm surprised at how easily I picked it up. Normally older classics are a bit more difficult for me to get into but this one feels slightly modern. Still on part 1 but really enjoying it so far. Anybody have any thoughts or opinions or suggestions for a Dostoevsky first timer?",Crime and Punishment,1612899766
books,"My pick comes from Ted Chiang's short story ""The Great Silence"": 

&gt;*Human activity has brought my kind to the brink of extinction, but I don’t blame them for it. They didn’t do it maliciously. They just weren’t paying attention. And humans create such beautiful myths; what imaginations they have. Perhaps that’s why their aspirations are so immense. Look at Arecibo. Any species who can build such a thing must have greatness within them. My species probably won’t be here for much longer; it’s likely that we’ll die before our time and join the Great Silence. But before we go, we are sending a message to humanity. We just hope the telescope at Arecibo will enable them to hear it. The message is this: You be good. I love you.*",What are some favorite passages from books that are so well-written you just have to stare at the page and read it over again?,1612898495
books,[removed],"Stephen king ""later""",1612897412
books,"I'm nearly finished with the Remembrance of Earth's Past trilogy by Liu Cixin. I've read The Three Body Problem and The Dark Forest and I'm half way through reading Death's End. Before this I've read a lot of translated Chinese webnovels that I got introduced to through r/noveltranslations. There are obviously huge differences in quality between published, highly acclaimed, professionally translated novels and these webnovels which are translated by volunteers. That being said, these Chinese works have some similarities in the way they handle descriptions of scenes and metaphors that stand out to me as being different from the way English speaking authors write. I feel like a lot of these differences are especially pronounced when reading about female characters but it's hard to nail down and it would be irresponsible for me to make any claims about the way Chinese authors write women when I've read such a limited selection of chinese works.

Are these differences just artifacts of the translations or is the storytelling tradition and culture in China just different from what I'm used to? How much of what I'm noticing is just because I've got a small sample size of Chinese work? I want to be perfectly clear that I'm not arguing that one culture is better or worse at writing stories, just that there are differences between them. 

I'm trying to find a better way to describe what I'm talking about and I'm wondering who else has noticed stuff like this or other ways that novels in different languages are written differently.",Differences between Chinese and English books,1612897369
books,[removed],"Stephen king ""later""",1612897316
books,[removed],Who is excited about the New stephen king book later,1612897245
books,[removed],who read the Percy Jackson books?,1612896182
books,"I’m looking for some advice on how to actually enjoy reading Shakespeare. At school we studied Macbeth and Much Ado About Nothing and I loathed it. English was my subject at school (as I imagine it was for a lot of people who browse this sub) but reading those plays and trying to understand and write papers about them was a loathsome experience. 

Well it’s 10 years later and it’s time to give Shakespeare another try. I picked up a copy of Henry IV part 1, the character of Prince Hal and later Henry V is one of the more interesting kings in my counties history and Shakespeare our greatest writer. I’m maybe a third of the way through and it’s fucking tough. What am I missing, how can I enjoy reading Shakespeare?",Help with Shakespeare,1612896157
books,"Hello everybody! Hope you are all alright!

I am thinking of writing a crime/thriller book about a murder mystery/case sort of thing and I was just wondering if anybody on here has any plot ideas or anything? It's really difficult actually to come up with something original and different so if anyone has any plot ideas please let me know!",Writing a Thriller/Crime Novel,1612895767
books,[removed],What has been your best Little Free Library find?,1612895117
books,"Hey guys!  


I'm sorry if this has already been asked before, I rarely use Reddit so I'm not very familiar with how it works.

I live in Toronto, Canada and have been wanting to buy physical books lately, and was just wondering where I can buy ""cheap"" books from. I see tons of people with libraries in their houses and had no clue if there's a trick to acquiring cheaper books or if they just have the money to spend. I do use Kindle on my iPad and have kindle unlimited, but nothing beats a physical book. 

If it helps, I'm looking for more fantasy-type books (e.g. The Witcher, Game of Thrones, etc. etc.). If you also have more tips and tricks for ebooks, I'd love that as well!

&amp;#x200B;

Thank you!",Where to Buy Physical Books,1612894729
books,"So I have ADHD and I love reading and I’ve read lots of books throughout my life. However, one thing that has always annoyed me is the fact that unless I’m hyper focused (which happens only when I have been reading for like an hour straight), I read very slowly. Reading slowly isn’t the problem per se, it’s more that when I don’t have much time to read, I don’t do much progress so the story gets interrupted at anticlimactic points which in turn makes it harder to remember when I resume the reading. Another problem is that I get carried away very frequently by my thoughts, sometimes every sentence. 

What I want to know is if someone here with ADHD has found a way to overcome these issues. I would appreciate the help A LOT, because adult life is consuming my time and thus diminishing the joy in reading :(",Reading with ADHD. Suggestions?,1612894626
books,"I hate reading. 

That’s something I’ve been telling myself for, well - my entire life. It’s not that I hate stories. In fact, I love stories. It’s the literal act of picking up a book (or tablet, but I’ll refer to things in the context of a physical book for this post), opening it, turning to a page, reading the text that’s printed on it, and digesting that text. That’s what I hate.

Now, I believe the disdain I have for the action of reading began during the early years of my education. I was never the best student (yay anxiety!). Take that aspect of things, mix it with the education system that has/had an unwavering persistence with taking an experience as transformative as reading a book and neutering said experience to the point that it felt like a soul-crushing chore, and voila! I developed a hatred for reading.  On top of that, I truly believe the book choices didn’t help. We were forced to read books that were far from stimulating for someone at the ripe age of 8. 

So, at the age of 30, I feel like I want to try and disprove this lie that I’ve been telling myself for decades. I want to rewire my belief system. I want to learn to love the act of reading. I feel like I’m missing out on so many incredibly stories, as well as opportunities to improve on how I digest and visualize the written word. 

However, here’s the issue: I have absolutely no idea where to start. There are millions of books, all with varying themes and degrees of difficulty, and I get overwhelmed with the thought of trying to find some to start with.

So, r/books...have any suggestions for someone in my position? I don’t care if the book is something that you’d recommend to a 10 year old - I just want to read something that will make me realize that the act of reading isn’t actually dreadful after all.","At 30 years old, I’ve decided that I want to start reading for the sheer fun of it. Where should I start?",1612893073
books,[removed],How would I know if I read slowly?,1612892664
books,"I’m a guy in my mid twenties and I just blindsidedly had my heart crushed less than 24 hours ago. I was preparing for Valentine’s Day too... The reason was that I was too loving and my ex had trouble forming an emotional connection. 

Most relationship books I see are geared towards women, which isn’t a problem, but I’m feeling a little left out.

Can you please recommend me a book that explains the science of love and emotion or a break up book that will help a male twenty-something year old heal. :(",A book about the philosophy of love? Maybe a book that helps with breakups?,1612892469
books,[removed],Book suggestion,1612892076
books,"At the risk of sounding utterly pedantic:

Reading War and Peace has satiated a deep hunger in me that has panged me for so long. Growing up I loved RPGs and deep stories with an entire roster of fascinating characters to note and keep track of. Games like Final Fantasy Tactics, Tactics Ogre, Fallout, Planescape, and Baldur's Gate would fill my proverbial stomach with the most delightful of tastes: philosophy, war, loyalty, legacy, morality.

A big reason I've fallen away from video games is that I feel the higher the budget the less we likely we get these kinds of experiences. Today's games - and especially RPGs - are for wish fulfillment, not stating something important. The past decade I've solely read non-fiction works, far more interested in the mechanisms of this world than the ones of fantasy, yet all this time I've craved deep stories like those of my youth where I had to get out a notebook to make sense of the characters and world. As I read War and Peace, for the first time in the longest of time I feel full. Going through a story that makes me question my very being and every chapter makes me lick my fingers, as if finishing off a delightful meal.

War and Peace has single-handedly reignited a love for literature and reading fiction again. I'm thinking of reading Crime and Punishment after. Reading Tolstoy has helped me accept how much I've grown out of video games. I'll devote more time to literature instead of continuing to chase something that's not there anymore.",Reading War and Peace has invigorated a passion for fiction I thought I long lost,1612891212
books,,Agatha Christie's England | Full Documentary,1612890949
books,,Super health care,1612890931
books,[removed],NORTH KOREA DECEPTION: AN INTERNATIONAL POLITICAL SPY THRILLER (THE DECEPTION SERIES Book 1),1612890264
books,"I finished reading the Lord of the Rings on December 30th. I have just begun reading it again because i love Tolkien so much that my brain is addicted to his writing.

&amp;#x200B;

Whenever i read LotR, i feel at peace with myself. Even though i ami an atheist and Tolkien was Catholic, reading his books gives me a feeling of calm, like i am able to withstand everything life throws at me. His prove and verse alike give a feeling of fulfillment that few other books have given me.

This is now the third consecutive year that i read LotR and i am planning to make it my habit. Every year, i small attempt to read LotR at least once.

&amp;#x200B;

Is it silly to be reading the same book over and over again? Have you ever done anything like it?

&amp;#x200B;

I feel like at some point, i need to move on, but i can't.

&amp;#x200B;

Is it silly?",Is it silly to keep reading the same book over and over again?,1612889817
books,"I had purchased this trilogy 4 months ago and immediately started reading. The author's way of writing is so pretentious and degrading, i couldn't move past 40 pages. This book makes me angry for unknown reasons. I've heard people praise this trilogy but I can't bear it.

I wanted to know if I'm the only one feeling this way or is there someone out there who feels the same? Will it get any better afterwards? 

If not this, what other book made you feel this way?",Fifty shades trilogy - Pretentious and degrading,1612889246
books,"I have a very weak stomach for full on horror but am interested in Mexican Gothic. I love to read mysteries but usually stay away from ones that are very gruesome. How much will this book spook me, especially if I read it before bed? For reference, the movie Oculus was too much for me and the preview for Us once gave me a nightmare.",How scary is Mexican Gothic for someone who is easily spooked?,1612888817
books,[removed],What Can't You Do? Helping Your Child Realise What they will Do!,1612888673
books,[removed],"We are the writer and illustrator of a new graphic novel based on real-life pirates, and we’re here to answer your questions about comic creation! AUA, me hearties, yarr, etc.!",1612888530
books,"Just got done reading this and have been trying to understand the message of it; along with the ending.  

Spoilers Throughout:

Throughout the book, the Judge is constantly pontificating about the nature of man.  While all of them are as evil as a person can get, it is the Judge who rises above all of them.  Or at least, thinks he does.  So he goes around justifying the evil they do by saying that is the way of men.  That it always was, and always will be.  That the ultimate game is to push one’s own will against another.

Enter the kid whom we never explicitly see do any of these horrible things.  By the end, he meets the Judge again who reminds him that just as war/violence precedes man, so does destiny.  Why else would he be there that night?  And so their ideals clash.  The Judge who is, for all intents and purposes, the master of his own destiny; no matter how vile.  And the Kid (now the Man) who has been going through life living in the moment, going wherever events take him.  

I believe that just like how we never saw the “Kid” do anything horrific (which I’m inclined to believe he participated in but regrets), we again do not see him rape and murder the missing girl in that outhouse.  The Judge had won and got what he wanted.  Imposed his will on the Kid, who will become like the Judge.  Finally forging his own path in life, however evil and vile that path is. 

Need to let the book ruminate in my mind for a little while before I revisit the book.  What do yall think?","Blood Meridian, the Judge, and the Man",1612888279
books,[removed],Does anyone else find themselves unable to read “historic non-fiction” because of bias and changing research?,1612888090
books,[removed],bio of a space tyrant by piers anthony,1612887501
books,[removed],Looking for fantasy novels(english),1612887492
books,[removed],A Promised Land By Barack Obama Pdf Ebook,1612886711
books,"I really like the ""chosen one"" trope, but I'm getting tired of hearing it from the view of the chosen one. I want a book from the perspective of the best friend or sidekick, maybe a romantic partner,  documenting the struggles of sacrifices made to support that person. Give me a Ron, a Samwise, a Perrin as the main perspective. Any help appreciated!",Any recommendations on a fantasy novel where the main character is the sidekick?,1612886668
books,[removed],An Interesting Book,1612886593
books,[removed],An Interesting Book,1612885722
books,,An Interesting Book,1612885661
books,[removed],https://www.amazon.com/dp/1938911741?ref=myi_title_dp,1612885472
books,"Upon recently finishing Jeanine Cummins’ “American Dirt,” I finally had some time to reflect upon this book. I believe, there are two thing worth talking about regarding this book: the novel itself and the controversy.

First, the book. There is not much to say about the story. Nor is there much to say about the prose. The book is mediocrity in its purest form. It is probably not a widely held view, but I argue that immigration stories of these kind (violence escape stories) are a part of an over saturated market due to the public being desensitized by the media. Thus, its ability to grasp interest is low and the author has to work twice as hard to produce anything of above average quality. In other words, turning something generic into something exceptional would require a lot of effort from the author. And, Jeanine Cummins seems to not have put enough into “American Dirt.” As a result, “American Dirt” is comparable to the movies Netflix puts out all too often: the ones that are just good enough to watch, but not good enough to be remembered. 

Second, the controversy. I believe the shortcomings of this book are not due to the author’s race, but due to author’s level of competence. After all, it is a part of creative writing process to be able to convey someone else’s (or your own) life experience better than reality itself. As my favorite art critic, Susan Sontag, puts it: “That art is not separate from life but its highest form; that metaphor [...] could make reality visible to those who could not see it for themselves.“ In other words, art is not a mere copy of reality; rather, art is an imitation of reality. And, being able to portray reality in a way that would illicit an emotional response from the reader is among the highest forms of artistic expression. One, in which Cummins not only arguably did not excel at in “American Dirt,” but also one in which she did not completely fail. After all, as much as I did not enjoy “American Dirt,” it was highly successful in making people aware of some aspects of illegal immigration which they might have ignored before reading this book. Hence, the book partially succeeded in making some aspects (e.g. not all illegal immigration is done by criminals) of reality visible to those who could not see it for themselves. Thus, the book has some redeeming qualities that have influenced its success. And, criticizing the book based on the color of author’s skin is nothing more than baseless complaints made by the masses envious of its success. After all, the book would not have amassed such controversy if it was not for the number of copies sold worldwide.",“American Dirt:” The Novel and Its Controversy,1612885080
