subreddit,selftext,title,created_utc
books,[removed],Mayday: Moderately entertaining.,1588204782
books,[removed],Can you suggest me some good books or documentaries about Ernest Hemingway?,1588204666
books,"Its more of a memoir/letters to a friend/ journal deal. Its very important to me so I want it to be made into a book with a leather binding and everything. I was wondering if there were any recommendations to a publishing company that does that. Im very new to writing so any suggestiong would be helpful.

Thank you.",Im writing a book for someone.,1588203786
books,"I've never understood the interpretation of Hamlet that argues that Hamlet's madness and rage are fully or partially driven by his Oedipus complex. Sure, many of Hamlet's remarks towards Gertrude throughout the play are inappropriately sexual, even more so considering the period that the play was set in. Despite that, and many other arguments in favour of the existence of Hamlet's Oedipus complex, I am not compelled to agree with the interpretation and I personally believe that it greatly undermines the play.

Convince me that Hamlet has an Oedipus complex.",Convince me that Hamlet has an Oedipus complex,1588203676
books,"And I don't just mean the basic elements of ""musclebound badass in sword-and-sorcery setting"". I feel Howard managed something very special with the *feel* of the setting itself; there is a genuine sense of immense age to the various ruins, monsters and forgotten peoples Conan encounters. The setting itself is amoral and brutish and Conan reflects that. He isn't *evil*, but then neither is a lion.

Overall, Howard's Conan stories are a mix of shameless power fantasy, sword and sorcery and a bit of cosmic horror, mixed with everything feeling very primal and old. Has anyone else pulled this off?","Anything similar to Conan the Barbarian, by Robert E. Howard?",1588202363
books,"I’ve wrote some posts on this forum. Some have been applauded others despised. I am a solitary figure and books give me great joy in life. Finding Reddit and having this ability to communicate with others around the world on topics I love is something I am really grateful for. I have already began to make friends in this community and I look forward to this continuing. 

This is a list of my own favourite books. The ones that have impacted my own life greatly. Some will also have read and loved these books and others will have not. Either way feedback and discussion is truly welcome and I’d love to hear what you think. Of course there are numerous amazing books out there and I’m excited to discover more that also impact on me. These are just my current favourites and ones that will forever live in my heart. 

Novels 

1. A Farewell to Arms - Ernest Hemingway 
(Whilst I can never say for sure, this will always be my favourite book) 
2. For Whom the Bell Tolls - Ernest Hemingway 
3. The Great Gatsby - F. Scott Fitzgerald 
4. The Catcher in the Rye - JD Salinger ( absolutely incredible, a book I return to consistently) 
5. Things Fall Apart - Chinua Achebe 
( my first introduction to African Literature but after this masterpiece it will not be my last) 
6. Lolita - Vladimir Nabokov 
(It takes a true genius to make us care so much for a character as despicable as Humbert Humbert) 
7. The Alchemist - Paulo Coelho 
(Reading this is a spiritual experience unlike any other) 
8. The Wind in the Willows - Kenneth Grahame
( perhaps the most loveable characters I have ever come across. Every child deserves to enjoy this book) 
9. Siddhartha - Herman Hesse 
10. Brave New World - Aldous Huxley
(The ending of this book disturbed me immensely) 
11. 1984 - George Orwell 
12. The Sun Also Rises by Ernest Hemingway ( I am a huge Hemingway fan and he is my favourite writer. I have been moved by most books on this list but his works are the only ones  that all have the ability to move me to tears) 
13. Infinite Jest ? ( I have not finished this book but I absolutely love it. It is unique piece of work unlike anything in its use of language and imagination. I will be very surprised if it’s not one of my favourites by the time I have finished it.)

Non-Fiction 

Whilst I prefer fiction I do love non-fiction as well these are some of my favourite works. 

1. Sapiens - Yuval Noah Harari 
( this changed my world view forever) 
2. The Autobiography of Malcolm X - Malcolm X 
3. Jobs - Walter Isaacson
(I now more than ever what to put my own dent in the universe) 
4. 12 Rules for Life - Jordan Peterson 
5. Recovery - Russell Brand 

Let me know what you think of my favourites. Have you read any of them yourself? Needless to say I recommend all of them. I hope to read some more great books this year and share my thoughts on them.",My Favourite Books: A Brief Tale of a Man of Letters,1588202129
books,"I was fascinated with this dream early in the novel. I havent finished reading the book but so far, Raskolnikov's dreams and sleep seem to play a pivotal role. 

there are two things I'm curious about 

1. what are your thoughts and interpretations of the horse dream? what do you think about this article's interpretation of each person in the dream representing one aspect of Rodion Raskolnikov. 

2. what do you think is the relevance of sleep - beyond simply it being due to his exhaustion due to the guilt and stress of the murder?",Raskolnikov's Horse dream - the four Raskolnikovs in Crime and Punishment. What are your thoughts?,1588201482
books,[removed],"What’s the poetic writing style called, used by Marya Hornbacher (author of Wasted)?",1588201308
books,[removed],Help!,1588201186
books,"Some of my friends are big Harry Potter fans, and while I’ve read the books and seen the movies and enjoyed them, I said that I think Harry Potter’s impact is limited to a specific group of people who were the right age. They disagreed, so that brings me here. 

My question is about whether or not Harry Potter will continue to be referenced in pop culture? Are there still many people new to the series? Or do you think the impact, while certainly a phenomenon, is short-lived?",Does Harry Potter have a lasting impact on culture?,1588201117
books,[removed],A couple questions about a book,1588201115
books,[removed],Dragon,1588200630
books,,Masterpieces in Some Other World: D.F.W.'s The Pale King and Mac Miller's Circles,1588200629
books,,🤔 Fornecedores VIP Brasil O Que É? Como FUNCIONA? Análise!,1588200131
books,,Finding the right book during Quarantine,1588199008
books,"On this day (April 29) in 1986, a huge fire ravaged the Los Angeles Central Library. To this day there is some mystery as to how it started.

This is the main topic of Susan Orleans's book, but she covers other library-related topics as well, including the history of the library, and the system today. 

Overall, I thought the story was interesting and the book informative. However, I also felt it goes on tangents that made it feel at points like the author was trying to reach a word count. For example, there is one section describing an ""experiment"" by the author to burn a book. It felt so gimmicky I almost stopped reading at that point.

A moment of regret for all of the books lost during the fire. And I'd like to hear your thoughts if you've read the book!",The Library Book by Susan Orlean [mild spoilers],1588198732
books,"OK, so this post might be a violation of r/books rules, but i read them, and while this isn't specifically prohibited, it definitely feels like i'm violating the spirit of the rule. I try to be a rule follower so please; mods, remove this if it is inappropriate. No hard feelings on my end.

This is me putting on my book reader hat and my web developer hat. I work full time as a web developer, as well as spend the majority of my life online. My wife jokes that i live on the internet and take vacations to reality. I hate most forms of social media; reddit being the exception, but i've used Goodreads too. I think goodreads is a terrible book platform. Every book has the same rating, hovering between 3 and 4 stars, so the ratings are pointless. Reviews for books pop up before its ever even been published. So i gave up on gr and have been on r/books for my book related social media and discovering of content. 

But i had a thought a while back about why reddit sucks for music (I'm also a musician; or at least was when i was younger) and its because the model itself is a feedback loop of popularity. Even the subreddits dedicated to showing people new music don't do that, because music that is truly new and unheard of doesn't get mass upvotes and music that everyone is familiar with gets upvotes because ""Oh hey, i love that song.""

Well, this applies to books too. I've seen this sub complain about it as well. So I had an idea. Possibly a bad one, so i'm running it by you.

What if there was a book forum that, like Goodreads, organized content by ISBN, but rated books using a binary yes or no option, and each isbn listing had a discussion section where instead of just leaving a review, you could discuss books you've read or are reading. I'm envisioning the process being books that you have read are added to a ""read"" list and then your homepage will have a section with the most recent discussion posts from those books; no friends lists like in GR, just anonymous honest discussion, like reddit, and your content is curated by books youve read, not by who you've added as a friend. Honestly, imagine a reddit where each ISBN was its own subreddit and you subscribe to the sub when you've read the book. Everytime someone posts something new to the discussion, you would see that there are new discussions in a book you've read; whether or not you jump in and partake in the discussion is on you. Titles that are hotter, aka, the rate of new discussions questions added is higher, they can become trending, and your home page would show you both trending titles you have read plus regional and global trending titles. In addition to this, recommendations would be made based on algorithm where if you liked Book A (by giving it a thumbs up or whatever represents a positive binary choice) and people who also liked Book A liked Book B, Book B would earn a point towards being suggested to you. If you also liked book C, and 10 people who liked Book A and Book C also liked Book B, then book B earns even more points towards becoming a suggestion for you. If you Like A, C but didn't like D, and people who disliked D but enjoyed A and C, also disliked B, it would lose points... etc. etc. you get the point. 

To me, this addresses some of the main issues i have with both reddit and goodreads for book social platforms, but... i also don't know if its even necessary in the first place. I'm biased; i live online and only take breaks in reality, so of course i would use something like this, but n=1, and i'm an odd case at that. 

So yeah, tell me this is a bad idea so i don't spend any time on it. Or tell me you'd love it and maybe i'll have a new project. Thanks r/books",Third Times a Charm?,1588198021
books,,6 SUREFIRE WAYS,1588197912
books,[removed],"Ever since Guardians Of Ga Hoole came out I've been wanting someone to cover some of the songs from the books. No one has so, I've decided to work on them. I'm gonna be posting a cover of Evensong onto r/books either tonight or tomorrow. Are you interested?",1588197907
books,[removed],Feedback for Book Chapter,1588197754
books,[removed],how can I get rid of smoke/musky smell from a book?,1588197388
books,[removed],Is there a compiled list of the most common books read by billionaires?,1588196994
books,"I see so many people saying it's their favorite book and I don't understand why. The major themes were there and the main conflict wasn't confusing, but I was so bored reading it. I read it both in high school and after just to make sure I didn't remember it wrong. I couldn't stay awake reading it. Can someone who is a fan tell me why?","Why is ""The Catcher in the Rye"" considered a great book?",1588196609
books,[removed],What book have you read over and over again?,1588196582
books,"I wanted an opinion on this. A book series (later TV show) I read and watch has rape and I did not know when I started. I feel like it's wrong to reccomend it without disclosing the fact that there is rape, too (many people may understandably want to avoid that). 

1) is it right and probably obligatory to say that there's rape in the series if you reccomend it to someone

2) is a warning like ""this book has rape"" a spoiler

Thank you for input in advance",Is warning people about the fact that a book contains rape considered a spoiler?,1588196125
books,"Some of these are ""fun"", showcase that the author is better than what they're constraining themselves to, or have good concepts.

I just don't ""get"" the appeal. Inherently there's shoehorned ""mechanics"" exposition dumps that do nothing but pad out the word count. The majority of plots seem to be in the same vein as the Isekai and power fantasy genres. It reads like the enjoyment is to see the exploits and moves before they're used, but in a technical manual with more artificial stupidity from the characters.

If I want to read a book with a lot of material for avid D&amp;D players, Orconomics is the first thing that comes to mind. The ""mechanics"" of the RPGs is central to the entire worldbuilding, plot, characters, etc. There's a lot of nice references for people familiar with the inspirations, while not being completely off-putting either. Mistborn series is another good example. I don't care much for Sanderson's dialogue or characters, but I'll give him credit for being clever and fun with worldbuilding and ""mechanics"" of a setting.

The LitRPG genre feels like a distillation of the wrong aspects. It kind of reads like an alien tried to connect people liking CRPGs to liking books while completely missing the point of what people like in either.

I'm not sure if I'm not the right audience, but I've got to ask who comprises is this market? I've seen quite a few in the last few years.",Can someone explain the LitRPG genre? As a lifelong tabletop and PC gamer I don't understand it.,1588195503
books,[removed],Free Books from Springer Editorial,1588195214
books,"I generally read informational books about things like human history or social sciences, but Blake Crouch is one hell of a fiction writer.

I was so taken aback by the realistic portrayals of traveling through time by memory. It feels so real and possible I found myself feeling close to the characters and storyline. I wanted to believe this wasn't my first time in this timeline

I loved the fullness of the story and solid ending. The writer really put thought into how to bring everything full circle. 

The way that the book ties up everything actually left me feeling very satiated and happy. It makes me realize books will always be superior to movies for their ability to be full of nuance and descriptions of things you could only ever see in the minds eye. 

Thought I'd share my thoughts with the internet.",Recursion by Blake Crouch (time travel),1588195115
books,[removed],Pbffnmj,1588194811
books,[removed],From the Living Book of David Millett,1588194767
books,[removed],Ggg,1588194727
books,"Today I read *“ \[he said\] with a gentle, ironical, disillusioned, rather absent-minded smile”* (Proust) and realized that rather than try to picture what the hell this looks like, I try it out myself, try to ‘find’ the expression with my own face.. does that make sense?

It's so much fun because you can easily glance over these descriptions, but if you actually linger on them/try them out, they can add a lot of depth to a character or scene. 

Another favorite of mine:  *""... her eyes appeared to jettison everything that was dark and heavy and to glow with fan-club appreciation""* (Salinger)

**I was wondering if anyone else does this too. What’s the weirdest or hardest one you tried to capture?**",Do you ever catch yourself ‘trying out’ a facial expression you read?,1588194375
books,"I know it is technically a short story but man is it enthralling and gripping! The whole concept of the consequences of interfering with fate is masterfully told in the shape of this tale. Since the author doesn’t explicitly state who was knocking at their door at the end and Mr White wishes for it to stop, a lot of interesting speculation can take place about the ending and it is left to the reader’s imagination. Definitely worth checking out.",The Monkey’s Paw is downright chilling!,1588194257
books,[removed],What's the best erotic scene you read in a non-erotic book?,1588194252
books,"It is possible that the fantastic worlds created by Mrs. jk rowling and by master Tolkien were the last pillars of our generation? 

What do you think of the new generation? There will be a future for this genre, so loved by ours (I am 24 years old), or now It is just talking about marketing and how to do money, or something about ""how to quit your job today""? 

By my thoughts, but I hope to be wrong, our generation will be the last one interested in this genre, to fantasize with the mind, to travel in unknown worlds, to find mistery and hype between one verse and the other. Whats next? A new Video or Photo sharing APP that'll takes place? Maybe text will be animated on the new epub format who knows.","Can science fiction books, children's books, have a future, given the lack of interest of the new generation in reading? Whats your thoughts?",1588193489
books,[removed],"Please help, I need summary of any of this books?",1588193068
books,[removed],Help me find a good online book store,1588193036
books,[removed],looking for recommendations,1588192801
books,"Hello readers!

I am planning on launch my new amazing book. It is about the current lockdown situation and how to completely invest every Second of your free time in helpful things.

I have included every single interesting subject with the details that you need. One of the most important subjects that I have included in how you can make Money Online from home using just your laptop (rather than just a mobile phone).

Now I know this is a self-promotion, but there is no rule broken here. However, I am very very sorry if posting topics like this is against the rules of this sub-reddit. 

The e-book is not done yet, but I am working as hard as I can to write the best content for the current situation! Please, if you are interested, feel free to visit the page in the comments to see more details and to sign up to get the e-book once I am done.","{My Own E-Book} ""Lockdown Hacks : How To Invest Your Free Time During The Lockdown""",1588192628
books,[removed],"{My Own E-Book} ""Lockdown Hacks : How To Invest Your Free Time During The Lockdown""",1588192460
books,[removed],I have a free book credit on audible. Any suggestions?,1588191643
books,"help me please!!

i read a book a year ago, it was in the adult section of the library. what happened was a lady who recently got married (for some reason i think her husband was called ben..) she had a kid or two i believe too. she was being stalked and books about mental health and struggling with it would arrive to her house. everything that happened made it seem like she was crazy. she went to england(?) to visit her parents and family and was in a park looking over a lake i think her child went missing for a few minutes. she later received a postcard from exact location addressed to her. the stalker turned out to be best friend that was talking to about this situation oblivious it was her. she later got captured and brought to her friends basement with the stalker/friends children. please please please help me!! also if you have any books that have a similar plot can you tell me as i might be able to find related books. many thanks :)",can someone help me identify this book?,1588191618
books,"It was about a girl, she was alone and wandering in kind of a post-apocalyptic world. She had a way to connect to something like a mix between the internet and virtual reality, using a device similar to a clam shaped make-up mirror, or a large pocket watch. This gadget was recharged by solar panels, and she used it to acquire data to help her along the way and information about the past.

The virtual world was called something along the lines of web, net, thread, or cloth.

To navigate, she had to draw symbols in some squishy material on the bottom part with a stylus or maybe by hand.  As I recall she learned the language of the web by trial and error. At some point she acquired a more advanced device, and have forgotten the old language, and struggled to learn it again later on, because she couldn't or didn't want to use the new device.

I read the book around 12 years ago as a child so this is more or less all I remember. I would be glad if someone could help me out with a title and author.

Thanks in advance for any clue, and have a nice day!",I'm looking for a novel I read!,1588190226
books,"When writing a novel, is it deemed acceptable to have the story be told from start to finish using non-stop intensity and a “not being able to rest” type of vibe where the characters are constantly on edge all the way through? Like via the characters are chased non-stop throughout the entirety of the book and there are, roughly, 95% of scenes involved in the whole plot that is just practically intense and heart-pounding.",Can a novel conceive of just pure intensity and extreme heart-pounding scenes?,1588190063
books,[removed],Books about Bi Polar Disorder,1588190011
books,[removed],CONFUSION IN STORYTELLING.,1588189932
books,"Every morning I start the day being interested. While sleeping I have no chance to overthink my life and being. I feel good early in the morning. But hours go by and finally all my feelings are changing. I start forgetting about my own worth when its just a normal day. If nobody surprises me or if I didn’t do something excellent, I’ll feel useless. This problem rises until the end of the day, where I just pray for falling asleep so I don’t have to figure out why I feel like this. I just want it to stop. The only days where I don’t feel like I’m worthless are the ones where I flirted to many boys or where I got something great like a new job. The problem is, that there must follow normal days. Days where I just get up in the morning, work, eat and go to sleep in the evening. And then I just fall from this high mountain into the dark. And it feels like there’s nothing to stop it. I feel like a junkie, just need big adventures or something exaggerated to feel ok or good. When there’s nothing like this, I just don’t know if I’m worth.",short text to think,1588189714
books,"This book adresses how the president acts in a sequence of crises, on of which is to do with the outbreak of a virus. He orders a lock down for the country really fast and the thing dies down. With all that is happening this book reminds me of the good things in America that could be once again with new leadership.","Re-reading ‘Executive Orders’ by Tom Clansy, just to remind myself that America also contains normal people and hopefully can be lead again by a well thinking president who acts on the best interest of the people in a crisis situation.",1588189400
