subreddit,selftext,title,created_utc
books,"Welcome readers!

We are continuing our ""Best Books of the Decade"" threads this week with a new category. Last week we did ""[Best Mystery or Thriller of the Decade](https://www.reddit.com/r/books/comments/g684bn/best_mystery_or_thriller_of_the_decade_voting/)"", which is still open for nominations and votes, and this week we are doing ""Best Short Story Collection of the Decade"".

**Process**

Every week there will be a new voting thread for a specific category. The voting threads will remain open for nominations and votes for the following two weeks. You will be able to find links to the open voting threads at the bottom of the post, along with the announcement of next week's category.

This is the voting thread for the Best Short Story Collection of the Decade! From here, you can make nominations, vote, and discuss the best short story collection of the past decade. Here are the rules:

**Nominations**

* Nominations are made by posting a parent comment. Please include the title, author, a short description of the book and why you think it deserves to be considered the best debut of the decade.

For example:

&gt;*Generic Title by Random Author*  
The book is about .... and I think it deserves to win because....

* Parent comments will only be nominations. Please only include one nomination per comment. If you're not making a nomination you must reply to another comment or your comment will be removed.
* All nominations must have been originally published between 1-1-2010 and 31-12-2019. With regard to translated works, if the work was translated into English for the first time in that time span the work can be nominated in the appropriate category.
* Please search the thread before making your own nomination. Duplicate nominations will be removed.

**Voting**

* Voting will be done using upvotes.
* You can vote for as many books as you'd like.

**Other Stuff**

* Nominations will be left open until Wednesday, May 13, 2020 at which point the thread will be locked, votes counted, and winners announced.
* These threads will be left in contest mode until voting is finished.
* Most importantly, have fun!

**Other Voting Threads**

Last week's voting thread: [Best Mystery or Thriller of the Decade](https://www.reddit.com/r/books/comments/g684bn/best_mystery_or_thriller_of_the_decade_voting/)

Next week's voting thread: Best Horror of the Decade

p.s. Don't forget to check out our other end of year threads, of which you can find an overview [here](https://www.reddit.com/r/books/comments/e4m352/the_rbooks_end_of_the_year_schedule_and_links/).",Best Short Story Collection of the Decade - Voting Thread,1588189010
books,,Tried and failed to identify this book in both r/TOMT and r/whatsthatbook. It's driving me crazy. It's a kids/YA book I read circa 2008 about two teens who get lost on their way to go camping and are taken in by an old couple who don't want them to leave who turn out to be ghosts.,1588188964
books,"Hi all, 

I recently finished 'Factfulness' and this book blown my mind! One of the best books I've ever read!

Are there any other books that explain how the world works based on siance and confirmed data, and at the same time are written in a way that a non-scientific mind (like mine) can understand?

Will be grateful for every recommendation!",Looking for books like 'Factfulness',1588188607
books,[removed],CONFUSION IN STORYTELLING.,1588188204
books,[removed],CONFUSION IN STORYTELLING.,1588188105
books,,love 77 by julio cortazar (english subtitles/micro-fiction for quarantine),1588187934
books,[removed],WRITING A BOOK: HELP!,1588187774
books,"This happens in so many plots it's quite honestly a pet peeve of mine. Even brilliant books could fall victim to this, despite being brilliant for the most part.

Me no good with words so maybe you didn't understand what I meant, so I'll try to give an example. Character X and Y are competing for a position. There's various schemes going on, and eventually character X thinks he tricked Y yada yada ... But, it turns out Y tricked X all along, because this whole thing was a distraction to make X forget about a crucial thing and thus making him the competition. 

So, in this case for example, the whole plot relies on distraction and character X forgetting something. And I've seen several books use this kind of thing. But there's just so many other things that could have happened. What if X wasn't distracted, what somebody else reminded X of that crucial thing etc... There are just so many things that could have happened, it's not an iron-clad plan.","Don't you find that a lot of strategies in books rely on characters doing or not doing something that isn't a guarantee and has other possible ways of happening, thus ruining the plot?",1588187696
books,[removed],Free Audiobook Codes!,1588186941
books,[removed],"Odd “censorship"" type phrases in my copy of Crime And Punishment.",1588186603
books,[removed],I don't know what makes me like a book.,1588186396
books,[removed],Free Audiobook Codes!,1588185516
books,"Hi guys! I am a native English speaker who has worked as a proofreader and technical editor for a number of universities in the US. With multiple years of experience in this field, I can provide valuable feedback in various subfields of the English language including (but definitely not limited to) research writing, academic text, and even creative works such as poetry and short stories. Furthermore, I am the author of several published academic papers and poems. I am now seeking new clients who are interested in improving their written works, whether it be to have a smoother flow, fewer grammatical and spelling errors, or just an overall better reading experience. If you are interested in my services, please contact me for further details!",English Proofreading Services,1588185374
books,"I finally caved and got a Kindle a few years ago and have come to love it. But I do miss casually strolling through the book store for an hour and leaving with a fresh stack of books. As much I've tried I haven't found a satisfying way to browse for books online. Is there no hope? Or has anybody found a way that they really like?

By the way, intentionally not including some of the ways I do currently search so if it's suggested maybe I can try it again from a fresh perspective.

Thanks!",Where and/or how is the best way to browse books online?,1588185255
books,"Hello!

I'm not sure if this is the correct subreddit to post to but I'm looking for a book from my childhood. I do not remember the name of the book only that is was about the 4 seasons of the year. I remember a few details about the book that might help one of you guys help me find it.

1. It was about the 4 seasons of the year.
2. Spring, Summer, Autumn (not fall), Winter 
3. Two children were in every illustration
4. One illustration they are flying a kite, and I think another   picking or eating apples.
5. The children had crescent shaped heads. 
6. I think it might have received an illustration award.
7. I read it in first or second grade so it would have been written before 1996.


Thanks a million for any help!!!!",Looking for a childhood book.,1588185077
books,,"For parents out there, I wrote and illustrated a free children's book about a family stuck inside together during the stay-at-home order, told from the perspective of the family dog. Times are extremely difficult for so many right now, so I hope it can bring you some joy and entertainment!",1588184578
books,[removed],Redwall sale,1588183873
books,,I've Finally Got An Amazon Series Page!,1588183853
books,[removed],Redwall sale,1588183760
books,[removed],What's the worst book you've ever read?,1588183683
books,,"In case you're interested/unaware, The Last Wish by Andrzej Sapkowski is getting a Limited Edition release hardcover via Illumicrate soon. // I couldn't figure out how to embed images here, but follow the link.. It. Looks. Lovely!!",1588183618
books,[removed],"I’m looking for people to participate in a book exchange. You can be anywhere in the world. All you have to do is buy your favorite book (just one) and send it to a stranger (I'll send their details through in a private message). You’ll receive roughly a maximum of 36 books back to you, to keep.",1588183199
books,"There is no better question to ask than, “When and what is the Sabbath?”

The Sabbath, if not carefully and prayerfully studied, can be one of the most confusing subjects. There is clearly a Sabbath that the God of the Bible made for His assembly, but with His voice of commandment being a Judge on all things, why are there yet various sabbaths differing from the one He set?

There is a reason why, on the seventh day of every week, the God of the Bible would have our faith know His “rest.” In the book, The Bible Sabbath, the reader will venture into the ever-lasting nature of the seventh day’s refreshing, examining, through the Bible’s philosophy, the reason for that Sabbath’s ever-lasting establishment. The reader will therefore, as they pass through this introduction on the Bible’s Sabbath, understand why they are given this appointment, and why the service held to it is so necessary for their mental and spiritual well-being.",A book about the real deal behind the true sabbath,1588182754
books,[removed],help!,1588181396
books,"I bought it years ago as an audio book and only managed to start now. I am sure I'm not the only one reading it in this time.

6 hours in and 39 to go. LOVING IT. I've only read It and quite a few of his short stories, but I genuinely believe he will be on the same level as a Charles Dickens in 80 odd years.

Also, it is weirdly prophetic. He predicts nature coming back and all sorts of things. Anyway, so far so good.",The Stand by Stephen King,1588181362
books,[removed],Does anyone have a copy of Your Duality Within: A Study of Your Two Distinct and Opposing Internal Voices (Anderson Silver)?,1588181272
books,"Hello fellow Redditors, I need your assistance. So recently, I've been writing a self-help book on the topic on how motivation hardly gets people anywhere anymore, becuase, in this day and age, people are expecting quicker results from less work. I will tie this into the idea of how people are too indulged in what can satisfy them in the present, rather than the future. Now my question is, would there be anyone interested in reading this, and if so, what age range? I'm wondering how I need to format such a book and who I need it to appeal to.
Thank you for your time!

[View Poll](https://www.reddit.com/poll/gad67d)",Would you read this book?,1588179792
books,,Everyday objects and useful objects by Karl Marx,1588179172
books,"While I was finishing The Art of War by Sun Tzu, I spun randomly for another book. And that book as Ulysses by James Joyce. I've heard a lot about this book for two reasons. Reason number one, it's a parallel to Homer's The Odyssey set in the modern world. Of Ireland. Reason number two, everyone that I've heard or seen talking about this book and on a YouTube video, says this book is the most difficult in literature. I've read many books before, Stephen King's IT, Harry Potter, Percy Jackson, Jane Eyre, Wuthering Heights, Schilder's List, Diary of a Young girl, Dracula, etc. But none have come to this before. So I'm making this post so you guys can wish me good luck or maybe some tips to help with this book. Thank you.",Im going to read Ulysses,1588179169
books,,"Karl Marx, Grundrisse//1858, Everyday objects, Useful objects - Artist Frog",1588179127
books,"I am a moderate Stephen King fan and have read maybe 5 of his books over the years. I’ve had a copy of “The Stand” on my shelf for years and had the macabre desire to read it while Uber quarantine. I was always a little intimidated by the size of it and was never sure I would be able to cope with 1500 pages of Stephen King. I’m about halfway through and I have to say I think this is Kings best writing. And I mean specifically the writing, his prose is just so on point in this book. He balances detail, imagery, character development and action perfectly in this book. It is possibly the best paced novel I’ve ever read. Somehow he has kept me hooked page after page. There is also an elegance to his writing that seems to be missing from some of his other book. There’s a sense of confidence like he really knows what he’s trying to say in this one and isn’t meandering or redundant. The plot so far is also fully fledged we’ve met many of the characters and have the foreshadowing that all their lives will be intertwined at some point in the future. So far I can’t recommend the stand enough, I would consider it Stephen Kings best out of the ones I’ve read of his and I’m only halfway.",A mid review of The Stand by Stephen King.,1588177842
books,[removed],Book Discord,1588177765
books,[removed],Can anyone recommend books similar to “The Ending of Mr. Y”?,1588177600
books,[removed],Can anyone explain which individual James Herriot books are collected in which larger editions?,1588177474
books,[removed],Recommend me a fantasy fiction,1588176871
books,,Linked AMA,1588176692
books,[removed],what's this dot between the text?,1588176650
books,[removed],"[Spoiler] Help in understanding the ending of ""The Alteration"" by Kingsley Amis",1588176422
books,[removed],Paper Soldiers,1588176339
books,[removed],Reading while high?,1588176207
books,,Interesting facts about dolphin,1588175227
books,"Hi, Reddit! What are some books about mental illness? It doesn't have to be mordern, I'm interested in how madness has been treated in our society. I would prefer novels, but non-fiction is good as well. Maybe books about being in an asylum or about dealing with a descent into madness. 

I read The Bell Jar and loved it. I also really liked Norwegian Wood by Murakami. I'm just fascinated about the different perspectives on reality that these illnesses bring. 

I would prefer books that aren't cheesy or eyerollingly melodramatic. 

Thanks!",Books about madness,1588175050
books,"Hello,

For quite some time now, I've had this idea of founding a community that is focused around books. There isn't that many in my home country and I definitely think there is a demand for that. No one has just gotten around to make one. Initially I thought it would be great to host this meetup physically somewhere, but Covid-19 has forced this potential community to take an online form. Nevertheless, I'd be really interested to hear what book has moved you this year? It could be fiction or nonfiction. I am on the lookout for some books that could be discussed with a group of people. The only small prerequisite that I'd mention is that, the book should be easily accessible, meaning that one would be able to find it in a book store or buy as an e-book.

Thanks for your help!",What book has moved you this year?,1588174996
books,"After rereading with pleasure *Interview with the Vampire*, Anne Rice's novel that modernized the vampire myth in the last quarter of the twentieth century, I was very eager to read the following novels from the American writer's vampire saga. So I read the second novel in the series : **The Vampire Lestat**.

After following the adventures of Louis, the almost humanist vampire in the first novel, we have a new narrator in this second one : Anne Rice offers us the point of view of Lestat, Louis' ""vampire progenitor"".

The novel begins in 1984, when Lestat begins a rock-star career and is about to publish his autobiography. It is the text of this autobiography that makes up the bulk of the novel.

It's rather interesting to read about Lestat telling us his destiny, from his mortal youth at the end of the 18th century to his crazy project of revealing the existence of vampires through his career as a vampire-rock star in the mid-1980s.

Seen from the inside, we discover a very different character from the unsympathetic, cruel and disillusioned vampire who poisoned Louis' life in *Interview with the Vampire*. It's an interesting counterpoint, which sheds new light on several elements of the first novel.

However, the story suffers from some lengths in the middle ; after a while I wondered where the author wanted to take us. Fortunately, the revelations end up succeeding each other and the pace even accelerates frankly in the last part.

You have to understand that we are almost dealing here with a tale of stories : as Lestat's story unfolds, he meets ancestral vampires who tell him about their mortal and immortal lives, so we go back in time, as if we were leafing through a History of Vampires, to the origins of these creatures of the shadows. The story does indeed go back a long way in time, and that's the part I liked best in the novel.

The ending ends with a cliffhanger that promises action and probably more revelations in the next novel : The Queen of the Damned, which I should read soon.

Note : ★★★★☆",The Vampire Lestat - Anne Rice,1588174677
books,,Can You Pass This Color Blind Test?,1588174229
books,,"I will convert, organize, optimize, edit and secure pdf file. - Classified Ad",1588174129
books,[removed],New word -- covident,1588174040
books,"ok, so i fully admit this post may be irritating to some and useless to many. but im trying to identify a book i read. i know, i know.

the book was very dark, creating a feeling of claustrophobia and dread. i dont remember much of the plot points as it was a very non-traditional format and style. 

there were blank pages (intentionally), words trailing all over the page creating a sense of mental dread and paranoia.

it was written by a male author in the last 10-20 years and i think the cover was dark. i seem to remember an undercurrent of mental breakdown in the book involving a believe that their bodily fluids were a poison.

i tried googling and searching all kinds of ways but obviously i know so little identifiable information!",Help in Identifying a Book,1588173690
books,"There are a number of wonderful books that exist and I do not have access to or have no knowledge of because I am can only read in English - which is a fault of my own. I want to diversify my reading selection as I do not work hard enough to seek out books by authors who don't publish in English. 

What are some of the best books you've read that have been translated into English? This may be because the translation was done very well or the story line is powerful. I'm open to anything! Fiction, non-fiction, children's, etc.",Best translated books (into English),1588173443
books,"In the late 1940s or early 50s, Random House began publishing a series of books on the history of America by well known authors, directed at what are now middle school age kids. I started reading them a bit earlier and developed a life long love of reading history as a result. J. Frank Dobie - ""Up the Trail from Texas""; MacKinlay Kantor - ""Gettysburg""; Shirley Jackson -""The Withcraft of Salem Village are among volumes in the series. Which led Random House to a ""World Landmark"" series. Great history for young readers, that have aged well.",Landmark Books started my love of history.,1588173254
books,,Interludes on the development of English Comedy,1588172685
books,[removed],"I’m Blake Crouch, author of many bestselling books, including Wayward Pines, Good Behavior, Dark Matter, and Recursion. AMA!",1588172525
