subreddit,selftext,title,created_utc
books,[removed],Where do I go from here?,1603119552
books,[removed],the iliad and the odyssey,1603118913
books,"  

Hi everyone! I finished reading Krasznahorkai's Satantango a couple of days ago and found it to be utterly brilliant. It was definitely one of the best books I have ever read. It was difficult to parse out what the author was trying to do, but after re-reading passages and taking notes, I have come to my own interpretation of it. For anyone who may have been confused as well, or simply seeking some other viewpoint, I thought I'd post my original blog post here as well! It's lengthy, but I honestly couldn't find a way around that given the book's complexity. I hope to hear your thoughts after! Here's a link to the original: [https://watchreadgame.com/satantango-novel/](https://watchreadgame.com/satantango-novel/)

&amp;#x200B;

**Satantango, The Novel Explained**

### introduction

Laszlo Krasznahorkai’s novel *Satantango* concerns itself with the destitute lives of the residents living in a decrepit, rain-drenched Hungarian estate. He writes the novel using winding, multi-part, sometimes page-long sentences that almost act as a dialogue when no one is speaking. Instead, the sentences speak to themselves, discussing the themes, correcting the earlier moments, or arguing with one another. Krasznahorkai expertly uses the plot to set the basis for the thematic material.

On the surface, he is writing a novel about the failed Totalitarian Communist leadership present in Hungary at the time. The story is about those irreverent citizens, living as drunks and cheaters, who live like this because the government is now unconcerned with them as they pose no use following the downfall of their industry. Often, I read about people who question the book’s purpose or writing style. They wonder what it’s about or if the sentences and paragraphs serve any importance other than the author being pretentious. I hope this article gives a little insight into why I believe this book is absolutely important and why it serves a much greater purpose than what may be apparent. This whole article will contain SPOILERS.

### the events

Before delving into the thematic material to help explain *Satantango*, it is important to have an understanding of the overarching plot within. The citizens of the estate are living in squalor and perpetual drunkenness. They cheat on wives and husbands, leave their children to prostitute themselves, and drink the mornings, days, and nights away to pass the time. The estate they live on was once some sort of agricultural industry. Now that it is useless, the government has given up on this community, leading to their current state of living. Their indifference leads to the suicide of a young girl, Esti.

Thus enters Irimias. Irimias is literally a government worker – an informer of sorts. But he represents other entities: the totalitarian state, the material form of Satan, or a foreshadowing of a fascist capitalist state. He leads them to believe he is bringing them to a literal Eden, and instead (without their knowledge) tears them from their homes and sets them to work as spies. They believe they are going to work for certain individuals while Irimias builds his Eden, but instead, they will report on those they are working for. It ends with the Doctor of the estate hearing the same ringing bell Futaki heard at the beginning and deciding to write their story.

### part 1: nihilism

The theme of nihilism is present throughout the novel. Nihilism is the belief that life (or things you do in life) are meaningless – that there is no point in morality, love, or enjoyment. I will use nihilism to set a quick basis for what I believe the purpose of the novel was. *Satantango* opens and closes with the ringing of a bell. When Futaki hears it in the first few pages of the novel, to us it calls to mind some higher power. It makes us wonder, are heavens gates opening? is it signaling the coming of some angel or prophet? Well, a religious person (or someone who believes in signs) would believe it was a sign from God, but here is what comes to Futaki’s mind:

&gt;*… and he saw himself nailed to the cross of his own cradle and coffin, painfully trying to tear his body away, only, eventually, to deliver himself — utterly naked, without identifying mark, stripped down to essentials — into the care of the people whose duty it was to wash the corpses, people obeying an order snapped out in the dry air against a background loud with torturers and flayers of skin, where he was obliged to regard the human condition without a trace of pity…*  
*pg. 4*

Instead of thinking of something beautiful, what comes to his mind is thoughts of death and the meaninglessness of life. He is presented with God and thinks of the Devil. It is almost as if he is seeking this pain, or these “torturers and flayer of skin”.

But who else hears the bell? The Doctor, or the narrator of the entire work. The book ends with him writing down the first few pages of this novel, signifying his authorship or the work. Before getting into his experience with the bell, it is important to see his worldview as well. Far before his hearing of the bell, he sits and watches the people of the town. He thinks:

&gt;*… he was lost in successive waves of time, coolly aware of the minimal speck of his own being, seeing himself as the defenseless, helpless victim of the earth’s crust, the brittle arc of his life between birth and death caught up in the dumb struggle between surging seas and rising hills, and it was as if he could already feel the gentle tremor beneath the chair supporting his bloated body, a tremor that might be the harbinger of seas about to break in on him, a pointless warning to flee before its all-encompassing power made escape impossible, and he could see himself running, part of a desperate, terrified stampede comprising stags, bears, rabbits, deer, rats, insects and reptiles, dogs and men, just so many futile, meaningless lives in the common, incomprehensible devastation, while above them flapped clouds of birds, dropping in exhaustion, offering the only possible hope.*  
*pg. 59*

Again, like Futaki, his world view holds on to some meaninglessness of life. He sees himself as a small part of a pointless world, as a speck of time that comes out to experience something insignificant while hills rise and sink before him. He views life as a simple waiting game for death, and that death is “the only possible hope”.

Finally, to drive this point of nihilism home, now I can get at what the Doctor experiences when he sees the bell. Again, it should come to mind that a bell would usually signify something grand and beautiful, but when he arrives at its source, there is some disfigured creature speaking in incomprehensible bursts, and we are uncertain if it is even human. It is not some god ringing the bell, and it is not even the devil. It doesn’t matter what it is as long as we know it is something grotesque, something that is suffering through life performing menial pointless tasks, just as the townspeople seem to be doing.

### part 2: the estate

Now to tie this theme of nihilism into the bigger picture. Futaki and the Doctor open and close the novel – they present us with most of the book’s philosophy – but they rarely play a big part in the central moments. Esti, as young as she is, already seems to deny the importance or beauty of life, and instead seeks solace in death. She kills her cat and then herself, waiting for a guardian angel to come and take her up. But at one point, in the book’s very few paragraph breaks (and the only one that isn’t breaking for a song or list or prayer) Esti is thinking:

&gt;*… she could sense their presence without seeing them, she knew they were there, that she was facing*  
*them*  
*down there,*  
*pg. 109*

Esti is literally viewing her family and village members from a higher place. She could be acting as the only source of good throughout the book, watching over them from a vantage point, some metaphorical sense of heaven maybe. It is no coincidence that Krasznahorkai chose to break this line up. He wanted us to think on this line as a metaphor or something more important. Down there calls to mind viewing Earth from above, like an angel or a god. She may be acting as a guardian angel over the entire estate, yet as she watches over it all she remembers her mother’s words to her – “There’s nothing for you here!” It sets in motion her nihilistic beliefs; she comes to realize the lies the town and even her brother tell her; apathy sets in. Esti kills herself and the town loses its guardian angel.

The loss of this angel is what gives Irimias a way to enter, but first we see the outcome of this loss at the bar. There are no redeeming qualties expressed in this chapter, just drunkeness, cheating, anger. The rain pours down onto the bar as if foreshadowing some apocalypse. And most importantly, the spiders weave their webs on these still living, breathing inhabitants. The spiders give them a symbolic sense of the dead – yet even they refuse to stay with these “corpses” and their immorality – and then retreat back to their holes.

### part 3: the journey

As I said, Esti’s death (or more accurately, the failings of the townspeople to protect her) opens a doorway or a purpose for the devil to come into their lives. It calls to mind a sort of Faustian bargain. Maybe an unwilling or an unspoken one for the townspeople, but still similar. They are promised an Eden and so set to destroying their former homes and leaving the decrepit estate. But this is all lies as the devil is wont to do. They are sent out to “work” for certain individuals, believing that one-day Irimias will come back for them to present this Eden. But the devil (or maybe he is simply a minion of the devil) is just using them to learn – to spy for his master, which as presented in Part One Chapter 2, happens to be the Totalitarian bureaucracy of the Hungarian government.

Does this new work give their lives purpose? Will their conditions of living improve? Will they receive some sort of satisfaction with their work, or some hope that something better is coming – an Eden? It is all possible but hard to believe. They had a purpose before on their estate, but once their use had run out, they were forgotten and most likely will be again. Likely, they will revert back into alcohol or some other vice as a means of passing time and forgetting; they will bribe, steal, cheat, and fight. They may hope or set their sights on some other Christ figure, maybe this time one who is not in disguise. But as their story closes, it feels as if that thought is absurd.

### conclusion: hope

*Satantango* is obviously highly nihilistic and provides a horribly pessimistic worldview, but it does give hope. Krasznahorkai gives us scenes that provide some solace or comfort that there is something that matters, whether from a religious, artistic, or social perspective. In the scene when Esti’s corpse (or soul?) is rising above the fog seeming to be taken to heaven, Irimias cowers. He is seeing the innocent saved and brought to what is a real Eden. There is light and beauty after death, and maybe that shows him it is possible before death as well. The Doctor finds comfort in writing, in art. He finishes his chapter having possibly found a true purpose in cataloguing the lives of these souls. Or maybe his comfort is in providing some form of social commentary in showing what his country has done to its citizens.

That is what I believe the purpose of *Satantango* is. It is pessimistic and depressing and bleak, but Krasznahorkai is not saying that life is meaningless or that death is the only exit. He does not think humanity is a pointless dot in eternity. What he is doing is showing what happens when people are forgotten. He is criticizing his government and country for allowing life to reach such low levels. It is social commentary but not heavy-handed, blatant allegory – rather it is art at its peak. It provides us with a tapestry of never-ending thoughts, paragraphs, and sentences, taking stream-of-conscious to a more philosophic and meaningful level. His descriptions of life, sunrises, and rain, are written in some of the most touching and unique prose I have ever read. In his sentences we see beauty in even the most desperate creatures, a light in the dingiest of bars and hovels, and all they need to flourish is a little help.

**5.00/5.00**",Satantango - The Novel Explained,1603118799
books,The book is was better than the movie just saying that upfront. But that ending I didn’t see it coming and it did leave me shocked but at the same time I felt it wasn’t a Big Bang and just ends. It was kinda a twist but it wasn’t OMG. I’ll get into details on the comments. I recommend the book if you like suspense 7.5/10 but avoid the movie that was trash. Okay have a good day!,"Just read and watched the movie “I’m Thinking of Ending Things” by Iain Reid (Spoilers, wanna discuss the end)",1603118667
books,Okay so there's a kid and his dad is a psychic after his death he's told if he signs down papers hell get X amount of dollars and after signing it he also inherited his dad's... Host? I think? There a group of ghost his dad has taken control over one of the ghost rebels and he's turned into a ghost himself while his body is taken over if anyone knows this book is really appreciate the title as I was halfway through before covid struck and I had to return the book.,Anyone know this book?,1603117516
books,[removed],A simple book to make me a proficient writer,1603117440
books,"There is always one place where I feel good to be. No matter happens in life, there need to be.

According to me;

To create a fictional world and write it, and live in it. Describe the settings and every aspects as much as I can reach up to every detail. I really like to make my fictional characters in my stories speak each other and I am the only one who can control theirs emotions. So in this  respect, I like to loose my conscious in reality and my conscious alters to my ficional world which I've been writing it for 2 months. 

It would be glad to read, ıf there somebodies who share the same feelings with me. Or you can just answer my question. I would like to think what others think. Thanks in advance.","What is your ""There is always a place where I feel good to be"" ?",1603116908
books,[removed],Are 'classics' the Oscar of movies?,1603115989
books,[removed],Has anyone here finished Fifty Shades Trilogy?,1603115985
books,[removed],Has anyone read (listen to) “The Lost Causes of Bleak Creek),1603115837
books,,Stephen Curry talks about his latest venture: A book club,1603113850
books,[removed],Speed!!!!,1603113674
books,[removed],Books with descriptive language you can imagine,1603112611
books,,how to change gmail password 2020,1603112323
books,[removed],Where can I read books online for free or at cheap prices?,1603111779
books,[removed],Where can I read books online for free or at cheap prices?,1603111696
books,[removed],QuickBooks Customer Service Nevada,1603110352
books,,Stop asking ‘diverse writers’ to tell you about their lives,1603110107
books,[removed],Please watch,1603110099
books,"Here is a great book to everyone who is into zodiac or interested to learn about it.
The book is called ""Zodiac Explained: Understanding the Innate Motives Behind Our Actions"" by Alb Imeri and here is a descriprion.
In this book you will learn what every sign of the zodiac is all about and how it affects a part of your personality and the personalities of people around you. Everyone has a motive behind their actions and by the end of this book you will see past their actions and truly understand what each sign’s motive is. You will get a better sense of which types of people you are more compatible with, furthermore you’ll have an insight into how to approach people based on their personality. You will realize where your strengths and weaknesses lie, why you feel a certain way and what are your biggest flaws.


[Zodiac Explained](https://www.goodreads.com/book/show/54972466-zodiac-explained)",Zodiac Explained,1603109544
books,[removed],Zodiac book recommendation,1603109443
books,,"Joy Harjo on the Power of Poetry, and on Building a Comprehensive Canon of Indigenous Poems",1603108732
books,[removed],Looking for a magical realism novel,1603107016
books,,PSYCHIC LOVE &amp; PERSONAL READING +27603764121,1603105861
books,"So I recently bought the penguin classics deluxe editions of the Iliad, odyssey, and Aeneid. Once I got them I realised that there was a problem, the odyssey was larger than the others, And after looking at them I realised that the only problem is that it wasn’t cut right at the bottom. It’s noticeable enough that you can see it from far away so I was wondering if any of you would know what to do about it. Are there any places that do it or is it one of those things that I would have to do on my own.",Trimming books,1603105082
books,[removed],Please help me find the title of this book,1603105071
books,"I  saw this book mentioned here on a list of 15 Titles Not for the Faint  of Heart and I found it extremely captivating.  Especially during a  pandemic, a horror story about a highly contagious illness feels quite  real and relatable.  I found the detailed description of smells to be  greatly adding to the immersion.  For most of the book, I was on the  edge of my seat while reading.  I had to take some breaks now and then  because it felt too intense.

Anyone else enjoyed The Troop?",The Troop by Nick Cutter,1603104398
books,,"अथर्ववेद भाष्य तृतीय काण्ड- क्षेमकरण दास त्रिवेदी, विश्वनाथ विद्यालंकार",1603104263
books,[removed],Forbidden books,1603103697
books,[removed],Tess Gerritsen Books,1603102224
books,"It was some time around 2010, I remember reading a book review in a smaller New York publication (possibly the Park Slope Patch, but I could be mistaken) about the most depressed man in history.    


What I remember: 

* The book was about a portly lord who documented his struggles getting out of bed in the morning to put on his slippers (sometimes for whole chapters).
* It appears to have been a review-in-retrospect,  I don't think it was a recent title; more of an obscure, little oddity that was unearthed to make an interest piece.
* The review was written out of amusement a sort of, ""If you think you're depressed, at least your not as bad as this guy,"" which makes me not entirely sure if the original work was a genuine diary or satire.  


For years, this article has been dimly signaling in my mind and I fear I might have lost my chance to find the book and read it.  I've  done a domain search, but it appears the Patch is no longer what it used to be, as are most smaller news sites these days.  Do any of my clues sound familiar to anyone here?",Need help finding a book I barely remember reading about,1603102212
books,"Hi everyone!

What are you reading? What have you recently finished reading? What do you think of it? We want to know!

We're displaying the books found in this thread in the book strip at the top of the page. If you want the books you're reading included, use the formatting below.

**Formatting your book info**

Post your book info in this format:

**the title, by the author** 

For example:

**The Bogus Title, by Stephen King**

* This formatting is voluntary but will help us include your selections in the book strip banner.

* Entering your book data in this format will make it easy to collect the data, and the bold text will make the books titles stand out and might be a little easier to read.

* Enter as many books per post as you like but only the parent comments will be included. Replies to parent comments will be ignored for data collection.

* To help prevent errors in data collection, please double check your spelling of the title and author.

-Your Friendly /r/books Moderator Team","What Books did You Start or Finish Reading this Week?: October 19, 2020",1603101611
books,"Hello readers!

Every Monday, we will post a calendar with the date and topic of that week's threads and we will update it to include links as those threads go live.  All times are Eastern US.

---

Day|Date|Time(ET)|Topic|
-|-|-|-
^Tuesday|^(October 20)|^(12pm)|^(AMA: Author Reid Forgrave)
^Wednesday|^(October 21)|^(1pm)|^(AMA: Author Mike Ayers)","Weekly Calendar - October 19, 2020",1603101606
books,[removed],Favorite sad ending novel?,1603099144
books,"I've looked at various websites (Amazon, Barnes and Noble, Ebay, etc) to find a complete, unabridged version of Little Women. It seems like there are a lot of versions that claim to be ""unabridged"", but the reviews left by customers say otherwise. Some say the Puffin and Usborne editions contain only half the book, and say that the CreateSpace Independent Publishing Platform book is almost unreadable with its poor translations. Other listings don't specify at all whether it is abridged or complete, so first-time readers (like myself) won't be able to know if it is the 'real deal' since they have nothing to compare it to. I would also rather have a book without illustrations added in (like the Great Illustrated Classics published version). It seems like no matter what publisher's edition I find and read the reviews of, they all seem to have customers complaining about either the formatting or the changes made to the story itself.

Has anyone found a good collector's copy that doesn't have any issues with editing, quality, or poor illustrations? That being said, does an 'untouched' version even exist today, or have they all been tweaked over the years of reprints? I'd appreciate being steered in the right direction; this will be my first time reading Little Women and I want to make sure I set off on the right foot!","Has anyone been able to find a decent quality, completely unabridged version of Little Women?",1603096342
books,[removed],"Hey community, I'm looking for a book from my youth that pertains to science and space. It was the book that got me into the universe and would love to read to my little guy. ~10in x 6in. The coolest/dominant feature was the wrap cover showed the size of Betelgeuse in relation to our sun",1603096142
books,"I've looked at various websites (Amazon, Barnes and Noble, Ebay, etc) to find a complete, unabridged version of Little Women. It seems like there are a lot of versions that claim to be ""unabridged"", but the reviews left by customers say otherwise. Some say the Puffin and Usborne editions contain only half the book, and the CreateSpace Independent Publishing Platform book is almost unreadable with its poor translations. Other listings don't specify at all whether it is abridged or complete. I would also rather have a book without illustrations added in (like the Great Illustrated Classics published version). It seems like no matter what publisher's edition I read the reviews of, they all seem to have customers complaining about either the formatting or the changes made to the story itself. 

Has anyone found a good collector's copy that doesn't have any issues with editing, quality, or poor illustrations? That being said, does an 'untouched' version even exist today, or have they all been tweaked over the years of reprints? I'd appreciate being steered in the right direction; this will be my first time reading Little Women and I want to make sure I set off on the right foot!","What is the best, complete, unabridged version of Little Women currently available?",1603096027
books,So I bought a copy of Dracula recently and immediately in the first paragraph I noticed the grammer was really off. I looked up the reviews for this particular copy and saw a bunch of people complaining that the entirety of it is written like it was translated to another language and poorly translated back to english with tons of typos. I scoured amazon for other copies and saw people saying the exact same thing about every version of the book I came across. Where the hell can I find a version of Dracula that's properly edited?,Where can I find a a proper version of Dracula?,1603094767
books,[removed],Perks of being a wallflower,1603094202
books,"I'm incredibly squeamish and just got to the part in The Vanishing Half where &gt;!the twins' father is lynched twice in one day.!&lt; 

Can I expect this level of violence across the whole book, or is this about it? Wondering whether to keep going.

I wasn't too badly affected by &gt;!initial accounts of Sam's violence against Desiree!&lt;, but they weren't graphic and nightmare-inducing, just sad.",Violence in The Vanishing Half,1603093931
books,"I just read this ""classic"" book. Don't get me wrong, the build up is excellent and it *did* have me hooked until the very end. 

However, the ending was unfair because I don't think there is any reasonable way a smart reader could have figured out the real killer being the judge. I don't think the clues, even in hindsight, line up enough for a diligent reader to have figured it out with some confidence. I like a murder mystery to have enough clues that a diligent reader is able to pickup. In that sense the book should be *fair* to the reader. It felt like the book had a lot of deus ex machina just to make the ending unfairly unpredictable. 

When I read the ending, I was like ""Ok. If you say so"" in terms of justifying who the killer was. 

Was anyone really able to figure out the killer much before the ending though ?","""And Then There Were None"" is unfair",1603092973
