subreddit,selftext,title,created_utc
books,"I've read a decent number of mountaineering books recently (drawn, touching the void, dead mountain, denali's howl, and buried in the sky, as well as into thin air last year). In addition to not helping my depression it led me to question the purpose of this genre.

Reading through these books -- seeing the scathing armchair criticism of these people's final moments -- I wonder the point is. Are we glorifying these attempts and rationalizing away the bloodiness? Do we dehumanize them, treating it like an adventure novel? Or do they decrease the inexperienced by inspiring respect for the mountains? Do we read them for the insatiable and inexplicable drive or the unnecessary death? Are the things these books say even helpful? What's the take away?

I understand that writing helps many with survivors guilt. I'm more wondering what we get out of it as readers.",What do we hope to gain from books like Into Thin Air?,1607076718
books,,"Hello everyone !! Can you all support my small youtube channel, please? How to use ""study with me"" videos? Treat it as if you're skyping a friend to study! You can leave this video running in one of the tabs on your browser and hopefully, this will help you to stay focused and motivated :)",1607075903
books,[removed],African Folklore-E book,1607073435
books,[removed],Please help me find a book 🥺,1607073146
books,"Ok so I have been always interested in great stories, br it video games, movies or even someone telling me a story.

But because I probably have ADHD or maybe something destroyed my attention, I stopped reading.

But I always read detective fiction for some reason.
But now I want to read books, like actually profound books.
The one who got me interested in reading and writing id Charlie Kaufman, and since there are books that are as beautiful and profound as Kaufman. I think I want to read actual books this time.

Anywho here's my list of writers that I think are east to read, so let me know if I am wrong or right(you can also check them yourself if you like:))

Jorge Luis Borges:
Ge is one of the creators of magical realism and he writes very short stories that I think are easy to read,right?

Yukio Mishima:
One of the readers that PewDiePie recommended
And English isn't his first language (likr me) and he read it translated and he became one of his favorite authors.so maybe he is easy to read or got good translationd.

Haruki Murakami :

I have read ""kafka on the shore"" and I must say I am impressed.....I have never ever had something given to me that I didn't understand a thing of.
But this book broke the rule,and I am still waiting to get sime experience with books so I could read thsi magical realism book.
Are any of his other books,well you know, won't make me feel like an actual idiot for not understanding a thing.

Ernest Miller Hemingway:

Have you ever read an article about the life of this guy?

Because I did and I want to read every books he has ever written.
I know his writing is very easy but I also know that he use subtext,so I am afraid I won't understand him the way murakami did.

John Ernst Steinbeck Jr:
I have always heard that he is perfect combination of easiest to read and most profound so maybe I will like his stories?

Naguib Mahfouz:
I am Egyptian and my first language is Arabic and I am interested in existentialism....so maybe he would make a perfect start?

Taha Hussein :
Like Naguib Mahfouz.

Onr thousand and one nights:
Isn't a writer,but it's written in Arabic.
Except it's old and the language is probably different.hoefully not that much.



Ok,so tell me which one is easy or try them yourself.I will wait?",So which of these writers should I read if I am a teenager and someone who didn't read that much in life?,1607069594
books,"Hello, I’m going on my honeymoon on Monday and I want to get a really good book to read, I thoroughly enjoyed all of the ‘me before you’ collection by Jojo Moyes and a selection of her other books, I also enjoyed the book ‘Eleanor Oliphant is completely fine’ by Gail Honeyman, can anyone recommend anything similar?",Holiday read!,1607067769
books,"I found one of her books (called Silenced) at the lending library (free community library), and loved it. I realized it’s book two in her series of crime novels and found the first one at public library, along with the rest of her books.

Her 2 book series Buried Lies and The Lies We Tell were so good. Loved the characters and pace of the stories. Couldn’t get enough and felt sad when I had read the second book. However with a lot of googling I found she’s written book 3 with the same protagonist, I’m just waiting for it to be translated into English and sold here 🤞🏽🤞🏽

Anyway, thought I’d share this with you all since I couldn’t find any info about her through searching this sub.","If you haven’t yet read books by Swedish author Kristina Ohlsson, you should give them a try!",1607066291
books,,I'm Writing A Novel About A School Shooting,1607066205
