subreddit,selftext,title,created_utc
books,"I mean... they're just ugly and take away on of the nices thing about books, the possibility of getting your own image of the charakters? I really like abstract or minimalistic covers because they normally just enforce the image of certain things you get in the book. I would really like to go on a rant against them but I'm a bit to sleepy right now, but are there ANY good things about them? Does anyone like them? And why do they even get produced?? Idk. anyone that enjoys them and I'm really happy about that, it just destroys the whole book",Who likes covers with real humans??,1605397598
books,[removed],Notebook book tracker recommendations?,1605396278
books,[removed],Book,1605396195
books,[removed],The Bear by Andrew Krivak,1605395647
books,[removed],"Online (used) book stores, that AREN't Amazon",1605394987
books,[removed],Is it just me or.......,1605392926
books,[removed],Book recommendations,1605392819
books,"Hi All, 

I am currently a student doing research on consumers sci-fi interests and habits. We’re also researching to see if consumers have gained interest in this genre with current social and world events including COVID-19.

If you could help me out real quick and answer the survey I would greatly appreciate it. There is around 20 questions and takes 5-10 minutes. 

If there is enough interest I will post the results. Thanks everyone who answers!

Link: https://forms.gle/BYTv67p5QxyaiXSn7",Survey on general and sci-fi reader interests and how COVID had changed your perception of the genre,1605392780
books,[removed],Looking for contemporary English-language novels by Pakistani writers. Any ideas?,1605392628
books,"Before I begin I would like to warn you I'm French so I might do some mistakes sorry about that. 

I'm reading Frankenstein by Mary Shelley (in English) for the first time and clearly one of the most known idea of the book is that one does not born a monster but is made a monster (in the case of the creature by the rejection of the humans). 
Although I think this idea might be true I don't know if I love it or not. 

I mean this idea makes me think about those serial killers who became bad because they suffured during their childhood. It is often explained in some documentaries as if it was an excuse for what they did. I think that having a terrible life is not an excuse for doing terrible things and I don't want to forgive them. 

That is exactly my ""problem"" with the creature in Frankenstein, I don't know if I despise him (even if the word despise might be too violent to express what I may feel) or if I feel sorry for him. I don't know if I want to forgive him. 

What do you think ?",I'm finishing Frankenstein by Mary Shelley and I don't know if I like the phylosophy of this book,1605391130
books,,Non fiction recommendations in the same ilk as the following?...,1605391000
books,,The Complex Relativity Of A New Job,1605390794
books,"I have not seen the show either so I’m a total outsider when it comes to GOT. I’ve pretty much only read self help/motivational books these last 4 years as I really enjoyed the pursuit of self improvement and becoming a master of your mind. 

I’ve wanted to get a new hobby as my main passion is fly fishing but I can only do that every few weeks considering having a career and young twins boys. I’ve also wanted to spend less time on my phone, So I thought reading is something I can dive deeper into and enjoy and get lost in the novel. 

Those of you who have read this series how did you like it? I think I’m going to watch each season on TV after I finish the book to compare and contrast just for fun. Thanks for reading!","Just bought GOT book 1, haven’t read a fantasy genre book since elementary school (14 years ago). I hope it’s what it’s hyped up to be!",1605390634
books,"I’ve been stalling on finishing a few of books that honestly are pretty good. Not sure what my hold up is, I think I have 2-3 floating around at various stages. Maybe 5 books in reality. One is Space Opera by Catherynne Valente. Any words of encouragement to stop my procrastination? 

What’s the longest it’s taken you to finish one book?

How many books have you read at one time?",Stalling out on finishing a few of my books.,1605390472
books,[removed],What books/novels should I read?,1605389888
books,,Mouad,1605388389
books,,Nick Nanton Set to Direct Upcoming Feature Film on Lack of Literacy in America,1605387121
books,,New Jonathan Franzen Novel Slated for 2021,1605387114
books,"I have a question for you.

We all know that George R. R. Martin needs a lot of time to write. It has been nine years since The Dance of Dragons came out and fans are still waiting for the series to continue.

However, non-English speakers need even more time to wait for the novel. 

My question is this: when the book is finally out are you going to wait for it to be translated into your native language or you're going to read the book right away? 

I pick the latter option.",For non-native English speakers who are waiting for the Winds of Winter to come out...,1605386021
books,"Whenever people criticize the work of a popular author, people always jump in to defend him/her with the classic argument that since the book is entertaining, it's good. In other words, the book knows what it is. It does its job. There's no need for literary value. 

I disagree with this notion, as in my opinion when we evaluate whether a book is good or not we are talking about both entertainment value (plot, character development) and the quality of the writing itself. A bad book might be successful, and in this case I respect the author for doing a good job at catering to his/her audience, but I believe the quality of the writing style is a factor in determining whether a book is actually good. 

The rebuttal to this argument is often that since many books are targeted at a younger audience, we should hold them to a lower standard. However, when I assess the quality of a book, I don't care about the writing level. I care about the fundamentals of writing, which are independent of writing level - sentence structure, proper use of adjectives (no purple prose), flow, stuff like that. Simple prose can still be good. 

Let's use two examples: A series of unfortunate events and The Da Vinci Code. I starting reading the former when I was five years old, the latter at sixteen. While series of unfortunate events is targeted at children, I believe that Daniel Handler is a far better writer than Dan Brown. 

Any thoughts?","""An entertaining book is a good book""",1605385291
books,[removed],Anyone have any recommendations for an Illuminae Fan?,1605384249
books,,Ancient Japanese Tonic Melts 54 LBS of Fat,1605384160
books,[removed],Am I the only one afraid of read in public?,1605384001
books,[removed],Reading on public,1605383881
books,"So in the end Roger falls in love with Molly and as stated in the editor's chapter, they marry. 
How do you feel about Molly and Roger marrying? 
I find it a little disturbing and not at all heartwarming. Molly is such a nice character with great qualities, she doesn't to deserve to be someone's second choice. Her worth should be apparent to a potential lover from the beginning not after the lover gets heartbroken  from a previous love, learns his lesson and finds women like Molly worthy of love after heartbreak. 

I was hoping that she would get over Roger by the end of the book. I predicted it to happen but it didn't. It made me sad.",The ending of Wives and Daughters by Elizabeth Gaskell,1605383393
books,[removed],"Alright, so after asking for advice here months ago, even though I listened I went against your advice and kept reading Infinite Jest.",1605382977
books,"Hello bibliophiles!

I'm look for some book recommends for my 6/7 year old. He's starting to read chapter books on his own. He really likes the Captian Underpants  / Dogman books but my wife doesn't care for the content. I didn't know if any of you would have a good recommendation. He's into everything really. Thanks!",Chapter Books for 6/7 yrs,1605382096
books,"I have been reading the Pendergast series by Preston &amp; Child. It is a great mystery book series featuring the FBI special agent Pendergast. There are 20 book series in total, and I have finished 14 of them so far with most of them read in order. Most of the stories are great and a real thriller. some are not as great. 

For example, i love the Diogenes trilogy (book 5, 6 and 7), and Helen trilogy ( book 10, 11 and 12). I also love book 8 (wheel of darkness). But I just finished book 9 (cemetery dance), and don’t feel that thrilled about it. The first chapter got my attention because one of the main characters who had appeared in many other books got murdered. I had my disbelief and thought he might revive later. But it turns out the author truly intended to let this character die. Personally I feel this book is not as thrilling as other ones. But the author successfully built suspension throughout the chapters, and all the puzzles were put together in the last chapter as always. 

Have anyone here read Preston &amp; Child’s novels? If you did, have you finished the whole series? I’d love to hear about it and get some motivation to continue on.",Pendergast series by Preston &amp; Child,1605381717
books,[removed],Best novel by Stephen King,1605381227
books,[removed],What is the most impressive book you’ve ever read?,1605381084
books,[removed],Best non-fiction stories?,1605380048
books,"[https://www.youtube.com/watch?v=sGz-iOB\_cUo](https://www.youtube.com/watch?v=sGz-iOB_cUo)

A recent interview with Allie Brosh that reminded me why I love The God of Cake so much. Currently, reading Solutions and Other Problems which is really intimate and an oftentimes surprising next evolution for her as a writer.",Any other Allie Brosh fans??? Super candid and insightful interview with her and Jenny Lawson,1605379197
books,,"'To Kill a Mockingbird,' Other Books Banned From California Schools Over Racism Concerns",1605378999
books,,Any other Allie Brosh fans??? Super candid and insightful interview with her and Jenny Lawson,1605378899
books,"I don’t have many reading friends so I often look at reviews of books I’m thinking of reading, mostly on Goodreads. 

Often I’ll see, for example, a thriller that has multiple 5 star ratings, people calling it a page turner, read it in one sitting, couldn’t put it down, amazing plot, great twist, etc. And I’ll think “wow, well I have to read that!”

Well I don’t know if I just have high standards, but very often it’s just another throwaway tropey thriller, dialled-in plot, weak characters, ropey dialogue, no intrigue whatsoever, massive plot holes. And I don’t mean like *Girl on the Train* or *Gone Girl* which some people hate on for not being literary masterpieces, but I found perfectly respectable and readable twisty thrillers. I mean books so weak they read like a high school project and you wonder how they even got published. And I wonder if I’m on the same planet as these reviewers. 

I know a lot of other products are affected by fake reviews, but these reviews don’t seem fake. They just seem... wildly over-enthusiastic. I know a lot of prolific reviewers get given free books, though. 

What do you think? Do you refer to reader reviews, and how useful are they?",Do you find reader-submitted book reviews reliable?,1605378767
books,"It's an amazing read that's for sure. But one thing's clear, today's media's takes on the Jekyll and Hyde trope just don't do it justice at all. By the end of the book, Stevenson's psychological interest really shines through. Hyde wasn't a whole other being or person, he was just Jeckyll disguised and without a conscience. Jeckyll was fully aware of what he was doing when he was in Hyde form, it wasn't some type of possession or 'evil ulter ego' as I've seen many renditions claim. Although Jekyll did end up hating Hyde which was some weird meta shit but still doesn't change the fact that the same person was conscious and in control in both forms, the difference being the fall to temptation.",Just read the gothic novella The Strange Case of Dr Jekyll and Mr Hyde by Robert Louis Stevenson and no book has ever left me more sad and terrified.,1605378689
books,[removed],Looking for book recommendations to make my research,1605378414
books,[removed],Eyes of the Dragon episode 1,1605378306
books,[removed],"SIMILAR BOOKS TO ""A WALK TO REMEMBER""",1605377242
books,[removed],Which books made you feel something?,1605377176
books,[removed],Which books made you feel something?,1605376958
books,[removed],Looking for a book like this...,1605376533
books,[removed],OU's Abraham Ancer co-leader at The Masters,1605375811
books,"This question is inspired by seeing fan art of book characters where characters described as normal, homely or even ugly are beautified in illustrated form. I know its typically done for things like movie adaptations, but I reference fan art because that's typically done by people you interact with online. Do you / the artists actually picture all characters this way (in your minds eye do they all generally have good looks or you imagine characters that you're attracted to)? Can you help it or is it a preference?

  


Thinking about it myself, I actually have a harder time imagining beautiful faces -- and like many other people, I often don't imagine any faces at all, just bodies and hair. Or maybe you have aphantasia and don't see anything at all!",Do you imagine ugly characters?,1605375128
books,,'Treasure trove' of unseen Ted Hughes and Seamus Heaney writing found,1605374947
books,[removed],OU's Abraham Ancer co-leader at The Masters,1605374786
books,[removed],OU's Abraham Ancer co-leader at The Masters,1605374196
books,[removed],OU's Abraham Ancer co-leader at The Masters,1605374003
books,I struggle with wanting to read but not having the attention span to do it... for example I love Star Wars and I know how extensive the universe goes in print I even have the Thrawn trilogy but I feel like it’s so much easier to consume the visual form of all there is on the TV I’ve watched the movies at least 2 or 3 times since I bought the books... sorry for the long post but does anyone have any advice to block out the TV and pick up the book,Need help!?!?,1605372112
books,"Hi /r/books! So I recently became a father to an 11 year old who does not have the love of reading that I had when I was his age. In an effort to nudge him in the right direction, I have been building up a library of things I loved in 3rd-5th grade (his current reading level).

One of those was Wind in the Willows. Now, I was probably in 11 when I last read it, but I remember it introduction me to a lot of the Scottish vernacular that I would encounter in later classics of British literature (we are American)

We were at Half Price Books and they had four or five different versions of the book. They all looked really thin.

""I must have been misremembering the book as a pretty large one because I was such a little kid at the time,"" right?

So I start to compare each of the 4 editions in front of me. From the very first page, they are different from what I remember... and they are different from one another.

There are lots of colorful illustrations, which weren't in the one I read as a kid (I think there were simply black and white drawings back then). But the language seemed to be really Amerianized and simplified. Like they were written for ages 7-8 or so.

That's fine, I think. They clearly have American versions and they clearly have versions for younger kids.

But the thing is ... None of these editions said anywhere on the cover or near the front of the book that this was this edition or that editoon. All four of these books were written very differently, and anyone who didn't know any better would think that they were reading the original book!

What give?

More important, how can I get the original book? How in the world would I know? I don't need or want the original edition ... we aren't collectors ... I just want the normal, latest copy of the REAL version of this beloved classic!

Any ideas?

Thanks in advance!!!",Wind in the Willows by Kenneth Grahame ... + general question about different versions of classic books,1605372099
books,,Jonathan Franzen - The kind of people who read books,1605371694
books,,My doubts,1605368900
books,Both these books are my absolute favourite but unfortunately its not a very famous series and even the reviews online aren't that good so I was wondering whether anyone else here has read them and I would like to hear their opinion on the books. What did you like or dislike about the books and story?,Eon and Eona by Alison Goodman,1605368612
books,[removed],Anyone else that has read Eon and Eona by Alison Goodmayes?,1605368492
books,[removed],"Have you ever waited hours in a long queue for buying a book other than Harry Potter? If yes, which book is it?",1605368174
books,"I just finished the World Reading Challenge by taleaway.com and I highly recommend it. All of the books are chosen to represent or give a glimpse of a different countries culture and background. Some of them are dark and very emotional. If you liked books such as Kite Runner or writers like Nadia Hashimi, definitely check this out, although this list also contains memoirs and represents 52 different countries and regions. Some of my favorites were She Would Be King, The Last Brother, and Do They Hear You When You Cry",Finished World Reading Challenge 2020,1605368156
books,"I know this is a pretty popular novel, but I finally got to read it for a college class, and wow, what a perfect book. 

I have almost no words for this book, it’s something beautiful, one of the best things I’ve read this year; it reached deep into my soul. It's a difficult book, hard and painful, but at the same time, it manages to be beautiful, something that moves you deeply and leaves you with a sense of hope. Alice Walker is a magnificent writer, and she is able to bring these characters to life, these great women who fight and search for their freedom. One really connects with Celie and Nettie in an intimate way, they become real people. The narrative voices are amazingly constructed, and you can't help but empathize, with their thoughts, their experiences, and their exploration of life.

This is an incredibly spiritual book, something that goes beyond religion, as it is a search for our own selves, for freedom and identity, something that comes from race and femininity. Is the understanding of the beauty of the universe, of the change we go through in our lives, with love and people that surround us. Walker’s novel is a scream of freedom, a delicate study of life, relationships, and our connection with the world itself.","I just read ""The Color Purple"" for the first time!",1605367547
books,"I would love to talk about the impact of the character of Neil, who I interpret as the ghostwriter of The Power. I found so much of this book frustrating, and at times thought it felt lazy in how it was imagining women would behave if they suddenly discovered they were physically able to dominate men. For example, the idea that most women in Saudi Arabia would suddenly unite against their male oppressors and start a civil war seemed to utterly fail to understand how family relationships complicate the ""sisterhood."" So while I found much of the speculation interesting, I didn't find it believable that there wouldn't be many, many women protecting their fathers or brothers or sons or husbands, or that none of those women would be in positions of power and fight against people like Mother Eve/Allie. I feel like any characters like this were framed in very minor ways, like the nun who thought Eve was demonic, instead of like German Chancellor Angela Merkel, who would almost certainly side with the status quo and not a violently religious cult of women suddenly spreading on YouTube. 

But then I thought more about Neil. If we reinterpret the entire story through Neil's eyes, I might see how a man, thousands of years after the cataclysm, would fail to imagine a time when women and men had close relationships or shared power. I can understand why he may not have imagined women having close relationships with men. And it would be internally logical for his understanding of these events to be a bit flat, even as he is reimagining them in a way that is transgressive and speculative about the role that man used to play and questioning the idea that women have always been more powerful or that their tendency towards violence and cruelty is  a result of being powerful, and not inherent to being a woman. 

So, what do you think? Do you agree the portrayal of women and men is a bit shallow? And is it intentionally so, because ""Neil"" is supposed to have written it? Perhaps more so, because ""Naomi"" (his editor) may have rewritten parts of it or even stole it?","[SPOILERS] The impact of ""Neil"" in Naomi Alderman's The Power",1605367209
books,[removed],Just finished Dune and absolutely loved it. Should I continue with the series?,1605366747
books,[removed],"Rolling Rocks Downhill , i need the PDF version",1605366081
books,[removed],Rain doesn’t dampen a parade up the leaderboard during Masters’ first round,1605365390
books,[removed],Rain doesn’t dampen a parade up the leaderboard during Masters’ first round,1605364662
books,[removed],Rain doesn’t dampen a parade up the leaderboard during Masters’ first round,1605364525
books,,"Endlich habe ich das erste Mangawelten E-Book fertig und zugleich in Buchform. Katsuhiro Otomots Werke geben einen Überblick über seine Mangas, Artbooks und Anime und ist über Kindle Select und Amazon erhältlich: Katsuhiro Otomos Werke (Werbung)",1605364423
books,[removed],What books were 100% worth the money?,1605364380
