subreddit,selftext,title,created_utc
books,"If theres anyone else here who has read Sally Rooney's novels, have you found it strange just how often she talks about the main character not eating? She also often describes how skinny the main character is, and I just find it kind of random. I thought maybe it was just a ""Normal People"" thing (which I read first), but I just finished ""Conversations with Friends"" and saw it come up a lot. Anyone else noticed this?",Sally Rooney and Eating,1612884878
books,,Blog Tour Showcase: No Good Deed Goes Unpunished,1612884579
books,,"The Pretty One, a review by Di",1612884578
books,,"The Raven by Edgar Allan Poe, read by myself. Hope you enjoy!",1612884151
books,,"Buy Trustpilot Reviews - 100% USA, UK, AU Permanen Trustpilot Reviews",1612883888
books,,Buy Verified PayPal Accounts - USA Verified Personal &amp; Business Account,1612883879
books,,Collection of great books,1612883062
books,[removed],Billy Brown Dies: Star Of Discovery Channel’s ‘Alaskan Bush People’ Was 68,1612882899
books,[removed],Good elementary philosophy book?,1612882833
books,[removed],How do you organize books in your home library? By author name? By title?,1612882721
books,"I was recently reading something on this subreddit only when I came across a line saying along the lines ""even though a parent like his child's fingerpainting, they still cannot say that it's better than Cezanne or Picasso.""

This got me into thinking, what differentiates some amateur folks being pretentious and emotional, and, the legit masters (Rushdie, Tolstoy or someone like that)?

Thank you in advance!",[DISCUSSION] What is the difference between some amateur writers vs the legendary old masters?,1612882579
books,,Hủ Nữ Gaga,1612882576
books,"My local library has quite a number of Clive Cussler books and I’ve thought numerous times of snagging one or two. Every time I browse I look them up as I go and they’re all part of a series which is incomplete at the library. It seems very random but I’ve yet to find the first book of any series. 

I’m wondering how important it is to read them in order or if they do ok stand alone?

Any guidance is much appreciated. 

Thanks",Reading Clive Cussler out of order?,1612881766
books,[removed],Anyone interested in Lou Andreas-Salome (1861-1937)?,1612881759
books,,The Midnight Library by Matt Haig – Book Review ⭐️⭐️⭐️⭐️⭐️,1612881738
books,"I've only read another World War 2 book before this and that was All the light we cannot see, which I really enjoyed but this book wow.

It's absolutely heartbreaking, like yes I have a decent understanding of World War 2, but I'm finding this book very confronting and upsetting simply because it's hard to believe people were treated in such a way, that they were demoralized and bullied. The way people homes were taken over by the German army, homes looted, destroyed, the struggle people had to go through to live in general.

Like I said confronting, and I believe I'll be reading the book thief after this.",Currently reading The Nightingale and it's breaking my heart.,1612881109
books,[removed],"Books similar to ""cure"" by robin cook or any fiction involving medicine",1612879993
books,,Adult Graphic Novels Sales In Bookstores More Than Double In A Year,1612879449
books,[removed],How do you read in phrase rather than one word at a time?,1612879298
books,[removed],IKIGAI The Japanese Secret to a Long and Happy Life,1612878921
books,[removed],Where do I get my books from post-Brexit?,1612878849
books,"For me i'm in the middle of reading Dante's Inferno (very tough read tho I recommend it) it is quite hard to understand but after I read a chapter I look up the summary for that chap because the book uses words that end in eth and stuff like that and its very hard to follow whats currently going on (if you read the book you would understand) but I do enjoy a great challenge. Beside me I would like to know what you guys are reading (and for any recommendations for what to read after I finish The Divine Comedy trilogy; yes their are 3 books, Dante's Inferno, Dante's Purgatory, and Dante's Heaven)!",What books are you currently reading? And what do you think about it?,1612878579
books,,Does anyone know which book this might be?,1612877827
books,"It’s a bit weird question I know. But I have been looking for places to get ebooks.  I no longer read physical books.  I mainly get mine from the Local library with Libby.  And if not there or the wait is to long, I buy them from Amazon. But it’s been getting really pricey. Wanted to know if there are other places to get them?  I mainly read on my kindle. But do grab the phone too on occasion.   Thanks!",Where do you get your ebooks from?,1612877644
books,"I'm only 2 chapters in the first book and I'm taken aback by the similarities between the two. Like Hawke's description brings Bellamy's face to mind. Both seem to have a slight haughty attitude. While Poppy somewhat reminds me of Clarke with her defying attitude. Not to mention, both Bellamy and Hawke call Poppy and Clarke 'Princess.' What'd you guys think? Am I simply having a Bellarke hangover and looking too much into Poppy and Hawke? Again, I've only read 2 chapters.",Anyone else think that Poppy and Hawke (from Blood and Ash) kinda remind you of Bellarke (the 100)?,1612875972
books,,Buy Verified PayPal Accounts - USA Verified Personal &amp; Business Account,1612874613
books,"I've just finished reading this book. In some ways it was enjoyable and well written, with the description of the evacuation to Dunkirk being especially vivid. However something is bothering me and feels off. In the story &gt;!a teenage girl is raped. Another teenage girl lies about what she saw on that night, which leads to an innocent man being jailed and having his life ruined. The girl who was raped later falls in love with and marries her rapist.!&gt; This does not sit right with me, especially since the book was written by a man. It seems to reflect persistent false beliefs about rape that some men hold, &lt;!i.e. the false belief that some women secretly enjoy being raped and like men who take what they want, and the false belief that women often lie about rape and so most accused men are innocent.!&gt; Was anybody else bothered by these ideas in the book? Is Ian McEwan being a rape apologist or am I reading too much into the story?",Atonement by Ian McEwan,1612874551
books,"Essentially, the book is about a dude from the 70’s going back in time to meet Jesus in 28 AD but Joseph is some cranky old dude, Mary is just a slut, and Jesus is a mentally handicapped hunchback. I’m looking for books similar to that in where a character meets a historical figure/witnesses a historical event but it’s not at all like the history books say it is",Any books like Behold the Man (1969) by Michael Moorcock?,1612874441
books,"Warning: some spoilers and a rant ahead.

Seems a lot of people read this book at a young age and thus they don't really have a lot of critical thinking capability or something? So they say ""what a great book"" and it becomes part of the canon of books they liked, and so it gets taught in schools etc. However, I'm an adult so my first impression upon reading the book is: this makes no real sense. Sorry to sound disappointed, but I've got to teach this book now and I can't help but think, why did this get assigned when its central allegory is untenable? It might be decent for a 5th grader, but barely.

I get that its dystopia-lite. I get that no one thinks a dystopia where no one has any real feelings or sense of real at all (no love, no color, no… pizza? Who knows…) is good. So, like, let's teach people to have better funerals?  I get that we’re supposed to realize that it’s better to have feels and know what’s real rather than live in a sterilized world. I get that. However, just a trite theme doesn't make it a good book.

There's a lot of dystopian books in the world so that in itself doesn't make it a good book in and of itself even if the themes are timeless. What bothers me is a series of doubts I had. I just don't see it as a coherent world that could be possible. It's like if a functionally literate eighth grader tried to write a novel and they just go with what they think is a profound theme but gloss over the actual function of the world by not explaining or justifying whatever doesn't add up so they can say, ""but, dude, it's like... they're cruel and they don't know it!"" But how is that possible? There is no coherence. 

Indeed, how is it even possible to stop people from knowing what goes on in their world if everything is videotaped and/or available for viewing in the hall of records or whatever? I mean, Lowry didn't need to tell us that, but she did. So... all of the information and stuff *is* available. It doesn't add up. I mean, Lowrey could have just built this world better so the videos are not available in the hall of records and problem solved. Who is doing the videotaping? Where are the servers? etc. There is just so much hand waving in this book I don't even know where to start.

Next example, why does the society need to have colors taken away? Like, just simply...why? How does that help euthanize bad emotions? And if they don't have memories, how do they survive as a human? The book mentions that they'll remember if they skinned a knee. So... there is pain. And there is some memory. And planes frighten people. So there's even bad emotion though its frowned on or whatever. But... no one ever falls off their bike and gets their foot caught in the chain and has to go to the hospital because they've mangled their foot and they're bleeding to death? Accidents never happen, ever? How can that be? It's impossilble that no one ever remembers ever having some kind of extreme pain or witnessing it. Impossible. A tree never falls over on someone's head? Or, if it's wiped, then we have to be told it's wiped by pill or something plausible. Instead, its haphazardly thought out as far as I can tell.

And...why don't they have hills? Is Lois saying that in order to have a neutered emotionless society (so that they can engineer population control) that ... you have to bulldoze hills so you can live on flat ground? Wha? The world-building here is poor because the details of the world make no sense.

Second, how does all this euthanizing of bad emotions happen? It's implied that it's DNA based maybe. That's why people with a certain kind of eye can see more. Well, if that's the case then its another biologically unequal society, right? So how is that achieving justice when we have another BS chosen one type of person who is born to save the others from their pitiable state of bliss?

Anyway, if everyone is in bliss but it's fake, who cares?  Plus, if no one can ever feel a bad emotion, why do they care about using words precisely? After all, you can't hurt anyone's feelings, can you? Or-- why do they whack you with a stick if you can't obey the rules or get some words right? So... you CAN feel pain, because if you couldn't the whacking would be meaningless. If the point is that this society uses cognitive behaviorial therapy including group talk and dream analysis, and it produces a better society, what is the book saying? That BCT is bad, or that Freudian talking cures are bad? And people should be free to make messes of their lives even if that leads to famine? Why pick on modern psychology? If she wants to paint a world where that is too invasive, why is it dropped later on in the book in favor of this magic memory mumbo jumbo? 

There are hundreds of doubts I could bring up regarding how this world works. For example, if the previous Receiver was that girl Rosemary who revealed memories to the group ten years ago... so they DO know that painful memories and greater freedom exist. They obviously haven't forgotten, but they just feel... uncomfortable about it and unwilling to put two and two together?  But is this really how memories exist in the world: when someone goes to war and remembers that, if they don't pass it to someone else correctly by putting their hand on someone else's back, everyone suddenly wakes up in the morning feeling like they went to war? How is that DNA based, then?
If you set this book in some alien land, ok, then you could explain it as ""that's just the way this alien land works"", but that's not what we get here.

Burning books is one way to erase the painful past, ok, and so Farenheit 451 is on solid ground when it critiques a neutered society, but but ""everyone has a collective memory"" when the keeper of memory decides to do a suicide? Wha? How does that work, exactly? 

Meanwhile, The Giver kid Jonah can pass memories to the baby Gabriel via touch. So... it's not DNA, because all the Crispr engineering in the world can't suddenly do that. Now, if they were all robots and you couldn't access the main database at will, but a hacker could cause some data in the database to be shared with the units...ok. That might make sense. But that is not the world we have here.

A writer has to choose what details to include and which to discard. In the case of the hero Jonah, he's like a big... nothing. He has some typical hopes, some typical fears, some typical revulsion. Fit for a fifth grader. So they *do* have feelings sometimes, when it serves the writer's purpose of not making them inacessibly cold or boring, but when convenient they live in a terrible world where people can kill at will and go home smiling? Right, no. Jonah's not actually a real person to me since if he's a Receiver he should have some more insight into his own existence beyond, ""gee wiz, sometimes there is the flash of an apple"". That's it? That's the depth of his thinking on his existence? And then in one second when he gets a whiff of dead baby he's actually postulating a thesis about choice? LOL. What are they teaching in ""school"" that these kids are said to go to? It's not science since their jobs are all service economy jobs, apparently. It's not thinking, writing or reading, apparently? Or... who the hells knows. No one does, just go with it because... dude, that's the way it is in this book, so said Lois. And I like that cute baby, and dad's a killer and people should be allowed to go sledding.  Is that it? What am I missing?

I guess this book is decent for a 5th grade class because kids at that age don't have much in the way of articulation or depth of perception. But... this main character we follow is all surface. It's like Lois read 1984 and Brave New World and then garbled them all together into a fantasy book that assumes we are already know enforced groupthink exist and are bad, so no need to actually provide details. we'll just fill in the holes. 1984 is masterful because each step we see how the society works to benefit an elite and to keep others down and it's plausible and psychologically informed. This book just... assumes it works.

Plus, don't get me started about how easy it was to guess that Gabriel was going to be knocked off in the end. I said, ""that baby is doomed"" the minute I read it wasn't hitting its growth targets. So... if the father knows he has to euthanize babies, but he can break the rules whenever he wants (and everyone DOES break the rules sometimes, like with the bicycles)... so who actually enforces the rules? A loudspeaker? Who enforces what the loudspeaker says to do, if people can actually have free choice and break rules and make mistakes and feel pain...sometimes, but only when the author says its ok? Plus, why did we read about Asher being a misfit and then he just disappears? The subplots don't even develop.

Concernng the father's role, why wouldn't the father ship the baby off Elsewhere instead of being the one who is both caregiver and then cold blooded killer, so that the father's role remains innocent of his participating in euthenasia schemes? If he has any feeling at all --and he does, he saves Gabriel-- then he'd also be capable of the moral outrage he should have at being a arbitrary baby killer. But... he just doesn't. Why? Because he's been programmed that way. However, it has to be consistent and explainable, and it's not. If the father knows he's a killer, but his DNA engineering has made it so he doesn't care... so why does he care after all but only sometimes? You can't have it both ways unless you can plausibly explain how this actually really functions in a plausible world.

So... Who is behind that loudspeaker? Where is the military/police force that must be behind it all? Why are they never confronted? That's an unresolved plot there. They're the real evil here but instead we get some ""elders"" who we never really dramatically confront. So, there's no clash. Sometimes they ""tsk tsk"" about their role in all of this or smirk, which they must be conscious about to at least some small degree, but we never see any confrontation with them. Instead, the way to confront them is to remember some stuff one on one in a library with one guy while everyone else is blessedly ignorant.

Meanwhile, if The Giver has the inventory of memories, he would also have the inventory of memories of the people who engineered the society to be that way, and he'd be able to simple explain to Jonah why things work the way they do. ""Well, there was this famine"" is what is implied. But where, who, and how much? if you can go visit other settlements (like Lily does), then it would seem that the whole country, or at least county, is like this? How many bulldozers would it take to engineer that? Wouldn't there be a lot of memories that The Giver would retain of that? And if so, then the memories would be full of famines that would explain why the world justifiably was created to be the way it is, and Jonah's initial repulsion would become knowledge of the cold but necessary things humans have to do for survival. Then why would he reject it?

There's just such a gap between how this societry is said to work versus how it would have to work to actually exist that I can't buy it. Now, if the big reveal of the book is that they're all living in robot/android bodies and they are actually bytes in a Matrix world, then maybe. But that's not this book. (Actually, that would be a better book).

Finally, even the central metaphor of the book doesn't work that well. Even if we can accept that this world exists, and we can accept that some memories are off limits, and some impulses (sex) are drugged away (though if they DNA engineer bad memories and feelings away why can't they DNA engineer the sex drive? And if there are Handmaids who do the birthing, who are the selected studs? But nevermind...), then what's so wrong with euthanization? Why is the central metaphor that it's better to have the full range of human emotions versus a cold but efficient society? From a utilitarian point of view, it actually sounds good. Living happy and carefree... what's wrong with that, exactly? Sure, I could make an argument for why government regulation of human choice is bad, but the book just TELLS you the argument all at once and you're supposed to just get it because Jonah is upset he saw a murder or two. And we're supposed to just accept that ""a fuller range of choices"" is always good. Because, well, because we as readers already live in a world of color and we know that color is nice when you want to look at fields of flowers and stuff.

Well, Enlightenment values would have you postulate that each individual has rights such as the right to a full albeit messy troubled existence. But from the standpoint of human beings, it's impossible to have some feelings (like they do) and some bad experiences like they do and not therefore have the full range of knowledge of the bad things in life. We are born with inalienable rights of full consciousness, so this ""muted"" consciousness world is functionally impossible unless it's explained better. But if it were explained better then we'd be in danger of actually finding it superior and justified. What if you put your hand on the stove? Are you gonna let it burn? If you don't learn to pull it away, you're not going to survive, right? So this world is impossible the way its set up. Painful experience as a teacher is a necessary component of survival for humans, it can't be wished away when you are world-building without a full and plausible explanation for why a world of people can exist without it.

Finally, let's conclude this rant by saying that, obviously, the book is a metaphor for the horrors of abortion, right? But if it is... then the choice to abort a not-grown-yet fetus isn't a bad thing if you're a liberal. After all, life presents us with difficult choices that we need to make anyway to survive, and to be cognizant of it means having to face some things about society we'd rather not. So this moral contradiction is glossed over in the book by way of a direct one page exolanation of how ""choice"" is always good. Nevermind that the idea is not dramatized via showing not telling (the way good fiction should) but is simply handed to you. But... if you want to confront some bad choices that societies make, how is a ""colorful"" one superior to a managed one? Remember, there is some kind of military in this world because it flies over your land in an airplane. So.. someone in your society somewhere has authorized killing for your safety. Shrug. That's not ok, or it is. The criminals are euthanized too (three strikes). And yet that ensures a peaceful society. And... those things also happen in most socieities even when you don't have all of this DNA world-built nonsense in them, so how is this world worse than the one we already live in?

So, by the standards of the book... this universe they live in is not a dystopia but a real utopia even if it is built on some killing and some loss of perception (colors) and feeling (but only some, and only where convenient). Because when compared to the real world (that we should want to prefer, natch) it has all the features of the real world with just half the problems, right? It is indeed a better world and so why complain? So, some outliers have to die. How is giving people back their colorful memories of pain (as Jonah gives them by running away) gonna suddenly stop all the bad things from happening?

So, to conclude, who believes that the way the society is set up in the book is bad (and choices are taken away, and it's all about freedom of choice)? I don't see a case for it. So why does the poor boy have a cow about it when he finds out? Sure, anyone would be repulsed to find your society engages in euthanasia, but the memories necessary to justify it could also be transmitted to Jonah. So... there must have been some good reasons why the society is set up that way or no one would have gone to the trouble of setting it up that way. Either the people who did it were actually doing it for their own craven interests (bad, which is plausible) or they were actually doing it for sincere and good reasons, such as starvation plague forces them to make hard choices to ensure that life on earth goes on (so they're actually quite rational and good).

But we don't read about that, because it's a young adult novel, not something as well-thought out as Dune. If these elders who set things up are just Epicurians (the elimination of pain, measured pleasure) then why is that a bad thing just because a few people die early? After all, Epicurus would also say ""death is nothing to us"" and so why cry over it? It is what it is, society runs well on a utilitarian basis, people are generally happy even if they don't realize they exist within a muted pallette. What am I missing about this allegory that is supposed to convince me that a ""full color"" life with magical passed-on memories of trauma for everyone (via books, I guess, and real experience, because in the real world memories are not passed on via ""osmosis"") is better than what they have?

It seems it's just a YA novel that purposely plays on the ""no way, that sounds bad"" gut reaction of kids who won't look deeper into the world that's been built since this world kills babies sometimes. But the contrarian case says: yeah, let some babies and old people die. Sounds good to me if the result seems to be multitudes of happy lives. But since we know that those lives are functionally impossible according to the rules of the world that was built for us in the book, it's just not that good of a book no matter what your childhood memories of reading YA fiction tell you. Anyone able to change my mind? Sorry to have a contrarian view of a book that won medals and is taught in schools. /Rant",Can someone explain why everyone says The Giver is so great?,1612874182
books,[removed],Do you register every single sentence while reading ? Do you sometimes feel like some sentences and words just go by without fully registering in your head ? Do you also hear someone reading in your head while reading ??,1612874105
books,[removed],Are books getting more expensive?,1612873665
books,[removed],Any alternatives to publishing ?,1612871608
books,[removed],Any popular alternates to publishing?,1612871477
books,,SmartFTP 9.0.2836 Crack With Serial Key Download [Update],1612871441
books,[removed],How to organise your books on pc?,1612871421
books,[removed],I’m looking for a colouring book,1612870992
