subreddit,selftext,title,created_utc
books,"Well, the title is self-explanatory but I will extend myself a bit. My girl's stepdad lent me the book last weekend, said it was a good book, easy reading and very interesting. As Flowers for Algernon is published by my favorite publisher in Brazil I've always had it on radar, but never bought because I'm more of a space opera, Asimov's robots and PKD-like craziness fan. Nonetheless, I decided to grab the book and in less than 48 hours I consumed it, or it consumed me.

The way Daniel Keyes gives voice for Charlie in his journals, especially in the beginning of the book is marvelous, plus the author's psychological knowledge makes us to go deep into the questions that he brings to light. Anyways, I'm out of words and wasn't expecting it to hit me as hard as it did. 

Would like to know if you guys had the same experience with Flowers for Algernon. (And STRONGLY RECOMMEND the reading of the book if you've been researching about it, but like me, was not still able to make your mind)",I've just read Flowers for Algernon. I'm speechless.,1606262209
books,"Chapter 1

“Entering Madcliffe”

The Sky is jet black and dotted with white circles, a dark maroon mustang rips through the air on a vast road in rural Carolina. A tall muscular but feminine female sits behind the wheel, her kite structured face with bow shaped lips, almond shaped hazel colored eyes, and ivory skin framed by the moonlight alongside her medium lengthened thick curly blonde hair softly billowing in the wind with the top of the car down. She is a supernatural hunter and has come to Carolina following a werewolf connected to the death of her family, she just past the “Entering Madcliffe: Pop. 3,556” and her soul burns with hatred for everything supernatural.

Name? Claire Garland, born in 1993 on the 20th of June in the New York State to Lydia and David Garland alongside her brothers Elliot and Noah in a farm outside Rochester. Growing alongside the supernatural was the normal since 1698 and truth be told, Claire loves the supernatural. Correction, loved. In 2009, on a cool foggy night just after a rainstorm and just after her siblings and her had been put to bed, they invaded. A Vampire, a Witch, and a Werewolf had broke through the gate and in a flash she heard her mother screaming.

9:12 Pm, she is dreaming of school then is awoken by the screams of her mother and bolts up alongside her siblings.

9:14 Pm, father comes in and tells his frightened children to hide.

9:15 Pm, he leaves.

9:18 Pm, Claire hears her father “Please no-just take me! Leave my family alive! Please!”

9:22 Pm, silence, beforehand terrifying screams like a banshee.

9:37 Pm, still silence.

9:58 Pm, still just silence.

10:12 Pm, Elliot goes out and leaves Noah with Claire, the door flies off its hinges and in a flash Elliot is a heap of blood. Noah rushes out to protect Claire but the witch turns him to ash. Suddenly two persons, a man and a woman downstairs break in rush upstairs. It’s auntie Helen and Uncle Marti-

Claire shakes her head, clearing those thoughts and pulls into a diner called “Auntie Janets Grill”

“Auntie Janets Grill Part One”

Claire opens the door to her mustang, her maroon leather jacket blending in with her car while her black skinny jeans blend into the night, her m1911 pistol slightly creating a bulge in her jacket

she walks up to the diner which is nestled in tall trees, it’s not big nor small, not popular nor inactive, normal yet crawling with creatures. Claire thinks ‘quaint, quiet, rustic...optimal’

she opens the door which creates a chime, a female waitress says “Hello, grab a table or seat at the bar, someone will be with you in a tight minute”

Claire strolls up to the bar and takes a seat, looking around to see possible vampires, wizards or witches, and some werewolves but some do look distinctly human

A woman in her 50s in a dark blue waitress uniform rolls up behind the bar with a notepad in hand

“Hello welcome to Auntie Janets Grill, I’m Waitress Boyer, what can I get you hun” says Waitress Boyer

“Hello, I’ll take a dark coffee, no addings, and I need information” says Claire

The waitress tenses, now realizing the bulging pistol in Claire’s jacket

“Sure thing, and....what information...I’ll also need your supernatural hunters license” says the waitress

Claire pulls out a wallet and takes out a small rectangle shaped card which reads REGISTERED SUPERNATURAL HUNTER:ISSUED BY THE DEPARTMENT OF THE SUPERNATURAL alongside other information

“All right, I’ll get your coffee ms Garland and....information” says the waitress

Claire looks around the dinner again and now sees several eyes on her, she thinks ‘mistake showing that license, people now know and judging these looks, they favor the supernatural’

After 2 minutes, the waitress comes back with a black coffee and sets it down then leans her elbows on the bar

“Alright what do you need?” says the waitress

“Auntie Janets Diner Part Two”

Claire sips her coffee then looks around before leaning in 

“A werewolf, Alan Clark. 6 foot 2, 180 pounds, wears dark woodsy attire. Last seen in a Mercury XR4Ti with a busted fender and green paint job. His right arm is in a sling and he has bruising around his right eye, both courtesy of me” says Claire

“Well, I don’t know cars but a fellow did come in matching that description, made a real fuss” says the waitress

“What do you mean?” says Claire

“Well he came in frightened, said he was being chased by a blazing blonde storm-guess that’s you-and he got into a fight with our regular mr Fowler just socked him, right in the face” says the waitress

suddenly a patron calls the waitress over and leaves Claire alone who writes the information down in a small black journal while sipping her coffee more

The door chimes, Claire turns to see a tall handsome muscular man who appears to be a policeman. CORP. BARK is on a silver rectangle on his uniform, he goes and sits and flags down the waitress who comes to his table then walks away and seconds later enters the kitchen.

The waitress comes out with a plate and opens a glass dome container on the counter with a cue card reading “raspberry pie”, she cuts a slice and puts it on the plate then walks over to his table and sets it down

“Waitress can I have you?” says Claire to the waitress who was talking to the policeman, she rises her head and walks behind the bar.

“Sure, what now” says the waitress

“Clark, where is he now?” says Claire

“Oh, that fine officer over there was here when it happened and arrested him, imagine he just came back from the sheriffs department putting him away” says the waitress

Claire gets up leaving her coffee and dropping 5$ bill on counter. She walks over to the mans table and sits down, his pie slice half gone already.

“Can I help you ma’am?” says the policeman

“Look it was my understanding that you arrested a man just earlier who assaulted somebody?” says Claire

“Yes? Umm..why? Friend of yours?” says the policeman

“God no, look can I....see him?” says Claire

“Only if your immediate family or a close friend but judging by that god no, imma guess and say neither” says the policeman who now drops his fork which had raspberry pie on it

“Look-I want-no I need to see him, please” Claire says while leaning in, trying to give the cop her best face

the cop juggles his thoughts for a few seconds before putting on his hat and rising

“Alright...but you need to tell me why your so desperate to see him” says the policeman

Claire rises “First, Claire Garland, registered Supernatural Hunter and.......this man may know the werewolf clan whose member helped....kill my family” says Claire

The cop gets out of the booth and slaps down some money then walks alongside Claire as they leave the diner, talking to her

“Corporal Joshua Bark, and I’m sorry to hear that and also I am a werewolf my self” says Joshua while opening the side door of his squad car, gesturing for Claire to get in

“Wait-my car, I can’t leave it here and also the name, Bark?” says Claire

“I can get someone to get it. Also yes, hardy hardy har, my ancestor was Nathaniel Bark who met a female werewolf-just please get in the car” says Joshua

Claire gets into the squad car and Joshua drives out and into the town, Claire sees the bustling town called Madcliffe more and more

(Suggestions? Thoughts? This is just a rough draft)","Beginning to write a book, here is a rough draft of Chapter One",1606261468
books,"I have two books on deck to be read (Jade War and the original novel of Queen's Gambit) and I have plans on getting a third book. I have three book choices I want to read:

&amp;#x200B;

The Meme Machine by Susan Blackmore: I listened to Susan Blackmore's podcast interview on the Pansycast and I'm interested in learning more about her ideas on memetics.

The Biggest Bluff by Maria Konnikova: I majored in psychology and I'm still very much a psychology nerd. I'm also interested in it because it's tangentially related to Queen's Gambit since they're both stories about women dominating in a male-dominated field.

Stop Reading the News by Rolf Dobelli: The title should be self-explanatory. One of the themes I'm learning from the books I've been reading recently is that news media has always been faulty and unreliable in terms of both how it represents the world and in delivering information. If you want to cure your doomscrolling, this might be the right book to read.

&amp;#x200B;

Which of these books sound the best to you?","Out of these three books, which should I buy?",1606261413
books,,Ebook promotion,1606260272
books,"I just finished the book Five Total Strangers by Natalie D Richards, where did the man in the yellow hat come from??

This whole time I thought he was the one writing the letters, and I thought the person sabotaging and the person writing the letters were two different people, then I put them on the yellow hat man, then I was wrong in the end! 

But, how did he find them in the end though? He just, shows up in a random mountain out of no where?",Five Total Strangers question,1606258615
books,"So I was chatting to a guy I had just met about audio books, and he told me his favorite all time book was Natchez Burning by Greg Iles. I bought the book without reading about it. I listened to the first 7 hours and decided to look up what a ""bone tree"" is.  


Turns out this is #4 in the Penn Cage series!!@!@@!#!@#@!!@  


Dang it. I'm kind of invested in the book, all I usually read/listen to is fantasy books, so I thought a one-book break would be Ok, and for 35 hours, a pretty good value for an Audible credit.  


So what do I do now? I feel like there's alot of backstory to Penn Cage and the DA, should I stop this book and start the series at #1? Should I stop reading and go back to fantasy, as I'm unsure I want to dive into an unfinished 7 book series? Should I just read the three books that make up the Natchez Burning trilogy within the Penn Cage series?  


I was going to read The Warded Man series next.  


Keep in mind I'm talking audio books, a series like Penn Cage could take me 2-4 months to get through.",Natchez Burning/Greg Iles reading order importance?,1606258502
books,"*In which we meander along the Thames with Montmorency and his three companions.*

Three Men in a Boat is one of the few novels I own with the dubious honour of having been attempted twice and completed once. That’s not to say the tale isn’t an enjoyable and light read, more that it requires a certain mood to succeed. Much like *Cold Comfort Farm*, it’s a relatively brief diversion that is best read at speed as you surrender to its charms for a few nights.

The first time around I perhaps made the mistake of treating the novel too reverentially and reading too little at a time. Much like many a romantic comedy, it’s an entertaining tale but if you take a break halfway through, you’re liable to guess at the ending rather than return. You’d probably be wrong by the way, as entering the final chapter there seems so much yet to achieve in so few pages.

Thankfully, after several months I returned. I started where all good readers start, from the beginning, and stopped a week later as I read the price on the back cover (50p many, many years ago). I thoroughly enjoyed the journey this time, winding my way as a fourth man in the boat along the gently drifting currents of the Thames from pubs to picnic spots, through devious locks and along meandering towpaths. 

It’s the oddest thing, *Three Men and a Boat* could have been written this year. Three businessmen taking a trip out of London along the river, dropping in on lodging houses and historical sites sounds like a ready-made blog or YouTube series. It’s not just the concept, the jokes land as well today as (I assume) they did in 1889.

Jerome’s writing is crisp and observational, slipping between comic scenes and well-worn truths of life, such as how a kettle must be ignored to boil, and a free morning is bound to lead to an early rise. The three men of the title squabble and argue their way along the Thames, each taking the side of whoever seems in most agreement with them at the time.

As [Robert McCrum writes in The Guardian](https://www.theguardian.com/books/2014/mar/10/100-best-novels-three-men-boat-jerome), “like all the finest comic writing, it's about everything and nothing.”

Originally planned as a travel guide, Jerome expanded the comedic elements of his writing and abandoned the idea. Despite this, the travelogue elements underpin the story and drive it forward – giving the necessary straight-faced backdrop to the farcical tale. This accuracy means that fans of the book can recreate the journey today down to visiting the same pubs – in fact, the BBC filmed exactly that in 2005 with three comedians. 

I don’t hesitate to recommend a week with *Three Men in a Boat*. It is, quite naturally, a perfect choice for a holiday read – perhaps both to divert the reader from the tedium and frustration of modern travel and to reassure them that it has never been possible to get from one place to another without incident. Whether you’re holiday bound or not, the novel is a rare find – comedy writing that makes you laugh. And that’s worth whatever cover price you find.",My review of Three Men in a Boat by Jerome K Jerome,1606257309
books,"Hey I'm wondering if any specialist book sellers can help me with this question! 

Original hardback editions of The Neverending Story were usually published in two colours (I think green and red, but I've also seen a blue and orange German edition) and I'm really wanting to know if any in print paperbacks are still printed in two colours. (I really don't see the point owning the book if it's in black and white, the colours are what made it so special.)

I found [this article](https://scifi.stackexchange.com/questions/160425/which-in-print-editions-of-neverending-story-have-red-green-text#:~:text=This%20fantasy%20story%20is%20set,is%20drawn%20more%20and%20more), which is extremely helpful and tells you to look for Roswitha Quadflieg illustrations, but it's out of date. Some recent paperbacks have Roswitha Quadflieg illustrations but are printed in black and white. 

I found a German 2010 paperback printed in red and green for 10 euros (from Piper), and wondering if there is anything similar printed in English, or if all the colour editions in English are hardbacks. 

Thanks in advance for any help and info on this.",Help finding in print editions of The Neverending Story printed in two colours,1606257291
books,"This sounds crazy but somehow it gives me an uneasy feeling when I read a book written by a political figure in public.
I'm afraid that some people will get offended or something.
Have you ever considered to do something like that before or am I just being silly right now?

Yes it's sad having to think about things like these nowadays","Removing the cover of Obama's new book ""A promised land"" while reading in public transportation?",1606256902
books,[removed],Detective/crime/spy books recommendations,1606256843
books,[removed],"Removing/Covering the cover of Obama's new book ""A promised Land"" when reading in public transportation?",1606256764
books,"I've literally just set the book down, so I hope you'll forgive this stream-of-consciousness. 

At fifteen, I read my first King book - 'salem's Lot. It was the start of my own journey to the Dark Tower, though I didn't know it at the time. It was the book that bridged ""young adult"" and ""adult"" fiction for me; my first step over the line that divided the two halves of the library. And though I've never stopped reading books for children or teenagers, I've also never forgotten the weight of that first ""adult"" book in my hands. It was like a coming-of-age, though I didn't know it at the time. 

I read 'salem's Lot. And then, The Shining. IT. The Stand. I fell in love with his emotionally raw style of writing, and his turns of phrase - the branches of winter trees *snarling* against moonlit skies; the *enamelled* *black* of a tarred road on a hot day; the *wrecked beauty* of an actress. 

The more I read, the more hints I came across to something greater in his work. Connections started to emerge. The Turtle, from IT. Randall Flagg, from The Stand, and Through the Eyes of the Dragon. Strange parallel worlds, in The Talisman and From a Buick 8. Engines that seemed too alive, too malicious, for their own good, like Christine. 

And then I found the Dark Tower books, and it started to come together. Roland and his doomed ka-tets, first with Cuthbert and Alain and then with Eddie and Susannah and Jake and Oy. The road to the Tower. Randall Flagg. The Crimson King. 

I wanted to know so badly what was in the top of the Tower for Roland. And I'm only just realising it now, but he found what he needed the most - redemption. The original books are a doomed quest, a journey that sets him up on a next journey that he can only take in our minds. A journey where he makes the choices not only to take him to the Tower, but to make him worthy of it - and to give him the chances to protect his friends, and save his ka-tet, from his own grim reckless determination. 

I believe he'll find that redemption. 

For me, though - I haven't read even half of King's works, but I think I'll take a break from now. His worlds are painful, at times, in how realistic their balances of hope and cynicism can be. I'm devastated that Roland has to endure his journey again, and my own hope is that it will be for the better, but I think I need to step away and let all of this settle down in me for now.  I do wish we'd seen more of Cuthbert - he really stole my heart. 

Thank you for reading all of this. Please let me know what you think of the Dark Tower. It's been a very long journey. I don't think I'll have another one like it in this lifetime.","[SPOILERS] After seven years, I've finished reading The Dark Tower series, by Stephen King.",1606256494
books,[removed],How Affiliate Marketers Around the World are making upto $500 per day (Complete Training),1606256149
books,[removed],Has anyone read “Come To Me In Silence” written by Rod McKuen?,1606255902
books,[removed],Most Depressing Books,1606255177
books,"My kindle version of Portrait of an Artist as a Young Man had little clickable annotations all over the place, and boy did I need them to do things like translate random latin, give me a background of people like Parnell, and just help sketch the context of a lot of things. I'm now moving on to Ulysses and I wonder if anyone has confirmed a version of it with clickable annotations, because trying to read it raw has me hopelessly lost when Daedalus goes into his frequent paragraphs of dream-sequence-like imagery. One version of Ulysses for kindle is advertised as annotated but it was a *lie*. Thank you for any assistance!",Any version of Ulysses with annotations for kindle?,1606253845
books,,Book Recommendations | Raheelies,1606253294
books,"Hello everyone
I am french and I have started learning vietnamese , but i would like to begun with grammar.
The problem is that I can't really find anything to help me start, even non free books I cant find some interesting and available to start
Please if you have any  document reference or document help me :) 
Thanks",Vietnamese grammar books,1606252672
books,"I enjoy reading but do sometimes find it difficult to concentrate. I can read whole pages only to realise I never actually READ what I was reading. But I can get through most academic journals and plenty of fictional books easily.

But now I’m  trying (again) to read Hero with a Thousand Faces and I just can’t understand it. A single sentence just loses me. How can I be better at understanding what I’m reading without struggling?",How can I be better at reading difficult writing? Currently trying to read Hero with a Thousand Faces,1606251898
books,"It is absolutely appalling to see the criticism and outright HATRED towards Ernest and his honest, eccentric, self-revealing, and honestly, necessary work in this world.

I do NOT want to see anymore criticism of Cline and his work.  Please, take a look in the mirror before you tear down an author with such authenticity.",The criticism of Ernest Cline and Ready Player Two is literally 1984. We cannot allow authors to be shunned for their eccentricities or we will devolve in to the 1984-verse,1606251826
books,"It's such a great read for anyone who wants to know more about the man behind the mythology. It's really easy to take what Tolkien did for granted. The biography really shows just how much time and effort went in to the background and world-building of those novels. It really opened my eyes to just how special Tolkien was, not only as a writer, but as a philologist and ""sub-creator"". It definetly made me personally appreciate his works, particularly the LOTR, so much more.","If You're a Fan of the Lord of the Rings, The Hobbit, or Anything Tolkien, Then You Should Read Humphrey Carpenter's Tolkien Biography.",1606251542
books,,Milorad Pavic will change your life - here is a good place to start...,1606249957
books,,“Celebrate Books and Booksellers”,1606249659
books,[removed],BRAND NAME USAGE IN books,1606249585
books,,"For a Hefty Fee, Nature Journals Offer Open-Access Publishing: Academics will soon be able to make articles freely available in Nature-branded journals for a €9,500—with a discounted option available under a pilot program that provides review, but no guarantee of acceptance.",1606249232
books,[removed],How Affiliate Marketers Around the World are making upto $500 per day (Complete Training),1606248187
books,"I was reading Bleak House by Charles Dickens when I stumbled upon a certain line. It's from chapter 16 and was about Jo.

It goes:

""His whole material and immaterial life is wonderfully strange; his death, the strangest thing of all.""

I have no idea what it means metaphorically. Does anyone have any interpretations?",Got any interpretations?,1606247574
books,"Hi! 
As I am in need of money, I have come to the sad fact that I must sell my beloved complete collection of the Sherlock Holmes novels. It’s the 1986 publication by Omega Books Ltd INCLUDING THE ORIGINAL STRAND MAGAZINE ILLUSTRATIONS (I’m not crying!) 

The thing is... I have no idea what it’s value is?!? I can’t find similar books (obviously), as all publications sold today are newer and not from 1986... 

Any idea what such a beauty is worth? 
Appreciate your help!",Sherlock Holmes originals - value,1606247183
books,,Deep Vellum Acquires Dalkey Archive,1606246721
books,"I’ve exhausted google searches and I cannot decide! This will be my first E-Reader, I am already a Barnes and Noble member so I can save there, kindle books seem to be cheaper and now with the subscription they offer it may be more economical. I’m just wondering from experience what you guys would recommend? 

I’m specifically debating between the Nook Glowlight plus and the Kindle Paperwhite. The main features drawing me in are that they’re waterproof and light up so I can read at night without my clip on light. The nook has night shift which I like but I don’t want to make the decision based solely on that. 

Please share whatever you have!",Nook or Kindle?,1606246390
books,[removed],inpatient psych book recommendations :),1606246290
books,,Teaser Tuesday // the Answers,1606246167
books,[removed],Finally Finished Cape Cod by Henry David Thoreau,1606246126
books,[removed],What are some lesser known beatnik/counter-culture novels?,1606245919
books,,Analysis of Gift Behaviour in a Relationship,1606245679
