subreddit,selftext,title,created_utc
books,"I'm in the middle of volume 1 chapter 8 during Justine's trial. From my perspective it seems extremely obvious that she is guilty and Frankenstein is being a dumbass. That being said, am I thinking this way because of knowledge I've gained from the story being so popular? If you read the book with no knowledge of the story would you also be blaming the murder on the monster? Or has the intention always been to think Frankenstein a fool?","Had I read Frankenstein in 1818, what would I be supposed to think at this point in the book?",1590331435
books,"I'm having a really hard time getting into fantasy because when I was a kid I read a few generic YA fantasy books and since then I just thought of fantasy as a childish genre which I know is ridiculous. Did this ever happen to you? And how did you (or did you) get into that genre?

For the fantasy fans, where should I start? (I like horror, crime, adventure)

I thought about starting with Stephen Kings' *Dark Tower* series.",Have you ever disliked an entire genre just because of bad books you've read?,1590331301
books,[removed],Has anyone else read The Enlightenment Of The Greengage Tree?,1590331112
books,[removed],I am looking for two books: Daughter of Eden and Mother of Eden of Chris Beckett?,1590330929
books,"I consider myself a fairly intelligent and well-read individual, but my son came to me with a question the other day to which I couldn't come up with a good answer:

Are encyclopedias of fictional universes (think: Encyclopedia of Hyrule) fiction or nonfiction?

My first instinct was that it's obviously fiction. But then as I thought about it more, I kept waffling back and forth as I thought about exceptions and exceptions to the exceptions...

Fiction always tells a story, right? Well, in that sense, an encyclopedia, even about fictional material, fails that test. On the other hand, non-fiction is always about facts and truth, at least as far as the author is concerned. Accounts of alien abductions, for example, are generally considered non-fiction, because they're relaying information that is at least purported to be truthful.

So I put to you all: are encyclopedias of fictional universes fiction or nonfiction?",Encyclopedias of Fictional Universes: Fiction or Nonfiction?,1590329718
books,[removed],I’m searching for investing books. Can anyone recommend a good book?,1590329635
books,"This will be my 2nd attempt to start War and Peace. I first tried in January by downloading a free EPUB version from Gutenberg.org to my phone. I had some long flights coming up and I thought I could at least get invested enough to then want to finish it. But I discovered I needed to flip back and forth from the page I was reading to the cast of characters. It was a real slog!
This time I have a paperback edition by Constance Garnett, with a fascinating introduction that provides very useful context for Tolstoy’s mindset then he wrote, and subsequently edited and reformed, it. I already feel drawn into the story as a result. I hope to finish it this time!",Starting 2nd Attempt at Tolstoy’s “War and Peace”,1590328526
books,[removed],One or more books at a time,1590328450
books,[removed],The book i cant remember the name of,1590327587
books,"So I recently finished this book and overall I did like it although I think some examples could have been cut short a bit. 

However, I have been thinking about the implications of what the book suggests. So the conclusion seems to be that aside from talent and hard work, there are several factors which create success which can be summarised by the phrase ""being the right person, at the right time, at the right place"" . 

Obviously the ""being the right person, at the right time, at the right place"" is something we cannot control hence it kinda implies that out success will be always limited by strong factors that are completely out of our control. I agree from my practical experience that this seems the be one of the ""cold realities"" of our lives. It's kinda saddening TBH but I don't see any other way to interpret this. 

Let me know if you guys agree with my interpretations.","The implications of Malcolm Gladwell's ""Outliers""",1590327258
books,,Studying Fire Sprinkler System Layout Examples for Better Understanding of Coverage and Effectiveness,1590326897
books,"I was inclined to do some work on improving my English skills and found that transcribing might help with it. So I just started with it, and as I just started I am not yet there with its affect, but it is fun, and as it requires me to do it on the desk I feel like I am focussing more on the book than before, even though I am busy writing word by word. It also helps me with pushing through the book somehow, when I am in bed I often read a couple of page and happen to put it back down. One negative is, which all knows, it slows down the reading speed immensely.

Apart from my experience, curious if anyone else is doing it, and whether you found it beneficial (or can be for fun).",Anyone transcribe while reading?,1590326798
books,"When I have read Great Expectations by Charles Dickens, I honestly felt my life was about to change. Well, yeah, I am a man with high expectations and dreams in life. But with Pip's drastic rise from the commoner's life he once had and the measures that accompany his rise, I became dubious of my own dreams. I mean, dreams and expectations never ceased to occupy my mind, but I became curious on how far I am willing to take just to achieve my dreams and meet my expectations in life. I became obsessed with Joe's saying that I made it my motto:

""If you can't get to be oncommon through going straight, you'll never get to do it through going crooked.""

Does this book have the same effect on you?
What classical book had been guiding your journey in this world?",The Best of Classics,1590326576
books,"So I remember reading a book in middle school, called ""Geeks: How Two Lost Boys Rode The Internet Out of Idaho"", an amazing book and definitely changed my views on life as a young kid. This book is now 20 years old, wow. However, my question is that this book I just realised is marked as a biography/non-fiction meaning that it's true and the characters are real. So I'm wondering if anyone knows or can help my figure out who the characters are based on or their names or something? I'm not sure if he changed it all to protect their identity or what, but I definitely wouldn't change my name if a book was being written about me haha. But i've looked up as much as I could and found absolutely zero zilch nada about the characters ""Jesse"" and ""Eric"". If anyone could give me any background info or sources or anything, i'm just super interested in how these people turned out. It has been 20 years like I said, that's a long time. Who knows right? That's what I'm here to find out.",Real People From This Book?,1590326503
books,"I really enjoyed reading this book. I really liked the prose, the characters were very fitting, some of the mistakes they make are relatable because I've been there. That said, sometimes the author does take it a bit overboard tho, that one event about Conell being depressed because some guy he barely knows killed himself. I guess he was building up to that depression and that was the trigger but still felt like it could've been done better. I also don't get WHY Marianne's brother hates her. And sometimes, the author would insert a completely ideological viewpoint that felt forced but it still fit the characters that presented it so that's alright. I feel like even after finishing the story, I don't really understand the two main characters fully. Their personalities are very chaotic, impulsive and difficult to pin down and nothing much happened in the book really. I guess it fits the title. It felt like a slice of life anime tbh lol, I enjoyed it a lot tho, particularly because I'm in the same age group as the characters I guess. I don't think it deserves as much praise as it gets but it is good. That's it, just felt like sharing my thoughts here.",I just finished reading Normal People by Sally Rooney,1590326110
books,[removed],I asked Jane Austen fans which novel was their favorite. What do you think was the overwhelming answer? (Results in description),1590325460
books,"I mean Harry Potter esque theme park in the theme  of a book series or an authors collection of books. For example I've always thought that a Stephen king land would be awesome. It could have a shining haunted with actors and scary rides or a misery themed  escape room. Or a lord of the rings theme park. 
Anyway What other literature  would translate well into theme parks?",Book series or authors books that you think could be given theme parks,1590324905
books,"I don't remember much about the book just some stuff about a few characters, there was a boy who was a empath who killed anyone he directly touched, his brother who could make fire, and a girl who made guitars. Does anyone know the book i'm thinking of? It was a young adult novel if i'm correct.",Trying to remember a book.,1590324440
books,[removed],7 Crazy Funny Short Story...,1590324439
books,"Started reading this book a few weeks into lockdown, and i am now convinced i am dantes, and london is  chateau d'if...",The count of monte Cristo,1590323934
books,"A woman, in front of the people she does not love, is easy to decent.Because she doesn't love you, she can't go wrong.Because she does not go heart, not emotional, so she knows what you want, give you what.If a woman really loves you, no matter how intellectual, how mature, how grand, how much she is, she will lose her way in the relationship.Because she cares.She cares whether you love her or not.Her mood will fluctuate and rise and fall, she will talk about some details to quarrel with you, she will be unhappy because of your words, she will make some childish actions to brush off the sense of existence.Can let a smart mature girl, instantly become full of girl heart force, only love.Most girls, have a split personality skills: in front of outsiders, clever sensible, in front of the most close to the most trusted person, unruly capricious.If a girl is being mean and clingy in front of you, it's not because she's sick, it's because she loves you.She's trying to get your attention.She wants to make sure you love her.That's all.When a girl is in love, she will ask some ""stupid questions"" from time to time:Do you think I'm fat?Do you love me?Do you love me even if I become a wall?Do you think my best friend is pretty?Do you love me?Do you love me even if I stand next to Avril?Who's better than your ex-girlfriend?Do you love me?I'm more important to you than any woman you know, right?Boys get annoyed when girls ask.Well, they're off your back.Imagine your girlfriend asking the doorman, uncle zhang, do you think I'm fat?Ask the delivery boy, do you think my bestie is pretty?Ask next door Lao wang, compared with your ex-girlfriend, who is better?The picture is so beautiful, dare you see it?That's why girls only ask silly questions in front of people they care about.In fact, girls do this because they don't feel safe.When you feel that she is becoming more and more unreasonable, it means that she loves you more and moreThe deeper you get, the less you love her.Boy this time can say again, but, the woman is vexatious still want me to coax, want me to contain, the requirement can be too much?Rely on.We tolerate all kinds of bad habits like throwing socks everywhere, playing games all day long, dying rather than saving face, etc., let you tolerate girls to do it, ok?We're not asking you to be super rich, super handsome, super long, super durable. We're asking you to be nice to me. Is that too much?To pay attention to her, to love her, to accompany her, to remember what she said at random, to remember every little interest of hers, to despise any woman except her,Give her a tangible feeling that you love her 100 percent, and she'll happily go shopping for a bag. Who the hell cares?So, cherish the privilege of being asked and harassed, okay?One day they are not in front of you to do, a new object to do, you cry too late.","What did your girlfriend do to you? You should be thankful, because she loves you！",1590323904
books,"I see a lot of **WEIRD** questions pop up, again and again and again on this sub. People asking how to read faster, better or more. If they should stick with books they hate or even how to read non fiction. I'm afraid I have no answers for those questions (but good luck to you....well, obviously don't read stuff you hate, too many books out there!)  


I noticed that having my reading list fixed (as in what I'm going to pick up after I finish my current book and then the book after that etc.) is **DULL** and **BORING**, for me at least, so I came up with another ""system"" that I'll probably go by until I die and it's very simple and **ALWAYS** works!  


I use a Kindle myself so I can see percentages but you can easily do this with a physical book as well. So when I have 10% or less left in a book (Basically you'd just eyeball it with a physical one). I'll make a mental note of the fact that ""OK, 10% or less until I finish this book"" and having that in mind, I'll let that finishing stretch tell me what to pick next. For instance:  


I was reading a book and during the final stretch, the phrase: ""A mote of light"" appeared at least twice, so because of that, in my mind, the book was telling me to next pick up the Sci-FI book: *""The Mote in God's Eye""* The reason this works so well is that, even if your TBR list is BIG like I bet is the case with most users on this sub, subconsciously you'll always have a general idea of what's on there and I've found that this method of mine, in fact, deep dives quickly into your sub conscious mind in less than a second when prompted to do so, often by a single word, and pulls something out for you to read.  


Try it out, I hope it works as well for you as it does for me,",A FUN way to keep your TBR/Reading List FRESH and not a drag or HOW to pick your next BOOK,1590323757
books,"https://amzn.to/2ZJ4zp9
A wonderful factual story on Amazon is a book that shows the difference of races and religion between a Mäori girl from New Zealand and a young Arab man from Dubai..and worth reading",New book,1590323469
books,"Hey /r/books 

When reading different kinds of books the amount I can chew in a single sitting varies dramatically, without taking 5 minutes to decompress.

* Dense philosophy, - less than 10 pages. 
* History - 30-40 pages.
* Classic fiction - 20 pages.
* New fiction - 30 pages. 

What is your focus like?",How long can you stay focused for?,1590323378
books,[removed],I just finished reading The Stand (extended version). Did any of you guys happen to read it during the quarantine?,1590322617
books,"I began it at the beginning of April and I finished it last week. I feel like it was the perfect Quarantine book and I’m sad it’s over. Those of you who have read it, what do you think about it?",I just finished reading The Stand (extended version)!,1590322424
books,"I’ve got my ideas and theories about this but if anyone who’s read this book would like to tell me what they think id love to hear it! 

So the parrot is probably the easiest one. The parrot represent Caden’s doctor, Doctor Poirot. 

The crows nest, I believe, is the place where the patients went to get their medication, the beverages were the assortment of medications that would change occasionally. 

The captain is a tricky one. When I first read the book I thought the Captain wasn’t symbolic, but after my second time reading it I think the Captain represents Caden’s illness itself.


The caption(Caden’s illness) pushes Caden to kill(stop trusting) the parrot(his doctor) and encourages Caden to not visit the crows nest(place where he gets his medication) 

Maybe all those were obvious but if anybody wants to share their theories I’d love to hear them!",What do these things represent-challenger deep by Neal Shusterman,1590322378
books,"Are you thinking 2020 is over for the entertainment industry during this quarantine, think again. Writers have not yet stop putting more in writing books as [books to read and we still are expecting in 2020](http://www.wottnovel.net/books-to-expect-summer-2020/) are nearly due to be released.

Meanwhile as short stories [are publish online](http://www.wottnovel.net/best-short-stories-free-online/) especially coma full. This is the only opportunity for more reads to be achieved.

Cast in Firelight (Wickery) 

Description: Adraa is the royal heir of Belwar, a talented witch on the cusp of taking her royal ceremony test, and a girl who just wants to prove her worth to her people.

Jatin is the royal heir to Naupure, a competitive wizard who's mastered all nine colors of magic, and a boy anxious to return home for the first time since he was a child.

Together, their arranged marriage will unite two of Wickery's most powerful kingdoms. But after years of rivalry from afar, Adraa and Jatin only agree on one thing: their reunion will be anything but sweet.\\

Only, destiny has other plans and with the criminal underbelly of Belwar suddenly making a move for control, their paths cross...and neither realizes who the other is, adopting separate secret identities instead.

Soulswift

Description: Gelya is a Vessel, a girl who channels the word of the One True God through song. Cloistered with the other Vessels of her faith, she believes—as all Ovinists do—that a saint imprisoned Elath the Great Demon centuries ago, saving humanity from earthly temptation.

When Gelya stumbles into a deadly cover-up by the Ovinists’ military, she reluctantly teams up with Tavik, an enemy soldier, to survive. Tavik believes that Elath is actually a mother goddess who must be set free, but while he succeeds in opening Her prison, he inadvertently turns Gelya into Elath’s unwilling human vessel.

Review (2)

“Lavish, sweeping, and powerful…. A must-read for fans of heart-wrenching, sob-your-heart-out YA.” (Kirkus Reviews (starred review))

“A rich, imaginative tale that delivers thrilling characters, heartstopping action, and exciting intrigue with every turn of the page.” (ALA Booklist)

“At once haunting and compelling, this tale of love and loalty will wreck you. Exquisite from the first note to the last.”

(Natalie C. Parker, author of Beware the Wild)

Ruinsong 

Description: Her voice was her prison…

Now it’s her weapon.

In a world where magic is sung, a powerful mage named Cadence has been forced to torture her country's disgraced nobility at her ruthless queen's bidding.

But when she is reunited with her childhood friend, a noblewoman with ties to the underground rebellion, she must finally make a choice: Take a stand to free their country from oppression, or follow in the queen’s footsteps and become a monster herself.

Conclusion: we all can just wait and hope until their released as weeks passes while indoors. With all this surprise comeback of many authors like out spoken character like Jeff Kinney diary of wimpy kids. This is so much to look forward to this year.",More Books Coming this Year 2020,1590322308
books,"So I began reading The Stand in April. Granted, I took a lot of breaks in between but I finally finished reading The Stand (extended version) last week. It was the perfect quarantine book and I feel like I completed a milestone.",I finished reading The Stand about a week ago.,1590322260
