subreddit,selftext,title,created_utc
books,"Yesterday I finished reading Mythos by Stephen Fry. I (18/f) have always been interested in the idea of learning about the Greek myths, but never really knew where to start. Most books on the topic seemed a bit daunting, but I believe that Fry has provided a perfect first read. No prior knowledge or understanding was required to appreciate the myths and to enjoy not only the stories but his light hearted, humorous writing style. I would truly recommend this book to anyone who wants to take their first step into the world of Greek myths.",A great introduction to Greek mythology,1612870086
books,,Wallpaper,1612869667
books,"I'm a university student and I already read plenty of very dry industrial research everyday.  

Whenever I wanted to start a fiction, my thought process goes like this:

""I could be reading a non-fiction and be learning something right now instead of reading about things that never happened"" → ""If I'm learning, I might as well keep learning things in my field"" → ""I could be working right now"" → ""Gives up reading and plays video games instead because its more relaxing""

I really want to replace my gaming habit with reading instead but how do I get out of that mindset? I want to take reading as a relaxing habit but I just can't relax because of the thought pattern. 

Perhaps I'm reading the wrong books? I quite like relaxing animes like Yuru Camp△",Help! How do I stop dissuading myself from reading?,1612868962
books,,"Buy Trustpilot Reviews - 100% USA, UK, AU Permanen Trustpilot Reviews",1612868869
books,,Buy Verified PayPal Accounts - USA Verified Personal &amp; Business Account,1612868831
books,[removed],GET iPHONE OFFERS.,1612868502
books,"Author: Steven Johnson

There were some valuable lessons in this book. Like one of them being Ideas come from crowds. And it does make a lot of sense if you think about it. There is a reason why the top companies and top brands only come from a certain Geographical Regions. It is exactly the reason we won't find much innovations in countries like North Korea or let's say Saudi Arabia. Serendipity was also one of the ideas that I liked, it is the reason why most of the classic literatures are from Russia and most of the classic films are from France.  Do give this book a read.",Where Good Ideas Come From,1612867889
books,"I’m Canadian and think this book is wonderful!

First, I’d like to excuse inevitable air of sanctimony and smug superiority that will inevitably drift into this post. I can’t help it. It just kind of innate. I’m sorry.

I think this book is a scathing examination of the American self-image (or self-delusion) of the altruistic, hard working, charitable, do-gooder vs. The international perspective of the U.S. as a vain, boisterous, ignorant bully.

I understand this book was incredibly popular at the time of release, though I don’t see much discussion about it now. It seemed -at least to me- this book was especially poignant during the rise and reign of Donald Trump.

It seems to me that this book may be too self-reflective to a nation who seems wholly averse to the notion. Any insight or discussion is welcome.

Thanks!",Asking all Americans! Is The Ugly American a widely taught/ read book in schools in the U.S.?,1612867297
books,,"Fantasy Folk - The perfect companion for reading fantasy, playing RPG or just for pure enjoyment. Acoustic guitars, flutes, lute, harp, violin and more - enjoy and thank me later!",1612866020
books,"I am new to reading. I read literally millions of words for my profession but I am not reading any book! And I am very sorry about that. I do not even know what to read and where to start. I feel like reading articles that give real world information would be more beneficial but I am also so wondering the other side.

I want to improve my critical thinking. I just want to be excited about what I am reading. What can I do?

Thank you...","I need advice, please!",1612866018
books,"Welcome readers, 
        
Have you ever wanted to ask something but you didn't feel like it deserved its own post but it isn't covered by one of our other scheduled posts?  Allow us to introduce you to our new Simple Questions thread!  Twice a week, every Tuesday and Saturday, a new Simple Questions thread will be posted for you to ask anything you'd like.  And please look for other questions in this thread that you could also answer!  A reminder that this is not the thread to ask for book recommendations.  All book recommendations should be asked in /r/suggestmeabook or our Weekly Recommendation Thread.
        
Thank you and enjoy!","Simple Questions: February 09, 2021",1612864812
books,,THE 25 RULES OF CONCORD: IMPROVE YOUR ENGLISH GRAMMAR!,1612864667
books,"I was inspired by the ""unpopular opinion post"" where a surprisingly big amount of people agreed with my - what I thought was unpopular but probably isn't - more critical opinion about him.

I mentioned that he worte some masterpieces but also a lot of crap. Many people added he can't write endings and I agree with that too. He also has no idea how women and female sexuality works. Actually many male authors are guilty of that and spread misinformation about sex, the hymen, the period and so on. I'm looking at you G.R.R. Martin.

So what is your opinion on all that? I would also like to read some opinions that completely disagree with mine!",What is your opinion on Stephen King?,1612864560
books,"When I was in high school / early 20s, I worked my way through most of the classics and super famous 'must-reads' (1984, Fahrenheit 451, and whatnot). Lately, I've discovered a whole other world with minds like Didion and Camus and while I feel like they're both EXTREMELY famous, they aren't considered 'classics' in that sense of the word. This is not really for personal recs but I want to make an ultimate list of books that everyone should read before they die that isn't a total cliche. Maybe more modern, not strictly fiction, not strictly in novel format. I want this list to include things like books on social justice/the world, plays, biographies, poetry, collections, and basically anything you would consider a 'You should read this at least once' that isn't a classic or something you would read in school/college. Comment suggestions below and I'll edit the list with each one. Please give me those perspective-changing or totally all-consuming reads. Hopefully, this doesn't get taken down, I don't mean for it to be a rec request, more like just a discussion of some books that changed you or impacted you so profoundly that you think others could benefit from reading them and how they changed you. Also just want to point out that not all books that impact you have to impact everyone else. Personally, the two books I'm adding to the list become infinitely more impactful depending on life circumstances so feel free to include a recommended audience or something along those lines. To kick it off, I'll start with my own contributions. My first is 'The Year of Magical Thinking' by Joan Didion and I would highly recommend this one be read during a major transitional period in life to be fully appreciated. My second is 'I'm Supposed to Protect You from All This' by Nadja Spiegelman, its not a hit for everyone but to any girls out there, its a beautifully candid and harshly real book about women and their mothers and really strikes a chord with anyone who's had to navigate that relationship.

Books that arent classics that everyone should read at least once:

\- 'The Year of Magical Thinking' by Joan Didion

\- 'I'm Supposed to Protect You from All This' by Nadja Spiegelman",Ultimate List of Must-Read books/works that ARE NOT 'Classics',1612864519
books,"So my faithful paperwhite has finally gone to tech heaven.


I am ambidextrous but mostly a leftie and the paperwhite has often felt unwieldy and uncomfortable.


Amazon currently selling a new paperwhite for £119.00 which will not allow for left handed use.


Kindle Oasis will allow left handed use.  Current price £229.00.


WTAF Amazon?   This is why Jeff is a billionaire and I will be buying another E Reader.   Sorry for the rant but seriously this has p*ssed me off this morning.",Left handed? That will cost an extra £100. RANT.,1612864224
books,[removed],$200 Amazon gift card offer,1612863925
books,[removed],Suggestion- for a 3 years old,1612862538
books,"I really love reading, but I didn't grow up in a family that read a lot. I have a stack of lovely books that I'm interested in continuing, but can't for the life of me get myself to stay focused. I've tried to read in pretty much every place I can think of, and I still can't stop thinking about other things. The most luck I've had is reading in bed right as I wake up, but most days that fails too. Any advice to not make reading books you like feel like so much work?",Any Advice For Scatter Brained Readers?,1612861839
books,,Get a List Of Top Universities In Canada,1612861646
books,[removed],I'm trying to remember a book,1612861555
books,[removed],Forgotten book,1612861361
books,"I would like to know if there are any good websites to order books from, internationally. I've been using Book Depository, but for whatever reason they won't take my card anymore, despite there not being anything wrong with it.

I am looking for a website which I can order books from internationally, since I am European. I do not care about them being for cheap, I want books in new condition, not used or anything like that.

I've tried out Thriftbooks, but they apparently don't ship new books outside of US.",Websites to buy books,1612861255
