subreddit,selftext,title,created_utc
books,My love for reading is back. Covid-19 has basically pressed the pause button on my career. This means I’ve had the time to sit down and begin reading again. And my love for it has returned. I finished my first book in a long time last night (The Salt Path) and starting a new one today (The Cave). Feels so good to be reading again.,"After a long time away, it’s finally back",1590364661
books,"There's been something I think about and it's pretty common but it's this idea that schools kill a desire to read. I experienced it temporarily in late middle school early high school where it wasn't until my junior year that I even read a book again and I'm sure plenty of you guys have your own story's related to that. But my thing is as people who read yourself how do you think reading should be done in schools?

See for me personally I get why you need to force otherwise the kids would just read a narrow selection of YA books they enjoy (I know this isn't strictly true, I read non fiction and military books a lot and I know people who read other weird stuff that doesn't fit this generalization but it's a generalization) and never engage with the larger world of books and in particular the classics of ""western cannon"" or whatever. On the other hand if forcing kids to read these books is causing so many complaints about how they hate reading and in part might be creating these stats that ~25% of adults haven't read a book in a year that kinda defeats the point.",Discussion: How should we approach reading in schools?,1590364103
books,I finished the book a few days ago and I'm still going through some of the notes I made because there is just too much to digest. I'm glad that psychology has gone such a long way from the classic theories of the XX century and that the idea of a human being as a blank slate no longer has room in serious scientific discussion. Pinker reminded me about the complexity of nature and to be suspicious about simplistic explanations to complex phenomena.,Steven Pinker's Blank Slate: The modern denial of human nature was fascinating,1590363943
books,"Like the title says, tell me what song(s) remind you of a book or that you would use as part of a soundtrack. Books already made into tv/movies excluded. Examples:

Golden by Ruth B - The Library at Mount Char by Scott Hawkins (spoiler alert?)

Brick by Boring Brick by Paramore - The Hazel Wood by Melissa Albert

Back to you by Selena Gomez - The Seven Husbands of Evelyn Hugo

Somewhere only we know by Keane - Strange the Dreamer by Laini Taylor

Give it to me. I need both new music and new books!",Songs that remind you of books,1590363132
books,,Essiccare: tecniche e ricette...,1590362441
books,[removed],I need helping figuring out a children’s book title,1590362119
books,"I’m not talking about the usual strategy of eliminating the “Person 1 said” and “Person 2 replied” bits after a conversation between two characters gets going and an order is clearly established and you automatically know who is speaking.

What I’m actually talking about is...well, I read Sphere and noticed that during scenes involving multiple characters (more than 2), Crichton would sometimes stack a bunch of separate pieces of consecutive dialogue without ever clearly identifying who is speaking. So I’d sit there wondering, “I wonder if Harry said that...or Barnes...or Beth...”

I find this mildly annoying. I get that maybe Crichton is more interested (at times) in pacing and ideas and the vibe of a busy conversation than making clear who, exactly, is speaking. But I guess it’s just tough for me to adjust to that. 

Does he do this in his other books as well?",Does Michael Crichton usually include scenes of dialogue where it is unclear who is speaking?,1590361926
books,,Şampuan ve Saç Kremleri,1590360619
books,,Vücut Geliştirme,1590360291
books,[removed],Books your looking forward to for the rest of the year,1590359583
books,[removed],จะเกิดอะไรขึ้นหากสงครามโลกครั้งที่ 2 ยังไม่จบ? รู้ได้ในเกม Paradise Lost,1590358826
books,[removed],A question about Dune,1590358305
books,[removed],Reader's digest condensed books collection?,1590357869
books,[removed],Reader's Digest Condensed Books,1590357754
books,[removed],Reader's Digest Condensed Books,1590357662
books,[removed],Does anyone else get wicked head spins if they read too much?,1590356933
books,[removed],Best online retailer?,1590356664
books,[removed],Howl's Moving Castle by Diana Wynne Jones.,1590355606
books,[removed],"I just read The hunger games ""The ballad of songbirds and snakes"". I don't recommend it. (Spoiler alert)",1590354560
books,"im really trying to find this book i read when i was in elementary :(( i can only remember the cover and some of the plot
but the cover is basically a little girl with black hair and on some books there is a frog on the cover. 
also the book is fiction/mystery(?) but i also think she had a evil babysitter/aunt or some female figure she would run from. please help if u know what im talking about😭",need help finding this book😔😔,1590353933
books,[removed],Starting a new book,1590353695
books,[removed],After you finish a book when do you start the next one?,1590353587
books,"Hey for anyone that is interested, I wanted to recommend the book 'An Imperfect Offering' by James Orbinski. This book was the first book ever to bring me to tears because of its selfless, fearful and brave discussion of humanitarian aid in the developing world. The book is an account of a Canadian Doctor, James Orbinski,  working with Doctors Without Borders which is also known as Médecins Sans Frontières. I am a junior in college working towards a nursing degree and this is one of the few books that peaked my interest, more so as to learn more about Doctors Without Borders and humanitarian work in general. This books makes me want to work with the organization as soon as I get out of school and drove me to question the inherent good in people. If anyone has read the book I would love to know what you thought of it!",An Imperfect Offering,1590353438
books,"I'm 1/4 way in, but feels like I'm not able to keep the pace and always seems like I'm missing the point. To be honest, I think the Author's writing is my biggest problem, getting through the pages almost feels like a battle to extract what Gibson really want to describe (could be aggravated by the localization, witch mess things a bit). In the other hand, I've got excited in some moments  like &gt;!the heist in the firsts chapters!&lt;, so It was rewarding.","So, have anyone been thought a hard time reading Neuromancer?",1590352948
books,[removed],What are your favorite classic novels?,1590352340
books,[removed],Finished reading Hyperion and The Fall of Hyperion and loved them both,1590351405
books,[removed],Is How to Defeat a Demon King in Ten Easy Steps on audiobook only?,1590350870
books,"Just wanted to give a recommendation to people new to the fantasy genre or just looking for a great book. Look no further than Brandon Sandersons “The Way Of Kings” it’s a fantastic book with so much going on and fantastic characters, check it out on YouTube for a bit of a taste of what it’s about but I assure you it won’t be a disappointment, the world is vast and the characters great. Look out for the character ‘Yalb’ I think you will take a special likening to him.",A Start In Fantasy.,1590350869
books,"I don’t believe that I am super vulnerable to conspiracy thinking myself, but I want to understand the phenomenon, especially in regards to the current state of American conspiracies fueled by our political divide. Stuff like QAnon, Covid vaccine microchip tracking, 5G being dangerous, etc. Why do people believe this stuff and why does it spread like wildfire?

I am not interested in books that mock these people. Just want to understand the psychology/sociology behind it. Thanks!",Recommendations for books about how conspiracies spread and why people believe them.,1590350757
books,"Finally, after long, I have finished the Harry Potter series. I started reading Philosopher's Stone in December 2016, but I only read till ""The Sorting Hat"" chapter, since then I never read it. Then in December of 2018, I resumed Philosopher's stone. Today I finally completed it. It's been a ride, with all the characters, and past of Tom, Dumbledore, Snape revealing slowly, peel by peel like an onion. I felt that Harry Potter's story is not only about Harry and his friends but so many people whose past effect his story and arc. 

I to feel now we need a complete movie series for Voldemort, Dumbledore. But all in all fantastic experience. 

Now I am heading to read Percy Jackson's Book Series!! ADIOS!",Today I Finished Harry Potter Series. What a JOURNEY!,1590350523
books,,My friend and I made a video on social Darwisnim! Hope you lads like it!,1590350510
books,[removed],"Build startups like a poker player (my book, free to read on Amazon)",1590350479
books,[removed],"Mary Poppins by P. L. Travers (Book: 1934-88, Movie: 2018)",1590349991
books,[removed],Thoughts on Us Against You? (no spoilers please),1590349512
books,"I stumbled across it a couple of days ago.  I read it all last night online.  It was interesting.  Definitely along the same vein as Robert Anton Wilson and such.   It brought up some good ideas, they just seemed forced at times.  
I have to admit, the ending kinda shocked me, I didn't see it coming and was confused how it got there.  I also was hoping there would be more clarity into who the Howard actually was.  Any thoughts guys?  Anyone else read it and love it or hate it?",Just finished Poker Without Cards. I thought it was very interesting.,1590349205
books,[removed],Read “Why We Sleep” by Matthew Walker,1590348795
books,[removed],7 เคล็ดลับดูแลผมทำสีให้สวย คงสีสันสดใส ที่สาวๆ ทุกคนทำได้,1590348424
books,"What I liked most about it was the fact that it wasted no time in confirming that they they had to go away to the little white house away from their father. Other books, such as ""A Little Princess"", would continue to stretch it out (although a little princess is also very very good). Other that than it brings about an utmost sense of the time period when the author, Edith Nesbit, lived. What she captures in each and every moment of the story, whether Phil, Bobbie or someone else are talking is so mesmerising that it keeps you hooked on. Even the children talking or arguing with each other is fun and along with that, her own personal thoughts also come around occasionally. Like she might go off and say something like ""I thought mother was doing well"" or ""I for one like Ruth's behaviour"". The mother is my favourite character in the book as she always tries to make every moment count and though the children do get sad often, she always lets the time pass with certain enjoyments. It's up there in my favourite books of all time and I would recommend you guys to read it. 10/10.","""The Railway Children"" is a wonderful book.",1590347497
books,"[https://www.arnavj.com/2020/03/closeness-in-time-of-cholera.html](https://www.arnavj.com/2020/03/closeness-in-time-of-cholera.html)

I had written an article about how we need to look beyond race, caste, creed, and other hypocrisies o society today to be able to fight Coronavirus. The world has received an eye-opener and it is a huge potential to come together and do something for a greater positive net effect.   


Is it possible? Or is the world going to go back to being racist and partisan?",Closeness in the time of Cholera,1590346904
books,,Sci-Fi and Fantasy Build Mental Resiliency in Young Readers,1590346544
books,"After reading House Of Leaves, I found the formatting and style extremely refreshing, and added to my enjoyment of the book. However, I noticed that almost all of his novels are written in this style. If the formatting adds to the book, I don't mind, I was just wondering what people thought of his other less known works, and specifically if this style contributed to your reading experience or detracted from the experience. Thank you in advance!",Thoughts on Mark Z. Danielewski?,1590344734
books,[removed],Tell me your opinion,1590344473
books,[removed],Unpopular opinion: Weber’s Phantom was better than Leroux’s phantom,1590343440
books,[removed],App for book list?,1590343200
books,"So I've been clinging onto an old Kindle Firev2 for about 10 years now. While it would have been time for an upgrade about 5 years ago, I'm kind of iffy on spending money on replacing something that still does its job rather competently, especially since I don't use it for anything other than reading.

But I must admit, I have been contemplating getting an e-ink e-reader instead of continuing to use the gimped Android tablet I currently have. As someone who currently loads a bunch of pirated ebooks and pdfs onto their KF, what advantages and disadvantages would I face if I were to make the switch?",What are the advantages/disadvantages an e-ink e-reader has compared to a standard tablet?,1590343188
books,[removed],Does anyone know how to tell what edition and print this harry potter is,1590342310
books,"I've been watching a few booktubers for a while, but I've found that most of them gravitate heavily towards the young adult genre, which I can't really get into. I love hearing others discuss and recommend books though, but it seems to me that booktube is heavily dominated by this genre. Are there any other, maybe smaller booktubers that talk about other genres? Thanks in advance.",Booktuber recommendations?,1590342073
books,"I probably read \~25 books this year. Most of them are non-fiction books, such as ""Outliers"", ""Superintelligence"", ""The Intelligent Investor"" or ""A brief history of humankind"" etc.

All of those books are filled with informations and sometimes even from multiple fields. While I'm able to keep an approximate overview, I would definitely not be able to recall exact facts, besides maybe two or three. I probably also completely forgot about some points the authors made.

I enjoy the reading itself of course, but I would like to remember as much as possible since those books aim at education. I figured it might be worth to take one day a month in which I quickly skip through every book I've read, but there are probably better options out there.

So my question: How do you make sure to remember as much as possible from the books you've read?","How do you keep infos, especially regarding non-fiction books?",1590342033
books,"Hi,

I have an edition of Harry Potter and the philosophers stone which I think is a first edition. It has the number line 30 29 28 27 26 25 24 23... However there is no mistake on the list of Harry's supplies... I am truly baffled about if its a first edition or not.

I am looking at selling this book so I need to know ASAP

Thanks",Harry Potter and the Philosophers Stone First Edition?,1590341840
books,[removed],Weirdest/Creepiest Books You've Ever Read?,1590340667
books,[removed],Has anyone read Tess of the d’Urbervilles?,1590339947
books,,Education,1590338712
books,"Just a short gratitude post. I was browsing here, deep in replies, and someone mentioned the book, and how they enjoyed reading the writing when he was talking about mundane tasks and his everyday life... the comment spurred me enough to check out the book. I’ve been searching for that comment for a week to say thank you. I can’t find it so I’ll post it here. I’ve been struggling with addiction and this book has helped me spend my evenings with Kvothe instead of wine. It’s small, but it’s helped me get farther than I have before with sobriety and I wanted to say thank you, whoever you are. Love this sub and of course my friends at r/stopdrinking.",Thank Your for The Name of the Wind,1590337781
books,I've tried to read several books by Stephen King. I've always struggled. But I'm having a particularly hard time with The Gunslinger. I love his stories. I think his imagination is uncanny. But I struggle with reading him. I'm looking for opinions on what is it about SK that makes him a great writer? Maybe I need to approach this differently. Is anybody else having this problem? How do you overcome it? I really want to finish this series.,I'm struggling with The Gunslinger,1590337508
books,"I just finished the story in Haunted, Exodus and wow. Don't get me wrong Guts is disgusting but it was so grotesque that it after a point didn't bother me much. 

Exodus however left a (little) more to the imagination and it was really just depressing though it did make me think and I think is gonna sit with me for a few days. 

What did everyone else think of the story? And Haunted itself?",Just finished Exodus by Chuck Palahniuk,1590337200
books,"Bit of an odd question, I read quite a lot (although a lot is audiobook but I don't really think of that as any different anyway). Have always read for enjoyment. Something in the region of 40-60 books a year (varies wildly since saga fantasy tends to be considerably longer than most novels). It's ebbed and flowed over the years obviously and I generally flit between the same 4 genres: Sci-Fi/Saga Fantasy/Thriller and then oddball suggestions from wherever that are harder to categorise.

However I mostly just go where the story takes me, if a book is good I give it quite a bit of leeway. The story can have plotholes and I'm quite forgiving or be clichéd or fundamentally flawed. As long as they are enjoyable worlds to be in I'm kinda in for the ride anyway.

However I don't really ""ruminate"" on what I read. If I went to a book club I'd probably have very little to say other than ""yeh I enjoyed it"". Don't get me wrong I've absolutely *loved* books but I've never really re-read most things, looked overly long and hard to nuances I might miss or thought much about theme/setting/tone etc.

I'm just wondering if most people read books aren't overly anylytical or am I missing a whole other depth. I mean I could obviously try it for a few books. I'm just curious as to what mentality others approach reading with?","Should I be reading more ""critically""? Am I missing much by not?",1590336880
books,[removed],Where can I find PDF?,1590336843
books,[removed],How does Howl fall in love with Sophie?,1590336599
books,[removed],The Best of Classics,1590336549
books,[removed],Who are the most disturbing characters in the history of literature?,1590336365
books,Ok so I've been looking at all my books which I have in my collection and I've spent 20K USD on books itself. I am kind of confused? Is it ok that I've spent this much on books this year I've read all of them? What do you guys think? To me it seems ok like I have money so it does not hurt my pockets at all or anything I am happy that I've been reading a lot so I have no regrets. but does it seem too much though? Thanks!!,Hey guys I've spent 20K USD on books itself need help?,1590336290
books,"When (EDT) |Who |What |
-|-|-
Monday, May 25 at 4pm|[**Joe R. Lansdale**](http://tinyurl.com/3qkm9d5)|[*Of Mice and Minestrone*](http://tinyurl.com/y7rdzkkn)
Tuesday, May 26 at 7pm|[**Nancy Kress**](http://tinyurl.com/62vtsa)|[*Sea Change*](http://tinyurl.com/ybxsf8r7)
Wednesday, May 27 at 12pm|[**P.W. Singer, August Cole**](https://www.pwsinger.com/)|[*BURN-IN*](https://www.goodreads.com/book/show/49642928)
Thursday, May 28 at TBA|[**Gail Carriger**](http://tinyurl.com/tmpv9hp)|[*Prudence*](http://tinyurl.com/rdb2z9e)
Friday, May 29 at 12pm|[**Emily B. Martin**](http://tinyurl.com/y7m49y6f)|[*Sunshield*](http://tinyurl.com/y76mwdgx)
Friday, Jun 05 at TBA|[**Tyson Yunkaporta**](https://www.harpercollins.com/author/cr-134113/tyson-yunkaporta/)|[*Sand Talk*](http://tinyurl.com/y8dcgqhy)


---

[The Complete AMA Schedule.](http://www.reddit.com/r/books/wiki/amafullschedule)","Upcoming AMAs for May 24 - Jun 07: Joe R. Lansdale, Nancy Kress, P.W. Singer, August Cole, Gail Carriger, Emily B. Martin, Tyson Yunkaporta",1590336005
books,"There are actually 3 questions below, in case you want to skip the prolog.

I am from and live in Austria, thus my first language is German. I've found it much more enjoyable, though, to read books in English (same goes for movies and serieses). With the lockdown that took place in Austria I needed some more books to read and so I ordered two from my local bookstore, both of them in English. My sister also ordered two books, both of them in German. Her books arrived the week after, mine arrived yesterday --&gt; 2 months after ordering them.

Now obviously this is related to the pandemic and the measures taken in every respective country. But, I asked the owner of the book store why the English books arrived so much later. She said: ""They are printed either in the US or the UK, get shipped to Germany and she gets them from there.""  
I was not aware, that this is the case. I thought books (at least books in English) were printed in Germany or Austria and then distributed to book stores on demand. This revelation is actually making me consider switching to E-books, because of the environmental footprint the physical book has with such a long transport.

Now, I checked some of the books on my shelf and indeed they were either printed in the UK or the US. Interestingly, though, I got all three books from Leigh Bardugo's ""Shadown and Bone""-trilogy. But I bought each one from a different store. Book 1 I got from a German book store chain. Book 2 just arrived from my local book store. And book 3 I got from Amazon, as it was not available at the others.   
Book 1 --&gt; printed in the US  
Book 2 --&gt; printed in the UK  
Book 3 --&gt; printed in the US  


All of this leaves me with 3 questions:

1. Do books written in English only get printed in English-speaking countries? (or more general: Do books written in language X only get printed in countries where that languague is spoken?)
2. If so, does this actually make sense economically? (This one is defenitley more targeted at books in English, as it seems clear that very few people in Austria would read a book written in Chinese. A lot of people I know prefer to read in English though, so demand seems to be there.)
3. As the example above suggests, the books could be printed either in the US or the UK. Is there a way for me to know where the book is coming from before I buy it?",Are books written in English only printed in English-speaking countries?,1590335904
books,[removed],They Both Die At The End - Adam Silvera,1590335784
books,,Doodling in her Harry Potter book,1590335702
books,[removed],They Both Die At The End,1590335550
books,"Hallo,

I'm interested in (English) book rating, ranking or reviews of (new) books by reputable sources like magazines, news papers (like NYT Book Review, Times Literay Supplement, ...) or (e.g. library) associations (so not Amazon or other sales charts).

Preferably free and open accessible.

Any recommendations or pointers for me. In addition what are the pros &amp; cons about these lists?

Thank you

.","Book rating, ranking, review by magazines or news papers or associations",1590333929
books,,"'A World Apart' (1951) by Gustav Herling was praised by Camus and Bertrand Russell, and distinguished no less for its artistry than for its unflinching depiction of Stalin’s camps, it was one of the first Gulag memoirs to appear in the West, and has since attained the status of a masterpiece",1590333639
books," In the past six years I have started, and abandoned many projects. I gradually lose interest, because I've done it so many times before and don't get paid for it.

Open source, freelance, art and lot more! Where do you even begin to learn what to build?

Building a product is much more than the ability to solve a problem. To build an amazing product you have to be aligned with your passion.

De-Coding The Passion Project is your one-stop shop to the ideating process. It gives you the insights and confidence you need to build your Passion Project.

Pre-order the book: [http://gum.co/keky](http://gum.co/keky)","If you don't do something that's your passion, then you'll abandon it half way.",1590332308
books,[removed],The seven husbands of evelyn hugo,1590332093
books,"I just finished reading it and am in love. 

It's magical realism, nothing too crazy, very simply put and well structured.

You're walked through the story with Bahar, a member of a family of 5 living in Iran after the Islamic revolution. 

You get to experience Iranian mythical creatures, folklore, history, literature, traditions and get a glance at how this revolution is built on the blood of so many innocent people. 

I don't like to share too much in case someone decides to read it, enough to say it was a fantastic read if you enjoy reading books like 100 years of solitude, in fact there are references to Marquez too. So it's fair to say the writer was influenced by Marquez's work.

The writer Shokoofeh Azar is an Iranian who lives in Australia after seeking political asylum. The story was written in Farsi and then translated to English by an anonymous person, i guess for safety reasons.

So if you have read this book please do share your experience or make a suggestion for my next read!",Just finished reading The Enlightenment Of The Greengage Tree and loved it!,1590331956
