subreddit,selftext,title,created_utc
datascience,"I was overwhelmed by articles about how machines are going to conquer us and with my friend, a computer scientist and CTO, we started a newsletter in which we try to explain in plain English the main concepts of ML. To show it's practical implementation. To demonstrate the variety of problems that ML tackles. 

It's been less than two months since the newsletter was launched but it's getting a great following and positive feedback from both sides: people who don't have knowledge about ML tell us they learn with us to understand how ML is integrated in their daily lives, and to data scientists and developers we help to keep up with the development of the industry and focus on the relevant research papers. 

I would love to share it with you and hope you will find it useful for you 

[https://thesequence.substack.com/p/the-introductory-post](https://thesequence.substack.com/p/the-introductory-post)",[Discussion] Do you think it's important to explain to the general public what artificial intelligence and machine learning are? Can data scientists also benefit from such explanations?,1598277105
datascience,"I have an interview with a company that rolls aluminium for the newspaper and magazine industry, i.e. the printing press. They make the aluminium slabs and through a process of heating and cooling it, roll it into a thin sheet of aluminium ready to be rolled similar to tin foil. The question is more around what sort of analysis in regard to process and quality is best for this sort of thing. Previously I have come from a HR/marketing background, so I'd be interested if anyone has had any sort of experience doing data analysis in manufacturing, specifically around process and quality improvement.",Data Science in Manufacturing: Process &amp; Quality Control.,1598276286
datascience,[removed],Could anyone give me a concrete example of how you used Taylor series to solve a problem?,1598276205
datascience,"Hey I really need help I have been trying this for 2 weeks now and have not made any progress. I have a zipped file containing my folder but when I try to unzip it on Google Cloud Platform using the Bulk Decompress Dataflow API it decompresses them into a single folder containing text, the dataset has 3 folders of images(600k total). I have tried uploading it to my Google Drive and tried unzipping it from colab but am getting errors. Anyone know how I can do this? I have been searching and there isnt any proper way to do it.",Unable to unzip folder containing dataset,1598275550
datascience,[removed],Should I go forward with this masters thesis topic or switch if I want to work in data science/ML?,1598275351
datascience,"[https://ms-datascience.utexas.edu/](https://ms-datascience.utexas.edu/)

&amp;#x200B;

 

* Probability and Simulation Based inference for Data Science
* Foundation of Regression and Predictive Modeling
* Algorithms: Techniques and Theory

 

* Advanced Predictive Models for Complex Data
* Design Principles and Casual inference for Data-Based Decision Making
* Data Exploration, Visualization, and Foundations of Unsupervised Learning
* Principles of Machine Learning
* Deep Learning
* Advanced Linear Algebra for Computation
* Optimization

I personally think it appears to be rather quantitative enough to be valuable. Do you think this kind of program can compete with CS and stats?",UT Austin now has a Masters in DS and it looks good - thoughts?,1598274053
datascience,"Quick background: I graduated with my MS in data science in January 2019. I decided to pursue a PhD because I noticed that all the jobs I wanted either required or strongly encouraged a PhD. I'm 1.5 years into a PhD in computer science, which includes statistics and natural language processing. My masters thesis was in time series. Before that, I was working as an analyst without programming skills. During my masters, I did two data analyst/data science internships.


I've been trying to find a remote, part-time internship for a while now to keep my industry skills sharp and never even got to the interview stage since starting my PhD. I figured with my experience, I was perfect for an internship: I have academic experience, I have a little bit of industry experience, but I really need mentorship and guidance when dealing with practical problems.


Last week, one company emailed me back but told me that they were offering the paid internship that I'd applied to as unpaid only, and they asked me if I was interested in an interview. I figured why not, at the least it would be good interview practice. 


Horrific is maybe an exaggeration, but it was truly awful. So first of all, the company deals with image classification, which I've never done outside of classes. Maybe I was naive, but I thought that a few classes I took two years ago and my more recent experience in natural language processing might be enough to translate into an internship in image classification. I was wrong. 


I didn't realize it was going to be a technical interview. They immediately started off by asking me if I knew a certain term and to explain it. I had never even heard of it, so I'm not sure if it was a library, a concept, or a software (yes, I should have written it down but at this point, I was very flustered). This continued for maybe ten different terms. With each one, I'd never heard of it. I wish I had just cut the interview short after the first two or three since it was such an obvious mismatch. They eventually gave up and just asked me to explain what I was currently working on, and the interview ended.


I don't know where to go from here. Clearly there is a huge discrepancy between my skills and the skills that this company was expecting from someone with an undergrad or masters degree in data science/machine learning. Normally, I would find a bootcamp or some course and start up from scratch again. But I'm wondering if it would be better to focus on what I'm doing in my PhD and try to hone one or two skills. I am scared of either (a) pigeon-holing myself and not being able to find a job in those specific areas or (b) broadening my skills to the point that I don't actually know anything important about a wide variety of data science concepts.


By getting a PhD, did I ruin my chances of working in anything other than what I'm working on now? Should I focus on building up my natural language processing skills or should I start spending my evenings doing more general coursework that would be applicable to other data science areas?",I had a horrific interview experience last week; in need of some advice,1598271027
datascience," Hey!  


I'm a Belgian graduate CS student, looking to do a data science/engineering internship abroad starting in October/November. I've tried applying for some companies, but it's difficult to find companies willing to accept foreign students, so I was wondering if any of you guys know anything about companies who are offering special programmes for internationals? Or maybe someone has done something like this and can share their experience with the company?  


I don't know if this is the right subreddit for this question, if not please suggest another one 📷  


Thanks!",European internships/traineeships starting this fall,1598270403
datascience,[removed],European Internships/Traineeships starting this fall,1598270110
datascience,"I remember I saw a talk either about Data Science, ML or AI in which was shown one tool. It was a site, which could accept csv datasets and categorize them to represent data in a grid with circles coloured in different colours for each category. (here's a rough image that I could draw from memory of what it looks like after loading data [https://i.imgur.com/WE1om1e.png](https://i.imgur.com/WE1om1e.png) ).  
Would be grateful if someone recognises from my poor explanation and provides the name of this site/tool. Already tried to look for answer in both SO and Google(with poor googling skills i assume), no result whatsoever.",Help to find a tool for categorizing datasets,1598269867
datascience,I'm completely new to Data Science with no prior experience in programming. What are some best resources available to get started?,Where to get started with Data Science?,1598267087
datascience,"I have a. large dataset of customers which consists of customer name, product bought, date bought and quantity bought. Any ideas for some analysis/predictive analysis I could do based on this? I'm comfortable using python and libraries such as seaborn, scikitlearn etc. Thanks.",Ideas for data analysis for customers dataset,1598263772
datascience,"Hi all,

I'm currenly trying to use the orange data mining tool via both supervised and unsupervised learning - to study past historical sales trend and product images, and project future trends using more images.

In the industry i'm in, this sounds like it would work well as we have a large dataset (40k images and 5-8 years x 4 quarters of sales trend) to work from.

However, i'm having difficulties integrating images into the workflow because of the type of data image embedding returns (999 numerical values etc.) - anyone can point me in the right direction on how to make this work?  


How do you use images + .csv yearly sales trend to project future sales trend?",Orange data mining tool: Projection using images?,1598262845
datascience,"A bit of a background first: I'm currently an India-based software developer, and have been developing information management software for hospitals, for the last five years. It's fun, but I enjoy working with data (using SQL and Python primarily) and reporting, much more than Web development.

Ergo, my conundrum.

I'd like to transition to the Data space soon, most likely in the coming year. For this, I've already taken up some data science courses, but I'm curious about whether a Post Graduate Program would accelerate my chances at transitioning seamlessly.

Courses I've taken up already: 
Data Science Specialisation, EICT, IITR
IBM: Data Science Foundations path (Cognitive Class AI)
IBM: Applied Data Science with Python path (Cognitive Class AI)
Some Great Learning + Udemy courses based on Python and Data Science

Post Graduate courses I'm interested in:
Simplilearn's Purdue + IBM Data Science Post Graduate Program
M. Tech in Data Science, BITS WILP

I'd like to build a strong resume, gain more experience, get hands-on with more projects, and would want some placement assistance too. Are PG Courses important for this, or are there different paths which I could look at?

I'd be extremely grateful if I could have some guidance in this regard, thank you!",Need guidance to start off in Data Analytics / Data Science,1598250392
datascience,"Hello all, 
In my country, Singapore, more efforts and investment are initiated from the government to push data analytics and AI to be implemented in business and is one of the driver of the national economic plans. I'm new to the community and will like to ask the people here about career advice here in data science/AI. 

Academics:
Masters in Information System
I will finished my Masters in Information System from National University of Singapore this December, which is a #10 University Ranking Globally - QS World University Rankings by Subject 2019. 
I took four data science related courses mainly related to machine learning and predictive analytics.
-big data technologies(hadoop &amp; spark)
-predictive analytics (machine learning)
-intelligent system (more qualitative)
-data mining

Economics Undergraduate degree
Prior, I had an economics major background and graduated with the highest honour. 

Job:
Transaction Banking Product management experience - 1 year. My first job as a trainee for a year in a international bank. 
Data analyst, currently I have also secured a role in another leading international bank as a data analyst that uses predictive analytics and ML (not yet started)

My ultimate aim is to be a data scientist that uses AI or maybe an AI role but less on being a developer part. I'm not so much interested about business intelligence too. In the long term, I will like to grow into a even more rewarding career in the future. I dont have a preference in industry, but given my work experience and internships, I thought its more efficient to pursue something in the financial industry.

I was thinking doing another masters degree in Georgia Tech Online Masters of Science in Analytics (OMSA) program as part-time to further deepen my skills and be exposed to new ideas on how people apply analytics.(will it help in my career?). If relevant, I am 27-29 years old. I thought a degree with the brand name from georgia tech, can expose me to new career opportunities overseas. 

May the community here please give some perspectives and advise? Anything is welcome, will like to hear all views. :D",Advise on further studies. Data Analyst in a Financial Institution,1598250264
datascience,"Dear Recruiter,

My Work in 1min video

Project’s Video Demo

[https://drive.google.com/open?id=1TgTVroGndgiERtWbqLesDB05DfF6vE5t](https://drive.google.com/open?id=1TgTVroGndgiERtWbqLesDB05DfF6vE5t)

I am a motivated professional with innovation proficiency and extensive Data Science experience.

As a person who thrives in high-pressure and fast-paced situations, I strive for positive results through the application of my Computer Vision, Deep Learning, Machine Learning abilities.

Additionally, I possess expertise in Kubernetes, AWS, Azure and an aptitude for optimizing performance and motivating colleagues.

In any position, I am able to visualize success and identify innovative and effective strategies for achieving it.

Resume - [https://drive.google.com/file/d/1EPjoIbCq8eg7Sn1U7Kosn8VVM7IMhlV-/view?usp=sharing](https://drive.google.com/file/d/1EPjoIbCq8eg7Sn1U7Kosn8VVM7IMhlV-/view?usp=sharing)

I'm looking for opportunity in data science field for below location

India - Bangalore

Looking for Visa Sponsorship in - UK, Canada, Paris, Switzerland

Regards

Rahul",Looking for VISA Sponsorship in Data Science Field,1598248042
datascience,"I'm a 24 y/o Supply Chain Analyst at an Aerospace manufacturer with only a business management degree. I am technically savvy and know how to query our database, and export and analyze our data in Excel only. Recently, after doing a deep Safety Stock analysis, it started to occur to me how much potential there was for advanced analyses if I knew more coding languages/programs and mathematical concepts. Currently I perform most of my analyses with existing supply-chain-type equations, or just basic logic, but I almost feel like I'm cheating my job a bit without knowing more technical knowledge. Not to sell myself short, I am revered at my company as a young (24 yo) prodigy for knowing advanced Excel (lol), however I feel there is so much more I could be doing. 

Therefore, I'd like to explore the Data Science/Statistics field to learn more mathematical and programming concepts. To preface, I am an ambitious person, and love to learn. I've begun online (Udemy) classes for Python and SQL, and eventually more.. (I doubt that will be enough) but my main concern is with the math portion of Data Science. Looking back at my business degree, everything is theoretical to the point that I laugh thinking of how someone can learn practical business concepts from school. I've been working for 2 years in the Aerospace industry, and ""Business Management"" is load of shit in my opinion. There is no result, no practice, no product that you can market to an employer (IMO you'd be better off with a marketing or finance degree, something tangible so you can create a portfolio). I of course know there is exception, and I do value the discipline, endurance, and overview I received. But I feel like business education is much different than technical education like data science/statistics. Is data science/statistics something you can learn as you go? I feel like math is math, regardless of where you learn it, but the practice of where to apply certain theories is the important aspect to know? 

Just to tie this up, as I continue to work at my job, I'll be practicing programming, doing projects and even ""take work home"" and try to solve work problems/opportunities at home with a more diverse set of tools (Python, etc.). As I do this I imagine I'll run into mathematical concepts and problems that I will research and understand, and then move on with that knowledge. But I fear doing it that way will be putting together the Legos without reading the instructions, if that makes sense. I'm a little averse to more schooling because of the wealth of knowledge that exists on the internet/books/etc, but I would be open to night classes alongside my current job. (I'm an avid Dave Ramsey follower if that makes sense to you)

Any thoughts?

\*\*In case I'm investigated some day, I will not and have never taken any Technical Data home to use privately\*\*","Business vs. Data Science Education, Can you switch career paths moderately?",1598244053
datascience,,What are some of the daily life tasks that can be automated using artificial intelligence...,1598240882
datascience,"Struggling to wrangle a Panda dataframe here https://github.com/kaihendry/covid19-sg/blob/5f87e98c3308f1a86aedd68d21ac6e7c6b5bb461/pandas.ipynb to show the daily increases. I think this is called a ""lag window"", and somehow groupby/shift with a df can do it. Anyone know what am I missing? Many thanks!",Cumulative to daily count in a Panda,1598240641
datascience,,R Programming For Data Science for Absolute Beginners[2020] - UdemyDegree,1598236588
datascience,"I often find myself in a position where I need to store a certain amount of relational data (e.g. 3-4 tables, less than 30k rows, text only) for a simple analysis. I don't have performance requirements but it would be nice to have a GUI to quickly check and edit the data. It can be online or local, no preferences but ideally it should be super simple/quick to set up. Any recommendations?",Simple DB with GUI to store data for simple analyses,1598232034
datascience,[removed],Looking for a case study book in Data Science,1598231711
datascience,"I imagine the difference is that an ML engineer is first and foremost a software engineer. Who learned to specialize in machine learning. Where as a data scientist is first and foremost a data analyst, who specialized in machine learning.

But that’s just my guess. Could it just be title nonsense? What is a typical job for a ML engineer?

I have a strong software engineering background and I’m super interested in machine learning. I’m just trying to find my best fit. 

Thanks.",What is the difference between an ML Engineer and a data scientist?,1598227741
datascience,"2 questions regarding creating a DS portfolio: 

Question 1:
I have quite a few DS related projects at work that I would love to put on my github as I job search.  However,  how do l do it without showing too much information?  Do I put the full source code but just summarize my findings?  Is it okay to not talk about specific results and just say ‘using this technique, I am able to find....”not sure how to best think about github portfolio.

Question 2:
What do hiring managers expect to see in github? Does it need to be the actual analysis from beginning to end like a report or is the code enough?  Do you want to see it just to see that I’m actively doing DS it do you want to know all the context before we meet?  Does it have to be in a webpage format or is just GitHub code enough?","Do you put your work projects on github, and if so, how do you do it without revealing too much?",1598227170
datascience,,My university requires that I take either Scientific Writing or Professional Writing. Which class would be more useful as a data scientist?,1598223141
datascience,"Big Data Architects, Engineers and Developers - PySpark Certification Training will equip you to become a successful Spark Developer using Python and pass the Cloudera Hadoop and Spark Developer Certification Exam (CCA175). Gain in-depth knowledge of Apache Spark and the Spark Ecosystem including Spark RDD, Spark SQL, Spark MLlib and Spark Streaming and acquire comprehensive knowledge of Python Programming language, HDFS, Sqoop, Flume, Spark GraphX and Messaging System such as Kafka. Skill-based training modules cover: 1) Big Data Hadoop and Spark, 2) Python for Apache Spark, 3) Functions, OOPs, and Modules in Python, 4) Apache Spark Framework, 5) Spark RDDs, 6) DataFrames and Spark SQL, 7) Machine Learning using Spark MLlib, 8) Spark MLlib - Deep Dive, 9) Apache Kafka and Apache Flume, 10) Apache Spark Streaming - Processing Multiple Batches and Data Sources, 11) Implementing an End-to-End Project, and 12) Spark GraphX. 

Enroll today at: https://fxo.co/9YCB  

Much career success, Lawrence E. Wilson - Artificial Intelligence Academy (AIA)",Python Spark Certification Training using PySpark (CCA175),1598221812
datascience,"A while ago I had data on summary statistics for US census blocks.

It provided descriptive statistics for stuff like income levels, education levels, what industries people worked in, etc.

I can't seem to find it on the internet anymore.  It's \*not\* the polygon shape files of the census blocks themselves, but rather the tables of data you'd link to the polygons.  

Does anyone know where to find this?",Data on US census blocks,1598217387
datascience,"I have a background in business and finance. I am looking to develop data science skills to make better data driven decisions and improving predictive capabilities in the context of financial modelling. Hoping to achieve this all within R/python, which I do not have a background in. Is there any coursera or edx course/s that would help me achieve my goal. I prefer doing a structured/guided course. 

Many thanks in advance!",Need some guidance on business analytics and predictive analytics.,1598215205
datascience,"Hello everyone,

I'm currently learning the basics of Python from the online course, 'Python for Everybody Specialisation' on Coursera. After having a firm grip on the basics, I would like to venture into data science and data analytics any advice on online courses and books will be deeply appreciated. Thanks in advance.",Advice on learning Data Science,1598213946
datascience,,A new Github repo. The vision is an end to end Object Detection API that will run a search at every stage of the algorithmic process.,1598211001
datascience,[removed],Preparing findings and reports for your company?,1598206562
datascience,"Hello. I’m about to receive a masters degree in physics from a top school. I am debating whether or not to continue with my PhD because I am not sure if the academic researcher life is right for me, and so I am thinking of leaving with my masters degree and moving back to my hometown and getting a job in industry while my wife finishes her bachelors degree. 

I have searched online for companies in my hometown that are hiring people with my background, and most of the jobs that seem like they might be interested in someone with my degree are data analysis positions that ask for people with “masters degrees in computer science, engineering, mathematics, or similar disciplines.” Correct me if I’m wrong but I think physics fits here. 

Anyway, at this point in my education I am very good at solving physics problems, and I have some teaching experience and some research experience. My research has been pretty heavy on data but it has mostly been related to electronic data acquisition in physics experiments and a lot of Fourier/spectral analysis. 

So here is my question to you folks: is it likely that a company will hire me for data analysis just based on my physics masters degree from a top school and just teach me on the job? Or do I need to show that I have some additional relevant skills coming in in order to have a chance at getting hired? If so, what are some of these skills that I should be teaching myself in the meantime?

Thanks","Masters degree in physics, need advice",1598206353
datascience,"I am a student from Bangladesh and I am starting my Data Science major in the University of Texas at Dallas. I have been very passionate about Data Science and selected the major with barely any second thought, but now I have a eerie feeling that I might have taken a very bold decision. Taking CS could have been a safer bet and then afterwards focusing on Data Science as a Master's degree much later. However, my gut feeling is still telling me to pursue Data Science as an undergrad. As an international student from Bangladesh, pursuing Master's degree immediately after my undergrad is something I cannot afford financially and thus need a job. Am I taking the right decision in pursuing a Data Science undergrad degree and expecting a job right afterwards (provided that I gain internships and of course necessary professional skills)?   
This is a kid about to make a huge life decision, help me please.",Data Science as an undergraduate degree,1598204070
