subreddit,selftext,title,created_utc
datascience,"Hello all, quick question about Spacy NER. 

Let's say I train a Spacy model to identify brand names, and in the labeled data I am using, the word Apple is tagged as ""brand"", and Amazon is not. But I augmented this Spacy model using word vectors; would this Spacy model be able to extrapolate that Amazon is also a brand, based that Apple and Amazon are similar words, and Apple was tagged as brand in the training data (even though Amazon was never tagged in this same training data)?

I am actually working on a NER model to extract technical keywords out of a document, but there are countless keywords (including SKUs, etc.) so creating a master list of all the keywords is not feasible. If NER won't work for this problem, does anyone have any other ideas?

Thanks!",Question about Spacy NER,1598313365
datascience,I wanted to see one to help plan for my project.,Does anyone have a video of a really good data science capstone presentation?,1598313260
datascience,"Hey folks. I discovered last month that Google Sheets has a scripting language built in (Google Apps Script, not the best name I must say...). At work, we steward the Apache Superset project which lets you create visualizations &amp; dashboards from any SQLAlchemy compatible API. Little known fact -- Google Sheets has a SQLAlchemy compatible API (basically a wrapper around a limited SQL API!).

I had the join of chaining these 2 tools together to make a live-updating COVID dashboard using ""no code"" and writing up the whole process on the company blog!

[https://preset.io/blog/2020-07-27-live-updating-covid-dashboard/](https://preset.io/blog/2020-07-27-live-updating-covid-dashboard/)",Live Updating Dashboard Using Google Sheets / Superset,1598312110
datascience,"Has SQL seen its equal?   
[https://youtu.be/8XmvkYOKqvM](https://youtu.be/8XmvkYOKqvM)

Pandas is in the spirit of hacking and tinkering while SQL is mainly for selecting and maintaining LOTS of data. This video explains A to Z the pros and cons of Pandas vs SQL.",Pandas VS SQL - How to Choose in 2020?,1598311882
datascience,"Hi, I graduated from “MSc. IT on Data Analytics” at the age of 31. Then, I did some internship and discover my love for Big Data and Machine Learning. So, I came to Germany to “M.Sc. Computer Science - Focus on Big Data and Artificial Intelligence” . I will be aged 35 when I finish the program. I passed by 1st Masters with 3.7 GPA and doing excellently in my current masters. But I fear time is running out of my hand. By the time I graduate at 35, I will have no data science or data analyst experience other than some internship. I only have a long PHP web developer experience which I did after my undergraduates. 

So, I fear if my age will bring me disadvantage even to get into an internship or entry level programs. I am going to get older and I fear companies may not see viable to hire 35 year old for intern or entry level program when there are so many younger people. Will the age be dead end for me ?",Is 35 old age to be a data scientist or data analyst ?,1598310729
datascience,I am currently working on a project where I have 8 different tables which are small in size (the biggest table contains 7300 rows and 5 columns). What would be the best way to store this data? MySQL or a CSV file?,CSV vs MySQL as a database for my project,1598310185
datascience,"Hi Reddit,

Finally, I've become a grown-up and recently just graduated from my university.

I come from an MSc in business intelligence and have about one year of experience with study jobs, that is mostly focused on ""front-end business intelligence"". Basically,  that means making dashboarding and working with already ready data.

So, now I just hit an interview with Amazon and I'm pretty impressed that they wanna interview with me even though I lack experience, and therefore I'm here to ask for help.

As you can see in the [Job Posting](https://amazon.jobs/en-gb/jobs/1236454/business-intelligence-analyst-6-month-contract) I pretty much need two years experience and be proficient in SQL. Well, to anyone's information I'm quite confident in everything than SQL. I know for sure, that this job requires a lot of technical skills within data extraction, manipulation etc for business requirements.

And.. I'm pretty sucky in SQL having only had in school and made some basic query. The interview is on Wednesday, and I don't know if I should just try it? They send an e-mail, that said they will have live coding test on me but I basically am scared because I'm terrible at this part.

What's ur suggestion? I have two days to maybe run a data camp for fundamentals of SQL, but I'm unsure if that's enough to consider myself worthy for this position?

Any comments will be appreciated thanks!",Suggestion for amazon interview - need advice.,1598309006
datascience,[removed],What projects should I do for a data analysis role?,1598307596
datascience,I already have a Data Science BS degree but have the option to pursue a second bachelor's in Statistics. The downside to this is that I will likely have to take some private student loans for the first time to pay for it. Any advice would be much appreciated.,Is it worth it to get a second bachelor's in Statistics?,1598307265
datascience,"I have been learning python for about a year now. I just downloaded R to try using Python with [Reticulate](https://rstudio.github.io/reticulate/). I have all of my python packages pip installed in an anaconda base environment named ‘’’base’’’. I am getting everything to work except pandas. It’s the most bizzare thing. 

Here’s my code:

‘’’ {r}
library(reticulate)
use_condaenv(“base”)
‘’’

‘’’{python}
import numpy
Import matplotlib.pyplot as plt
‘’’

This works fine and I’m able to use both packages in RStudio. However, when I try to ‘’’import pandas as pd’’’, I get the error

‘’’ImportError: No Module named pandas...’’’

I most definitely have pandas pip installed in this base environment along with the other two packages. Just to be sure, I double checked by running a pip install for all 3 again. Why in the world won’t pandas work? It’s so frustrating!",Working with Python in R using Reticulate,1598305305
datascience,"So I was granted admission into the UCSD program, but I'm hesitant about enrolling.  

I'd like a heavier focus on statistical analysis and data vis courses in the program, as opposed to the programming/database systems courses.  My background is CS and I've got a lot of technical experience as a software engineer. I was thinking of doing a statistics master's elsewhere, but I'm not too sure about fulfilling the prereqs.  I do have linear algebra and stats from undergrad, and also received a fairly high quantitative score on the general GRE.

I'm also thinking about a change of location from San Diego and don't necessarily want to be locked down here for another 2 years.  I am concerned about having to wait longer to start another degree program or whether I'd get into one - would probably have to look at less prestigious schools since I'm not from a pure math background.","MAS Data Science at UCSD, or a statistics master's elsewhere?",1598303648
datascience,"Hello,

I am working on a project working with monthly sales data. I am running a simple arima  in python from the stats model pack. March-July of this year look a lot like the stock market: huge dip in sales with a full recovery July.

My question is: if I omit the march to July period from the training set, will I run into a lot of problems later when forecasting coming months after this period ?

Intuition says yes and that I should include it but run a transformation of some sort in order to consider the period as a “statistically significant event” and not a new trend of some sort?",Omitting March-July 2020 training a time series,1598301967
datascience,"
Hello, I am a sophomore in college. My school recently started a data science program. It is only offered as a double major. I am interested in analytics, finance and tech so I was going to major in Econ/ data science (this new program)

My concern after browsing this subreddit is that competition for new grads seems to be fierce, and many of you seem to encourage going for a CS degree in case it doesn’t work out. I am interested in working with data and analytics but I don’t want to become a SWE, so I’d like to avoid a major that’s so specialized in that regard. 

I go to a decent school (USC) so I feel fairly confident in my ability to network around LA.

I appreciate any and all advice or input. Be as brutally honest as you like. 

Here is a link to the program: 

https://datascience.usc.edu/academics/bachelor-of-arts-in-data-science/",How do you all feel about data science as an undergraduate degree?,1598301713
datascience,"Hey Redditors,

My life is a bit topsy turvy, though I shouldn't have any regrets 'cos apart from unemployment, I'm pretty happy with my life. Some information about me first, I'm highly creative but I'm also very analytical.  

I graduated with a degree in Biology and Chemistry. Decent grades, not the best, but I didn't want to go to Medical School so I ended up studying some film courses in Hollywood. I ended up having a film career in the Philippines as a second unit director and coordinator. (basically, I work with different groups, and do all the handling of talents and set coordination) A healthy mix of creative input and logistic problem-solving. After about ten years of that (until 2018) I decided I wanted something more stable than freelance work. I moved to New York with my wife. (I'm a US Citizen) and I joined a boot camp for data science.  I got certified in December of last year. My wife has a stable job now (almost a year) and I'm still unemployed. 

I've tried applying everywhere, entry-level, and even unpaid internships.  I have a decent knowledge of data analytics, I've made some personal projects apart from the ones we had to make at the boot camp. So I'm more than qualified for an entry-level job in data analytics, I think. I've had about 2 or 3 initial interviews but that's about it. My resume is basically my 10-year film career, my 3-month boot camp certification, a list of 7 data science/analytics projects, and a decent list of programming languages and computer technicals I can use for the job (Python, machine learning, excel, tableau, etc.) I'm even a member of American Mensa (high IQ society)

My projects are all explained in my data science blog and my git is up to date as well. What am I doing wrong? Should I not mention my previous work in film? I'm 35 now but that shouldn't matter, right?  I'm going for a career change here and I need help getting my foot in the door. Any tips or suggestions?",Career Change into Data. Need help with the job search.,1598299335
datascience,[removed],How do you all feel about an undergraduate degree in data science?,1598296599
datascience,"Hello, I am a sophomore in college. My school recently started a data science program. It is only offered as a double major. I am interested in analytics, finance and tech so I was going to major in Econ/ data science (this new program)

My concern after browsing this subreddit is that competition for new grads seems to be fierce, and many of you seem to encourage going for a CS degree in case it doesn’t work out. I am interested in working with data and analytics but I don’t want to become a SWE, so I’d like to avoid a major that’s so specialized in that regard. 

I go to a decent school (USC) so networking might be possible. 

I appreciate any and all advice or input. Be as brutally honest as you like. 

Here is a link to the program: 

https://datascience.usc.edu/academics/bachelor-of-arts-in-data-science/",How do you all feel about an undergraduate degree in Data Science?,1598296442
datascience,"Hi reddit,

I just got accepted into this program and will start classes on October 2nd. 

Has anyone gone through this program before and willing to speak about their experiences? 

What they liked and didn't like? 

Any peculiar professor quirks to watch out for? 

Anything I should learn on my own that the program doesn't cover or doesn't cover well?

Anything that would help as well.

Thank you",UCSD's Masters in Data Science and Engineering,1598296321
datascience,[removed],"If i want to share interactive plots and graphs with coworkers, are jupyter notebooks really the best way or am I missing something obvious?",1598294202
datascience,"""Meme Monday""

FANG Recruiter after posting a Data Science Role

[https://imgur.com/IawK7nu](https://imgur.com/IawK7nu)",FANG Recruiter after posting a Data Science Role,1598292177
datascience,"Hi all! I am a nonprofit professional who current works as a fundraiser for a public library. I've been working as a fundraiser for seven years, working as a call center representative, call center manager, proposal writer and frontline fundraiser, to list a few. I am looking to move more towards the research and data sides of my industry, which has made me start looking at data science. I don't have much of any background in this and I'm trying to find some kind of introductory course that could help me decide if this is really for me. Do any of you have recommendations?",Want to learn more about data science,1598291791
datascience,"I have been endlessly curious about the Data Science field and hence why I decided to do a masters in it. I came from no computer science background and had only studied marketing in my undergrad. My experience with the master's program was not at all what I expected. It was completely unorganized, unprofessional, and set me up for failure rather than success. 

I have lost a lot of my passion because of this, and because of this experience I have left feeling stupid and unprepared to enter into any role related to data science or analytics in general. After some thought and self reflection, I still would love to pursue a career in data science but I am at a lost now where to begin to prepare myself. I still have a research thesis to finish my degree, in which I don't know where I want to go with it. I was wondering if there is any advice from anyone who has gone through a similar situation, how you dealt with it, where you went from here, tools that could be helpful to get back on track, etc..? Anything would be very much appreciated.",My Data Science master's sucked and now I am lost,1598290958
datascience,"My background: I have a PhD in Physics, which was heavy on the data analysis &amp; Monte Carlo simulations (but in a non-OOP language few have heard of). And I've spent the last 8 years working in finance at a top-tier bank in data engineer / financial analyst combinational role. 

During lockdown I've completed [DataQuest](https://www.dataquest.io/) (highly recommended for beginners) and I've now started planning for the future. With a mix of the professional and personal I'm considering (covid notwithstanding) taking a sabbatical next spring to travel and study. 

Initially I thought a Master's in Data Science was the best option and had settled on applying for the [MSDS at Michigan](https://www.coursera.org/degrees/master-of-applied-data-science-umich). However this would cost $42k and with my current background I think a master's might be overkill anyway. So I'm currently considering taking a year out and aiming to finish all/most of the below in lieu of a masters:  


* Two 'MicroMasters' one at [MIT](https://www.edx.org/course/probability-the-science-of-uncertainty-and-data) (heavy on the Statistics) and [UCSanDiego](https://www.edx.org/micromasters/uc-san-diegox-data-science) (heavy on Python, ML &amp; Spark) - to be clear, I'll do both - approx 1,100 hours of study and $2,750 in total. 
* Several Coursera certificates: - 500 hours in total
   * [Michigan Applied DS](https://www.coursera.org/specializations/data-science-python) \- general overview ML, data mining. 
   * [IBM Applied DS](https://www.coursera.org/professional-certificates/ibm-data-science) \- covers ML with a Capstone project
   * [IBM AI Engineering](https://www.coursera.org/professional-certificates/ai-engineer) \- ML, Apache Spark, Keras, PyTorch, TensorFlow with a Capstone project.
   * Three different courses from deeplearning.ai, which seem to extensively cover [Neural Networks](https://www.coursera.org/specializations/deep-learning?), [TensorFlow](https://www.coursera.org/specializations/tensorflow-in-practice?) and [Natural Language](https://www.coursera.org/specializations/natural-language-processing#courses) processing. 
* There's also a broad Specialization from [HSE](https://www.coursera.org/specializations/aml) on coursera, but at 240 hrs this looks similar to MicroMasters. 
* Finally, I'll probably finish the R module on Dataquest \~30 hours

The above will likely evolve as I learn more. And I'll keep an eye out for worthwhile Kaggle projects (already finished the Titanic project). 

Long-term I may wish to move away from finance entirely, maybe even back to academia. But short-term I might be best placed to attempt to pivot back to finance into a full time data science role for a few years and then decide from there. 

I'd really appreciate any advice or suggestions on anything, but especially; 1. the merits of foregoing a masters over the above. 2. comments on the future plans, 3. Kaggle suggestions, 4. If there's anything on my study list that I've missed (I only learned of PyTorch &amp; TensorFlow 2 weeks ago when I started looking at job listings).",Studying during a year out - advice and suggestions please,1598290882
datascience,"As there has been a big hype/push towards dats science there seems to be a lot of universities offering masters in data analytics and boot camp programs.

Are these programs worth the heavy dollar investments? What is the best way to learn data analytics? I have been taking udemy courses which I find to be helpful. Not sure if the boot camps or masters programs would offer anything better.

Thoughts/suggestions are welcomed",Are masters and/or boot camps worth it,1598290874
datascience,"I am very bad at maths so i wanted to start everything all over again and specifically wanted to start with cal 1,2 and 3 all over again. Before that, i wanted to polish my precalculus and I've chosen Khan Academy for it(please comment if you have other better options) So, do i go over the pre cal topics one by one or start from Calc 1 where if i get stuck on a certain topic, i clear them from the pre cal course. TYI",Do i take the whole precalculus course again?,1598288563
datascience,,Scientists create highly sensitive instruments to detect traces of alien life,1598287879
datascience,,My first post on data analysis! Still trying to learn the math behind it all,1598285754
datascience,,Using Data Science to Find the Funniest Character in F.R.I.E.N.D.S. (TV show),1598285235
datascience,"Hi. I'm interested in learning whether data analytics would be a good career fit for me. Can anyone recommend a good online course, free preferably, that would be great starting point for a novice? Thank you!",Online Course Recommendation for Beginner in Data Analytics?,1598284918
datascience,,"All you Need to Know When Starting a Data Science Career in Media, Advertising &amp; Entertainment",1598283779
datascience,"Data scientist?  What does that mean?  I know many struggle with this question.  Let me try to provide some clarity and thoughts by comparing to other professions.  In this world there are many big industries oil, energy, auto, pharmaceutical, aero, shipping, finance, etc.   just to name a few.   Many other newer businesses too but many new ones are built on marketing like FB.   Each specific company has different data infrastructure, business needs, and problems to solve.    Each company has to make profits.  If they are collecting or trying to collect data then they want to use it to optimize/estimate/predict and make more profits.  Data scientists build capability or products to do this.  

Now we can ask the questions of who is qualified for this work and how much is a data scientist job title worth?
Well what is a financial analyst worth,  what is an engineer worth?   Who can do those jobs?   It all depends on the business.    For these other professions they require accredited schools and some require standard certifications like PE license.  So the qualifications depend on the job and business.  Also,  just because one is experienced in one business doesn’t mean they make big bucks, because their industry may be in a bad time in history.   Many professional engineers in oil industry are cut or making less today.   In finance I am sure big bankers make a whole lot more than little ones and are basically a different profession than little banks due to skill set.  But both are considered financial analysts.  One thing the other professions have learned is their domain expertise, with traditional skills.  Which usually analyzes data already in their jobs.

Data science is even more general than other professions.  I could find a high school student and train them to be a data scientist very cheaply and quickly on some dataset using powerBi.  But they won’t know much about other domains, business, profits, design, coding, and consequences of data decisions.  Most importantly they won’t have domain or business knowledge.  Which they will need to get a good data science job and provide value to business. They could probably find one with some small business trying to analyze their small datasets like at a local library or city govt.  But it won’t pay well, maybe minimum wage.  This would be just a few steps under the large amount of people today getting a BS or just a MS without a thesis.  So the low end will be getting flooded with this type of job seeker.  This is ok since everyone with data wants to profit from it.  But due to accreditation or licenses these jobs will be low pay, not like engineering. 

Now many wonder how do I just get the highest paid job with the smallest amount of education in data science?  This question appears here almost multiple times a day.   The answer is hard,  one can do it with just a no thesis MS but it may not pay well.  It is a continuum, where depending on what you know, and who you know you will be qualified for various roles.  If you have a phd, highly technical, understand business problems, and have personal connections you can work at Google.  If not then it will be more difficult.  

Data science won’t go away but expand vastly.  It will not be taken over by analysts and software engineering but the opposite in prototyping phases.  The pay and people in the field would also expand, making many lower and higher paid jobs.   It will not be a clear distribution of pay, but multimodal,  and average pay will not mean anything.  Many modes of pay.  

So in take away, if you want the best and highest paid job as a “data scientist”,  You need higher education, correct technical skills for a company, understand a company/industry, and know people.   There is no easy route and as always the only path to greatness is putting in the work for years, and networking.   And even after getting all that education, you can still end up not being valuable.  So networking and knowing an industry is critical to getting in the door at a good company and data science role.",Data Science Career Value,1598283658
datascience,"I received a Bachelors degree in Marketing. In the past decade I’ve worked in data related roles (Database Marketing Analyst and Strategic Marketing Analyst). I’m thinking about taking the next step in my career and going for Data Science.

[View Poll](https://www.reddit.com/poll/ifr57b)",What route would you take?,1598282944
datascience,,Dataiku Raises $100 Million,1598282093
datascience,"Hi guys! I have recently published my [package](https://modeloriented.github.io/fairmodels/) on CRAN. The aim of the package is to facilitate handling biased ML classification models. It includes fairness checks, visualizations, and implementations of bias mitigation techniques are included. I would love to hear some feedback from you.    
Additionally, if you are interested I wrote 3 blogs: 

* [part 1: detection](https://medium.com/@ModelOriented/fairmodels-lets-fight-with-biased-machine-learning-models-part-1-detection-6c2786e6c97c)
* [part 2: visualization](https://towardsdatascience.com/fairmodels-lets-fight-with-biased-machine-learning-models-part-2-visualization-66558630a4d)
* [part 3: bias mitigation](https://towardsdatascience.com/fairmodels-lets-fight-with-biased-machine-learning-models-f7d66a2287fc#51d5-9cfbb4743e35)","R package fairmodels: flexible tool for bias detection, visualization, and mitigation in ML models",1598279762
datascience,[removed],How is the data science field doing in Toronto and Canada in general?,1598278146
