subreddit,selftext,title,created_utc
datascience,"I couldn't think of an elegant way to explain the question in the title so hold judgement on it until I explain further with an example.

Many of the data sources I use are estimates. For intercensal population from the Census Bureau as one example, when a new version comes out the source will update the prior year's estimates using the new data. In v2020 population for Springfield in year 2015 could be 1,000. But then in v2021 population for Springfield 2015 might be 1,005. In some cases the changes are so extreme using older data is just not possible. However, most of the time it's minor enough not to change takeaways but rather just to make the results a little different. This is the case with a good number of the sources I use.

I feel bound to use the freshest data possible. The non-technical folks hate this. It means prior materials no longer jibe with new ones and they have to explain it to clients. So I always get pushback on it. There have been a few situations where I simply couldn't convince my boss and had to use prior estimates.

So my question to you, my data brethren: does anyone ever utilize the old estimates in situations like this? Do you think it's defensible? Or are there no circumstances in which you would ever do so?",Do you ever stick with legacy estimates or always use the most recent?,1616000315
datascience,"I've been doing some text analytics work, and am trying out LDA (Latent Direchlet Analysis) as a way of categorizing text into different topics.  I've used it for two sets of survey data, one from local post offices, and one from medical education, and some police report data. Before getting into real data, I ran through some online exercises in R and Python, for sorting chapters of classic books.  (You know, where you get ""20,000 Leagues Under the Sea"", and ""Nemo"", ""Submarine"", and so forth pop out, and ""Pride and Prejudice"", where ""Elizabeth"", and ""Proposal"" pop out, and so on.)

I'm unwhelmed by the results.   For the data sets I'd done topic modeling on by hand, and have a fair amount of domain knowledge.   I've played with varying parameters, but had a fairly clear idea going in what a 'reasonable' number of categories would be.

The category clusters use common words, but I can't think what the clusters are supposed to represent, even when I go back and look at the quotes that best match those categories.   For example, with the post office one, you'd think ""Damaged stuff"", ""Late Mail"",  ""Missing Items"", or ""Like my Mail Guy"" would come out, but I can't go from the word clusters suggested by LDA to any of these obvious categories.  In the medical stuff, one concept that gets mentioned a lot is ""Broken Arm Syndrome"", and I find that ""Broken"" and ""Arm"" appear in different clusters.  (There's nothing else in this data set related to ""Broken"" or ""Arm"" separately).

I'm wondering if text size is the problem.  While the corpus size is at least 10k's of words, and \~1M in some sets, the individual quotes are almost all &lt;100 words, with some only a few.  Could that be the problem?   Those of you who have some experiences with real data sets and LDA, could you confirm or deny whether you've been successful.  I'm best in R, but I've done some work in Python and SAS Viya also, and done LDA in all of them.",Text Analytics &amp; LDA Topic Creation -- Any success stories?,1615999426
datascience,"When doing agglomerative clustering, I draw the dendrogram (https://imgur.com/a/PhMCMlJ). You have to choose how high to draw the single cutoff line.

But sometimes (the image linked) I'd like to draw lines at different heights: at one height there is a clade that is clearly just one big cluster. But then another clade clearly in has sub-clusters, but there is no single horizontal line that will resolve things neatly. Agglomerative clustering can't handle these cases. Is there a technique that can?",Clustering conundrum: in agglomerative clustering I often find clusters with clear sub-clusters that a single criterion can't resolve. How to handle this?,1615999346
