subreddit,selftext,title,created_utc
datascience,,What is the name of your team/department?,1616983937
datascience,"Howdy friends,

I've got a few questions for the kind folk here, who seem to always be ready to answer the questions that I've proficiently searched.

I'm a 20-something who hates my life and job (no surprises) but recently got back into data science after doing a lot of STATA/R in university. I couldn't find a job or anything remotely technical where I currently live (Singapore) and didn't bother to learn SQL which seems to be the ticket here.

I'm just about to r/iwantout once I finish my bond of service to my Singapore university and I'm looking to get back into what I always wanted to do: public policy and data science. 

There is an abundance of very expensive, very nice MPPDS (and other funny names) in the West, mostly looking at CMU, GT, USC etc. but I'm not too interested in names or prestige as compared to finding a course with a strong Asia focus. I'd rather study where I intend to work afterwards (excluding Singapore as the public policy schools are more mid 30s clubhouse simulators) but I really cannot find anywhere with a solid DS foundation and a public policy focus in the region. 

Potentally looking at CMU Adelaide, perhaps Australia but wanted to know if I'm missing something. Asia loves MBAs and other Master's which are not interesting to me. Alternatively, are there any good schools abroad with a fair Asia focus? I'm definitely returning after my studies to the Asia region, though I'd honestly be willing to go anywhere if it fits. My area of interest is in media analytics, propaganda detection and public opinion.",Data Science &amp; Public Policy - APAC?,1616983295
datascience,[removed],Advice for New Data Science Manager,1616981929
datascience,[removed],Currently working as a data scientist but want a career change,1616978186
datascience,[removed],BS physics to Data science suggestions??,1616976851
datascience,[removed],Undergrad Physics to Data Science,1616976504
datascience,"Hey everyone, I'm strongly considering the degree plan described in the title. I think working as a bioengineer would be really cool, but since this field is relatively limited as of now, it's important for me to have some backup careers. I have data science in mind as a backup, and I had either the choice of a CS minor or a statistics minor to add -- however, the CS minor is basically off of the table due to how much work it would be, and I want to know if it's possible to get a solid background in data science with the statistics minor.

For reference, I would take bioengineering electives that are more computational in nature (classes where we learn computational biology methods, biostatistics, and bioinformatics/biological data mining) and my statistics classes would cover basic statistics (and an intro to R), intro to probability, computational statistics with SAS, and a machine learning class. Just from this rough summary, does it sound plausible that I would get a solid background in data science from this degree plan, and would I be decently competitive for data science jobs in case the whole bioengineering thing doesn't work out? Thanks so much!",Would a bioengineering major + statistics minor allow me to have data science as a possible backup career?,1616973588
datascience,"Hello! I am a person who could finally afford college/realize want I wanted in my 30's, so I have been working full time and pursuing an associates at my community college. Originally I was going for a certificate in database programming, but after speaking with my advisor I realized my favorite part at whatever job I was was creating spreadsheets and extrapolating data given from my place of business so I am now finishing up an associates in business analytics. My only question is does this really do much for the world of becoming a data analyst? I am doing some side volunteer work with a local program for SQL/R and Machine Learning and I am really enjoying it! I just don't know if anyone knows what an associates in business analytics would even get anybody, but at least I am content knowing a path I want to pursue. Also, I'm tired of being a retail manager, haha.",Does anyone ever consider an Associates?,1616968727
datascience,[removed],How do I calculate the accuracy for graph mining in terms of (top 1%)?,1616967818
datascience,[removed],Data visualization Python,1616967031
datascience,"I hear that Python has such a simple syntax, but that the way R organises data tables is much more akin to the way one thinks about data in Excel.

Unfortunately my job is locked down to Excel as the way to present data, but I'm looking for the programming language that is (1) more intuitive to learn for an Excel user and (2) better at interacting with Excel. Any input?",Is R or Python more intuitive for an Excel user?,1616963556
datascience,Can some recommend good books/tutorials on inferential statistics for data science?,Inferential Statistics,1616962444
datascience,[removed],Need help proposing a different kind of hybrid work schedule,1616961794
datascience,"Recently, I have been very much interested in hypothesis testing, primarily in the context of A/B testing now that I started working as part of a product-oriented team.   
There are some well-known textbooks like those by Hogg and Craig, Wackerly, All of Statistics by Wasserman, Casella &amp; Berger, but those are rather academic in nature and hypothesis testing is not covered in detail.   
For example, there are so many aspects of tests in the wild that you can think of like what is the rationale behind the choice of a particular test when your sample is small/large, the distribution is normal/non-normal, whether it makes sense to use bootstrap or permutation testing. 

Surprisingly, I haven't even seen the derivation of the sample size necessary for an A/B test to detect some delta difference. 

Do you know any great books with a focus on such applied aspects?",Do you know any good applied statistics books?,1616961769
datascience,[removed],Should a data scientist know how to write models from scratch?,1616961369
datascience,"I am looking to move into the data science/analytics field. I studied finance and statistics in college, but I have very little coding experience. I dabbled with SAS and R in my statistics courses, but I'm not proficient. What are the best resources for getting my toes wet in this field? And what languages should I focus on learning? Any tips would be greatly appreciated!",Getting Started,1616959096
datascience,,Ranking companies in Bangalore using Glassdoor ratings and Confidence Intervals,1616958763
datascience,"Hey guys,  im interested in learning more about forecasting and wanted to see what you guys thought were good materials. Im looking for something that has theory, but also has applications with code

I have already gone through Rob Hyndman's book : [https://otexts.com/fpp3/](https://otexts.com/fpp3/)And I was interested in getting this book: [book](https://www.amazon.com/gp/product/0387759581?pf_rd_r=XZSN0VESWAHXVM4QE4ND&amp;pf_rd_p=5ae2c7f8-e0c6-4f35-9071-dc3240e894a8&amp;pd_rd_r=d1e17686-94d7-444a-af05-900a56991faa&amp;pd_rd_w=si5uO&amp;pd_rd_wg=3nhB9&amp;ref_=pd_gw_unk)

If you guys had any recommendations do let me know. I mainly work in R but am fine with python. Also are there any good books on bayesian time series or materials on bsts/python?",Good books/resources for forecasting,1616957203
datascience,[removed],Best undergrad major for data science?,1616954496
datascience,"For those that are still working remote, how has your WFH setup evolved over the last year?

I'm currently using a work-provided 16"" MBP with a single 27"" monitor. The monitor has a built-in KVM which makes it easy to swap between my work laptop and personal desktop, but the screen real estate is a bit lacking. I'm curious to see what setups /r/datascience use to maximize productivity.","After a year of remote work, what does your WFH setup look like?",1616953267
datascience,"I want to (commiserate) hear about your terrible interview experiences. Here’s mine that happened a few weeks ago:

I saw a job posting for one of my most watched companies and it was for a job that was an exact mirror of my resume. I had work experience, academic research, and personal projects done in the exact area (and oddly specific tech stack I had worked in). I applied on Day X, they emailed me on Day X+1 to set up an interview for Day X+2. 

I was scheduled for a 45 minute phone call to go over the usuals + some technical stuff. The interviewer called and started off the conversation by saying how they contacted me as soon as they read my resume. On the first “tell me about yourself” kind of question I stuttered really bad (I have a usually mild speech impediment but it is worse over the phone) and the interviewer’s tone immediately changed. I didn’t think this was going to be a problem because I briefly mentioned this in one of my emails giving them advanced notice. The interviewer basically was like “if you don’t have anything else for me I think that’s fine.” and ended the call after 4 MINUTES. It was a 4 minute phone call that was supposed to be 45.

I received the rejection email a little later.

Just very disappointed as this was a company I had built up in my mind and a place where I really could have added value. I will be okay as there are lots of other opportunities for me, but I was just very upset following this. 

Has anyone else had a similar experience or any advice to offer up? Really not looking for sympathy as this is not a new thing and I will absolutely be more than okay in my career, but just wanted to hear from others about their bad interview experiences.",Disappointing Interview Experiences,1616952528
datascience,"I would like to showcase something I worked on a while back. It's a Python implementation of the DenStream algorithm ([https://archive.siam.org/meetings/sdm06/proceedings/030caof.pdf](https://archive.siam.org/meetings/sdm06/proceedings/030caof.pdf)); the algorithm is based on DBScan but for streaming data (i.e. you don't acquire all the data at once during training but iteratively).

The implementation can be found here: [https://github.com/MrParosk/pyDenStream](https://github.com/MrParosk/pyDenStream)

If you have any feedback please let me know!",Implementation of DenStream,1616950494
datascience,[removed],Columbia MSDS vs Cornell Tech MEng ORIE,1616950238
datascience,"R based software for basic data analysis that I built with simplicity and speed in mind. Wrangle data, run linear regressions, plot, etc. Give the tutorial a try and let me know what you think! I am curious to hear feedback on whether this software would be useful, what features should be added, etc.",Simple and elegant software for data science,1616949203
datascience,,Did anyone finish the Data Science Certificate from Waterloo University? If so how was your experience?,1616948356
datascience,[removed],Causal inference in data science and economics,1616946223
datascience,[removed],I'm thinking of starting a data science firm,1616945946
datascience,"I'm currently working on a data joining project fuzzy matching names for joining purposes. I am curious if anyone has any experience with distance measuring techniques or phonetic codes for such context. From what I understand, distance measuring--maybe a two pass algorithm using Levenshtein and Jaro-winkler--might be accurate, but computationally expensive. I've never used phonetic coding before, so I don't know how effective it is. Also, if anyone has any other tools/suggestions I would be very appreciative. Using R at the moment.",Fuzzy name matching - distance measuring and phonetic codes,1616945191
datascience,[removed],Causal inference,1616943708
datascience," I fitted an ARIMA model to a time series. Now I would like to use the model to forecast the next steps, for example 1 test, given a certain input series. Usually I find that fit.forecast() is used (as below), but this forecast works on the series it was used for fitting, while I want to get the forecast for a completely new series. 

 

    from statsmodels.tsa.arima.model import ARIMA model = ARIMA(series, order=(2,0,0)) 
    fit = model.fit()  
    forecast = fit.forecast()[0] # this forecast the next value given the last 2 step in 'series'",Forecast with ARIMA model with python using unseen data instead of training data,1616941495
datascience,"I'm a 21 year old senior graduating in a couple of months, and feel like I'm beyond saving. Started college with a communications degree my first two years because I was not sure of what I wanted to do, then switched to pursue a BS in Data Analytics at the start of my Junior year.

The first semester and a half of my degree was fine. I was introduced to Python, SQL, and a bunch of concepts in the field. Pandemic hits and we switch to a terrible remote learning model. Our professors were already hit or miss, but this just made things much worse second semester. I managed to get an internship as a Junior Data Analyst in the summer following Junior year, but very little to no coding was done. I was basically handed task and told to create infographics while cleaning data from huge excel sheets I was given. Around this time my father died, and my focus around the internship dwindled as I had to take some time away. 

Fast-forward a bit to the beginning of Senior year and everything is still remote. Classes still were not organized well, professors were terrible, and I was not learning anything. Just kind of did the work for grades and moved on. I spoke to other students in my field and they agreed that they felt as if they met no requirements to begin work. 

I chalked it up to bad timing in being a student during the pandemic, and turned my attention to grad school. I go to school in New York and my school offers a Data Science Masters degree, so I thought I'd do that as it's still a field of interest. After doing some research in my school's Data Science MS degree, I realized how fucked I am. Not only are the professors bottom of the barrell based on student reviews, but the prerequisites are some things I haven't touched since last being in person or before that. I am familiar with a ton of different terms within my area of study, but can by no means give you a proper run down on them. At this point I should be super comfortable in my understanding with some elements of probability and statistics, but I'm just not. I should have all the fundamental knowledge of Python and SQL, but I just don't. In fact, I can't even put it on my resume anymore because I essentially forgot everything. 

I've been going on too long and am losing focus of the initial purpose of this post, sorry. What do you think my options are? I have close to a 4.0 GPA in my major, 3.5 GPA overall, but it's not reflective of the information I currently hold. I want to try and transfer to another program since the professors here are universally described as below average, but I feel like there are other areas of concern I need to address first such as having a plan. My initial goal was to work with a sports franchise in some facet by working with data, but I'm a complete and utter joke to the job market right now; and I'm scared if I enter Grad school I'll get punched in the face. Thanks in advance.",About to graduate and am sick to my stomach about how little I know.,1616934235
datascience,"Welcome to this week's entering &amp; transitioning thread! This thread is for any questions about getting started, studying, or transitioning into the data science field. Topics include:

* Learning resources (e.g. books, tutorials, videos)
* Traditional education (e.g. schools, degrees, electives)
* Alternative education (e.g. online courses, bootcamps)
* Job search questions (e.g. resumes, applying, career prospects)
* Elementary questions (e.g. where to start, what next)

While you wait for answers from the community, check out the [FAQ](https://www.reddit.com/r/datascience/wiki/frequently-asked-questions) and [Resources](Resources) pages on our wiki. You can also search for answers in [past weekly threads](https://www.reddit.com/r/datascience/search?q=weekly%20thread&amp;restrict_sr=1&amp;sort=new).",Weekly Entering &amp; Transitioning Thread | 28 Mar 2021 - 04 Apr 2021,1616932830
datascience, I want to learn statistics used in Data Science applications. Could anyone provide me some free resources to do so? Thanks,Want to learn statistics.,1616929568
datascience,"I have my own corpus of text indexed by date time.

I wish to generate Google Trend-like index based on this corpus.

Maybe for simplicity, I just want to avoid dealing with more complex issues like synonyms, etc. 

Are there some good references on building these indexes?

Thanks",What are some methods to build Google Trend-like indexes?,1616925642
datascience,"Link to VentureBeat article here, which suggests it's own reasons... but most seemed fairly generic 

[https://venturebeat.com/2019/07/19/why-do-87-of-data-science-projects-never-make-it-into-production/](https://venturebeat.com/2019/07/19/why-do-87-of-data-science-projects-never-make-it-into-production/)

An other similarly bleak article - behind a paywall though :/

[https://sloanreview.mit.edu/article/why-so-many-data-science-projects-fail-to-deliver/](https://sloanreview.mit.edu/article/why-so-many-data-science-projects-fail-to-deliver/)","A VentureBeat article said 87% of Data Science projects never make it to production. 1 - What are examples of work that was put into production at scale, AND has resulted in big commercial gains (e.g. &gt; $ 1 - 5 million / year)? 2 - Why do you think most DS projects don't make it to production?",1616925411
datascience,"Long story short

Was never the best student (managed to barely scrape an undergrad in business)

Got an okay job at company that finances car loans/leases

Was fairly handy with excel, vba and sql and so the company game me some work with their reports (automating them, running them, and doing adhoc requests that involve pulling data from our warehouse using SQL) stuff of that nature 

thought I might try my hand at analytics to get a better job (and I'm currently pursuing a Post Grad certificate in the subject)

basically I figured that I could get a post grad education during the pandemic (when i'm working from home and everything is online) and I wouldn't have to leave my job

there's one problem though I HATE USING SAS, I just straight up hate it, I can't get a feel for the program, its not intuitive and i'm struggling a lot in my classes 

I think I'm still going to pass the program but I know i'll have to learn SAS on my own afterwards and i'm absolutely dreading it, 

is SAS even relevant anymore?",is SAS still worth the trouble,1616914909
datascience,"I wanna be done with college already but if a PhD opens up significantly more opportunities and income, I might consider that. Does it though?",I’m doing a statistics bachelors right now that will end with a coterminal MS degree in data science. Should I pursue a PhD instead?,1616912528
datascience,"I am looking at trying to make much more ""attractive"" data visualizations (using R software). I came across articles like this that tend to show you the capabilities of data visualization : [https://www.royfrancis.com/elegant-scientific-graphs-learning-from-examples/](https://www.royfrancis.com/elegant-scientific-graphs-learning-from-examples/) 

These graphs look amazing - I tried to search online for tutorials that show you how to replicate these kinds of graphs ... but all you end up seeing is how to make the basic graphs (nothing wrong with that), but nothing which allows you to make it ""pretty"" (e.g. all the fancy labels, blocks of text, cool colors, etc.). At this point, I am starting to think that some of these graphs might have been created with advanced software such as photoshop, and not so much using python and R.

Does anyone have any ideas about this?

Thanks",At what point does data visualization require photoshop?,1616910311
datascience,,"Practice coding for data science and machine learning tech interviews online, for free",1616904292
datascience,"I am a sophomore industrial engineering major and business administration minor looking to improve my skillset in data analytics. I am thinking about doing a masters in business analytics. What programs should I learn first? Python? R? SQL? others? 

Please let me know! Also include how do you prefer to learn new languages?",Best software to learn for a beginner?,1616898273
datascience,"I actually didn’t know vs code had a pretty slick jupyter plugin. Installed a few libraries like nltk and sklearn. Running vs code from my raspberry Pi and I use a PWA to access it. Then added Jupyter and did some python coding. Here is a short video that shows how to set it up. Hope it helps 

https://youtu.be/FjFDZBMgeVQ",Jupyter Notebook on iPad,1616891179
datascience,,Manual GAN Evaluation,1616891046
datascience,"I apologize for the confusing title, I am very bad with those. 

I have Healthcare data that I have organized into sequences of Diagnoses embedded with the dates these Diagnoses occurred for each patient. 

I was wondering what kind of model I should use to predict the number of days until a specific Diagnosis, based on the input of a new patients sequence of diagnoses. 

The data I have is organized as 
PatientID, [Diagnoses sequences leading up to major diagnosis], [delta of days between each of the aforementioned Diagnoses], Age, and Sex. 

The input I would have is a patient who has [Diagnosis A1, Diagnosis C5, Diagnosisj G4],[12 days , 44 days, 0 days]

The output I would want to get is an estimate of the number of days until this new patient would be diagnosed with Diagnosis XX.

If anyone could point me in the direction of a similar project or has any suggestions they would be greatly appreciated.

Thank you!",What type of Model to use to predict Days until Major Event based on input of sequences of events?,1616890479
datascience,Why/why not?,Does it make sense to perform best subset selection before a gradient boosting tree?,1616888211
datascience,"Hi guys!

I'am currently writing my thesis, which is about predicting the upselling of a certain product. I have got very nice results, however because i'm studying marketing and writing this thesis under ""marketing strategy"" so my consultant said that it's not enought to write about how i made this model and i have a nice recall and precision i have to talk about why this is good for the marketing strategy, the certain industry and what are the main factors influencing upselling. I mean i know that i can check what were the #0-1 lvl splits and candidates in the trees, but that can change with each iterations. So my question to u guys who might have done something like this: What would u write, present for the chief marketing officer?

&amp;#x200B;

Thanks for ur time and your answers in advance!",How to interpret the results of a random forest model for marketing strategy?,1616886451
datascience,"I've sometimes wondered what I would actually do if I came across a discovery like this, it's not like I can just send Elon Musk an email.

What would you do?","If you made a huge discovery to improve AI (e.g. Self-Driving cars), what would you do next?",1616880310
datascience,"[www.windts.app](https://www.windts.app/)

R based software for basic data analysis that I built with simplicity and speed in mind. Wrangle data, run linear regressions, plot, etc. Give the tutorial a try and let me know what you think! I am curious to hear feedback on whether this software would be useful, what features should be added, etc.",Simple and elegant software for data science,1616880045
datascience,"I have an internship interview for a Data Scientist position approaching. It's gonna be a 1-hour live event; I'll be given a dataset and required to perform an EDA, and complete a supervised learning task. I don't know what kind of project to expect and I'm afraid to come unprepared. Should I expect something similar to Kaggle-style tasks? Or, in your experience, have you been given a task that you had never done before (say, some NLP task, or may be learning-to-rank)? What should I prepare aside from the standard classification and regression approaches?",Data Science internship interview. Need advice,1616879487
datascience,"tidyquant is very well documented as long the theme is about package based data. At the moment I got a file of prices (.csv) and imported that as tibble to tidyverse. Now I'd like to mutate these prices to stock returns using a similar formula:

stock\_returns\_monthly &lt;- stock\_prices %&gt;%  group\_by(symbol) %&gt;%  tq\_transmute(select     = adjusted,   mutate\_fun = periodReturn,   period     = ""monthly"",   col\_rename = ""Ra"") stock\_returns\_monthly

I'm new and completely clueless. I loaded the csv (tibble 370 x 1,300) but don't know how to proceed with the next steps...

maybe one of you guys might walk me through this...","calculate returns from a .csv using tidyverse, tidyquant respectively",1616875826
datascience,,Thoughts on AI in Data Privacy??,1616001012
datascience,Are there any apps for example that collect data and let you download it about yourself?,Everything collects data about you. Where are some easily accessible datasets about yourself?,1616000642
