subreddit,selftext,title,created_utc
datascience,Does anyone know any library where we can plot big geo data without lagging issues?. I googled it but all I got this useless towards data science pages where people try to plot data with 50 rows. I'm learning plotly at the moment but geo plotting 100k location values seems too laggy. Any suggestions?,Plotting Big Geo Data,1588958347
datascience,,Key &amp; Peele - Data Science Edition,1588957588
datascience,"I work at a small, grassroots nonprofit youth center that provides afterschool and summer camp programming to middle school students in the inner city. I was hired on full-time as their ""Data Analyst,"" however, they had no prior systems, databases, or even spreadsheets, so I inevitably ended up becoming a one-man data team (which I actually am enjoying).

I built a small system of google sheets &amp; forms to collect our student data (attendance, grades, behavior, etc), volunteer data (attendance, skills, etc), and program data (performance evaluation), but I would like to migrate to a more centralized solution that is scalable. The organization plans on scaling and replicating this model around the city, so it would be ideal to have a scalable, replicable data system to accommodate that goal.

My question is this: Are there any open-source/low-cost solutions for building a network of automatable data systems to fit this use-case? Something like a cross-platform app that we can read, write, modify, and delete data with and store in a sort of simplified document system like JSON or Firebase. Since I don't plan on staying here forever, I'd like to build it so it can be used by someone with any level of proficiency in programming.

I welcome any collaborators or advisors, and I'd love to work together to figure this out for a great organization that does great work for the community.

Thanks for reading :)","Designing a Small, Scalable Data Pipeline on a Budget",1588956993
datascience,"This tutorial will cover the fundamentals and some advanced techniques for creating an application to analyze and visualize a variety of data sets. 

[https://www.education-ecosystem.com/dev\_zero/RrYjq-python-data-analytics-and-visualization/6pQqV-data-analytics-and-visualization-with-python-10/](https://www.education-ecosystem.com/dev_zero/RrYjq-python-data-analytics-and-visualization/6pQqV-data-analytics-and-visualization-with-python-10/)",Python Data analytics and visualization,1588955111
datascience,"Starting off by acknowledging that yes, I’m sure it depends mostly on the industry, company, and specific position, if I’m not mistaken.

However, so far under my belt, I just have the basic t-test concepts like one sample and independent samples. I also know about z-tests for proportions and such, but haven’t had to utilize it in a while so might have to revisit that. 

I see a lot of linear regression being somewhat of a standard in a lot of data analyst/scientist requirements, but wanted to see if there was some order to learning some other statistical analyses that would make my progression in the statistical side of things more fluid and easiler to grasp and retain, rather than jump to higher level stuff that might be way over my head for now. I don’t come from a solid background of statistics at all, so the t-tests and z-tests also gave me a headache when I was first learning it. 

But also at the same time, this post serves (or at least I’m hoping it does) as a way for me to understand what statistical analyses/processes might be more relevant so I don’t waste time learning something I might never use or is out of my league. 

I don’t know if this helps, but I’m interested in either going the business analyst route or the marketing analyst one; but more leaning towards business analyst.

Appreciate and input on the matter, thanks!","(Need advice) In your opinion, what kind of statistical analyses should I be learning next, as a Data Analyst?",1588953989
datascience,,Augmented analytics: Are you ready?,1588942270
datascience,"I have an engineering background and work experience limited to project management. I studied Machine Learning and Data Analytics in my free time mainly through reading books and tried my hands on some projects that may or may not were successful.

I dont have a lot of success in getting interviews for entry-level data analyst roles and can't get face-to-face interviews. I dont want to be confined to studying textbooks for years to come. This got me to the question that maybe I could get some reputable certifications or achievements on my resume so that I can get a chance to get a data analyst job.

I saw people on LinkedIn posting their Coursera, Udemy, etc. certificates. Are these actually helpful or just a waste of time? I know for sure that the LinkedIn certificates are crap. Do you have any other ways to makes professionals of the industry be interested in at least giving me an interview?","Besides private projects, what can I do to indicate in my resume that I am qualified for a Data Analyst role and get to a face-to-face interview to prove it?",1588939168
datascience,,6 Legitimate Websites for Your Overseas Job Search in 2020,1588933840
datascience,"Hi /r/datascience,

I have a problem I'm working on where, for each row of features, I want to predict *two* binary output variables, y1 and y2. At the moment I'm predicting these independently (using sklearn's Multiple Output Classifier). However, I know that y1 and y2 are somewhat correlated. Are there any techniques that I can use that take advantage of this correlation to improve the accuracy of y1 and/or y2?",Multi-output prediction with correlated outputs?,1588933833
datascience,,Integrating systems thinking and data centric solutions,1588932695
datascience,"I've been contacted by Amazon for the first time ever for a data scientist role. I cleared the first behavioral round and they told me next one will be a 1hr technical phone screen.

They said ""you decide when you're ready while you brush up your tech skills and let us know when you want to schedule it for"".

Since I have no experience with interviewing with big firms, how much time should I give myself to study? Is 3 to 4 weeks reasonable or would that piss them off and make them question me as a candidate?

There will be questions on ML model I worked on, model evaluation, and stats theory on probability and a problem solving question where I will have to explain my thought process of building a model for a given case.

Would really appreciate your advice. Thanks!",How long should I give myself to prepare before scheduling my DS tech interview with Amazon?,1588927583
datascience,,SQL JOINS tutorial | Learn SQL Online for beginners | harisystems,1588925861
datascience,"Hello guys, I know that I should not ask this kind of question here but still, I don't know where to go:

I am a Junior year UG in a college in India. I am proficient in both App development and Machine Learning. I need to earn around 150USD before 2nd July due to some personal reasons. I lost my internship due to the COVID'19 pandemic. Can you guys suggest me what should I do? Where should I ask these questions? 

Thanks",A really stupid question to ask here... but.,1588925241
datascience,"I’m a Statistics major (Junior) with a decent understanding of Python, SQL, and Tableau. I attended a couple Data Science internship interviews and bombed the ML portions so badly that I had to apologize to the interviewers for wasting their time. I have a decent grasp of the Mathematics and coding required for ML and predictive modeling, but have no clue where to actually start learning it.

To make things worse, my school’s Stats curriculum doesn’t have any ML related courses and the internet has way too many resources and recommendations to the point where it’s extremely overwhelming. Any advice or pointers would mean the world to me. Thank you!","Stats majors turned Data Scientists, how did y’all learn machine learning and predictive modeling?",1588918593
datascience,"I’m a Statistics major (Junior) with a decent understanding of Python, SQL, and Tableau. I attended a couple Data Science internship interviews and bombed the ML portions so badly that I had to apologize to the interviewers for wasting their time. I have a decent grasp of the Mathematics and coding required for ML and predictive modeling, but have no clue where to start actually learning and applying ML. 

My school’s Stats curriculum doesn’t have any ML related courses and the internet has way too many resources and recommendations to the point where it’s extremely overwhelming. Any advice or pointers would mean the world to me. Thank you!","Statistics majors now Data Scientists, how did y’all learn machine learning and predictive modeling?",1588918010
datascience,"This is going to come off as salty. I think it's meant to? This is a throwaway because I'm a fairly regular contributor with my main account.

I have a masters degree in statistics, have 12+ years of experience in statistical data analysis and 6+ in Machine Learning. I've built production machine learning models for 3 FAANG companies and have presented my work in various industry conferences. It's not to brag, but to tell you that I have actual industry experience. And despite all this, I wouldn't dare call myself an ""AI Expert"", let alone ""AI practitioner"".

I recently came across someone on LinkedIn through someone I follow and they claim they are the ""Forbes AI Innovator of the Year"" (if you know, you know). The only reference I find to this is an interview on a YouTube channel of a weird website that is handing out awards like ""AI Innovator of the Year"".

Their twitter, medium and LinkedIn all have 10s of thousands of followers, each effusing praise on how amazing it is that they are making AI accessible. Their videos, tweets, and LinkedIn posts are just some well packaged b-school bullshit with a bunch of buzzwords. 

I see many people following them and asking for advice to break into the field and they're just freely handing them away. Most of it is just platitudes like - *believe in yourself, everyone can learn AI, etc.*

I actually searched on forbes for ""AI Innovator of the Year"" and couldn't find any mention of this person. Forbes does give out awards for innovations in AI, but they seem to be for actual products and startups focused on AI (none of which this person is a part of).

On one hand, I want to bust their bullshit and call them out on it fairly publicly. On the other hand, I don't want to stir unnecessary drama on Twitter/LinkedIn, especially because they seem to have fairly senior connections in the industry?","I'm sick of ""AI Influencers"" - especially ones that parade around with a bunch of buzzwords they don't understand!",1588916694
datascience,[removed],INTO HOW MANY TYPES STRUCTURED DATA CAN BE CLASSIFIED?,1588915894
datascience,[removed],"Hi, I'm an undergrad International Relations major looking for something to fill my time now that classes are over and I'm still stuck at home",1588913337
datascience,,Deploy Machine Learning Pipeline on cloud using Docker Container,1588909053
datascience," 

Hello, I am a junior BI Engineer with 1 year of experience. I have been trying to switch career data analytics, but most jobs require 3-5 years of experience... and it's not like CS jobs where I can make a great project to impress the recruiters. I have been studying Tableau and got certified, working on a significant case study, and learning JavaScript for basic web development. I also have several AWS certifications.

Honestly, I am not sure if there is anything I can do this time. I am not expecting the economy will recover until the summer of 2021, and the job market in Canada is way worse compared to US/UK. Luckily my parents can still support me, but I want to make the best out of it and come out strong.

Doing more projects won't help sadly, since most data science jobs require MS. To be competitive for data analytics, I even thought about passing CFA level 1 because I have seen quite a few risk data analyst jobs that use a lot of Python, SQL, Tableau, R. But it is a huge commitment and costly.

How do junior BI Engineers get a job in data analytics?",BI Engineer to Data Analytics,1588908091
datascience,"Hello Folks,

I see Udemy is giving a huge offer on the data science courses, it is around 97% discount on most of the courses, are these usual offers of specific to this lockdown situation?

Please advise so I can grab the opportunity.",Regarding Udemy Discount,1588906336
datascience,"Need a python data analytics assignment done, Willing to pay.",Need Python Data Analytics assignment done,1588906234
datascience,"Hi,

I am someone who currently has no formal education in data science - I have a a bachelor degree in accounting, and am currently working in public accounting. I am a CPA, but am looking to enter the world of data science. Do I need to go back to school? Or what would be the next steps you would recommend?

&amp;#x200B;

Thank you!",Looking to enter Data Science,1588906084
datascience,"Hey y'all. 

I am a graduate student currently at the end of my master's program in HR management. I am currently interested in becoming an HR Data Analyst/Scientist but don't have much of the math/engineering background. Over the past few months, I've spent my time studying stats, mathematics, and programming (Mostly Python and a bit of R). But I've been teaching/refreshing myself these subjects through the means of free online sources (e.g. Khan Academy) as well as a few courses on Udemy/Coursera. I'm also planning on learning SQL, Tableau, and Power BI. 

I wanted to know if what I'm investing my time in will lead to results, as I'm sure that my profile wouldn't be as preferable to that of someone with formal education.

I've basically set my mind to get into the field of HR analytics but was looking for some reassurance or to see if someone is/was in a similar situation. I would like to hear some words of advice or anything that I can do to further improve my chances of getting into the field.",HR Graduate student seeking a career in Data Analytics/Science,1588903464
datascience,"Hey y'all. 

  
I am a graduate student currently at the end of my master's program in HR management. I am currently interested in becoming an HR Data Analyst/Scientist but don't have much of the math/engineering background. Over the past few months, I've spent my time studying stats, mathematics, and programming (Mostly Python and a bit of R). But I've been teaching/refreshing myself these subjects through the means of free online sources (e.g. Khan Academy) as well as a few courses on Udemy/Coursera. I'm also planning on learning SQL, Tableau, and PowerBI.   
I wanted to know if what I'm investing my time in will lead to results, as I'm sure that my profile wouldn't be as preferable to that of someone with formal education.

  
I've basically set my mind to get into the field of HR analytics but was looking for some reassurance or to see if someone is/was in a similar situation. I would like to hear some words of advice or anything that I can do to further improve my chances of getting into the field. Thanks in advance :)",Am I wasting my time?,1588902472
datascience,,Data Science Job Search Tips During COVID-19,1588899452
datascience,"I have taken data structures and algorithms already, would taking a class about programming paradigms be helpful? It is not necessary but recently have been interested in it 
thanks!",programming paradigms ?,1588897696
datascience,[removed],The Humans of Ai Podcast: Damian Brady - The emerging field of MLOps,1588897612
datascience,[removed],Resume/Qualifications Critique: Data Analyst Position,1588894942
datascience,"My clients are some of the least technical people I’ve encountered. The whole process of getting them excited about this was not pleasant.

It got me thinking, how would other data scientist go about doing this.",How do you explain the benefits of a ML driven customer segmentation?,1588894721
datascience,[removed],Undergrad Tips,1588894012
datascience,,Lessons from a Year in the Data Science Trenches (2019),1588893612
datascience,[removed],Dynamic programming - minmax partition problem,1588890462
datascience,"Hi all!

In a couple of weeks, I’ll be joining a firm as a data analyst intern. I’ve taken related courses that acquaint me with the concepts, but I’ve never really worked hands-on in a data analysis environment. Does anybody have any advice as to how I can best prepare?

Thank you!",About to start a data analyst internship.. have some worries.,1588889998
datascience,[removed],What would be the easiest way for me to get time data for Coronavirus in different cities/countries?,1588889207
datascience,[removed],Python Programming MADE EASY : A Concise Python Course -Udemy Course - 199.99$ OFF (FREE Limited Time),1588888813
datascience,[removed],Learn Complete Python-3 GUI using Tkinter -Udemy Course - 199.99$ OFF (FREE Limited Time),1588885755
datascience,"This question possibly could be better for StackOverflow, however since I didn't have specific coding questions, I thought it might be appropriate. 

I was trying to create a plot in the style of FiveThirtyEight and wanted to ask the community here for any insight you might have in visualizing charts similar to the one linked here.

[https://fivethirtyeight.com/features/the-five-types-of-nicolas-cage-movies/](https://fivethirtyeight.com/features/the-five-types-of-nicolas-cage-movies/)

I'm not looking for anything like an exact tutorial, I'm just trying to get a better understanding of the tools or approaches to create a graph like this.

I understand the graph itself was done in R with ggplot2. The highlighted color areas must've been done in something else after like Photoshop or Illustrator.

My question is similar to one asked here 5 years ago where one of the programmers from the chart mentioned something called ChartBuilder.

If anyone has any thoughts about how this graph was created, I'd be very appreciative. Thanks!

[https://www.reddit.com/r/statistics/comments/2jon2b/anyone\_knows\_how\_are\_made\_the\_graphs\_on/](https://www.reddit.com/r/statistics/comments/2jon2b/anyone_knows_how_are_made_the_graphs_on/)",FiveThirtyEight Plot Breakdown / Tutorial,1588885610
datascience,,[OC] Looking for feedback on data dashboard design: COVID-19 cases mapped against available community college healthcare grads to help alleviate critical workforce shortages,1588882187
datascience,[removed],Damaged Dataset (File Timestamps),1588880393
datascience,[removed],Node relationship within Anaconda? how would I go about orienting myself to this problem?,1588879920
datascience,[removed],Resources for transitioning into ML engineering from DS?,1588878981
datascience,[removed],"A brief, probabilistic demand forecast model (Blogpost)",1588878056
datascience,[removed],A few questions about pandas' syntax,1588877861
datascience,,Free Programming and math ebooks,1588874310
datascience,[removed],Deciding on a minor to go along with my Computational and Data Science Degree,1588874152
datascience,"I'm a recent grad from UC Berkeley (graduating in 2 weeks yay) and I accepted an offer for Insight's Data Engineering program. I've had to turn down a couple interviews after accepting, but I am really worried about the success rate given my background. I talked to a few alumni and noticed most of them have graduate degrees. Can anyone share their experience with the job hunt/getting a job through Insight (or if not through Insight, through other ways)?",Insight Data Engineering -- can someone share their experience?,1588873604
datascience,,"If the 1960s had begun with a worldwide pandemic, would an American still have been first on the Moon? Four futures for 2020's answer to the space race: the global contest to develop AI",1588873479
