subreddit,selftext,title,created_utc
datascience,"Hi All,

I am a researcher from a UK University, I am currently helping in carrying out a study on the use of data science methodologies during Covid lockdown, specifically the Business Understanding phase of methodologies.

I am looking for data scientists/miners who would be willing to take part in a 30 min interview to discuss their experience with projects and how they engaged with tasks. I wouldn't need any specifics around what the project was / the data used just an experience-based examination. 

We are hoping to publish this data in a journal/conference once completed to help further the research in the workflow of data scientists. I can assure you all of the data will be anonymised and I am happy to share the research with all once complete.

If you are interested please message me or comment. 

(Sorry if this is breaking the no homework helper rule, I was unsure with the given context)",Looking for Data Scientists to take part in research on the use of methodologies during Covid,1617895545
datascience,"Hi folks,

I am from India and I have 3 years of work experience as a Data Analyst and I am planning to look for a full-time remote job in Europe, America, Australia, or any developed country.   
1) I want to know whether it is possible to get a remote job in an abroad company?   
2) Has anyone done it or tried it?   
3) What are the challenges that one might face?   


Please share your views, experience and let's have an interesting discussion.",Is it possible to get a full-time remote job in another country?,1617893191
datascience,"With the recent news that Apple will be halting MacBook production due to the global chip shortage [More info here ](https://www.businessinsider.com/apple-ipad-macbook-delay-production-global-chip-shortage-2021-4), as a freshman who will be studying data science this fall at University I feel like I probably need to invest in a good laptop sooner rather than later. I’ve read both good and bad things about the M1 chipset on this sub, but I was wondering if you all thought it would be a good investment for a first year student, or if I should buy a Mac with an intel processors, or maybe and windows laptop instead. Most of this sub’s main gripes with the M1 chipset is that it hasn’t been able to easily run some programs and libraries due to the lack of a proper port; but my freshman year my course load is looking to only consist of entry level CS courses and math classes in which I’m unsure if I’ll be using such software. Though I’ve been learning and practicing with Python and R for a little over a year now, data science is all very new to me and I would appreciate any sort of tips you all have on this subject. Hope you all have a great day.",M1 chip for a first year data science student?,1617892851
datascience,"I've been working in my first job about 2 years out of my masters degree as a ""financial analyst"" at a large engineering company. I use historical manufacturing/material/project data to quantify risks for contract proposals.

For example, one proposal I worked on: engineering design project with 500 activities to complete.

(1) Calculated duration averages &amp; standard deviations of historical similar steps and assumed normal distributions for each.

(2) Ran monte carlo simulation of project with variable durations along their unique distributions to generate PDF of finish dates &amp; compared to deterministic ""most likely"" plan.

(3) Applied to cost escalation profile to probability function to generate range of potential costs, allowing us to bake in risk-adjusted margin into proposal.

I have an engineering undergrad and find statistics/data very interesting. I've been studying 30 min of python a day. I don't do anything involving machine learning/AI at my job, just mostly statistical calculations. However, I have an intense desire to learn these things. Would my current job allow me to be able to land data science roles in interviews?",Could I leverage my current position into a data scientist role?,1617891056
datascience,Hi Everyone! I just want to share this new job portal I made specially for those who are looking to hire a remote data professional. Just go to [heydatapro.com](https://heydatapro.com) to post a job. Thanks for the support! Subscribe to get a weekly update of remote jobs for data science!,Want to get the latest remote job opportunities in Data Science?,1617889158
datascience,"I've created the following dataframe:

Region                           object
Month                    datetime64[ns]
Type_of_Offense                  object
Number_of_Cases                 float32
Number_of_Convictions           float32
dtype: object
Index(['Region', 'Month', 'Type_of_Offense', 'Number_of_Cases',
       'Number_of_Convictions'],
      dtype='object')

I need to perform some descriptive and predictive analysis using my df. What would you typically do as a starting point for your analysis after the df has been created?",First data science project. Crated and cleaned a decent dataframe. What's a good starting point for analysis from here?,1617888591
datascience,"I have a dataset I need to perform HPO on for a forecast. Model is a LightGBM regressor.

I use a time series aware split, doing this:

[Time Series Aware K-Fold CV](https://i.stack.imgur.com/fXZ6k.png)

Since I'm doing a train/test split n times, do I still need to withhold an extra test set and/or an extra validation set = reduce the amount of data I can use for HPO?

Or is using k-fold CV enough since train/test split is build into it = I can use the whole data set for HPO?",Do I need to withold an extra test/validation set when I do HPO with k-fold Cross Validation?,1617886240
datascience,[removed],Switching carrer path,1617885690
datascience,"Hi there, I am a student pursuing a Master's degree in Applied Statistics &amp; Analytics. I don't have any domain knowledge of digital marketing. I wanted to get some hands on experience, so I got in touch with a Digital Marketing Agency through one of my contacts. This agency specializes in Google PPC campaigns and it's clients are small to medium sized. I had a short meeting with one employee of this agency and he was interested in knowing how I can help him fine-tune campaigns for the clients.

&amp;#x200B;

If you can share some use cases of Analytics in this field or guide me to any resources for learning the same, it would be a lot helpful. 

Thank you!",What are some applications of Data Science in Digital Marketing?,1617883982
datascience,,Facebook Speaks About Recent Data Leak And Explains As Not A Serious Threat,1617881894
datascience,I’m a recent highschool grad entering uni soon and I’d really love to pursue a career in data science however the uni I’m attending doesn’t offer it. I have no coding experience at all and I kind of feel like It’s too late to start. What are some things I should do to explore the world of DS.,"Want to start with data science, where should I start",1617879695
datascience,[removed],Hello! Me and my team are building a tech media app which will have short articles from the top sources. It will be releasing on Tuesday as “Gist” on App Store/Play Store. It would be great if you could validate and give feedback!,1617876726
datascience,"Hello all

I've been learning Machine Learning in Python for some time now and while I find the field very interesting I'm starting to think a lot of the code I'm writing could be automated in some way as it is somewhat generic from case to case. 

I've been looking into AutoML libraries and I think the consensus is that the better option is auto-sklearn. Only problem is I don't think this installs on Windows 10 very easily? 

What's my best option if I want something like auto-sklearn, but don't want to go through the hassle of setting up a virtual Linux environment on my computer?

Thanks.",What AutoML library is the better option that isn't auto-sklearn?,1617869754
datascience,"I know there are multiple answers to this question, but I'm curious what your go to's are.

For context, I've created a data frame of 23 months of crime data, with number of cases and number of convictions for each month across a number of regions. However, I'm missing the data for one of my months.

I feel like the best solution may be something along the lines of calculating the mean for the year (2015) of the missing month (November), and then finding the median between each of those figures and the correpsonding figures from November in 2014.

How would you approach this?",How do you personally go about filling in missing data from a time series?,1617869746
datascience,[removed],How helpful is kaggle in real life ?,1617868847
datascience,"Hi! I’m actually enrolled in 3rd course of the data science degree and I had one subject about digital signals and systems.

A lot of teachers told me it is a must for a data scientist, that a lot of problems can be approached by this way. I can see it’s utility in mono-neuronal structures like perceptron or adaline where you can build filters, or interesting systems with very different finalities. I also know Fourier transformation it is also be used a lot. But anything further of this, I also can see it has a  great utility for engineers.

I am missing anything? Should I still learn more about this topic? Do you think is a must for a data scientist? Do you guys use it frequently?",Digital signal processing is a must?,1617866113
datascience,"Supposedly you are working for an e-commerce sector and in the lifecycle of a customer ordering a product to us delivering it, you find the areas where it takes the most amount of time.

You have to present it to leaders how would you go about it? Given that it is just the average of the time taken in the processes? 

If you would just write it down like - 

It takes about x days x hours for the operations team to assign it to something something. 

Would it be too bland?",How would you present such findings to leaders?,1617863347
datascience,"**Why Attend Data Love**

Virtual events are doubled-edged. Although more accessible to attend, there are so many popping up it is challenging to determine where to invest your time. Below are some things to consider to determine if Data Love is right for you. 

**Content**

Take a look at some [speakers’ videos](https://www.youtube.com/playlist?list=PLBqWQH1MiwBS8f0PhhDeQuBVCjxC_i0X5) to get a feel for how deep these distributed systems experts dive. Then scan the [speaker schedule](http://datalove.konfy.care/schedule) to determine whether your professional aspirations might benefit from these real-world lessons.

**Connection**

Similar to our previous events, a key objective remains to be facilitating interactive connections between attendees and speakers. 

Consequently, every session will be streaming LIVE with a dedicated [Discord channel](https://discord.gg/RSAApz8) supporting lively Q&amp;A—because everyone benefits from improved learning through questioning and connecting.

**Community** 

The Hallway Track has long been considered the hidden gem of open source conferences. It's alive and well—and online—at Reactive Summit, thanks to innovations by [Spatial.Chat](https://spatial.chat/).

As a gift to the community, the tickets are [free](https://datalove.eventbrite.com). However, you must reserve your space to participate.","The Data Love conference, online, free",1617863058
datascience,"What would be a better choice for a master's degree for someone going into this field, a Master's in Computer Science with an concentration in Data Science , or a Master's in Data Science itself? assuming all else is equal like choice of school, GPA, internships,etc.",Choice of grad school program,1617859826
datascience,"Not on a once every week basis, but I find myself working 50 hrs a week.

Is this normal?",Average hours worked per week? (Salary),1617859440
datascience,"Hi, among many data scientists, who among them has the most number of audience/followers in their Podcast?",Data Scientists who have Podcasts?,1617855091
datascience,"Hey guys, I'm looking to learn regression and trying to pick a type to learn and use within the financial industry. I'm considering using logarithmic regression because in business we always talk about strong growth periods followed by levelling offs, as other companies enter the industry or whatever. Same for economics, countries often grow fast initially, then level off. I'm also wondering if learning logarithmic regression will sort of be more useful within small cap companies because of the super growth period and levelling off aspect. Or am I overthinking it and I should just use linear regression?

What do you guys think, should I learn both or one? Do they have a lot of commonalities between them?",Linear vs Logarithmic Regression?,1617851767
datascience,"Hi guys, I'm trying to break into the financial industry, I'm interested in learning logarithmic regression. I've chosen logarithmic regression because in finance we always talk about strong growth periods followed by a levelling off. This typically applies to economics as well, since economics is the sum of all businesses. It's just a much longer time frame. I'll be using this for company and economic analysis. Do you guys think logarithmic regression is the right type? I'm aware most people use linear regression. 

Are there any ""go to"" sources for someone who is CFA Level 2 level? I don't necessarily want the bare basics, I'm looking to get a more intermediate source if possible. Any suggestions would be nice! From tools within regression, to any curriculums you suggest I go through, books, anything would be nice.

Thanks guys!",Sources to learn logarithmic regression?,1617848802
datascience,"Hi guys, I'm trying to break into the financial industry, I'm interested in learning logarithmic regression. Are there any ""go to"" sources for someone who is a CFA Level 2? I don't necessarily want the bare basics, I'm looking to get a more intermediate source if possible. I'll be using this type of regression for company analysis and economics so if you have any comments on whether logarithmic regression is the right type, go ahead. I think it is because in business we always talk about strong growth periods followed by a levelling off. This typically applies to economics as well, since economics is the sum of all businesses. It's just a much longer time frame. 

Any suggestions would be nice! From tools within regression, to any curriculums you suggest I go through, books, anything would be nice.

Thanks guys!",Sources to learn logarithmic regression?,1617848147
datascience,"Metadata management is the proactive use of metadata in an organization to govern data in order to enable well-informed business decisions and efficiency in data handling. Metadata management involves ingesting metadata to learn about the data an organization owns, its value, and the optimization of data storage and its retention.

***Enhanced data quality***

Through automation, data quality is gradually assured with the governing and operationalization of the data pipeline to the benefit of all data stakeholders. All data issues and inconsistencies within an organization’s integrated data sources are captured in real-time, thus improving overall data quality. This also increases the time taken to draw insights from the data.

***Faster project delivery timelines***

By automating [metadata management](https://www.dqlabs.ai/free-trial/data-catalog/?utm_source=reddit&amp;utm_medium=referral), greater accuracy levels of up to 70% ensure the acceleration of project delivery for data movement and deployment of projects. Automated metadata management gathers metadata from different data sources and maps all data elements from their sources to target and enhances data integration across various platforms.

***Enhanced speed to make insights***

Currently, data scientists spend up to 80% of their time gathering and understanding data and resolving errors instead of analyzing it to draw real value. This time can be reduced greatly by the use of stronger data operations and analytics, leading to drawing insights faster, with access to underlying metadata.

***Improved productivity &amp; reduced costs***

Reliance on automated and repeatable metadata management systems and processes leads to improved productivity and reduced costs.

***Regulatory compliance***

Data regulations, including the General Data Protection Regulation (GDPR), and the Health Insurance and Portability Accountability Act (HIPAA), and The California Consumer Privacy Act (CCPA) are to be complied with, depending on the area an organization is located and the type of operations they are engaged in. When critical data is not collected, cataloged, classified, and standardized in integration processes, compliance audits may be inaccurate. Metadata management ensures that sensitive data is automatically flagged and tagged, it is then automatically documented, and its flows captured so that it is easily noticed and its use across various workflows easily detected.

***Digital transformation***

Metadata management enables knowledge of what data exists and its potential value, thus promoting digital transformation through;

* Improved digital experiences by enhanced understanding of how an organization interacts with its customers
* Enhanced digital operations by improving the speed of data preparation and analysis

Metadata management brings about business value, thereby improving innovation, collaboration and helps to mitigate imminent risks. [Metadata management solutions](https://www.dqlabs.ai/data-catalog/?utm_source=reddit&amp;utm_medium=referral) like DQLabs.ai helps organizations to access high-quality and trusted data, in order to ensure that they get accurate insights from their data for optimal business goals.",Benefits of Metadata Management,1617845713
datascience,,Databricks(Apache Spark) from Zero to Hero! - Session 3 | Delta Lake,1617842627
datascience,"Hello, currently a sophomore doing some classical stat analysis at a lab on campus. It’s a driving simulation laboratory so it’s mainly doing analysis on the data  they get between two different scenarios and doing some hypothesis testing. 

Anyways the lab manager told me how my analysis was completely wrong and how I mishandled the data because apparently I joined two datasets which weren’t supposed to and ended up with duplicates. 

I’m kinda bummed that I made this mistake cause I felt pretty confident about and proud of my results. 

This had me thinking, what mistakes have you made at your work when handling data?",Worst mistake anyone’s made while handling data?,1617841889
datascience,"I've been working in my first job 2 years out of my masters degree as a ""financial analyst"" at a large engineering company. I use historical manufacturing/material/project data to quantify risks for contract proposals. 

For example, one proposal I worked on: engineering design project with 500 activities to complete. 

(1) Calculated duration averages &amp; standard deviations of historical similar steps and assumed normal distributions for each.

(2) Ran monte carlo simulation of project with variable durations along their unique distributions to generate PDF of finish dates &amp; compared to deterministic ""most likely"" plan. 

(3) Applied to cost escalation profile to probability function to generate range of potential costs, allowing us to bake in risk-adjusted margin into proposal.

I have an engineering undergrad &amp; finance masters. I find statistics/data very interesting, and would like to move into a data science position in the future. I've been studying 30 min of python a day. Would my current job allow me to be able to land data science roles in interviews?",Could I leverage my current role into a data science position?,1617838165
datascience,[removed],Biologist/Bioinformaticist transitioning to Data Science,1617837099
datascience,[removed],High School Senior - Degree/Certification Advice,1617836774
datascience,"Hey all, I just wanted to ask someone who’s done the MIDS or really any masters in data science if it’s a good decision for someone coming from a non technical background? When talking to admissions they all claim my life science bachelors is fine and that the program takes students from various backgrounds but is this really the case? or is it the case that only people with a technical background benefit by adding the berkeley name onto their resume?",Honest opinion on doing Berkeley MIDS,1617836444
datascience,,Should patients be able to sell and trade their own medical data?,1617836312
datascience,"I've got a dataset of consumer transaction with over 1mil+ entries. I have to sort the data into the merchant the transactions are coming from. There's a lot of false positives, especially coming from payment methods (i.e. an entry might say ""Online Payment 1234567890 To CAPITAL ONE AUTO FINANCE 12/15"", I want to identify the merchant ""CAPITAL ONE AUTO FINANCE"", even though ""Online Payment"" is more frequent in the dataset) 

The format of the transactions is not universally the same. To make matters more complicated, the merchant names vary–""CAPITAL ONE AUTO FINANCE"" may become ""CAPIT ONE ATO FINANCE""

I would greatly appreciate any advice about going about this task, be it any tools, tips or tricks. I'm new to processing datasets, and my process is pretty brute force. Also, does anyone have experience contracting out work like this?

I'm very new in this area, so any advice would be greatly appreciated.",Sorting through 1mil+ entry transaction database for merchants,1617833895
datascience,So I am a master's student going a degree in AI for medical research but I have found a liking for the data science side of things. I have an undergraduate degree in computer science so the technical skills I have are mainly based around software engineering. Where should my time be spent before I graduate in December?,What technical skills should I focus on to before applying for jobs in the next 9 months?,1617826092
datascience,"Hey folks, I am doing my Master's in Data Analytics and I aim to be a Deep Learning Engineer in the next 1-3 years. I am not quite sure how feasible such a target is but well! I still wanna try. Anyways, for the analytics project in our college, we have got some choices to pick from and I want to pick the projects that would turn out to be most relevant for my back up plan(or long-term goals). While none of them are related to CV or NLP directly, I still want to be doing it with dedication so that I could get into business analytics as a back-up plan (since, I understand that I might not be able to be a deep learning Engineer fresh out of college). Anyways, my project choices are as follows and can you throw some thoughts on what seems more promising in terms of the evolving research or importance with respect to the current industry demands or which choices would be most helpful for me if I were to look for jobs showing off that project, ikr, jk! :p

1. Predicting Penalty shots based on player positions (using discreet choice models)
2. Predicting car driver choices like accelerating, brake, left-/right-turn etc ( using discreet choice models)
3. Analyzing and predicting mode of transport choice behavior in London (using Multinomial Logistic Regression)
4. Predicting electric vehicle purchase choices (by increasing charging stations) in London (using Multinomial Logistic Regression)
5. Predicting park-and-ride choice in London (using Multinomial Logistic Regression)
6. Predicting boarding time in public transportation vehicles, the alternatives are car, park-and-ride, and public transport (using Multinomial Logistic Regression)
7. a model that is capable of predictions of total boarding times of a coach given the number of egressing and accessing passengers at given doors of a tram/train.

My thoughts respectively:

1. I believe if it were actual video analytics of sports, then I could call it computer vision but this one is more like analyze the player and predict the choice of where would he kick the ball.
2. Sounds pretty close to self-driving cars i.e. CV but not quite sure if this would help me to start off my career really. 
3. this project is about analyzing if a person would take a car or a bike, etc based on influencing variables like weather, temperature, perceived temperature blah blah

Not quite sure about the rest. While I understand the project statements  I can't figure out why some of these projects are very relevant for industries/firms perhaps. I would like to know which projects among those would actually be applied in a business analytics/ data analytics firms directly or if there is good breakthrough/research in any of these applications, I would like to pursue them because at least I would have a good reference or a baseline to do my project. any thoughts?","Need help to select the minor project topic as I am pretty clueless, any thoughts please?[long post]",1617826025
