subreddit,selftext,title,created_utc
datascience,"I'm wondering if knowledge and skills in statistics becomes second nature with a lot of practice. I'm also wondering how do DS keep up with advances theory and methods.

So how much time do you need to dedicate to this?",How much of your time do you dedicate to reviewing statistics concepts or learning new methods?,1579902226
datascience,"A bit of a background - I am a data scientist, with 4+ years of experience in data science and analytics, having mostly worked at startups in the bay, at a B2C consumer startup and a B2B marketing startup. Experience with ML, hypothesis testing, analytics and the whole DS gamut - have worn multiple hats.

I have zero experience in fintech, but I am super intrigued by the way the industry is progressing. And I have my onsite at the fintech startup soon. Wondering how I can best prepare for the kind of questions they will ask. Any/all tips very very appreciated. Thank you!!",How should I prepare for a Data Scientist interview at a FinTech startup - recently young and is changing the B2B corporate card landscape?,1579901700
datascience,"Hello Data Science community,

Going to try to keep it as short as possible while providing relevant information. To start, a bit about my background… I graduated with a BS in Petroleum Eng and did well in school. Been more than a year and still having a difficult time landing an engineering position without any experience.

At this point, I’ve been recommended by many people to start a masters program but I’m having a hard time deciding what to pursue. Some have told me to go into MS data science, maybe an online program while i continue to search for an opportunity. This would allow me to move into tech or any other industry when the oil industry goes to shit. Few others have recommended to pursue Masters in Mechanical or Chemical Engineering which would open more opportunities.

I've really been leaning towards a masters in Data Science as it would complement my undergrad degree. The Oil and Gas industry is already heading into automation and heavily utilizing data science to significantly cut costs in this competitive environment. I'm having a difficult time deciding if I should pursue a MS in data science (preferably an online program at Berkeley/Georgia Tech) or go for a Masters in Chem/Mech Engineering and learn data science on the side through certifications. 

If you could share some suggestions or insights on this matter, I’d really appreciate it. Thank you all in advance.

TL;DR : Can't find an engineering opportunity after undergrad. Should I go for a MS in Data Science or Masters in Chem Eng or Mech Eng with data science certifications?",Looking for Post Undergrad Career Advice,1579901451
datascience,[removed],HarvardX Data Science with No background in Computer Science (Bac.Degree in Accountancy),1579893960
datascience,"I am looking into Master's programs. I feel like potential employers look for more STEM based data programs like Applied Statistics or even Engineering and Computer Science backgrounds.

&amp;#x200B;

Does anyone here have experience with a program that is Data Visualization and Analytics? I am interested in it for the merging of data and the visual aspects as I would like something that has science but also a creative aspect.",Anyone here have a Master's in Data Visualization and Analytics? I am just curious about how you decided to choose a program and if you are satisfied with your opportunities afterwards.,1579891888
datascience,"What are some good resources to prepare for intern interview position ? 

Although the recruiter has shared some resources but those are all related to  SQL.",Facebook Data Science Intern interview preparation?,1579884665
datascience,"Hi, I just started a new job and in this company they have a lot of data scattered in a lot of excel spreadsheets interconnected.

Some of the spreadsheets pull data from other spreadsheets using macros, other get data from an sql database and many of them perform vlookups on other spreadsheets.

I’m thinking on a replacement for this system, I thought about doing a sql database, but it would be nice for anyone to be able to acces the data and modify specific values manualy.

So I thought about replacing each xlsx file with a csv file + a python script that keeps it up to date. That way anyone can modify the data, but the math is done by python much faster than excel.

Do you guys have any better ideas?

Thanks!","I need to replace a net of excel spreadsheets, looking for recommendations.",1579884604
datascience,"We are working with a lot of complicated data with tricky relationships (and a user-base that loves Excel and pivot tables). I design web apps for visualizing this sort of thing and, while a lot of the charting libraries are awesome, I am looking for a good solution for working with tabular data. 

Specifically I'd like a table that can present a simple 2d view of complex data that is then grouped (so a sort of roll-up view). But, if the user needs to drill down they can select a particular dimension and get the specific data that lies underneath it (rolling it out).

For example, if I have a dataset for cars with make, model, transmission type, mpg. A make/model could have multiple transmission types and each transmission type has its own mpg rating. Maybe one view looks like this:

**View 1**

Toyota | Prius | corolla

Honda | CRV | ACCORD

&amp;#x200B;

and then clicking on ""toyota"" takes you to:

**View 2**

Toyota Prius | Variable | 30

Totoya Prius | Continuous | 34

Toyota Corolla | Variable | 22

Toyota Corolla | Continuous | 26

&amp;#x200B;

Are there any Web Components or JS Widgets where we can attach a dataset, define grouping relationships among the data, and create these views by configuration?",Good Front-End components for working with N-Dimensional data in tables?,1579882912
datascience,"Hello, sorry if this is a stupid question. I'm a new analyst and have been asked to find the confidence level (via the error rate?) for a set of data and have no idea what they're talking about. The data is from 3 year average spending from various companies. Is there a way to do this?",I was asked to check the confidence level of this data -- don't know how,1579882878
datascience,"So I have a background in Computer Engineering and I am fairly comfortable in understanding programming scrips and usual system of equations (read linear, quadratic etc) But, I get flabbergasted by the notations and formulas that are written in general DS, ML sources and papers.

Apart from Summations and functions, what else do I need to know to completely understand these mathematical terms.  


What do I need to do, to be able to comprehend and clearly imagine the differences between two different algorithms and how to deal with the data points by looking at their notations and functions.",Understanding Machine learning and Data science mathematical Notations,1579880622
datascience,,Apache Airflow testing with Pytest,1579878819
datascience,"I’ve noticed a large part of my job is literally just waiting. Wether that be waiting for data from another team, waiting for an engineer to give me a query or waiting for a model to train. I feel like a small portion of my job is actually scripting the model or analysis. A lot of it is sitting around. What is your experience as being a data scientist?",Do any of you feel like a large part of being a data scientist is waiting?,1579878147
datascience,"Note: I apologize if this question is not appropriate for this subreddit. If there is somewhere else where it is more appropriate, please let me know. 

Background: I am an MBA student concentrating in data analytics. I have been lurking on this sub for a year or so and enjoy all of the discussion I hear from you guys. I'm not even going to pretend that my coursework is rigorous compared to what you guys do, but I really enjoy working with data and sometimes feel like I maybe should have enrolled in an Analytics program over MBA, but that's a story for a different day!  

I am working on a project and I need to access data from the MusicBrainz database, but I am having a tough time figuring it out and have wasted a lot of time. I know what queries I want to run on the data when I get it, and I have a good idea of what sort of analysis I am going to do in R once I have the data I need from the MusicBrainz database, but I am getting tripped up with how to access the data once I download it from their site. I am pretty strong analytically and easily understand the theory behind data analysis, but I worked in manufacturing for 13 years (where computers are barely even used) before MBA and I don't have a lot of experience with using computer programs that aren't basic point and click GUI interface. I'm using a Mac if that changes anything.   

So... can someone please help me on what steps I need to take, what programs I need to download, etc. so that I can access this database? If there is a site you can direct me to as well, I'll be happy to read and figure it out on my own, but at this point I've probably wasted 10 hours trying to do that and I have nothing to show for it.",Noob needs help accessing MusicBrainz database,1579878090
datascience,"Just wondering - those who work in python, when you do EDA of a dataset do you typically leave it in the notebook or convert it into a `.py` file and store the analysis some other way? If there's a cutoff for moving from one to the other (in the context of eda), what is it?",Do you leave your EDA in notebooks?,1579877793
datascience,,Labeling Guides + Exams: new Supervisely tools to teach workforce on your custom labeling task,1579877200
datascience,"Hi!

The precisionFDA Gaining New Insights by Detecting Adverse Event Anomalies Using FDA Open Data Challenge is now live!

The purpose of this challenge is to advance techniques for the surveillance and detection of adverse events associated with FDA products. Participants are encouraged to use machine learning and artificial intelligence algorithms to automate the detection of anomalies in adverse event data. For more information and to get started, visit [https://go.usa.gov/xdgFt](https://go.usa.gov/xdgFt)!

Also, if you live in the DMV area and are interested in learning more about how FDA is modernizing its data strategy, attend the “Modernizing FDA’s Data Strategy” public meeting on March 27th.",New precisionFDA data science challenge: Help advance postmarket surveillance techniques for FDA regulated products,1579876789
datascience,Title says it all,I am a fully qualified South African chartered accountant working in the US. I want to get qualified in data science out of interest and for career development since it seems so sought after. Any recommendations for online courses that I can follow that is highly recognizable?,1579873972
datascience,"Hi all, I’m 24F with a degree in Management Information Systems (MIS) and have been working in Market Research as an “analyst” for 1.5yrs not doing much of anything technical, mostly project management and consulting. I want to make a switch to Data Science through self taught route or a bootcamp (Metis). But I’m also curious...with all of the companies in the Bay Area with DS roles, which are the best for people relatively new to the field or without a math background or that are exceptionally happy to couch newbies? Thanks!",Best companies in Bay Area to apply to for a first time data science role?,1579873868
datascience,"Hey everyone!

&amp;#x200B;

hope this is okay in here - I know it's more analytics than anything. Basically, I'm trying to visualize geographical Data stored in google sheets. The problem is the data is inconsistent - sometimes will say Netherlands, sometimes Amsterdam, sometimes Europe.  


I have figured out a way for the map to ignore data that is too generic (i.e Europe), and have discovered that if you just have the city (e.g. Amsterdam) then it automatically treats that as a country. However, when I have both 'Netherlands' and 'Amsterdam' as inputs, it only reads one of those and ignores the other. I'm trying to see if there is a way to automatically recognize both the city and country and display both on the map, or even a formula/script that picks up and re-allocates the city as the relevant country. There is too much data (literally tens of thousands of rows) for me to alter it manually.

thanks!",Rendering geographical data in Googl Sheets,1579873561
datascience,"I got my first job at ThoughtWorks, India as a Data Scientist. Also I'm looking for opportunities to work outside India especially in European Countries. How should I move in my career or things I should necessarily do?
Will be helpful for your suggestions !",Job opportunities on European countries for an Indian person in field of Data Science/AI ?,1579859826
datascience,[removed],BI experience without big data or data science experience.,1579859698
datascience," 

This article focuses on the materials, tools, methods used by scientists and experts in the field of data science. These materials include materials on machine learning algorithms, statistics, data processing, and deep data science techniques: density estimation, or tests of hypotheses, model-free data, robust methods for automated processing

[https://www.datasciencecentral.com/profiles/blogs/40-techniques-used-by-data-scientists?imm\_mid=0f1a15&amp;cmp=em-data-na-na-newsltr\_20170517](https://www.datasciencecentral.com/profiles/blogs/40-techniques-used-by-data-scientists?imm_mid=0f1a15&amp;cmp=em-data-na-na-newsltr_20170517)",Techniques Used by Data Scientists,1579847457
datascience,"For the people who have posted fearing job safety, rest assured for now! 
LinkedIn Emerging Jobs Report 2020

https://business.linkedin.com/content/dam/me/business/en-us/talent-solutions/emerging-jobs-report/Emerging_Jobs_Report_U.S._FINAL.pdf

“Data science is booming and starting to replace legacy roles.
Unsurprisingly, data science is a field that is seeing continued growth on a tremendous scale, but our data shows data scientists may be augmenting responsibilities traditionally done by statisticians as some industries, like insurance, gear up for the future.”",2020 LinkedIn Emerging Jobs,1579843596
datascience,"Hey guys, I’m currently a senior undergraduate student majoring in Financial Mathematics &amp; Statistics. I noticed my school offers a Statistical Data Science major, and that I’d only have to take 1 additional class in order to obtain the degree (I’m one semester away from graduation). I’ve been planning on pursuing a career in DS, and was wondering if switching majors would help me in any way, since my current major focuses heavily on DS anyways. Do you guys think it’s worth switching primarily to have a degree with DS in its name as opposed to just math/stats?

Again, the only difference is one additional class and the name of the major itself.",Does the official name of your degree matter for future career opportunities?,1579839398
datascience,"All,

I want to improve my skills in data exploration and analysis, and trying to decide where to start. Is Python, SQL, or R are these best languages/tools for this purpose or should I consider something else? Also, where can I do a “crash course” of 1-2 days where a human is there to help if I get stuck? 

Context: I am a civil engineer &amp; product/business guy, and don’t have much of an experience in programming. Trying to ensure that I succeed in improving my data analysis skills. I do however kill @ doing data analysis in ms excel.","Noob question, data exploration and analysis",1579822709
datascience,,For those Thinking Abroad - What Do Data Scientists in Europe Do &amp; How Much Are They Worth?,1579822268
datascience,"Has anyone had any experience with these courses on Datacamp and can speak on the main differences on what you'll learn/don't learn?

E.g. what do you NOT learn in the ML course that you do learn in the DS course - and vice versa?","""Data Scientist with Python"" vs ""Machine Learning Scientist with Python"" in Datacamp",1579821123
datascience,"Hello, I have a BA in economics (honors with high distinction) and a BS in mathematics. I finished with a 3.0 cumulative, a 3.5 over the most recent 99 credit hours, and a 3.5 economics gpa. I haven't gotten anything besides an A or a B in all my math classes in more than 3 years. I went to the University of Colorado at Colorado Springs. Is Regis University a good fit for me? Or should I aim hire? Is it really important where you get your masters in data science from?",Is a master's degree in data science from Regis University worth it?,1579819425
datascience,[removed],How to get brain-related internship?,1579817582
datascience,"I'm a data scientist, and currently most of my work focuses on data/ML infrastructure (I guess I'm more on the data/ML engineering side). I love what I do, and I've developed a solid list of technical skills in my roles thus far. However at this point I think I'd like to start specializing in a particular domain area. I'm not sure whether this means going deep on a technical domain area (like Machine Vision, NLP, Analytics/Statistics), or focusing on more applied sector specific knowledge (like Finance, Bioinformatics, Sports Analytics, etc).   
Keep in mind, this needs to be something I can get into without needing a PhD (so fields like bioinformatics are probably out of the question).

Any thoughts? I'd love to hear what sort of areas you have specialized in!",Industry vs Technical Specialization in Data Science,1579817032
datascience,[removed],Aethos - A library to help automate your workflow.,1579815538
datascience,"I am finishing my Ph.D. (from a state university in the US midwest) soon and want to move away from academia. My Ph.D. is in developing computational methods to make use of sensor data related to improve healthcare outcomes. Regarding the data science techniques, I have mostly used tools like Fuzzy Logic in my research and less core machine learning and deep learning stuff. Anyways, I have taken all the core machine learning courses and have a pretty good knowledge/experience of those and I have published in several conferences and journals and have more than five publications (none of them are very high impact).   

Sorry for the long post, but I thought providing my work background is essential for what follows next.

I have been applying to data scientist positions for the past 3-4 months, some of which are closely related to my Ph.D. work and some of which are generic data science job. The biggest hurdle I am facing right now is to even get an interview started. I mean, I've applied online to so many places, but I rarely hear back from the companies. I am not sure what's going on? If you got any insights on why this might be happening, I would really like to hear them.

I think that having a Ph.D. and experience with working with real noisy data should at least get me the interviews. Any suggestions/insights would be helpful.",Getting a Data Scientist job when your Ph.D. is ​very specific,1579814748
datascience,"I've been trying to create an Anaconda environment that uses tensorflow 2 however, I keep running into this error when I need to actually use tensorflow / keras.

`InternalError: cudaGetDevice() failed. Status: cudaGetErrorString symbol not found.`

The code that causes it is the 3rd line:

`input_tensor = Input(shape=(1,))`

`output_layer = Dense(1)`

`output_tensor = output_layer(input_tensor)`

I have checked that my version of cuda is 10.0 and tensroflow is 2.0.0. The Anaconda log of creating this environment is here:  [http://dpaste.com/3SG81AA](http://dpaste.com/3SG81AA) 

The error log  follows is here:  [http://dpaste.com/01KH5E8](http://dpaste.com/01KH5E8) 

Thanks in advanced!

Sam",Help! InternalError: cudaGetDevice() failed.,1579810296
datascience,"Curious about the breakdown of career paths for data scientist. Seems like the most common ones follow the individual contributor/management line.

Data Scientist -&gt; Senior Data Scientist -&gt; Principal/Lead Data Scientist

vs

Data Scientist -&gt; Senior Data Scientist -&gt; Data Science Manager -&gt; VP/Head of Data Science

Any other common paths? Maybe a branching off to ML Engineer/Data Engineer/Product Manager at some point? 

Curious about the experiences of others and the pros and cons of each path.",What are the most common career paths for data scientists?,1579809360
datascience,,"Noob Question, what are these diagrams called because it sounds a lot like cabana but every google search I make refers back to cabana.",1579808861
datascience,"I’ve started a blog to provide beginner-friendly tutorials on how to build fundamental data science skills and I’d like to get the community’s thoughts on entering that space.

If you’re learning data science now, I’d love to hear what kind of content you’d like to see. If you’re established in the field, I’d be equally pleased to hear about what kind of content you think should be included or wish had existed when you were learning. 

The site, such as it is, is [datascienceoutlook.com](www.datascienceoutlook.com). I’m still working on adding content and bringing on contributors (in case anyone is interested).

I’m happy to receive any input the community has. Thanks for taking the time.",New Blog Looking for Input,1579807417
datascience,,I have just started learning pandas library and i have created my first simple project “Amazon Forest Fire Analysis” using Pandas Data Analysis library Notebook Link 👇,1579806623
datascience, How do you manage against forecast risk for short term vs long term forecasts?,Forecast risk,1579803612
datascience,"Hello r/datascience.
    I've been a lurker on this sub for a while now and have learned a lot from you all. I had graduated from a data science bootcamp in NYC in August and have been looking for employment for a few months now. I have gotten a few interviews(some to the final interview stages) and technical challenges but still have not gotten any offers. I would greatly appreciate it if you guys can provide some feedback on my [resume](https://imgur.com/E6vv5zE).

Thank you",Data Scientist Resume Review,1579803219
datascience,"I’ve got my first DS job lined up for when I graduate (which I’m super excited about, yay!) 

My question is: how long should I stay before hopping jobs? In other words, after how many years of experience does it make getting your second job in the field easier? Additionally, after how many years do you become eligible for higher positions (i.e. Senior DS, etc.) in your experience? 

I’m excited about the job, but the location is less than stellar, so I’m hoping to move to one of my dream cities after putting in a few years and learning as much as I can.",How long did you stay in your first Data Science job?,1579801840
datascience,"Is there anything wrong about putting Pre-Job Assesments in my portfolio. While I haven't secured a job at the moment, I have been given some assessments in the application process that do a good job of demonstrating my abilities and could be helpful in supplementing my GitHub portfolio. While I don't see anywhere in the prompts explicitly saying the information is private, I was wondering if it would be improper to include these projects in a portfolio. Let me know what you think!",Pre-Job Assessments in Portfolio?,1579801655
datascience,title,What would be your no.1 tip for acing a data science on site interview?,1579800384
datascience,"Hi there

I’m interested in doing something like www.projectbiglife.ca

Are there any blog posts or tutorials that shows how to do something similar? I’m still a beginner and thought this would be fun.",Any tutorials on how to make an online calculator?,1579800371
datascience,"I’m working on a project where I have to apply object detection/classification. My manager expected me to label data/bounding boxes and build and train a model In two days. I did my best and the result isn’t very good, I think partly because I didn’t have time to label a lot of data. Is this sort of pace typical in data science? 

I would ask for more time, but the problem is he can only fund me to work on this project two days a week and he wants me to produce weekly results I can present. I’m not sure how to handle this situation.",Is my manager’s request reasonable?,1579800209
datascience,"Hello, I recently started learning about data science and I'm studying by myself through different internet sources such as treehouse and dataquest, skillshare, etc. I have already enrolled in a bootcamp 3 months long with another month fully dedicated to a personal project and building your resume, etc.

Without any sort of college degree, master or phd, is it realistic to get a job in the machine learning or deep learning fields?",Job requirements,1579799509
datascience,[removed],Data Scientist Hourly Pay Montreal Canada,1579798747
