subreddit,selftext,title,created_utc
datascience,"Hi, I’m sorry for this post but I’m just trying to understand what I’m supposed to be and do.
Do you have a minute to help me out what kind of job I’m supposed to be looking for? What position I should be looking for? I would really appreciate it, because I’m getting desperate during my job search.
I apologize in advance for some broken english here and there.

I have a bachelor in Economics during which I discovered statistics and R, and a MSc in Data Analytics.
In my MSc I studied more statistics (distributions, exponential families...), some marketing, some SQL, but mostly ML stuff (all the topics in ISLR basically) on R and Python, plus a course on NN (how they work relatively in detail, and tried them out on Python) I did go into some details on how these algorithms work, but not too much (e.g. I can’t tell you why the logistic regression doesn’t work when data is perfectly separable, but I do know the logic behind k-means, or GAMs, or SVMs, or gradient boosting, even though I think I would have a somewhat hard time with the maths involved).

I feel like I’ve done a bit of everything, but I’m not worth hiring for anything.

I’ve looked at “Data Analyst” positions, but the vast majority are focused on Excel (macros, pivot, lookup) and PowerBI. Some others simply require SQL. I’m not even good at Excel, and my SQL knowledge is basic. Machine learning is not even mentioned.

“Data Scientist” positions are more interesting, but they usually ask for more knowledge and in any case I know for sure I can’t call myself a DS, I lack the deep knowledge of maths and algorithms.

In any case, very few return my applications, very, very few.

I feel like I’ve studied to become a DS, I love what ML is, and I find the algorithms extremely fascinating, but I definitely lack the “solid ground” that someone with a BSc in Statistics or many other maths degrees, has over me.

Am I just wrong? Is this a feeling that I have but it’s not how it works? Should I apply for positions that don’t offer any ML and just get good at Excel, PowerBI, Tableau, and SQL? Is this the correct career path?

I’m really doubting my choices. I entered this field without knowing it and properly gathering information on how it works, I just found it fascinating and it agreed with my natural behavior of looking for patterns and striving to understand why and how things work. I also feel like my MSc is worth nothing, as I can’t apply for a job that actively does all that ML, as I would need much more knowledge. Instead, I’m starting to think that I should have had much more SQL courses.

I don’t know, I’m just so lost. If you have some time to look at this rant and find some information to give me I would greatly appreciate it. Or simply tell me where to look for this kind of information.
Thanks",What am I supposed to be?,1617061137
datascience,"After a slightly frustrating evening after work with VS Code and virtual environments and all that good stuff, I’m switching over to Spyder (which came with Anaconda, and therefore will find the packages I installed for my pet project). 

A question off the back of this: how important &amp; difficult is it to get a good handle on juggling these virtual environments? It looks doable but I have a list of things I want to do. 

Background: 6 months into my first job out of college doing non-CS, so there’s a lot of random tech skills I need to develop.",Environment management skills,1617060756
datascience,"Please bare with me if this has been asked before, but over the past 3 months, as I have continued my job search, I have picked up deep learning (Keras mainly). As a MS of DS student I found it interesting that deep learning has its own vernacular around popular statistical concepts (cost function (DNN) vs. loss/error (stats) is an example)

Then I started to better understand CNN, backpropagation, and CNN in particular really have nothing to do with stats, and everything to do with computer science / representing pixels as matrices, and analyzing these matrices accordingly.

I almost feel like deep learning is much more of a computer science, while data science is focused on more traditional statistical methods. 

Is this fair to say? Thoughts on this?","Is deep learning more ""computer science"" than it is ""Data Science""",1617055478
datascience,"Does anyone have recommended resources (textbooks, MOOCs, etc.) for learning biomedical image analysis? Specifically, I'm looking to learn:

* the math behind **signal and image processing** 
   * variational calc
   * numerical optimization
* **registration** 
   * transformations
   * image similarity
   * groupwise registration and atlas building
* **segmentation** 
   * edge and feature detection
   * statistical methods like mixture models and Markov random fields

... or any other interesting topics! I've been reading up on related papers and articles as they come up in google, but if there are more comprehensive materials out there, I would love to know.",Biomedical image analysis?,1617052514
datascience,"Hey All,

I have been in the data science and machine learning space for the majority of my career, but have more recently spent time in meddling around with infrastructure.  Could be the naivety, though the complexity (and inefficiency) of bundled cloud tools bothered me, so I built a tool to help manage costs.

It still requires some policy finagling, so it's not self service yet, however, I'd love y'alls candid feedback on the tool - [BlueArch.io](https://bluearch.io/)

Apologies  if this is against the sub's rules... sharing your work can be scary but I'm pretty excited about project.",ML + Infrastructure,1617050707
datascience,,What are some beginner Python projects I can create in my journey to becoming a data scientist?,1617049970
datascience,"I've seen some project ideas on Datacamp and I would like to make 85% of my portfolio based on them. I don't want to cheat or code along, just use the idea and maybe get some help, since some of them are guided. 

I'm having problems to have project ideas out of nowhere and I would like to know if I can do that.",Can I use projects in MOOC sites to build my own portfolio,1617048433
datascience,"Hi! I'm currently in the healthcare field right now and I'm just thinking that in the future I might wanna transition into data science. Any tips for what I should do? I'm trying to pick up Python again, but oh boy it's been a while. Thanks!",DS as 2nd Career,1617048431
datascience,"Hi all, I'm a new math phd grad - below is my resume, and feedback would be appreciated. Have had (essentially) no interest from employers after a month of applying. 

[https://imgur.com/a/38vJgR0](https://imgur.com/a/38vJgR0)

Thanks!",Resume critique - new PhD grad/ limited experience,1617047532
datascience,And how limited are your analyses by your data sources?,How much of your work is descriptive rather than predictive or explanatory?,1617047463
datascience,"Hey all,

It could be a really weird idea that came to me today. I have an underutilized server with a lot of RAM. So, I'm thinking what if I put all my data in RAM as pandas dataframes and build an API that can give those data to the clients. In such case those clients will be getting data very fast and they will be able store only subsets requested by the end users of dashboards. Every data scientist from my and other teams also won't have to do any hard disk IO operations, so they'll also benefit from my service.

Does it make sense? Are there solutions that do this already?",Store pandas daframes in memory to give to the clients,1617045705
datascience,,"Collection of 14 bestselling ebooks like Machine Learning in Action, Deep Learning with Python, and Succeeding with AI",1617044718
datascience,[removed],Migrating from Pentaho to Pandas,1617044363
datascience,[removed],Where to practice Data Science Interviews?,1617043778
datascience,"So I have been working in completely different fields for almost 9 yrs I am 30 yrs old . And now I have realised what I really want . Right now I am a team lead so little to no work. When I was this junior I had task of consolidating reports and  trying to find out what needs to improve and  weekly report . And this was the only thing that fascinated me about my job back then. Now it's all gone . Like I said I have got no work to do I don't want be a team lead. I just want to solve complicated  and challenging task try find out result. And because of this I did some research  so found out there was MIS which was kind of low level excel task but later on it becomes monotonous further on More reasearch I found data analyst and data scientist. Now I have pinged data scientist on linkedin to guide me. But I need To know more 
For  is this right
I have started with mathematics like Probability, later I will go for statistics , liner regression , can I learn python side by side , or should I learn R? How do get projects to work on, and when should I go for Kaggle and I do know few basis in SQL",Want to make career in datascience,1617041407
datascience,"Hey guys, am a Product Manager and so far so good. To be honest, even though I am good at what I do, there are almost no HARD SKILLS involved. This pandemic got me thinking about what if I am laid off at work and can't find another PM job?! And as such I want to keep backup options. Now data science is one of the options on my mind but it seems a lot of work at this point. 

I had taken a couple of Statistics courses during my undergrad covering topics like Correlation, Frequency distributions, Central tendencies, Dispersion, Skewness, Kurtosis, Contingency, Regression, Time Series, Probability distributions, Sampling, Estimation etc. Add to that I know  SQL, Excel and Python

Is there any family of jobs with the Data space which mainly utilises statistical methods and dont go all the way into ML algorithms etc. and which I can get by refreshing my present quantitative skill sets?

Thanks in advance",Statistics based jobs,1617039388
datascience,"I've been working with data analysis for a few years now, because I'm self taught I never really had a methodology on How to approach a New data set and usually work on the trial and error bases. However I got a new consultant job that requires a lot more efficience, a lot less time with interviews, and usually a lot more data. 

Do you guys have any recommendations on books, online classes, or somesort of workflow that helps keep your projects flowing? 




Ps. Please disconsider spelling mistakes, my phone os set to an other language",Any good tips or courses that will teach the workflow on How to do a data analysis?,1617037378
datascience,"In my role (Data Scientist at an e-commerce company) I focus primarily on building recommender systems. We recently implemented a Variational Autoencoder based system, and while the architecture/implementation is fairly straight forward, unpacking the nuance and derivation of the KL Loss function (and understanding Variational Inference in general) I found to be quite challenging.   


I'm wondering what projects/concepts you have worked with that you found challenging to understand/implement?",What are some of the most complex/difficult Data Science concepts that you've struggled to grasp?,1617037305
datascience,"What values should I use? In my experiment, I am comparing the efficacy of suppression of cytokine production by drug A and drug B in alloreactive T cells. My results include the suppression in percentage at different concentrations of the drugs. I was guided to use the maximum suppression values and perform a statistical test, but I don’t understand why. Why shouldn’t I use overall suppression but only maximum values?",Values of cytokine suppression for statistical analysis (HELP),1617035180
datascience,[removed],Values of cytokine suppression for statistical analysis,1617035103
datascience,"Hey all!  Hope everyone is having a great Monday, I know I am. I want to let everyone know about a NVIDIA AI platform piece I use daily, NeMo. 

[NVIDIA NeMo](https://github.com/NVIDIA/NeMo) is a toolkit for building new State-of-the-Art Conversational AI models. NeMo has separate collections for Automatic Speech Recognition (ASR), Natural Language Processing (NLP), and Text-to-Speech (TTS) models. Each collection consists of prebuilt modules that include everything needed to train on your data. Every module can easily be customized, extended, and composed to create new Conversational AI model architectures.

Conversational AI architectures are typically large and require a lot of data and compute for training. NeMo uses PyTorch Lightning for easy and performant multi-GPU/multi-node mixed-precision training.

[Cool collab notebook for getting started with NeMo](https://colab.research.google.com/github/NVIDIA/NeMo/blob/r1.0.0rc1/tutorials/NeMo_Getting_Started.ipynb) shows how we can construct a toy demo showing the ability to translate Russian audio files into English. That's what is so neat about NeMo is the pipeline is so diverse; we can translate these audio files into English, then if we wanted to, use BERT for the NLP task for the translated English as well. And so on and so on.   


Anyways, I hope you enjoy this collab book, and to have a poke around NeMo afterwards.",NeMo Getting Started. Prototyping Conversational AI Application,1617032631
datascience,,Does having few girl students in DS is common? Even in developed countries? Is it harder for girls to be in this field?,1617031817
datascience,,Do Data Scientists use Streamlit? Is it worth investing time on to learn?,1617031522
datascience,,"Identifying ""aliases"" among organization names with potential duplicates",1617029940
datascience,"https://m.youtube.com/watch?v=qKU97mVs6nM&amp;feature=youtu.be

I saw this video here that shows some of the advantages of a html presentation vs a PowerPoint presentation (e.g. smaller size, interactive graphs).

Has anyone ever done this before? Is there a straightforward way to make a html presentation? What software do you use for this?","Has anyone ever made a ""html"" presentation instead of a ""PowerPoint"" presentation?",1617028562
datascience,"Hey! Just finished the final commit of [Seattle Senses: Talking a walk around the city, through data.](https://github.com/ivanachillee/seattle-senses) It was very fun to work on and hope you find it fun too :) Would love your feedback if you have any.",Fun project: Tasting Seattle through data.,1617027425
datascience,"I'm an engineering major with 6 years experience in business analytics and now in middle management. I struggle with modelling related projects (like regression, clustering, PCA) due to lack of formal education in this field. I was decent at maths (very good at physics) and don't know if I would do well if I take up Data science ahead. What scares me is there's so much, it's often hard to visualize and it's ever evolving. Any suggestions?",How do know if I'm made for data science?,1617025010
datascience,"Like I said, I'm a graduating law student going into privacy and technology law. My job after law school does everything from 4th amendment-type civil rights claims to research papers on public broadband plans by cities to lobbying against AI/ADS use in government settings (and more!).

I will obviously be low at the this job (I will be both new and fresh outta law school) so my ability to shape their policy will be pretty limited, but I want to know that I know what I'm talking about, and I would truly hate to lack the technical expertise to do this job well. I want to put in the work and do a lot of reading so that I am at least knowledgeable, writing meaningfully, and giving the best advice I can give when given assignments. I will read papers, check out books, watch YouTube vids, whatever. 

Background on my knowledge base: I do not have a meaningful data science or even more general comp sci background, so send me whatever, there is nothing too small. Also send me anything complicated you think I need to have a working knowledge of: I will just have to learn it, that is how I will do this job well.

I'm cross posting this to a few different places + talking to other people, so don't worry, this is not my only check. But anything - literally anything! - will help.

&amp;#x200B;

TLDR: i'm going into a legal job where we work with data scientists (and sometimes against them!) and I want to make sure I know what I'm talking about, please point me towards media for me to consume / articles to read / even just a list of topics I should have a working knowledge of.",I'm a law student wanting to go into privacy / tech law. I have the job set up; now I want to make sure I know what I'm talking about.,1617021417
datascience,Love to hear your journey!,Anybody here working remotely as data scientist?,1617021278
datascience," I'm trying to build a simulation for my students which allows them to wear the shoes of a Data Scientist for a week (kind of a short internship)

Any ideas how that week should look like?

The week suppose to make them use all the skills they have learned during the last 3 months",Describe a week of a Data Scientist,1617015011
datascience,[removed],confused between data science and data analytics certification course.,1617013129
datascience,,How I landed a data science job at Microsoft,1617012429
datascience,"I have a bachelor's in sociology and planning to do my master's in data science. I have been taking computer science online courses (harvard cs50) and planning to take some more to prepare myself and go all in.
My question is how to pick a master's program or know of a program is good and applicable in the job market. I am viewing different programs in Malaysia specifically and I want some advice, tips, things to look for in a program.
And finally, what should I make sure to learn to make the best out of the program and prepare myself to enter this competitive field.",How to judge a data science master's program?,1617012142
datascience,"Im looking to self learn and get a job or at-least an internship in this field (don’t know even if it’s possible). Im a mech. Engineering graduate with no prior knowledge of coding. 
How should i start about, learning python online ?",How start a career in DS,1617011705
datascience,,9 Comprehensive Cheat Sheets For Data Science,1617011445
datascience,"PhD student thinking of going into either data science or UX research after grad school. Curious if there is any overlap in these positions, and if there are any corporations I should look out for that tend to merge the two.",Do you ever work with User Researchers?,1617004857
datascience,What could I do after I finish said course? I was thinking of doing an internship but immnot sure how to go about it. Is doing an internship even a good idea? What do I do? Any advice?,I plan on doing a 4 year btech course in data science however I'm not sure what my opinions are after finishing said course.,1617004023
datascience,,MACHINE LEARNING TIER LIST (choosing the best model),1617003568
datascience,[removed],Data Science and ML (Live Training) with 3 Mentored Internships.,1617000442
datascience,"Wassup. What are some resources that I can use to get better at data science? I know there are lots of available resources online, but I just want to make sure that I'm on the right track.

My background: programmed since high school junior year, had experience in python, c++, c#, front-end dev, and bash script",Git Gud at Data Science,1616998194
datascience,"
I’m wondering if there’s any computation of mathematics or conceptions that lets to do multiple-generators for generating different Classes at the same time ....?","multiple-Generators adversarial Network for example ,,,,!!!",1616995793
datascience,"Hi everyone,

I'm a junior in college and will be a senior starting next Fall. I'm not happy with my majors and looking to switch. Taking an extra year or two isn't a problem at all, so I'd rather do something I love than rush through something. In this thread, I'm hoping to get the opinions of some real data scientists about whether or not my university's data science degree (BSc) looks like a hyped piecemeal degree or if it looks like ""the real thing."" I know some schools just toss together some stats and coding and call it ""data science"" to cash in on the hype. I'd appreciate any comments or opinions you might have.

This degree would require me to choose either a computer track or a stats track, so I'll indicate the classes for each one of these in addition to the core courses. Courses I've already taken for my current combination of physics and economics are listed at the very bottom.

&amp;#x200B;

**DATA SCIENCE CORE:**

* Fundamentals of Programming and Problem Solving
* Intro to Statistical Modeling
* Probability 
* Statistical Programming
* Inferential Statistics 
* Regression Analysis 

&amp;#x200B;

**STATS TRACK (CHOICE 1):**

* Experimental Design Methods
* Data Analysis Practicum
* Stats Class Personal Choice\*
* Stats Class Personal Choice\*
* Math/CompSci Class Personal Choice\*\*

Choices for \*:  Nonparametric Statistics, Statistical Monitoring and Design of Experiments, Advanced Data Visualization, Introduction to Bayesian Statistics, Survey Sampling in Business, Statistical Learning, Analysis of Forecasting Systems

Choices for \*\*: Stochastic Modeling, Simulation, Managing Big Data, Optimization 

&amp;#x200B;

**COMPUTER TRACK (CHOICE 2):**

* Object-Oriented Programming 
* Data Abstraction and Data Structures
* Database Systems
* Managing Big Data
* Advanced Data Visualization
* Statistical Learning
* Stats Class Personal Choice\*\*\*
* Math/CompSci Class Personal Choice\*\*\*\*
* Math/CompSci Class Personal Choice\*\*\*\*

&amp;#x200B;

Choices for \*\*\*: Introduction to Bayesian Statistics, Analysis of Forecasting Systems

Choices for \*\*\*\*: Optimization Modeling, Stochastic Modeling, Simulation, Advanced Database Systems, Optimization, Theory and Applications of Graphs, Combinatorics 

&amp;#x200B;

**Already Taken (but also relevant for Data Science):**

* Calculus III
* Introduction to Linear Algebra 

&amp;#x200B;

If anyone cares to give opinions or insights as to whether they think I should pursue the computer or stats track, I'd be very grateful.

&amp;#x200B;

Thanks to everyone for reading!",Is My University's Data Science Program Decent?,1616995066
datascience," 

Completed my undergrad in data analytics and I'm now considering an online master's in applied statistics. Initially, I was looking over any data analytics or data science programs but I feel like I will learn more skills that I can retain in my career long term with more emphasis on statistics. I know programming is very important and I have some basic knowledge of Python and SQL and I figure I can learn more tools on my own.

So my employer covers up to $5250 per year and I'm trying to avoid building up any debt and therefore I narrowed my search to these two programs that are below 30k. I'm hoping if anyone has taken any of these programs and can provide feedback or has any advice on the courses can provide me anything that can help make my decision easier. I work full time so I am only looking for online programs.

* The first one is the University of Kansas's online Master's in Applied Statistics and Analytics which ends up costing about $21,000 and provides the choice with an emphasis on data science.

[https://edwardscampus.ku.edu/applied-statistics-analytics-program-details](https://edwardscampus.ku.edu/applied-statistics-analytics-program-details)

* The second one is Penn State World Campus with the Master's in Applied Statistics and I receive a 5% discount from my employer which ends up being $26,334. They carry a lot more courses and many of which are heavy on SAS and the rest are applied and methods.

[https://www.worldcampus.psu.edu/degrees-and-certificates/applied-statistics-masters/courses](https://www.worldcampus.psu.edu/degrees-and-certificates/applied-statistics-masters/courses)

Originally I had my eye on this affordable program at Kansas State (yea another Kansas school that so happens to be affordable) [https://online.k-state.edu/programs/data-analytics-masters/](https://online.k-state.edu/programs/data-analytics-masters/) but I'm not sure if it's better than applied statistics. The program has some statistics but this would take me through a route more focused on machine learning, data mining( which I took in my undergrad), and using a variety of software tools. I always see companies seeking strong programming skills and less emphasis on stats and math for data science roles. Are data science degrees the better route these days?",[Q] Choosing an affordable online masters program in Applied Statistics,1616992763
datascience,"I think idk anything but about to start my master’s and im scared. Here everyone talk like they know their stuff while i don’t know anything (or just basic, i did made project) but i feel like idk anything, and if now i ask people will think why im even doing master’s in it? I have negative self esteem when it comes to data science. I want to learn and be better. My classes starts soon. I want to be a good student and much better data scientist, what and how should i achieve it?",Is there any place where i can ask stupid questions about studying data science without looking like a complete idiot?,1616991999
datascience,I'm considering taking on an internship project that involves using audiogram data to predict/translate into parameters that can be used for hearing aids - does anyone know which libraries/models can be utilized to treat this type of data?,Audiogram Data,1616991654
datascience,,Where do you find a remote data scientist job?,1616990522
