subreddit,selftext,title,created_utc
datascience,"Hi all I’m a recent bs grad, job searching for a data analytics/science position in New York. But I’ve been having trouble looking for one. Virus thing doesn’t help but gives me time I guess.

Background:
Industrial engineering w minor in econs 
Wasn’t mature enough for college so I scraped through
Now I wanna do something about it.
I know basic sql, r, tableau, excel and now working on python. 
Took 1 C course during a sem in college. 
Never had a data internship (it’s all a ripple effect) have been close to getting a job twice out of hundreds of applications, but that I know is due to my incompetence in the subject matter. 

Currently I have been trying to do some home studying to better my beginner understanding in the subject by doing the codeacademy data science course and working on a textbook called thinking in python 2e. 

Hence, I’m looking for a mentor/meetups in the city that could help guide me and teach me the foundation of learning the subject and gaining my own independence as well as learning to equip myself with the necessary knowledge and strategies on nailing job interviews within this industry.

Thank you for listening, I don’t expect anything but I just thought Id take the fullest opportunity that reddit has to offer as a positive platform for good and for expressing my thoughts. 

PS: I’m not opposed to grad school. But even then I recognize that I need to build myself to a credible ability first. Which I’m not quite sure I know how to.",Looking for a mentor,1585093979
datascience,,"Why is ML,DL,AI so hyped, have they actually solved anything big enough?",1585090336
datascience," 

Is it true that you should set the y-intercept to 0 before doing linear regression if you absolutely know y = 0 when x = 0 ?

As explained in this video: [https://youtu.be/Rb8MnMEJTI4?t=278](https://youtu.be/Rb8MnMEJTI4?t=278)",Should you set the intercept before doing linear regression?,1585087045
datascience,[removed],Dissertation / Thesis idea required for MSc Data Analytics,1585083597
datascience,"Just curious on why most of the articles/guides go on Medium and not their personal blogs or even GitHub pages. Medium is good but seem to be a paywalled annoyance, similar to the news websites.",Why are most of the data science articles on Medium?,1585079925
datascience,"So I'm going to university and will either be doing a CS degree with a math minor or a Data Science degree with a math minor. I understand the fundamental differences between data science (mathematical models, analyzing data, predictions etc) and more traditional software engineering. Both sound interesting, and I'm not really sure which one of these I want to be working with in my future career.

I'm not really sure how to build and structure my education plan. The math minor will definitely help me on either ""path""/area. What is the general consensus: is it easier to self-study software engineering principles later on and get a related job that way, or is focusing on that in uni and later on self-studying data science and stats principles easier? My initial guess is that it would be better for me to take the data science + math combo in uni and later on learn about swe/developer ""stuff"", but maybe I'm wrong here?  


The ""traditional CS"" curriculum is more SWE-focused, with software projects and related theory, while the data science curriculum contains more stats and ""data courses"".

&amp;#x200B;

Any opinions / help is greatly appreciated!","Not sure which ""path"" to take here.",1585078951
datascience,"I'm starting to learn data science and started with the IBM data science course on Coursera. However that does not include mathematics involved in data science and seems more of a marketing technique for IBM product. I would like to ask you guys for a couple of recommendations. 
1. Please recommend a beginner course on mathematics for data science.
2. Entry level course into data science, similar to the IBM data science course. 
I'm very new to this field and so open to any suggestions as well. 
Thanks :)",Recommendation please!,1585078170
datascience,,All SAS e-learning is free for 30 days including the Data Science Academy,1585071834
datascience,"Probably going to be one of the more unorthodox threads to come up here!

But I went from using a single monitor to dual monitors a couple of months ago and now I'll *never* doubt the influence on your efficiency your work set-up can have!

Curious to hear about anything anyone has to say on this.",Trying to maximize my usage of desk space real estate around me to work more efficiently. What things (e.g. a giant SQL/Python cheat-sheet pasted on the wall infront of you) do you keep in your proximity to improve your work more efficiently.,1585071642
datascience,"UC Berkeley KPI Dashboard: Updated

https://preview.redd.it/9u34al4hpno41.png?width=2000&amp;format=png&amp;auto=webp&amp;s=08bbf3783f69a75db0c65114138c11924139894c

Link: [https://public.tableau.com/profile/shah.pankaj#!/vizhome/MOM\_wk\_11/MOM\_wk\_12](https://public.tableau.com/profile/shah.pankaj#!/vizhome/MOM_wk_11/MOM_wk_12)

Combine : Arts  + Viz

Feedback Welcome",KPI Dashboard: UC Berkeley,1585071399
datascience,"It's one of my schools I'm looking to go to get my masters once my undergraduate is completed next year. I was wondering what scores you got in with (GPA, GRE,) and what your overrall opinion is on the program. Thanks",Anyone here in Northeastern's M.S Data Science Program?,1585071349
datascience,"1. Problem statement 
2. Explain the technique you’ve used
3. Constraints you’ve faced
4. Tools you’ve loved using (bonus points if you can include libraries too)
5. Solution
Include GitHub link if you wish.",Interview question. Explain one interesting machine learning project you’ve worked recently. Focus is on solving real-world problems. And a fun project.,1585071329
datascience,[removed],Data Scientist- resume feedback,1585070545
datascience,"Hello experts - I have read about Structural Equation Modeling in grad school, I also seem to understand how it works and what it is used for. Can someone point me to a paper that demonstrates a real life application end to end ? I don't work in academia anymore so an open access or a public link would be really appreciated. Thank you all!",Papers demonstrating application of SEM analysis,1585070350
datascience,"hello, 

Im interseted in hearing stories about those with no background in data science or computer science becoming data scientists, how did you do it? what made you want to change your career? What were some major challenges you faced? 

Thank you for sharing","self made data scientist, what's your story?",1585069134
datascience,[removed],Is it too late to snag a summer internship?,1585068621
datascience,"What do you think??

[View Poll](https://www.reddit.com/poll/fo84cp)","Would you rather have an Analyst on your team who has great Technical Skills (but bad Soft Skills), Great Soft Skills (but bad Technical Skills), or Average at Both?",1585067654
datascience,,"Translating ""Wash your hands"" into 500 languages",1585067598
datascience,"Hi guys, I am a bit new to this stuff and looking for some help on how to tackle this problem.

I have a dataset of departments, with clients (and their needs) and staff (and their hours) for each day. I am looking for a way to predict how much (in hours) of each 'type' of staff (likely based on their position in the team), given a set of expected clients and other factors. 

As far as I can tell, to predict the expected hours for every position type, requires a seperate model for every position type. My case is that there a lot of different positions, and potentially a very large amount of models to essentially create one dataset.

What is an efficient way to tackle this? Should I automate modelling for every y is there a better way to think about this problem?",Predict a lot of y's,1585066542
datascience,,"Imagenet prediction decoder for simpler-labels. Ex: ""French_loaf"" (Keras) -&gt; ""baguette"" (simple)",1585066370
datascience,,What is this kind of viz called and what tools are used to create it on an interactive map? Does anyone have tutorials or similar examples?,1585061726
datascience,"Not sure if its been posted before or not.

[https://365datascience.com/wp-content/uploads/2020/01/Shortcuts-for-Data-Scientists-2020.pdf](https://365datascience.com/wp-content/uploads/2020/01/Shortcuts-for-Data-Scientists-2020.pdf)","If anyone is really into keyboard shortcuts like I am I just found a guide that has a ton of them for many IDE's. Includes: Python, Tableu, Excel, SQL, R, SAS, SPSS, Matlab &amp; Stata.",1585059303
datascience,,The quest for the best Hacker News title,1585058983
datascience,,How Big Data and Data Science work best together? | iunera,1585058850
datascience,"Dear fellow colleagues, 
I want to hone my data visualization skills. I searched for courses online but i couldnt find any good course that is specialized in data visualization in R. If you have any recommendations about books or online courses i would be very happy to check them out. 

Thank you all",Any recommendations for learning data visualization in R?,1585058177
datascience,[removed],Survey on Causal Data Science,1585057403
datascience,,Blog post I was an editor on explaining usage of data science at my workplace. Any other common approaches to the image optimisation described in the post?,1585052083
datascience,,"Netflix, Walmart, Uber and More: Big wins with Big Data",1585051207
datascience,,Production usage of data science at Expedia Group™: How We Optimized Hero Images on Hotels.com using Multi-Armed Bandit Algorithms,1585050628
datascience,"I am trying to find if  it makes sense that they often happen together: NLP, and data engineering or big data techniques (e.g. Spark, Hadoop, and Scala)

One classic example in Hadoop MapReduce is word count. I guess that doesn't count as NLP.

1. In NLP industrial positions, do natural language data often need data engineering or big data techniques, i.e. do natural language data often come as ""big data""? 

   Internet search engines likely require big data of natural language, but I guess there  are very few Internet search engine positions.  Do most information retrieval positions don't need to worry about big data? How about  other NLP applications.?

2. Natural languages are unstructured data. However, https://www.dataversity.net/natural-language-processing-big-data-powerful-combination/ said in 2014:

  &gt; As developed as big data analytics have become, they still really only excel at managing structured information.


  Have big data or data engineering techniques evolve for NLP already? If yes, how well are  NLP aware big data or data engineering techniques received in industry?


  Is it more often to convert natural language data to structured data, and then apply big data or data engineering techniques, or to apply  NLP aware big data or data engineering techniques directly to NLP big data?

3. Some other observerations and thoughts?

Thanks.",Big data or data engineering for NLP?,1585048187
datascience,[removed],Starting out a Data Science series during these trying times to help others grow with me!,1585047247
datascience,"hey guys!

Had a bit of time and did a project. finetuned hugginface distill-gpt2 transformer on yahoo answers data. It takes a question as an input and generates an answer based on that. Some of them are hilarious some are just straight-up nonsense. Give it a look and let me know what you think: www.answerthis.xyz
For those wondering the app is stored in Google cloud as the api to the model.",Finetuned distill-gpt2 on yahoo answers data,1585045373
datascience,"Hi,

I work at a fintech startup that disburses instant loans to low creditworthy customers. This is how the process works.

A potential customer downloads our app and starts a loan application. He/she has to input a few details like kyc documents and loan amount before he/she submits the application. The application is then reviewed by the Operations team and a loan is disbursed based on their credit worthiness. 

Now a lot of users start an application on a daily basis (about 30k) but not all of them submit the application; they are just stuck/dropped off somewhere on the app. This is called a 'draft'. Our startup only has a few agents (around 20) who call these potential customers (Stuck/dropped off from the app) and hence a lot of potential customers are left who could've given us good business.

My idea is to create a model that can determine customers who are more likely to submit an application than others. Using this model, our calling agents can prioritize whom to call and whom to deprioritize the calling. I have customer demographic data as well their app interaction data.

Any help is really appreciated. I need a simple and explainable model.",Determine customer likelihood of loan purchase,1585045235
datascience,,"Stay Home🏡, Stay Safe ❤️ #Airflow #DAG #CoronaVirus",1585044829
datascience,"Hi r/datascience,

We created a real-time feature learning method to support predictive queries in our predictive database product. When given a query with features like 'walks like a duck' and 'quacks like a duck', it scans the database for relevant patterns in (one or ten) millisecond scale and replaces the query patterns with high level features (like a duck).  

[https://aito.ai/blog/introducing-concept-learning-to-free-you-from-feature-engineering/](https://aito.ai/blog/introducing-concept-learning-to-free-you-from-feature-engineering/)

There will be separate blog post about the effect on the inference quality. There was significant improvement on decision boundaries &amp; accuracy for some test sets. Still, the biggest effect was that the probability estimates got significantly better, and some special cases are handled now much more graciously.

Any thoughts, questions or opinions?

Regards, Antti &amp; Aito",Real-time feature learning in a predictive database,1585031022
datascience,[removed],Data Science in Machine Learning,1585029626
datascience,[removed],Is there any useful performance measure for 'weak' labeled data?,1585024150
datascience,,Call to Action to the Tech Community on New Machine Readable COVID-19 Dataset | The White House,1585015594
datascience," 

Hello,

First post on a subject such as this, so please guide me to a different place if needed. I have a situation I could really use some suggestions with. I graduated college with my degree in management information systems and now I got a job as a data intern. I do not have anyone in my company to teach me as i am the first data position this company has had.

What the company does now:

Has forms which internal clients request a job on. These forms store data in SharePoint list data. On the employee side they can continue the form to add other information needed. I have not created a data model yet but I think I may make a relational data model to help with solutions. Right now there is a JobID and a whole bunch of attributes as the data is very flat. An employee has an automatically updating excel file with this data but it takes 40 min to update and it is so impractical to work with due to how unorganized and slow it is.

What I have been thinking:

Set up an azure SQL database and use flows to move the data from SharePoint into SQL and then from there into powerBI. This way I can query useful data way quicker. However the data is still very flat and unstructured and I have not done this before so I am trying to learn. I am looking for suggestions on some sort of data pipeline. I was told the data must stay in SharePoint but I can move it from there. For reference the excel file that is being used has 120,000 cells. I know this isn't that many comparatively but for how unstructured this system is it is very difficult to deal with.",Data help please!,1585008620
datascience,[removed],Using a bad forecast to make a better one,1585001655
datascience,"I'm working on a project where I have a bad sales forecast from another company and I have the actual orders that same company sends in. The accruacy of the forecast is about 46%. 

I'll be building a time series model for this but I'm not really sure how to incorporate the forecast into my model. The 46% accuracy is way above the no information rate so it clearly has some signal but it's just a little weird to use a forecast to build a forecast....",Using a bad forecast to make a better one,1585001642
datascience,[removed],Data Science Career,1584997820
datascience,,"Is blockchain useful for data engineering, big data and data science?",1584997044
datascience,"Hello, I’m currently a high school senior who’s going to study Data Science at UCSD starting Fall 2020. I was just wondering if you can share some advice / information on Data Science projects, obtaining internships and/or job opportunities. I’m really interested in DS but I’m afraid that CS majors will have preference when getting jobs. 

Here are some topics that I would appreciate your input on: 

1.) How difficult is it to get a job after college (B.S. in Data Science)? 

2.) Do employers want DS majors to have at least a masters? 

3.) Any personal project suggestions I should start working on to improve/ resume building? 

4.) How did you attempt to stand out with the growing number of CS / DS majors? 

5.) You were most likely in my position a while ago, any general advice? 

Thank you. All advice is appreciated!",Your advice for future data scientists?,1584995159
datascience,"We’re doing everything we can to make a difference.  ThinkData is building a repository of data on COVID-19 which will be constantly updated and accessible through Namara (free to register).  If you need the data, make use of it. If you are a data provider or can connect us with a source, please reach out. Here's the link to the data repository: [**https://app.namara.io/#/search?query=covid&amp;page=1**](https://app.namara.io/#/search?query=covid&amp;page=1)",COVID-19 DATA REPOSITORY,1584992703
datascience,[removed],Data Science Career,1584990097
datascience,Is it possible to apply Data Science to validate the cospiracy theories like COVID19 outbreak being bio weapon ?,Applying Data Science to test conspiracy theories,1584989994
datascience,,"a.ttent.io/n I wrote a short story about a data scientist who starts stealing and analyzing private data to uncover an underground biohacking conspiracy. The story explores privacy, attention, and the nature of consciousness. See if you can predict the twist... (WARNING: adult themes)",1584988866
datascience,,"I participated in my First ever ""Data Science competition"" in Analytics Vidhya. There are around 10353 registered candidates. I tried my best and got 1028 Rank Overall with 0.4791 F1 score. The person who is in Number 1 position his F1 score is 0.535.",1584987941
datascience,"Hi everyone,

Regarding the global crisis, COVID-19, my company as one data consultancy focusing on healthcare professionals online conversation, decides to put all commercial projects aside and therefore we start innovation now. My pitch is to find out those useful and practical experience and mistakes China had got before. I'm Chinese so no trouble to understand Chinese. But I find difficulties in framing questions I would like to answer and collecting enough data ( in this case, I'm thinking to get conversations from popular sites and social media) My aim is to provide some insights from China practically. 

It's quite vague actually, I have to admit. But I would love to hear what you guys are thinking. I really want to contribute some useful things to this situation.

&amp;#x200B;

Thanks",What would you advise in terms of one research on COVID-19?,1584985060
datascience,"Hi guys,

So over a couple of years I’ve been interested in data science but never took anything to learn it. Quite frankly I was waiting for some courses near me but nothing popped up. I was thinking on learning it on my own. But I have no experience in programming of any kind. So, I have the will to learn it but don’t know where to start.

I was hoping if any of you have any recommendations for us newcomers, some free courses or books something like that? 

Thank you and be safe.",Learning data science,1584984276
datascience,[removed],"Data Science Employment in Denver, CO",1584982842
datascience,"I am starting a new lab this fall at Florida International University (FIU). Our lab will focus on **understanding the neurocognitive processes that allow for the emergence of cognitive control** (how the human brain/mind monitors and adapts itself overtime to achieve task goals). Moreover, we will seek to understand how this system develops across adolescence, and relations to social behavior and social anxiety. Towards this end, methods that I currently employ, include: (single-trial) ERP analyses, time-frequency analyses of EEG (power and phase relations), source-localization of EEG, traditional fMRI approaches (GLM-based), and basic computational modeling (drift-diffusion models). Our lab is currently purchasing a high-density EEG system and FIU houses an fMRI scanner.

I am **seeking collaborators** that may or may not currently work in the fields of psychology or neuroscience, but that have at least some **expertise in one or more of the following domains: data science, advanced signal processing, machine learning, computational modeling, graph-theoretic/network analysis.** *I am most interested in finding collaborators that can help generate the best science; location, status, affiliation, or degrees earned are not important.* I also intend to take on at least one PhD student this fall and welcome responses from prospective students.

The scientific goal of this collaboration will be to combine skillsets in order to test novel hypotheses regarding the human cognitive control system, its developmental trajectory across adolescence, and relations to social behavior and social anxiety. At a practical level, we would seek to produce high-impact publications and to generate pilot data for pursuing collaborative grant proposals. **Depending on the situation, initial funding may be available for potential collaborators, consultants, or contractors.**

For examples of recent studies that will inform the work in our lab, please refer to the following publications:

[https://www.sciencedirect.com/science/article/abs/pii/S1053811919303696](https://www.researchgate.net/deref/https%3A%2F%2Fwww.sciencedirect.com%2Fscience%2Farticle%2Fabs%2Fpii%2FS1053811919303696)

[Adolescent Cognitive Control and Mediofrontal Theta Oscillat...](https://www.researchgate.net/publication/339927980_Adolescent_Cognitive_Control_and_Mediofrontal_Theta_Oscillations_Are_Disrupted_by_Neglect_Associations_with_Transdiagnostic_Risk_for_Psychopathology_in_a_Randomized_Controlled_Trial)

[https://www.sciencedirect.com/science/article/abs/pii/S1053811917304445](https://www.researchgate.net/deref/https%3A%2F%2Fwww.sciencedirect.com%2Fscience%2Farticle%2Fabs%2Fpii%2FS1053811917304445)

[https://www.jneurosci.org/content/37/11/2895.abstract](https://www.researchgate.net/deref/https%3A%2F%2Fwww.jneurosci.org%2Fcontent%2F37%2F11%2F2895.abstract)","Seeking collaborators with expertise in: data science, advanced signal processing, machine learning, computational modeling, graph-theoretic/network analysis",1584982501
datascience,"UC Berkley KPI Dashboard.

Link: [https://public.tableau.com/profile/shah.pankaj#!/vizhome/MOM\_wk\_11/MOM\_wk\_12](https://public.tableau.com/profile/shah.pankaj#!/vizhome/MOM_wk_11/MOM_wk_12)

Feedback Welcome.",UC Berkley KPI Dashboard,1584980291
datascience,,How to communicate data using tables and graphs,1584979348
datascience,[removed],"Need help with Python Plotly visualizations, specifically hovertext templates for a graph.",1584978667
datascience,"Hi, I'm a student 2nd class in Computer Science. This is my first project using Kaggle in Titanic Competition. This is not a final project, I will continue on this. Please leave your any thoughts about it. No matter it is positive or negative, I just want to hear.

[https://www.kaggle.com/erhanyumer/erhan-yumer-titanic-eda](https://www.kaggle.com/erhanyumer/erhan-yumer-titanic-eda)",Your thought about a beginner's first project,1584976685
datascience,Anyone know if there is a public list of hospital addresses in the USA?,HOSPITAL ADDRESSES,1584976408
datascience,,New D-Tale (free pandas visualizer) features released! Easily slice your dataframes with Interactive Column Filtering,1584976180
datascience,"I'm working on a project that involves using Knime to write data from another file into access. I can get it connected but can't figure out how to get it to write the data. I'm new to Knime. Not sure if it's the best thing from my project yet, but I have to try it and present it. Any ideas?",Knime to Access question,1584974551
