subreddit,selftext,title,created_utc
datascience,"Hi everyone,

I’ve been currently working as an actuary at a large insurance company for almost 2 years. I chose the career because I was drawn to the applied math part of it. My favorite part of my job is doing the math and crunching the numbers, but I’m finding the part about learning regulation and business boring and unfulfilling. Recently, I’ve been learning more and more about data science/machine learning and I’ve been finding the predictive modelling/algorithm topics and potential career opportunities and problems really interesting. I don’t mind programming/coding , but I see it more as a means to an end rather than the end itself (i.e I prefer the analytical part more than the engineering aspect). 

For those of you in the field, what proportion would you say your job is analysis vs engineering? Do you feel fulfilled (quantitatively-speaking)? Do you consider it more of an engineering job with some math or a math/stats job with coding?

Thanks!",Transitioning from being an actuary to data science,1579797902
datascience,"Hi guys

I am a PhD in biology (immunology and neuroscience) and currently a research fellow somewhere in Eastern Europe. I am bored with my current academic job, where my duties are more of a technician,  and want to move into a more data analytical one, probably in biotech industry. Yet, despite having some online courses behind and ongoing I want to have a more proper, formal to an extent,  education in data science (and also more personal communication with data scientists). Some people advised me to start a master in data science, but I doubt as I had enough of masters and grad school and also can't compete on admission with people who are younger and studied CS. I am curious if there are any good offline bootcamps (longer-better, I have no illusion I can learn data science in a month) in Europe or maybe Israel where I can get a kick to start a new career path? BtW, I am not scared by calculus, or prob theory etc., but I just don't wont to learn them alone without feedback. Thanks.",What Bootcamp to choose,1579789831
datascience,"I'm looking at methods beyond your regular job. Maybe freelancing, projects, teaching etc. If the rules allow, please post the name of your project / link as well!",How do you use your Data Science skills to earn extra money?,1579789403
datascience,[removed],future data scientist :),1579788433
datascience,"Hi, I recently graduated highschool in Australia and am about to enter university in about a month. I've received 2 University offers. 

The first one is for a Bachelor of Data Science (3 year), a course which, from looking at its required classes, mixes statistics, computer science and economics. The second offer is for a double degree in Statistics and computer science (5 year). 

Which is the best option for the industry?",What degree should I study?,1579788285
datascience,"Hi guys, 

I wanted to discuss [this article](https://towardsdatascience.com/predictive-vs-interpretative-analytics-9f2d85ac1106) with you. I know it's Medium and you don't like it but I'm really interested in discussing this specific subject that I find quite relevant. 

I really feel that DS (can I call it like this even if there is not ML?) can deliver enormous values on that kind of uses cases aiming specifically at explaining stuff. And I'm quite frustrated because I can't seem to find people able to do that even though it's supposed to be easier than Deep Learning... 

Let me know your thoughts !

&amp;#x200B;

PS. The first time I posted the article's link directly, it was removed by the bot, I wrote to the mods and didn't get an answer.",Predictive vs Interpretative Analytics,1579786082
datascience,"i was trying to deploy a face recognition app in heroku and pythonanywhere platforms. after deploying the application was popping the below error. can anyone help me how to access webcam.

Cannot open webcamRequest Method:POSTRequest URL:http://suneeltk.pythonanywhere.com/facerecog/Django Version:3.0.2Exception Type:OSErrorException Value:Cannot open webcamException Location:/home/suneeltk/myproject/nokia/views.py in facerecog, line 29Python Executable:/usr/local/bin/uwsgiPython Version:3.8.0Python Path:\['/var/www',  '.',  '',  '/var/www',  '/home/suneeltk/.virtualenvs/venv/lib/python38.zip',  '/home/suneeltk/.virtualenvs/venv/lib/python3.8',  '/home/suneeltk/.virtualenvs/venv/lib/python3.8/lib-dynload',  '/usr/lib/python3.8',  '/home/suneeltk/.virtualenvs/venv/lib/python3.8/site-packages',  '/home/suneeltk/myproject'\]Server time:Thu, 23 Jan 2020 13:13:03 +0000",OSError at /facerecog/,1579785484
datascience,"Hey everyone!

I am 24, have a B.S. in Chemistry and currently work as a lab technician. While I do like my job, I am considering a career switch as I work with a lot of hazardous chemicals. I've been considering the idea of doing something in Data Science. I would definitely need to learn the programming, but I think that once I do I might really like the job. I love making Excel spreadsheets and manipulating data to make it easier to understand/ more presentable. I tend to make spreadsheets and mess around with data for fun. I'm curious to hear about others experience I. The field, any advice, or thoughts on if it might be a good fit for me. 

Thank you :)",Considering Career Switch,1579783630
datascience,"I’m not talking about resources to transition in DS and changing careers. It’s more for a curious person to have an overview of why data science is important and how it’s changing the world in a social and business sense.

Please recommend books, courses... whatever you think it’s most appropriate.",What are the best data science resources for the layman?,1579778947
datascience,is this Pluralsight  [Data Science And Machine Learning Bundle](https://www.humblebundle.com/software/data-science-and-machine-learning-software?utm_source=facebook&amp;utm_medium=link&amp;utm_campaign=ds_ml_software_announc&amp;fbclid=IwAR21CqHM7Z0tsrLMXPUdbKWncXJ_rtbvxZS8ur1f8Z6lcIjSwCC6Rq2CMrY) Worth buying ? and reviews ?,Humble Data Science &amp; Machine Learning Bundle,1579778356
datascience,"Hello Data Schmatas.   


A bit of background before we start:  


I am currently enrolled in my second semester of a very good Data Science Program and can choose two electives. If you were in my shoes which two electives would you choose?   
P.s Core Courses are a must so any two of the electives at max can be picked. Minimum is 0 electives.

So which courses would you veterans take and why?  


Core Courses 

Mining Massive Data Sets.  
Machine Learning for Data Science. 

Electives (Where it gets fun)

Data Visualization -- Data Science Elective  
Social Network Analysis -- Data Science Elective  
Applied Image Processing -- Data Science Elective  
Block Chain and its Applications -- Computer Science Elective  
Cloud Computing -- Computer Science Elective  
Software Project Management -- Software Engineering Elective  
Mobile Computing -- Computer Science Elective  


I registered for Social Network Analysis and Software Project Management (I have a bachelors in Software Engineering so made sense to get hands on with some advanced concepts and distinguish myself but can change)  


Looking Forward to your replies and some Reddit logic blowing minds away.",If you could choose the data science courses to take from the list. Which one's would you take?,1579777885
datascience,,Need help to scrap a marketplace,1579775961
datascience,,Your Data Science Dream Journey Unlocked,1579773651
datascience,"I will be interviewing for a data analyst position that works closely with the data science, BI and data engineering teams. The job requirement expects me to know some of the following:

• creating BI reports (very familiar with this)
• providing insights for the company (retail industry)
• explore various types of data sets
• showing ROI
• “understanding” data mining concepts, algos and statistical modeling
• development of semantic layer 
• predictive modeling (language not specified)
• Redshift, Aurora, SQL
• S3 and EC2
• Hadoop, MapReduce, Spark

Apart from the above mentioned tools, the job does not specify language requirements. Is the assumption that all analysis / data viz libraries can be used through python? I know SQL and Python well, however I want to be prepared for these requirements accordingly. I am not sure if I will be tested during the interview or not, but I will meet multiple teams and have to talk about these points. 

How can I familiarize myself with data exploration and manipulation through big data tech such as Redshift and Aurora? I have not used them before, and am unsure of what I need to know beforehand. 

Finally, can anyone expand on building a semantic later? I have designed them and provided them to engineering teams in my previous roles, but never developed it myself.",Data Analyst Interview,1579765249
datascience,[removed],"Which laptop will be good for running R, SAS and Python",1579760395
datascience,Let’s study as a group...,Anyone interested to do a project right from a dataset selection to Visualization graphs?? Also need guidance,1579757163
datascience,"Hi all - 

I am a data scientist at tech startup. I am a member of this subreddit on my regular account, but I am using an anonymous account for obvious reasons. 

My small company right now is pitching to investors to raise another round of capital. Today the chief of staff asked me to make histogram plots from our database that they are using to pitch to investors. 

The problem is that these histogram plots are being used to make a pitch to investors that I know is factually not statistically certain or correct or academically honest at all. 

I made this clear to the CEO, the data science manager, and the chief of staff, and presented an alternative (and real) story about how we use our data - they all turned it down, saying the real story is too complex. The chief of staff straight up said that how they message with investors doesn't have to reflect how we are using our data in real life to maintain our informational advantage in the marketplace.  


**Was I asked to defraud investors? Or am I just freaking out?** 

**Is it normal to knowingly claim statistical significance from data when none exists as a way to raise money from investors?**",Was I just asked to defraud investors at my tech start up? Or am I just freaking out?,1579753441
datascience,"Elaborating on the title:  
I'm in the process of trying to find a job working in Data Science. What I mean by that is right now I'm taking courses through Coursera on the IBM Data Science Certification track. I'm on course 5 of 9 at the moment and getting through it. I have a job kind of working with data at a market research firm but I want to get more involved and my progress at the company is slow to put it nicely. I believe I'm making an effort and doing what I need to to get ahead but it just seems like it's not moving as fast as I'd like.  
I wanna get more involved and more hands on with my future career but I need some guidance and a push in the right direction. I feel like I'm doing something wrong for it to be taking this long. Does anyone have any advice on what to do? Maybe a story on how they got started? I've been hearing about doing Data Science internships for companies as a good way to start and get my foot in the door. I wanna get motivated and get going. I'm feeling impatient and can't wait to get started.",Getting more involved,1579753259
datascience," I'm planning to buy the famous book ISLR - Introduction to Statistical Learning with R and just want to know if the 2017 one available on Amazon is the latest one.

If anyone knows about a new edition that is in the pipeline and about to be released soon, please let me know as I might as well wait for the new one in that case.

&amp;#x200B;

Thank you!",Want to buy the book ISLR - Introduction to Statistical Learning with R,1579752180
datascience,"Even for jobs in the same area as me, they interviewed me over the phone rather than asking me to come in in-person. Not sure if it's the norm anywhere else",Is it the norm for most tech jobs to do phone interviews rather than in-person interviews considering its not a customer-based role?,1579751266
datascience,"I’m a college senior who is majoring in Economics at UCI, I will graduate sometime this June. My original plan was to jump straight into a masters program in Economics; however, I have recently become interested in Data science. I have begun learning R around a month ago and plan to continue learning R until I have become proficient in it. What are the best possible steps to take to make myself the most marketable for a job in data science when I graduate.

Any help is appreciated, Thanks","Currently In College, Seeking Advice",1579749098
datascience,,State of the art in style transfer: Re-render given image into another artistic style,1579747076
datascience,"So I'm trying to analyze crime data. How many years of data from today is required for the analysis conclusions to be sufficiently believable?

And is there such thing as data being too oldl?",How many years of data is sufficient for an analysis?,1579746339
datascience,"I recently took a position as a system analysis for a company that focuses on data science projects. After speaking to a few of my coworkers it seems there are more positions that focus on the back end of data science projects. For example, there are more positions that focus on configuring systems, automating data, and troubleshooting. I was under the impression there were positions that focused on predictive analysis, but that doesn't seem to be the case. I come from a system engineering/cyber background. 

With that said, I have noticed from talking to coworkers that there is a need for Information Assurance/Cyber help in projects. 

This might sound horrible, but I don't really have an interest in configuring scripts, coding, or programming. But I see a need for cyber support. Are there positions in data science that focus on cyber activity? Would it be a bad move to go to my supervisor and explain how I see a need and would like to help provide that support? 

I want to bring something to the table and not feel like I made a horrible decision taking this position.",Cyber in Data Science?,1579745659
datascience,"I have a geopanda dataframe lets call it A and a pandas datafrme lets call it B. A has much more columns and rows than B. A and B share one column called ""NAME"". I want to expand A's rows to include B's cols where [A.NAME](https://a.name/) == [B.NAME](https://b.name/). I like to mention able A has rows where the value in the NAME column repeats many times while on Table B the value on the NAME column repeats once.

I used the code below but i get so much more rows:

join = A.merge(B, on=\['NAME'\], how='left', indicator=True).reset\_index(drop=True)

Here are tables A, B, and the join: [https://imgur.com/gallery/4955bSd](https://imgur.com/gallery/4955bSd)

How can i get it to expand Table A with the cols of B but not expand Table A rows?",How to merge a geopanda with a panda dataframe on one column so that the geopanda df is expanded horizontally?,1579745167
datascience,,Does anyone know a promo code for the Intro to Data Science Metis course?,1579744482
datascience,"So I just finished my first Kaggle competition within my company, my team was tied for first on the public leaderboard, when we switched to private... we went from first to sixth (out of 15 teams) within the company. What made it sting more is the fact that mediocre solutions that we dismissed ended up performing so well they tied for first on the private leaderboard.",My first Kaggle competition... ouch,1579741115
datascience,"Hello All, 

Im very new to the field of Data Science. This summer Im going to be starting a Masters in Data Science with a concentration in Social Science from Utica College. Im looking for insight and help to get me ahead of the ball game. Can anyone help?",New to Data Science,1579740599
datascience,https://www.pi.exchange/careers/product-data-scientist,Good Dask skills? Or just good data science skills? Job opp in Melbourne,1579736121
datascience,,confusion about job requirements and the name of each type of ML/DS developer,1579731861
datascience,"Hi all,  
I'm kind of stumped right now and need some insight into helping me make a major decision in shaping my career future in Data Science.  
Just a little background of myself before I start.  
	\- Based in Canada  
	\- Have 2 years of being a Data Analyst under my belt  
	\- Have completed a Business degree at UBC with a GPA of 3.7/4.0  
	\- Have a bit of knowledge in coding specifically in Java and Dr Racket (I've done a few uni courses on these areas). Not familiar with Python or R.  
	\- Have good knowledge in SQL, have a year of experience using it in work as well as learning it through a uni course  
	\- Have 2 years of work experience using Data Visualization tools, Power BI &amp; Tableau  
	\- Have only the foundational knowledge in Stats. Just Stats I &amp; II. No knowledge in Linear Algebra.  
My goal:  
	\- Get into a data science(preferred)/data analyst position in FANG(Google etc) in the U.S. in the quickest way possible.  
To start, I'm not sure if I should shed USD 90k on a master's degree in data science from Berkeley or should I just self-learn data science tools and Machine learning?    
TLDR on the reasons why I'm choosing Berkeley over other programs is:  
	\- It's online/remote. I can work while taking it  
	\- It's from a prestigious school. This matters to me.  
	\- Help me get my quantitative knowledge(Stats, Algebra) up to pace.  
	\- I'm genuinely interested in Data Science/Machine Learning.  
	\- I don't want to waste my undergrad GPA.  
\- Majority of the people who work at Google, for instance, are from Stanford and Berekely  
My questions for you  
	1. Do you think with the 2 years as a Data Analyst be enough to qualify me for interviews for Data Science positions if I also self-learned the material myself?  
	2. Should I be spending USD 90k for a master's in data science?  
	3. Do you think having a Master's in Data Science from Berkeley will help put me in a better position in applying for Data Science positions?  
	4. What are your thoughts?  
	5. What was your path to becoming a Data Scientist like?",(Need help deciding) Self-learning Data Science/Machine Learning vs going to UCB(Berkeley) for Master's in Data Science($90k),1579731529
datascience,,State of the art in deblurring (motion-deblurrring).,1579728186
datascience,"I have a series of csv's (12 total each 15gbs) that my boss wants to be cleaned up (unmatching data types for example) with some additional columns added and concatenated into one CSV for further analysis. I've never dealt with data this big and at a crossroads with how I approach the issue. On one hand, I have set up spark with psypark to turn a virtual box into a local cluster to give me more juice, on the other, I am reading up on using sqlite to store the data for easier manipulation. I have to pick a single approach, since I will be teaching myself how to do all of this as I go along and I don't want to follow another rabbit hole. If anyone has any advice for my situation it would be greatly appreciated!",big data no budget best practice,1579725141
datascience,I want to get a certificate to start a new career. Any advice?,Which certificates will help me get my foot into this industry?,1579724479
datascience,Hi - is there a process to scrape web data that's freely available?,Scraping social data,1579722487
datascience,[removed],Energy Data Science,1579722425
datascience,,Data Science Listed in Top Jobs of the Future in 2020 World Economic Report,1579722210
datascience,"
Hi!
I am a newbie in here so please let me know if i did wrong or improper behavior :)
I am a junior majoring data science in University.
My career goal is doing data analysis in consulting or banking company.
So I asked my professors about graduate school.
Some professor told me that I need graduate school degree for becoming data scientist.
However, some others told me that I don't need the graduate school degree.
So, I need experts opinions!
Please, help me!
Thank you for your time! :)",Does Data Scientist need graduate school degree?,1579721524
datascience,"AI systems are already helping farmers with soil analysis, planting, animal husbandry, water conservation and more. Now a team of researchers from the University of Illinois at Urbana-Champaign (UIUC), Intelinair, and University of Oregon have introduced Agriculture-Vision, a large aerial image dataset for agricultural pattern analysis.

[Agriculture-Vision Dataset for Pattern Analysis](https://medium.com/syncedreview/new-large-aerial-image-database-for-agricultural-pattern-analysis-f4c0140e44d2)",[News] New Large Aerial Image Database for Agricultural Pattern Analysis,1579721337
datascience,[removed],Train a billion sample model in 5 minutes with Vaex and scikit-learn,1579717527
datascience,[removed],Does data scientist need graduate school degree?,1579717365
datascience,I am trying to make a project with the scraped data from LinkedIn and use to make an improved recommender system. Any help or links shared would be highly appreciated. Thanks in advance 😊,Anyone here have any experience in data scraping using selenium from LinkedIn?,1579711965
datascience,"Do you need a special degree or programming experience to become a data modeler?

&amp;#x200B;

they just hired a new DBA at my workplace but he refuses to do data modelling, saying its now what a DBA does and he will provide the table and query, but its nos his job to do relationship and DAX measure (data modeling)

&amp;#x200B;

if I want to step up for the role, what do I need?  so far i only used power query and power pivot and a LOT of cubevalue formula in Excel and pivot table",Do you need a special degree or programming experience to become a data modeler?,1579709550
datascience,"I'm a data science student and I'll be working on my undergraduate project this semester. The project uses SAS software and relies on using extensive statistical analyses to come to conclusions about the questions asked. I'm really interested in economics and I would like to explore a topic from the field and work on it for my project. I am wondering if anyone knows of any projects that I can look at for inspiration. 

Please note that I inted to do the whole work and have no interest in plagiarizing anyone's work. I'm new to the field and I want to see examples that help me structure my work and choose topics, siince I have never done this before. This is very important for me as it will be my first porfolio item; I would appreciate anything you could direct me to.",Data Science Projects on Economics/Global markets,1579708568
datascience,"(Crossposting from /r/learnpython).

I have a dataframe which looks like this:

    +----------+------------+-------------+----------+--------+-------+----------+
    |    id    |    name    |  predicted  |  actual  |   inc  | payout|yyyy_mm_dd|
    +----------+------------+-------------+----------+--------+-------+----------+
    |    215   |     Nir    |     100     |   200    |   100  |   1   |2020-01-04|
    |    215   |     Nir    |     110     |   210    |   100  |   1   |2020-01-02|
    |    215   |     Nir    |     120     |   220    |   100  |   1   |2020-01-03|
    |    215   |     Nir    |     130     |   230    |   100  |   1   |2020-01-01|

The above is stripped a bit, my actual dataframe has daily data for all of 2020, with 60 ids per day. `inc` is a result of `actual` - `predicted` and `payout` is 1% of `inc`. Here is the logic for how I have handled this:

    df['inc'] = df['actual'] - df['predicted']    
    df['payout'] = np.where(df['inc']&gt;=1, (df['inc'] / 100) * 1, 0)

I want the `payout` column to be 1% of `inc` but only after the monthly sum of `predicted` is passed by the monthly sum of `actual`, otherwise the `payout` should be 0.

I.e. 25 days into January, the sum of `actual` passes the sum of `predicted` for all of January, from then on I want to count 1% of the difference. Anything before should be 0.

`predicted` has values until 2020-12-31, while `actual` only has data up until the current day and is NaN for future dates.

Here is how the output might look if the total `predicted` for January was 1000.

    +----------+------------+-------------+----------+--------+-------+----------+
    |    id    |    name    |  predicted  |  actual  |   inc  | payout|yyyy_mm_dd|
    +----------+------------+-------------+----------+--------+-------+----------+
    |    215   |     Nir    |     100     |   200    |   100  |   0   |2020-01-01|
    |    215   |     Nir    |     110     |   210    |   100  |   0   |2020-01-02|
    |    215   |     Nir    |     120     |   220    |   100  |   0   |2020-01-03|
    |    215   |     Nir    |     130     |   230    |   100  |   0   |2020-01-04|
    |    215   |     Nir    |     140     |   141    |   1    |  0.1  |2020-01-05|

As on 2020-01-05, we passed the monthly sum of predicted (hypothetically 1000 here), we then payout 1% for everything past that amount.",Python - Dynamically performing logic based on a sum threshold.,1579708307
