subreddit,selftext,title,created_utc
datascience,"Hi Everyone,

While filling going through the application cycles I am feeling the skepticism of pursuing the Master's in Data Science, since this field is still in its nascent stage. What's your take on pursuing a Master's Degree in Data Science from the US in 2021, will it help me advance my career &amp; earn a heavy paycheck?

My background:

1. Completed my bachelors from India in 2018 &amp; working as an Analyst for the past two years. My work involves \~40% of the data science work

My motive:

1. Earn an advanced degree to upscale my career &amp; obviously move to the States and take advantage of the opportunities out there
2. Make money

Questions:

1. I came across opinions that people should rather pursue a degree in math or stats instead of pursuing a Data Science degree. After hearing these opinions, I am worried If a Data Science degree will be obsolete in the future?
2. Suggestions on the best courses for an average profile, I came across NYU Data Science &amp; CMU DS but due to their highly competitive applications cycles, I am refraining from applying to these courses
3. I don't even know the basics of Data Structures, will there be a disadvantage for me while applying for colleges or for full-time positions? I am planning to take these courses as electives

Thank you, much appreciated.",Data Science Master's in 2021,1610089381
datascience,I recently started to have to present results/ideas to people that are not from a technical background/other technical backgrounds. I'm wondering what are some of the techniques/tips/practices that you guys use in those situations?,Presenting to non-technical people,1610085360
datascience,"https://www.rpubs.com/loveb/som

Theres a picture on this page called ""count plot"". There is a color gradient scale that shows the size of each circle. Grey is not on the gradient scale. Does that mean grey is empty?

Thanks","in this picture, what does the color ""grey"" represent?",1610084847
datascience,"If you wanted to go into a specific field with data science (say Finance) would you better of be doing a master of DS straight out of undergrad, or is it better to enter the field with just undergrad and see where that takes you, or go postgrad in Finance straight after undergrad?",Career,1610081829
datascience,[removed],Want to become a Python pro,1610079304
datascience,I am starting out of college and wanted to get into data science. What is the prerequisite math competency needed for a career in DS?,How much math knowledge is needed for a career in DS.,1610078468
datascience,"Hey guys! I'll be starting my first year of college, and I plan on majoring in CS. I'm really intrigued by data science and hope to pursue it in the future, but given the amount of industry professionals in this subreddit, I do feel a bit intimidated posting here. I would greatly appreciate any advice, ways to get my foot in the door, or simply any words of wisdom in general :)",Advice for college students?,1610075562
datascience,[removed],"What are some examples of terrible figures? Misleading, hard to read/look at, etc. Trying to get a better understanding of the do's and don'ts",1610073420
datascience,"About me, I just graduated in chemical engineering, I've looked up several data science university programs in the USA and Canada and I'm honestly feeling very discouraged.

*  the cost of the programs are prohibitively expensive and I'm already knee deep in student loan debt from my last degree

* and secondly I don't meet most of their pre-requisite grades. Engineering kicked my ass in my third year, but turned my grades around in my fourth year. However, still not sufficient for most GPA requirements.

Can you become a data scientist without having a master's degree? Should I become an data analyst instead? I don't trust bootcamps. They tend to cost as much as a MEng degree on their own.

 I find that Data science would be something I would actually be interested in, and am already learning Python now on my own.","Becoming a Data Scientist without a Masters, is it possible?",1610071370
datascience,,Do you know or have a guess about what model does Adobe uses in its new function “Liquid Mode”?,1610069038
datascience,"Hello,

I am a student in my last year Msc in statistics and I intend to work as a data scientist (hopefully) .

I cant help but think that sometimes, two problems at two different companies can be awefully similar. Let's say that I worked at company A, implemented an IT architecture to collect the data to solve problem X. Then solved it successfully using that data.

Then I left and started working at company B, found out an awefully similar problem X'. Instead of implementing the architecture from scratch, wouldnt it be better to simply buying the data from company A, creating a model that uses this data + some from company B (to adapt it properly) and solve X' much more easily?

In this case, can I, as a data scientist just buy data from companies as I work in those companies in case I need it? (this way I can make sure it's not lost and dont have to go through the hassle of making company A and B communicate to sell the data)

I am not quite sure this is legal as I believe that when the data is about a third party, there are many confidentiality issues but I wonder if there is a solution around it?

NB: I am in europe but I would like to know the answer in both europe and the US if possible (because I am curious)",Can I buy data from my company?,1610065958
datascience,"I'm majoring in economics and I love it. I intend to apply to a competitive data science and engineering master's program and I'm wondering what moves I can make to make that possible. 

I know a minor barely scratches the surface of a subject but the goal is to build a good foundation heading into graduate studies. Would CS be more advantageous than stats?",Minor in statistics versus computer science?,1610064629
datascience,"Large well known financial service company providing indexes and portfolios. They are creating/increasing their esg data science department, to quantify the risks of climate change and model the impact on investments and portfolios. Basically projects like: where are the assets located, what is the risk of flooding in that zone etc

My fear is that there will be way too much data cleaning, too much reporting and not enough fun ML

I have a strong background in data science, especially deep learning and 3 yoe.",Should I accept this job in finance: data scientist - climate risks for financial investments,1610061867
datascience,"Hey guys . I’m currently in the process of undergoing a career transition to data science , I have a chemical engineering background and the only work experience I have is as a chemist for three year . 

I have been learning sql , advanced excel and python on my own and I’m now confident enough to apply for data analysis position ( thought it will be a good entry way to get my feet wet ) 

So I’m working on my cv and I just don’t know how to relate it with my previous experience or should I have an objective that states that I’m changing my career and just include the analytics tools I had learned so far ?",Any ideas for cv ?,1610061848
datascience,"Hello everyone,   


I hope is all well with you all.   


I am looking for DNS attacks dataset. Datasets such as, DNS exfiltration and so on. I tried looking in Kaggle but couldnt find anyone.   


Anyone can help ? Thanks",DNS attack dataset,1610060783
datascience,"

I have created a web endpoint that provides long term company data.  It’s in its first iteration currently, but there is an example on the homepage and a link to some documentation. 

The primary use case is access to annual report data, in json.  All data reported by the queried company is available through the API.

The site provides access to ongoing lawsuits, some news, companies that are know to be fraudulent and a direct feed of all releases from the SEC.

URL: http://www.ase-data.com

Any reviews, comments, or feedback are all greatly appreciated!!",Free financial data source,1610059897
datascience,[removed],Recent (1.5yrs) BA grad looking for help.,1610057846
datascience,[removed],How to become a Data Scientist ?,1610055481
datascience,"In our recruiting process the first interview is done by HR which have no idea about analytics, but we are asked to prepare a mini-questionnaire for a first screening.

Do you have experience with something like that? What do you ask the applicants?",Screening Interview Questions,1610054875
datascience,[removed],How good are Google sheets for data analysis?,1610053709
datascience,"Hello, can you recommend me blogs like Algoritma Technical Blog, where I can find literature with simple but thorough explanations for topics like Decision Trees and Random Forests, Clustering, SVM and Neural Networks. 

Thanks!",Recommendation,1610049027
datascience,[removed],DATA SCIENCE NYC Capstone Demo Day,1610048821
