subreddit,selftext,title,created_utc
datascience," I am running a test where I have 2 variants and one control. For variant A, the customer has 30 days to signup and receive a promotion. For variant B, the customer has 40 days to sign up and receive the same promotion. For the control group, the customer only have 15 days to sign up and receive the same promotion. 

In my analysis to decide which campaign performed better, 

* Should I only use the data of a customer whose 30 or 40 days period has surpassed, and end up with a smaller sample size, or 
* should I use all the data of all customers irrespective of them having the chance to see the end of the 30 or 40 day promo period? 
* E.g. it is 8/23, but the customer has till 8/30 to sign up - should I keep him in my data set, or remove them from the data set?",Campaign AB test - sample size,1598203694
datascience,"Topics include:

* data retrieval with SQL
* data manipulation and visualization with R and Python
* productivity tips with Bash and Git

Web version: [https://www.mit.edu/\~amidi/teaching/data-science-tools/](https://www.mit.edu/~amidi/teaching/data-science-tools/)

PDF compilation on GitHub: [https://www.github.com/shervinea/mit-15-003-data-science-tools](https://www.github.com/shervinea/mit-15-003-data-science-tools)",Illustrated Data Science study guides covering MIT’s 15.003 class,1598203656
datascience,"Hi everyone! I'm currently a data manager at a large clinical research organization, however I'm interested in transitioning to data science. I was initially drawn to the research field because I love the exploratory, rigorous, and prescriptive nature of research, which I view to be akin to a data scientist role. The problem is, I have practically no quantitative background with a BA in Gender Studies and Political Science: Calc I, intro stats, and I'm taking the Python for Everybody course on Coursera and plan to continue on to the Python for Data Science course (as a University of Michigan alumnus, I get free access to UM professors' coursework, which I'll definitely take advantage of!).

I know I'll need to get at least a Master's. My question is, how do people recommend I 'fill in the gaps' from my undergrad to prepare for grad applications? I've read that programs typically like to see college-level coursework to demonstrate strength in the material. Here's classes I'm considering taking, along with the Coursera courses: calc II-III, linear algebra, intermediate stats. 

What are your thoughts? Any CS coursework beyond what I can find for free online is especially appreciated!",How to prepare for grad school without a quantitative background,1598203467
datascience,"For feature selection with LightGBM I use SHAP values.

I run a lgbm.train() with default parameters and then:

    k2 = shap.TreeExplainer(lgbm).shap_values(X_shap)
    shap_values = k2_corr[""SHAP_abs""].tolist()

    for shap_value in shap_values:
        X_shap = X[k2_corr.query(""SHAP_abs &gt;= @shap_value"")[""Variable""].tolist()]

        for p_value in range(1, len(X.columns)+1):
            pca = PCA(n_components=p_value , random_state=0)
            X_pca = pca.fit_transform(X)

            result = lossfunction(X_pca)
            if result &lt; best_result:
                best_result = result
                print(result, p_value, X_shap.columns)

Then I use the X_shap.columns + p_value that resulted in the lowest RMSE score and train my model with it.

Is that approach okay or am I doing charlatanry?",LightGBM + SHAP Values for feature selection - can I use my loss function to determine RMSE that I can get guaranteed?,1598202992
datascience,"Getting an entry level job as a data/business analyst has been excruciating, even with a masters, since I do not have any prior relevant work experience. My program was only a year so there wasn’t time to get an internship at any point, and most internships only want someone currently enrolled, which precludes me from doing one now. I’m honestly out of ideas on what to do, I’ve been doing the udacity data analyst nanodegree but I feel like even once I finish it won’t make much of a difference to employers. Any suggestions appreciated at this point.",Getting that first job as a data/business analyst,1598201152
datascience,"[removed]

[View Poll](https://www.reddit.com/poll/if6c8k)","idea good podcast for machine learning , deep learning , nlp , computer vision",1598200742
datascience,"The logistics company im working for is having trouble keeping track of its vehicles, where theyre positioned at and who is driving them. They want me to help them solve their problems. 

What they had in mind was an Excel spreadsheet. The format for the Excel has one instance in two rows. Vehicles and drivers using them are seperated to two columns. The columns are like this for reference

Personel personeltype personelname storename
Car cartype carid storename

There isnt any identifier to describe theyre tied together but the order of items. 

They want to fill this manually everyday for a month. 

They want to split this format to three region leaders and want me to solidify their reports into one everyday. So no theyve had no intention of something like updating the format to a cloud. 

How do you think i should be approaching to this problem? I feel like creating a database is the optimal solution but i have no prior experience doing that let alone making it friendly enough to make the three regional leaders use it",How should i track my companies vehicles and personelle,1598198603
datascience,[removed],Tomorrow is my first day as a data analyst for a new company just starting out in DS,1598198142
datascience,"Hi guys,

I’m about to finish my Masters in Artificial Intelligence but and struggling to get my grad job in ML/DS. I know this can be normal but what can I do to improve my chances of getting the job? I’m going to upload some of the projects I did at university on Github. Also I have tried to volunteering but still lacking the experience I need. (I’m based in 🇬🇧)",Struggling to get a DS/ML job,1598198097
datascience,"Folks, I am in need of help. I am looking for an example of r code for automated textual frame analysis. Please, help",Need guidance for frame analysis,1598195502
datascience,"Folks, I am in need of help. I am looking for an example of r code for automated textual frame analysis. Please, help",Need guidance for automated frame analysis in R,1598195309
datascience,"Hello, can someone share some experience upon landing a graduate data scientist/Machine learning position? Was you rushed into getting into gritty work? Or was you guided/trained into it?",Grad Data scientist,1598195182
datascience,"I was recently accepted into the fall cohort for Insight Data Science and curious whether previous fellows / graduates think the value is worth the 12% Income Share Agreement (ISA) they have instated for Fall, 2020. The ISA is as follows: if you accept a same/similar relevant position ( [https://insightfellows.com/relevant-positions](https://insightfellows.com/relevant-positions) ) making $100,000+ USD within 6 months of completing the 7-week program, you will owe 12% of your salary for two years to Insight (actually, a 3rd party ISA service called Meratas), as long as you maintain this position (or similar / relevant position). The 12% ISA has DOUBLED what the ISA was in early 2020 (\~7%), and before that, there was no ISA (i.e., Insight was free!). There are other financing options, but they are either unrealistic (e.g., $24k up front) or only shave off a few-thousand over two years (e.g., a loan from a preferred bank). 

Will the benefits (e.g., network, project and interview prep, etc.) of the program outweigh the 12% ISA for someone trying to break into the data science industry? I should note that currently, my background is mostly academic and I live in a part of the country not known for its high-tech jobs (i.e., not San Francisco, Boston, NYC, Seattle, etc.). Also, the program (for all 2020 fellows) will be fully remote, so not sure if that's an additional factor of importance.",Grads of Insight Data Science Fellowship: worth the new 12% Income Share Agreement?,1598194871
datascience,"I heard back from a company about an internship and they asked for me to answer some questions. One was about my problem solving ability on a recent project and I wanted to link my portfolio to provide an example. My portfolio currently is hosted on GitHub pages and I only have two projects on there. One is more simple, just involves basic R packages and some functions. The next one is more involved with statistics and logistic regression. Could this possibly reflect badly if my portfolio doesn’t have too much yet?",Thoughts about linking an unfinished portfolio?,1598194012
datascience,"I’m a new grad who is trying to gain experience in data science. I’ve been applying to mostly data analyst positions for a few months but haven’t been able to get anything yet. I think my main problem is that I don’t have any real experience which employers are looking for. 

Wondering if there are any volunteer data opportunities that don’t mind taking on people with little experience? I’d love to help out and gain some experience at the same time. I’ve looked at datakind but it seems to mainly be for experienced professionals.",Data science volunteer opportunities?,1598193358
datascience,[removed],Tests to investigate 3rd party forecasts,1598189107
datascience,[removed],Are there online masters out there that have this same combination?,1598185441
datascience,[removed],How long would it take to study for a data scientist technical review?,1598185428
datascience,"Context:

I am presently pursuing Masters in data science(in the US) and would be graduating May-2021. I have about 5 years of full time  Work ex in analytics/BI roles before my Masters education back in my home country(India)

My queries:

- Should I target University grad roles or the ones which require work - experience or both?

- How vital/non-vital is my previous work experience ( If I am targeting the Data science roles)?

- If I were to start applying for full time roles what does the timeline to start applying look like(generically)? Some organizations hire students well before the turn of the year and some dont. I am confused about the timeline. I am on a couple of weeks break by now having completed a summer with 2 internships with one of them at Fortune -10. I would be starting my interview prep soon and want to be equipped with how the market works here in the US.

Looking for suggestions and advice from our community.

Thanks!",Confused about roles to target after my graduation and the timelines,1598184895
datascience,"Hello,

I am working on a small unsupervised learning project in Python where I am utilizing methods in Scikit-learn to create clusters. I am wondering what sort of global explainability methods are available? Are there any existing methods to find what features are driving cluster assignments?

Given that this is unsupervised, I am a bit unsure how methods like SHAP and ELI5 would work. Are there any other methods that would work? I was considering labeling the data (what cluster it belongs to) and using this as a surrogate, and training another tree based model on the new labeled data set for the explainability. 

Any help would be great!",Unsupervised Learning Model Interpretability?,1598184656
datascience,"Welcome to this week's entering &amp; transitioning thread! This thread is for any questions about getting started, studying, or transitioning into the data science field. Topics include:

* Learning resources (e.g. books, tutorials, videos)
* Traditional education (e.g. schools, degrees, electives)
* Alternative education (e.g. online courses, bootcamps)
* Job search questions (e.g. resumes, applying, career prospects)
* Elementary questions (e.g. where to start, what next)

While you wait for answers from the community, check out the [FAQ](https://www.reddit.com/r/datascience/wiki/frequently-asked-questions) and [Resources](Resources) pages on our wiki. You can also search for answers in [past weekly threads](https://www.reddit.com/r/datascience/search?q=weekly%20thread&amp;restrict_sr=1&amp;sort=new).",Weekly Entering &amp; Transitioning Thread | 23 Aug 2020 - 30 Aug 2020,1598184030
datascience,"Hi all. New in data analyze and want to collect my own datasets from internet for example from a web page of car dealerships. Can anyone explain if ı can or why cant?. And any suggestions of good resources to learn it.

&amp;#x200B;

Thanks from now.",How to collect data online.,1598182904
datascience,,Would be grateful to get some advice!,1598182195
datascience,"[**Project**](https://www.reddit.com/r/MachineLearning/search?q=flair_name%3A%22Project%22&amp;restrict_sr=1)

A strong focus on correlations between theoretical linguistics and NLP. [https://youtu.be/dMo\_eLNsg08](https://youtu.be/dMo_eLNsg08) | [https://twitch.tv/wasspen](https://twitch.tv/wasspen) \- a new channel - cause sharing is caring 😊:)",Episode 2 NLP course: Text Canonicalisation | Synthetic &amp; Analytic Languages | Morphology,1598181125
datascience,"If you are in charge of hiring for a DS position particularly for new grads, what do you look for (or strain your eyes in search of) on a resume?

Specific technical skills? A long list of relevant experience? College credentials? 

Do you care at all for a fun fact or ""the last book I read was...""? Or are you looking for a strictly professional resume that gives off the aura of diligence, curiosity, and intellect?",What do you want to see on new grad's resume?,1598179907
datascience,"A few years ago, I found a MOOC about UX design for Data Scientists that build dashboards. It wasn't about how to build one (such as the technical part), but instead, it was focused entirely on the UX. I put it on my bookmarks and of course, it got lost after a while. I am looking now for such resources, preferable a MOOC. Do you have any?",Looking for a MOOC about UX design in Dashboards,1598179881
datascience,"I’m currently an undergraduate student with bachelor of commerce degree, my majors are finance and businesses analytics. Just looking for some advices from everyone if it is necessary to transfer to a double degree like commerce/data science to become a data scientist... Studying on my own is important but i know there are other necessary skills provided with a degree. Or is it ok with a master degree after graduating?",Do I need a bachelor degree to become data scientist?,1598177195
datascience,,Crossposting from r/cscreerquestions: Data Science feels like a dead end. Any opinions?,1598175455
datascience,"I am a software engineer and I am interested in working as a data scientist/analyst(Even if its for a short time). I am especially interested in a facebook data scientist role.

I am practicing my sql and I think I will look for a statistics crash course. What other resources should I use to prepare for an interview?",What are the best resources to prepare for a data science interview?,1598167359
datascience,"So, I’m currently studying an undergrad in Data Science (DS). This course has coding, stats and a bit of econometrics. There is also a CS/Stats degree I can move to. 

The CS/Stats degree has all the stats classes with DS apart from Bayesian inference. It has software engi + regular CS stuff but no machine learning &amp; AI which is offered with DS. And obviously no eco with CS/stats. 

1.) Is it worth to switch?
2.) Is having a degree in DS too specific meaning I may be disadvantaged in other fields such as software engineering?",CS/Stats vs DataSci,1598166491
datascience,"I'm analysing billing data at work to look for anomalies (e.g. overcharging) in time series data. The models we've used so far include basic confidence intervals, time series forecasts, regression forecasts, LSTM, and libraries like [PYOD](https://github.com/yzhao062/pyod) and [Alibi Detect](https://docs.seldon.io/projects/alibi-detect/en/v0.2.0/index.html).

Does r/datascience have anything else they recommend for this type of job?",Anomaly detection for time series,1598165361
datascience,"I'm looking for internships right now, but I'm under the impression that most DS internships are aimed towards MS or PHD grads. Would it be better to look at data analyst roles, webdev, or something else?  
Some background, I added DS as minor a couple months back, so I don't exactly have an expansive skill set. Most of the coding I do is in Python (Pandas, numpy, sklearn), but I'm also self-learning Javascript at the moment.",Should I be applying to data analyst internships &gt; data science internships?,1598155252
datascience,"For a recent project, we trained a random forest model using 300 million instances: Spark took 37 minutes on a 20-node CPU cluster, whereas RAPIDS took 1 second on a 20-node GPU cluster. It was over 2000x faster with GPUs. Sharing if anyone wants to check out the notebook and try running it yourself:  [https://www.saturncloud.io/s/random-forest-on-gpus-2000x-faster-than-apache-spark/?utm\_source=reddit&amp;utm\_medium=forest%20gpus](https://www.saturncloud.io/s/random-forest-on-gpus-2000x-faster-than-apache-spark/?utm_source=reddit&amp;utm_medium=forest%20gpus)",Random Forest on GPUs: 2000x Faster than Apache Spark,1598154414
