subreddit,selftext,title,created_utc
datascience,,If I had to start learning Data Science again. ¿How would I do it?,1587772554
datascience,"I have a table of data with about 200columns and about 500k observations.  I'm planning to run a some sort of classification model on it for inference purposes (i,e  interpret the coefficients, so maybe a logit), but I want to see if I can narrow my columns a bit before I start.

The variables are of mixed data type:   
continuous(i.e, dollars),  
discrete(counts)  
categorical (0/1 indicators)  
grouped (i,e credit score from the continuous column  is grouped low,med, high) etc,  
char(states, regions, etc).

My response variable would be categorical(trying to predict a 1).

Curious what would be the best way to reduce dimension of  the dataset, or maybe find variables that will not add value before I start modelling.  Looking manually through them, the 'grouped' variables are probably redundant with the other data, so I may want to pick one or the other, but i'm wondering if there is a better way to do this.

appreciate any guidance on any suggestions for the approach",data with 200 columns (mixed data types). How is the most efficient way to reduce dimension prior to modelling?,1587768353
datascience,,How To Know Data Science Is For You?,1587767893
datascience,"It is called r/DataScienceAdmissions ! Everyone is more than welcome, I would love if we could get some established data scientist to offer their advice :) Anyone who is considering applying to Data Science Programs is more than welcome!

I appreciate you all :)",Hello! I create a subreddit for people applying to graduate programs in Data Science!,1587766971
datascience,[removed],For people like me who are into listening music while coding...,1587766029
datascience,"Hey there!  


I know this subreddit is filled with noise and educational recommendations, so I apologize for the addition of the heartache -- though hear me out!  


As a recent grad with majors in Biomedical Sciences and Marketing, towards the end of my undergraduate, it was clear to me that bioinformatics/data science is the future of the field with regards to machine learning and big data.  


Since my graduation, I have landed a gig as a private school teacher (for science) and have been teaching myself code through MOOCS such as Coursera (i.e. IBM Data Science &amp; others, I know, controversial, but I needed somewhere to start!)  


I've been in touch with my local University (Im in Toronto if that makes a difference) with regards to potentially applying for a masters in Data Sciences to help kick start my career in the venture.  


Since then, they have recommended that I complete their night school(s) certificate program to bolster my resume to apply.  


I'm really enthusiastic about the big data realm and tough I know I require more training to become a member of the data science realm, I'm up for the task. I just dont want to be gouged and take an incorrect path.  


I had a passion for the pharmaceuticals realm, though no luck was achieved with landing any gigs. I plan to continue my self-education and look for some projects to work on to hone my skills.  


I know it's an uphill battle, but im looking for a battle strategy to accomplish my goal!  


If anyone has any insight or similar stories they'd like to share I'd love to hear them!  
And for those that made it this far and replied, I truly appreciate your time.  


Stay safe everyone!",New Science Grad Seeking Data Scientist Prowess (Inspiration),1587758963
datascience,"Hey there!  


I know this subreddit is filled with noise and educational recommendations, so I apologize for the addition of the heartache -- though hear me out!  


As a recent grad with majors in Biomedical Sciences and Marketing, towards the end of my undergraduate, it was clear to me that bioinformatics/data science is the future of the field with regards to machine learning and big data.  


Since my graduation, I have landed a gig as a private school teacher (for science) and have been teaching myself code through MOOCS such as Coursera (i.e. IBM Data Science &amp; others, I know, controversial, but I needed somewhere to start!)  


I've been in touch with my local University (Im in Toronto if that makes a difference) with regards to potentially applying for a masters in Data Sciences to help kick start my career in the venture.  


Since then, they have recommended that I complete their night school(s) certificate program to bolster my resume to apply.  


I'm really enthusiastic about the big data realm and tough I know I require more training to become a member of the data science realm, I'm up for the task. I just dont want to be gouged and take an incorrect path.  


I had a passion for the pharmaceuticals realm, though no luck was achieved with landing any gigs. I plan to continue my self-education and look for some projects to work on to hone my skills.  


I know it's an uphill battle, but im looking for a battle strategy to accomplish my goal!  


If anyone has any insight or similar stories they'd like to share I'd love to hear them!  
And for those that made it this far and replied, I truly appreciate your time.  


Stay safe everyone!",New Science Grad Looking For Data Science Insight,1587758237
datascience,"Hi folks,

A bit niche but I'm a PhD in translational immunology and machine learning. I wanted a data-centric Python application for cytometry analysis so I took the plunge and had a crack and writing a Python library.

[https://github.com/burtonrj/CytoPy](https://github.com/burtonrj/CytoPy)

If anyone else out there works with Cytometry data and could share your experiences that would be amazing! Some things that cross my mind are:

1. Where do you see cytometry bioinformatics going in the future?
2. How can we migrate to a cloud platform that is affordable and inclusive for research?
3. What are your struggles and pains with cytometry data analysis?

Cheers reddit!",Anyone interested in Cytometry analysis in Python???,1587757231
datascience,"Hey folks. So a close friend started some time ago a small pallet business. The business follows a simple model, he buys pallets in small amounts to different individuals, stocks them until they have a decent amount, and sells those pallets to other companies in a big amount for a higher price. Of course I am leaving details behind, but that is the gist of it.

&amp;#x200B;

Do you think there is anything that Data Science could provide for a business like this? how would you go about improving such business?",Do you think Data Science can be used to improve a small business?,1587757046
datascience,[removed],How can I find out if I am capable of studying statistics?,1587756223
datascience,"I have had trouble finding the correct subreddit to inquire, please advise. 

I am wondering, is it possible to overlay data of stock charts to extrapolate daily/weekly trends using averages? I'm not making sense, let me try this: 

In other words, typical charts are X time, and Y price. 

Basically, 

X would be Monday, Tuesday, Wednesday, Thursday, and Friday

Y would be either 0 to infinity or maybe undefined price(?). 

Z(?) would be the average of Monday, Tuesday, Wednesday, Thursday, and Friday for 52 weeks (or more). 

In theory, I am wondering if a chart can be made showing the average movements of Monday through Friday on a particular stock. 

A one year chart shows the change in price, month-to-month. This one year chart would show the average change in direction day-to-day for 52 weeks. It's not about how Company ABC went from $15.00 Jan 1 2019 to $23.50 Jan 1 2020. But rather, what are the average movements on a day-to-day basis based on 52 week charts.

Another way to explain it is: imagine you're looking at a 5-day chart. Now imagine 52 weeks of 5-day charts overlay resulting in one final image that shows the average day-to-day movement based on the average of 52-weeks of 5-day charts. 

Maybe beta, historic volatility, rsi, and volume can all be factored in as well? I understand that regardless, there is always going to be entropy involved but I keep wondering if there is some sort of pattern. 

Probably not. 

I don't actually think I'm on to anything here, I'm not a student, I'm not a scientist, or engineer. But, I keep wondering what this even is? 

Does anyone know how to re-explain this to where it makes sense?",Multi-dimensional stock chart analysis [can this be done?],1587755093
datascience,"Hi everyone! 

I was lucky enough to receive an offer from MBB as a consulting intern. As my previous internship was as Machine Learning Engineer, I am interested to know what it's like to be a data scientist at McKinsey Analytics, QuantumBlack, BCG Gamma, etc.? 

How technical is the work? How sophisticated and innovative are the algorithms used as solutions? How does WLB differ from the Generalist branch? How does pay compare to normal Consulting at these companies?  

Due to my technical background and interest for this topic, it's something I am considering after graduation of my M.S., and I hope to see a little of that during my internship.

Thank you very much for your time and answers! :)",Your experience as Data Scientist at MBB,1587752372
datascience,"I have scraped quality data from the premier league in the form of playerstats, fixturestats and team standings and I'm looking to see is someone is interested in help analyse the data to get valueable insight that later will be used to calculate odds. The data is in json format and I do all the coding in python. If anyone of you feel that you can contribute, hit me up. If anyone would like a data-sample you will have to suggest a way to transfer up to 80mb json files.",Premier League data science,1587751710
datascience,,"Best AI, Machine Learning Courses for Professionals",1587748987
datascience,,"Simple Data Science Project, since data collected until WebPage to get news data and show the result.",1587747495
datascience,"Hello, beginner in data science here. I have created many different models, yet I have no idea when and how to deploy which one and how to imporve the model. My goal is to improve my scores in kaggle competitions. What and how should I learn? Any help is appreciated in advance.",Kaggle Competitions Mastery,1587745698
datascience,,How Tablets For Mice Can Help Solve Alzheimer's Disease &amp; Replication Crisis in Neuroscience,1587745339
datascience,"### **TL;DR** : I'd like to change the format of my data competition to bring more value to the students. The steps of the challenge are detailed below and I'd like your input to improve it.


Hi everyone, 

I've been in the organization of a data challenge for two years now and I'd like to share some comments as well as receiving input from the community. I'm growing discontent with our format, which prompted this post.

The goal of the challenge is to teach data analysis to business and engineering students ; their skills in programming range from beginners to decent but they're usually beginners. In the end, they have to prepare slides to explain their modeling process and models. We reward performance, originality, code quality and also how engineering and/or business comes into play in their models.

Please do comment and advice.

# Setup

During the challenge duration, the students are learning online on DataCamp plus some workshops to get a feel of what they're up against, over 4-6 months. It's completely voluntary, meaning that the engagement is somewhat limited but they're usually motivated enough to go through the learning material.

A company or a sponsor provides us with clean data and the challengers have to tackle a well-defined task, such as classification of comments (NLP) or image classification (CV), *à la* Kaggle. 

They're given access to the data and have to provide a notebook or a code file, ran on Colab, which is graded. 

Most people seem satisfied but we've got complaints about Colab being unstable which breaks the training process and I personally believe we could deliver more than what we're currently doing. 

# Feedback

I keep in mind that my public is usually not CS/IT oriented but here are my problems with the current format.

## Data

Currently, the data challenge is focused on clean, well-formated data which is way too unrealistic and gives a wrong picture of the usual data science problem. 

- Most real data is either unavailable from the get-go, in the wrong format, redundant, incomplete or all of those and more. **I'd like to emphasize data collection, smart/efficient reshaping and sane pipelines**. 


- Most real data is in tabular form, in spreadsheets &amp; databases and usually not in a model ready way. Because most of those storage methods were created with redundance, tracking and information in mind, they're absolutely not ready to be model oriented. **I'd like to emphasize problem solving and relationships between the problem and the data**. 


- Closely related, your data does not come with a target variable, it's usually up to you to find or create it and you'll find yourself debating with sales people and focusing on what they actually need rather popping the good ol' ``model.fit(X,y)``.  As such, **I'd like to emphasize business goals and proper targeting**. 


## Goals

- The goal and the problem should come before data science in the thought process, I'm not sure if I should have the students present their goals *before* the whole data science process. 

- We don't talk about the metrics enough, ideally I'd like the students to pick a metric themselves and motivate their choice for for the final presentation. Several metrics could be picked and ordered to show different sides of the business problem.

- A more meta goal is that the competition should be enjoyable, I'm trying to avoid very grindy phases and we're suffering of the Kaggle problem, which is that the students will focus almost exclusively on model performance and bland training tweaks. 

## Learning to learn 

I'm relatively pleased with DataCamp and even though they still do too much hand-holding, the website is good. Still, I'd like to have more focused and short projects about data manipulation and business targeting to help the students. My thinking now is that we could setup a fictitious meeting between data scientists and sales/marketing people for the students to watch. This is more work on my and our sponsors' ends but I think it's worth it. 

I'm not sure what else to add but comments are welcome.


## Tools throughout

 For now we rely on Anaconda and Colab. I'm satisfied with Anaconda for the environment management and relatively hassle free installations so I'll stick with that. The issue I'm facing now is that the challenge is NOT a software engineering problem nor is it a tooling competition.

I'm wondering if I should introduce Docker and git at all and if we should stick with notebooks for now. My guts say that it's absolutely important but I can't have them squander their time and energy either, the balance is hard to find.


# Miscellaneous 

Not everything is in my hand and the result will vary depending on the support we get from both the faculty and the sponsors we can get. For example, getting a server to store the data is surprisingly difficult. We often have to send them wetransfer or drive links.

# Conclusion

Thanks for reading my essay, I know this is a lot but specific resources or similar experience would be invaluable.",Organizing a data competition,1587743471
datascience,"You have started a new job as a data science/ data analyst. You work alone, so you are the only person that have responsible for the data in your department. You are in the beginning of your career. 

What do you think the best way to develop yourself in that situation? How do you start to review all the data process that already exist ?  

Thanks guys, I hope to hear many opinions",A hypothetical question,1587742316
datascience,,Could anyone help me figure an ARIMA model based on the ACF and PACF??,1587739868
datascience,"Recently, Ive applied for a data science apprenticeship for a startup in my local area but was rejected and got offered with an internship instead. To any employers out there, what does an apprentice and interns would do in terms of task being assigned? I know for a fact that both apprentice and interns will do a lot of learning in general.

P.S: Apologies for bad english",Difference between data science apprentice and intern?,1587737574
datascience,[removed],Considering Pivoting from Finance to DS. Am I too late at age 30?,1587737239
datascience,,Webinar on Enterprise Data Science &amp; Its Project Lifecycle and Management,1587735764
datascience,"Hey everyone, I'm looking to develop some dashboards for communicating EDA and enabling interaction with model results. Ideally I want to use a tool where I can do quick prototyping but has the flexibility for complex and modern layouts.

I've been recommended to look into Voila and Streamlit but am having a hard time selecting which one to go with. Voila has the advantage of easy deployment from JupyterLab during testing and flexibility to work with vue and react through materials but every review of Streamlit I see people are raving about it.

For anyone who's used these tools what have you found to be the biggest pros and cons? Are there any other tools you'd recommend looking into instead?",Dashboarding Tools for EDA &amp; Model Communication,1587735427
datascience,,The Super Duper NLP Guide and Tutorial - https://notebooks.quantumstat.com/,1587730290
datascience,,Googler Scientist,1587729589
datascience,,Googler Scientist,1587729570
datascience,"Hey everyone, I'm looking to develop some dashboards for communicating EDA and enabling interaction with model results. Ideally I want to use a tool where I can do quick prototyping but has the flexibility for complex and modern layouts.

I've been recommended to look into Voila and Streamlit but am having a hard time selecting which one to go with. Voila has the advantage of easy deployment from JupyterLab during testing and flexibility to work with vue and react through materials but every review of Streamlit I see people are raving about it. 

For anyone who's used these tools what have you found to be the biggest pros and cons? Are there any other tools you'd recommend looking into instead?",Voila or Streamlit?,1587728028
datascience,"This sub is fucking garbage. It's just random low-effort content that isn't interesting to professionals, people trying to market their garbage tool or total newbies asking questions with answers in any data science/machine learning/statistics book. They don't even bother to take a course or read a book before asking questions.

Compare it to /r/machinelearning where there is proper professional discussions (even though some of the content is academic in nature).

I'd much rather there be 3 interesting threads per week than 20 garbage low-effort threads in a week. There isn't even good content anymore, at least I can't find it because it's buried in ""Do I need this certification"" -&gt; google ""reddit data science certification"" and there are pages upon pages of reddit threads from this very sub dozens of threads with the very same ""is X certificate useful/do I need certificates/what certificate should I get"" type of questions.

Half of the frontpage is just generic career advice and the other half is /r/askreddit styled ""what do you think of X"" questions where nothing of value ever comes up. It's fine if there is 2-3 less serious threads per week but jesus christ THEY'RE ALL GARBAGE.

I don't even bother lurking this sub that often anymore because I just know that there is nothing interesting or useful out there. It's just going to be garbage.",This sub is fucking garbage,1587724751
datascience,"Hi all, I'm looking for some advice. I recently wrote a package around data augmentation of images. The package has been deployed to PyPi and gained a small amount of interest. My line manager contacted me and asked if I was okay moving the package under the companies name citing ""outside of work interests must be reported"". The package does not use any of the companies IP nor does it compete with it. What should I do?",My line manager asked me to move a package I wrote in my spare time to under the companies name what should I do?,1587723619
datascience,"Recently, Ive applied for a data science apprentice for a startup  in my local area but was rejected (most prob. Im more of an ML engineer lol) and got offered with an internship instead. To any employers out there, what does  an apprentice and interns would do in terms of task being assigned? I know for a fact that both apprentice and interns will do a lot of learning in general.

P.S: Apologies for bad english",Difference between data science apprentice and intern.,1587719449
datascience,[removed],Germany: Does anyone have experience with Spice Academy - Data Science Bootcamp?,1587719289
datascience,[removed],Interview questions for a junior data analyst/bi manager,1587718027
datascience,,How Data Science Powering The Businesses,1587716310
datascience,"Related to data science, a little more leaning towards machine learning; what certifications should you do to increase resume value?",What certifications should you do as a beginner?,1587715890
datascience,,Did anyone see any benefits to taking the AWS Data Analytics certification?,1587715499
datascience,[removed],SEQUENCE OF STEPS INVOLVED IN DATA MODELING TECHNIQUE IN DATA SCIENCE,1587707196
datascience,,Top 12 Careers in Big Data,1587703712
datascience,,Modern Data Scientist,1587703488
datascience,"So I am about to graduate next month with an M.S. My degree is not in computer/data science but in computational biology. I took a decent amount of DS courses though, and my research projects were all ML/DL applied to biomedical problems. 

I had an internship planned for the summer, but that was suspended 2 weeks ago due to obvious reason \*sigh\* I feel kinda lost right now since looking for new internship/ full-time positions seems even harder now and I only have one month. I am also an international student on F1 - OPT, so it is even harder.

Would love to ask for advice from everyone on the search! Even better if you know of opportunities that I can pursue. I believe I am not alone in this situation, so I hope this is useful for others as well.",Advice for soon-to-graduate looking for DS/ML jobs in this time,1587698185
