subreddit,selftext,title,created_utc
datascience," Hello fellow redditors, I've started lurking in relevant subreddits for my career, mostly /r/cscareerquestions and [r/datascience](https://www.reddit.com/r/datascience/). Today, I'd like to ask for your help.

My current situation: I'm a student from Germany and finished my bachelor's degree with a GPA of \~3.6 (1.4 in German grading system). I studied Business Informatics / Information Systems, which has like 1/3 computer science, 1/3 economics and 1/3 of information systems (think of business process modeling, knowledge management, development of application systems (waterfall model, scrum etc.)). Right now, I'm doing a gap year where I'm doing two internships (these are usually not done for job offers but for work experience) before I want to start my master's degree. Since I did two courses in data analytics, I started liking this topic a lot and also wrote my thesis about a data science topic where I analyzed a dataset in R.

Initially, I planned to do a data science master abroad but reading a lot about the career opportunities of data scientists on Reddit I'm not so sure anymore. I'm reading more and more that these programs are cash grabs and are created because of student demands, while there are actually not that many jobs for inexperienced data scientists.

While I had fun with statistics and aced these courses in university, I don't have a hardcore math/stats background and also not a CS background. I like the application and comprehension of models on a higher level but not really the maths stuff. But on Reddit, you basically read that this is absolutely essential as a data scientist and everybody recommends a statistics degree. So I'm also not sure if I should pursue this path. I also tried to pick up elements of statistical learning, which seems to be a must-read for aspiring data scientists, but I couldn't really get into it. It was too difficult for me.

Right now, I'm also thinking of just continuing my degree in Information Systems (I don't think there really is an equivalent in the US, at least I don't know of one) since I also really like most of the IT topics. For a project in my current internship, I'm designing the system architecture and the API specification and also develop a web application (frontend in Angular, backend in node.js). At another internship, I was part of a data warehouse project where we were the link between software development and the business, basically translating the business requirements to the developers and assure that it's implemented correctly. This meant creating test data and validating correct ETL processes. 

Most Information Systems master degrees also offer some data analytics courses. The ones I took at my university were also from the master's program. My second internship will also be at a data science consultancy where I will code in R most of the day.

What would you do in my situation? I really like to work with data but this career path seems kind of ""insecure"" compared to being more generalistic in IT.",Should I pursue a data science master or choose another career path?,1579706760
datascience,"Hi, I was thinking to go to WiDS, and I wanted to know if someone attended some previous edition of the conference. How was it? How was your experience? Where the speakers good? Organization? And the workshops?

&amp;#x200B;

And if you recommend a different DS conference, which one and why...

&amp;#x200B;

I'll be glad to read your experience... cheers!","Women in Data Science (WiDS), have someone attended before? How was it?",1579704479
datascience,"I've been applying to countless data science summer internships over the past few months, and I've only gotten rejects. I'm pursuing a pretty good Masters program, and I think I have a decent profile for landing an internship but I feel like I'm lacking in some way. Is Leetcode or Hackerearth going to help in any way?

Also, altruists of the sub, if you don't mind, can you dm me for profile evaluation? I can send you a link to my LinkedIn profile. Maybe I'll get a proper evaluation of my profile instead of a self perceived one.",Are Leetcode and Hackerearth participations necessary for data science internships? (USA),1579704337
datascience,,Machine Learning in Static Analysis of Program Source Code,1579700594
datascience,[removed],"Driving Digital Transformation with Data Science: What, How and Why?",1579693578
datascience,,How to consume a json HTTP endpoint as a infinite data stream,1579691454
datascience,"I'm currently pursuing CSE and I have literally no idea of industry requirements of Finance Institutions. People working in such companies on computer related jobs :

1. What kind of data do you work on ?
2. What Softwares / Programming Languages / Libraries do you often require?
3. How do I differentiate myself / form a niche from the competition and how do I stand out ?

My interests are ML and DataViz. I'm currently completing ML by Andrew NG on coursera. What should I learn next?","As a computer graduate, what skills should I learn to get a job in a Bank / Investment Firm?",1579688048
datascience,"I am an engineering student and i am currently working on a project in which there are prediction using Machine learning algorithms and Artificial neural networks
1. Is Neural network only for calculating losses in a model ? why there isn't accuracy? What more i can do after calculating various types of losses on the model i trained.

2. I draw various graphs of losses w.r.t epochs and set them in  tabular form but what's the next part i should be doing. Any User interface thing?",What's next after making model,1579679850
datascience,,How can data science be used to improve a real estate brokerage’s performance?,1579675653
