subreddit,selftext,title,created_utc
datascience,"This hurts your application far more than it helps it. 

I sit in and judge our Data Science interviews for multiple teams for my company in San Francisco almost twice every week. And I swear, almost every applicant throws Machine Learning as a solution to problems we send out in takehomes / in-person interviews / etc. 

In one specific case, we give applicants data to work on for take homes where Machine Learning cannot be applied due to inherent limitations of the data. But almost 9/10 we get candidates who always end with ML as a policy recommendation. 

This is a really bad signal to to the interviewees. It shows you that you don't have have business and product intuition. It just shows you that you are the 9/10 people who doesn't know how to think through actual business problems and come up with solutions local to the issue at hand. 

I mean I get it, you want to showcase your technical talent for complicated algorithms, because that's where most tech companies are heading toward anyway. But from a hiring perspective, what we want to see is the reverse, not to think about solutions but to think first about the problem itself. And from there, can you suggest solutions that's relevant to the issue? Whether that's A/B testing, just straight up analysis, or something that doesn't really require data science in the first place?

If you really want to impress the hiring manager, I would suggest thinking from this perspective, and honestly, it's OKAY to not suggest ML to every single problem that's asked of you. Unless it's specifically a ML/DL position where they ask you what ML/DL you'd like to use to solve this problem, approach it from a different angle that I mentioned above. It'll help you stand out as the 1/10 person in the sea of junior applicants.","Applicants, Please STOP throwing Machine Learning to every problem you get during interviews.",1620939622
datascience,"I recently got into a freelance datascience project.

It requires me to do EDA on a time series data, basically I need to find some seasonality , trend kinds of pattern here.

The data has millions of rows &amp; only 7 columns. Only 1 column is numerical, all other are categorial. It's more or less like sales data from walmart kind of store.

There are thousands of unique values in the categorial columns .

The numerical data has both very small values &amp; very large values, the boxplot gets totally squeezed and looks like a line.

I have bit of experience in python &amp; EDA on simple data like titanic dataset.

Some recommendations regarding what all I can do here will help. If you know any kaggle notebook which used similar dataset, that would help a lot too.

thanks

*tools I use - pandas, numpy, seaborn, matplotlib.*",Need help regarding what all should I do in EDA in time series data [Urgent],1620936626
datascience,"As the title says, I am starting my career after Masters in Computer Science with intermediate knowledge of Python and C++ programming. And couple of small academic projects done with pandas.

1) How hard/easy can this be for me to be a Data Analyst?

2) What are the most important skills, how should one proceed to get a job in this field?

3) What does a day to day job look like for Data Analysts?

4) Is this a difficult field to get into, compared to Front end/Full stack developer?

Thanks in advance",New grad wanting to be a Data Analyst,1620932141
datascience,,Q&amp;A for Time Series Analysis,1620931860
datascience,"I know that we are all working remotely to an extent now. But, does anyone here have experience with working on a team which is fully remote?

I am in talk with a recruiter for an exciting position in a fully remote company (well funded startup and recruiter promises a good work-life balance). I have had colleagues in the same location in all the places I worked before- I very much enjoyed the social aspect of office. So being in a fully remote team is something new for me and I am being a bit cautious.",Anyone has experience on working with ‘Fully Remote Team’ ?,1620931785
datascience,,"Data science problem: an electric car rebate program has ZIP codes as the only demographic data about recipients. How do recipients break down by race, income and gender? Two competitors use US Census data, IRS data, and market data to estimate unpublished survey results. See who won!",1620931204
datascience,"Scrolling down to the Net Household Savings you can see its at over $400,000 for Q2 2020, I know Covid is making the number high, but I feel like this data is formatted to be 10x higher? I am trying to use it for a report and it doesnt make an ounce of sense that a household could save $400,000 in one quarter, as well as that be the AVERAGE across the country.",Why is STATCAN showing an insane un-realistic number for Net Household Savings?,1620930701
datascience,I have a bachelors in accounting and certification excel. I need to find a new job and most of the roles that I want  require sql and python knowledge. How can I get this knowledge sufficiently enough to get a job in financial data analysis? What certifications would prove my competency? Should I go back to school? Boot camp?,How to transition from accounting to financial data analysis,1620930439
datascience,"I have an interview for a Data Analyst position coming up soon and have several questions.   


In the job responsibilities, it mentioned typical responsibilities for a Data Analyst except for 'Predictive Analytics'. Isn't this a Data Scientist's responsibility? Since it would require knowledge a typical Data Analyst would not know. Would it be fair to mention in the interview? The salary range was 60-70k. Assuming I can convince them it's a data scientist position and switch the title, would I be able to negotiate a salary above the range? 

&amp;#x200B;

Thanks in advance!",Data Scientist responsibilities in a Data Analyst job description?,1620930001
datascience,[removed],Data for the dataset,1620926662
datascience,"What do the tickmarks on the Partial Dependency Plots mean?  


[https://scikit-learn.org/0.23/auto\_examples/inspection/plot\_partial\_dependence.html](https://scikit-learn.org/0.23/auto_examples/inspection/plot_partial_dependence.html)",Tickmarks on Partial Dependency Plots,1620922392
datascience,Do you guys have any idea? Sklearn doenst have a built in library to do that,How can i create a dataset featuring clusters with inhomogeneous densities with python?,1620922246
datascience,[removed],Is a master's degree in data science enough to get a federal jobs in data science that pay over 90k/year? Currently I am working as a General Engineer and thinking about doing my master's either in computer science/data science.,1620921599
datascience,"In the past few years, I finished school with a statistics degree (bachelor), taught myself programming (Python, R, shell scripting), built portfolio on data analysis, data visualization and statistical analysis, worked as a programmer/math assistant at a lab for about a year during school, worked as a data analyst intern for about 4-5 months towards end of school and now working as a quantitative analyst for a government organization a little over a year (my ""first real job"" after graduation). Recently, I've been focusing on applying jobs at tech companies and reaching out to people (including recruiters) on LinkedIn for networking. For most of the application, I wrote a tailored cover letter and cv (one page summarizing my work exp - about 3 years in total - as well as 3-4 personal projects) and reached out to people who work at those companies for insights. I've been doing everything I could to improve my chances of getting interviews, but was not successful (I've gotten only one phone interview recently but was rejected for a data analyst role because I was less experienced compared to other candidates).

I've been feeling depressed at my current work. I find myself restricted from doing more data science-related projects due to bureaucracy and office politics. I like taking initiatives and going out my way to improve things (like inefficiencies in data transfer, analysis, etc.) but noticed that colleagues are tech-averse and hate changes (even if it provides more efficiency), which doesn't offer a lot of learning/growing opportunities - everything that I stand against - and I don't see myself being at this company long-term. I have a strong interest in ecommerce and have been applying to companies (big and small/startup) related to it but I feel that recruiters may be biased against my non-engineering degree, the fact that I don't have 4 co-op internships and that I work at a government (I've been told by someone who works as a recruiter at a very well known ecommerce company that when they see someone working at gov't, they just throw out their cv). 

I spend most of my evenings after work applying to jobs, networking online, learning new data science skills, and working on personal projects (currently working on a raspberry pi project with motion sensor and camera so that I can detect this outdoors kitty in my neighbourhood using machine learning - image recognition with CNN - and send mobile notification so I can pet kitty everyday). I think I'm doing everything I can but not seeing much progress. I'm starting to wonder if there's something that I'm not doing enough or if I should go back to school with co-op option or do some bootcamp with a job guarantee just so I get my foot in the door and have a better chance transitioning into a tech company. Any advice?

Also, I'm not necessarily looking for ""you should try Udemy/Coursera/\[insert some bootcamp for beginners\]"" unless you have a fantastic recommendation - I am already using DataCamp for learning. If you have similar experiences as me or is someone working as a senior/recruiter hiring for data-related roles and can give an honest opinion of how I can make my application stronger, I'd appreciate it :) Cheers",HELP!- I work at a Government. How do I transition into a Tech Company?,1620920807
datascience," I've got a relatively big dataset (8 GB) and pandas crashes when trying to load it into a dataframe. I've tried modin and pyspark, all with no luck. Are there any Python packages that can work with big data? Currently the data is stored in SQL.

I'm running this on a company VM which has 400 RAM I believe.",Are there any Python packages that can work with big data?,1620919844
datascience,"I'm looking for recommendations on my project, currently, we have a couple of hundred rows of health care review data. My project manager wants me to find a sentiment analysis tool that gives a compound score that correlates accurately to the stars given for the review. My first attempt I used vaderSentiment and it was around 55% accurate at the score to start rating, my second attempt I used texBlob and that was less accurate (35%). I want to know if there is any off the shelf models or other libraries I can use with python, especially if it understand Healthcare lingo. We hope that we can find something that is about 60-70% accurate from compound score to star rating. Eventually, we will build our own model once we have more data and time. For now, we just want to demo the data we have. Also if you think I'm going about this all wrong please let me know. I am relatively new to data science and this is a part-time project for my job.",Sentiment Analysis Recommendations on Review data,1620919160
datascience,"Hello,

I'm new and working on a logistic regression model. I have two variables that are (what I would consider) abnormally large at 10.2 and 30.7. I read online that it's usually a bad sign if this is the case and that this may signal multicollinearity. However, the VIF Factor on these is 1.2 (for both) under the 5.0 that I've read signals multicollinearity. Is it OK to leave these in? Should I remove them? Thanks.",Is it OK to have a coefficient greater than 1?,1620918414
datascience,"Two questions:

* How easy is making the transition from IT to datascience? Is it as hard as starting out from a totally unrelated field?

* Is this a common transition? I often hear people in engineering, computer science, and even math and statistics going into datascience no problem.",Going from IT to Datascience: How common is this?,1620916551
datascience,,Improving domain-specific transcription accuracy for AWS with custom labeling,1620915951
datascience,[removed],MSDS Northwestern — current students or graduates thoughts,1620914442
datascience,[removed],Career advice after 3 years of Data Science,1620912871
datascience,"Hi, in my attempt to create a new virtual environment that I can use for anaconda and vs, I made edits to the bash\_profile and now it's not letting me import the packages that are explicitly installed in both base and the new one. Does anyone have insights into this?? This is what my current bash\_profile looks like:

    GNU nano 2.0.6                                                 File: /Users/myname/.bash_profile                                                                                                          
    
    
    # &gt;&gt;&gt; conda initialize &gt;&gt;&gt;
    # !! Contents within this block are managed by 'conda init' !!
    __conda_setup=""$('/Users/myname/opt/anaconda3/bin/conda' 'shell.bash' 'hook' 2&gt; /dev/null)""
    if [ $? -eq 0 ]; then
        eval ""$__conda_setup""
    else
        if [ -f ""/Users/myname/opt/anaconda3/etc/profile.d/conda.sh"" ]; then
            . ""/Users/myname/opt/anaconda3/etc/profile.d/conda.sh""
        else
            export PATH=""/Users/myname/opt/anaconda3/envs/newenv/bin:$PATH""
        fi
    fi
    unset __conda_setup
    # &lt;&lt;&lt; conda initialize &lt;&lt;&lt;",Jupyter: Installed packages in a virtual environment but can't import,1620912549
datascience,"We're in the very early stages and thought we'd show you so we can get feedback and get a direction as to what we should build over the coming days.   
Even though it looks like a spreadsheet,  it works like a database. This means you can not only run SQL queries on the spreadsheet but also scale it to thousands or millions of rows.

**Key differentiators**  
1. You can write SQL queries on your spreadsheet. You can also do JOIN queries across spreadsheets.

2. Easily handle millions of rows - buttery smooth

3. API out of the box for your data so you can wire it to other systems.

4. Import your CSV or Excel files and run SQL queries over 

5. Command-line based access 

**Upcoming features :** 

1. Save SQL queries for future use

2. Native connection to databases

3. Self hostable version

4. Version control and error checking

5. Connect Spanrr directly to your Web application as a MySQL database.

Please let us know what you think? Anything you like to see in the coming days?   
Feel free to ask anything in the comments below.",A new spreadsheet with SQL support,1620912467
datascience,thank you v much,"Could you describe in a few lines a project you worked on as part of a job, an internship or a study project for which you managed to transform complex raw data (Big Data, ERP, Public Data) into a comprehensible document (Dashboard, Insights)?",1620907118
datascience,[removed],Dúvida sobre Data Science,1620905134
datascience,,Advanced Analytics and the Top 6 Data Mining Techniques,1620904551
datascience,"
I know python works, that’s it. Originally learned it because my friend recommended it as a useful skill. 

I recently completed the udemy course Data Science A-Z by hadelin de ponteves and kirill eremenko, and started their deep learning course 


My question is, what are some comprehensive resources to continue my journey here? What are all the things I should be learning and where is the best place to learn them? 


After the data science A-Z course I feel I have good basic understanding and am looking to grow further. I have a pure maths degree and think I’ve stumbled across my favourite thing ever as a career, can’t wait to become proficient in this",Hi data science noob looking to learn the field! Any advice on skill sets I should work on?,1620902522
datascience,[removed],Data Science,1620901390
datascience,,What is real-time stream processing?,1620899640
datascience,"I recently was offered a job as an analytical consultant after graduating with a degree in analytics. While working, I want to continue my education by building my software skills and eventually transition in a few years to a MLE or a more pure data science role. Since my company will sponsor further education, I’ve been considering a comp sci minor, or a masters in ML from GT’s online CS program (however I don’t have a software background). What is the best path for me to continue education?",What education to pursue while working?,1620899279
datascience,"Hello! I am currently a second-year (third) linguistics major student, and I am looking for an academic advice. I am looking forward intro declaring a minor in computer science or math. The problem is that I do not know what to commit to (and I can only choose one). I am aiming to apply to grad school in data science / natural language processing / computational linguistics. I have already developed some Data Science projects and I have developed pretty good coding skills by myself (Python, C++, Swift), and I am pretty much equally good at math. However, I am not entirely sure which minor would help me more career-wise. Can you guys help me out?",Linguistics student looking for advice to advance in NLP/Computational Linguistics,1620896772
datascience,"I heard that Kaggle is a good place to learn and have fun, but is there any place that is good for me to learn? Kaggle looks too difficult for a absolute beginner like me",Best way to leisurely learn DS?,1620895948
datascience,"
I know python works, that’s it. Originally learned it because my friend recommended it as a useful skill. 

I recently completed the udemy course Data Science A-Z by hadelin de ponteves and kirill eremenko, and started their deep learning course 


My question is, what are some comprehensive resources to continue my journey here? What are all the things I should be learning and where is the best place to learn them? 


After the data science A-Z course I feel I have good basic understanding and am looking to grow further. I have a pure maths degree and think I’ve stumbled across my favourite thing ever as a career, can’t wait to become proficient in this",Hi data science noob looking to learn the field! Any advice on skill sets I should work on?,1620892187
datascience,"I know python works, that’s it. Originally learned it because my friend recommended it as a useful skill. 

I recently completed the udemy course Data Science A-Z by hadelin de ponteves and kirill eremenko, and started their deep learning course 


My question is, what are some comprehensive resources to continue my journey here? What are all the things I should be learning and where is the best place to learn them? 


After the data science A-Z course I feel I have good basic understanding and am looking to grow further. I have a pure maths degree and think I’ve stumbled across my favourite thing ever as a career, can’t wait to become proficient in this",Hi data science noob looking to learn the field! Any advice on skill sets I should work on?,1620886013
datascience,"Anyone know of any good data science bootcamps? Preferably one that is not outrageously expensive! I have a degree in math, so one that would help be land a job in DS would be great. Thanks!",Best Data Science bootcamp??,1620885041
datascience,Is there a data science discord? Would be nice to have one :),R/Datascience Discord,1620880983
datascience,"Hi there! We've just added a new dataset to Gourdian, this one courtesy of Google's Project Sunroof. This dataset essentially describes the rooftop solar potential for different regions, based on Google's analysis of Google Maps data to find rooftops where solar would work, and aggregate those into region-wide statistics.

It comes in a couple of aggregation flavors - by census tract ( https://gourdian.net/g/eric/sunroof_solar.solar_potential_by_censustract#summary ), where the region name is the census tract id, and by postal code ( https://gourdian.net/g/eric/sunroof_solar.solar_potential_by_postal_code#summary ), where the name is the postal code. Each also contains latitude/longitude bounding boxes and averages, so that you can download based on that, and you should be able to do custom larger aggregations using those, if you'd like.

This dataset seems like it'd be interesting to cross reference with things like weather, and perhaps electricity prices, to find the best places for people to invest in rooftop solar. If you have any other ideas of what it'd be good to combine with, let us know, and we can try to prioritize ingesting those!",Gourdian Free Dataset Download: Project Sunroof - Solar Electricity Generation Potential by Census Tract/Postal Code,1620873373
datascience,Hi guys! I'm applying to UC Berkeley for this fall semester for the Online Masters in Data Science Program. I was wondering if someone could review my statement of purpose. Thanks!!,Can Someone Review My UC Berkeley MIDS Statement of Purpose,1620871782
datascience,"I have a flowset (list with nested lists), each nested list is a population. I have about 50 populations and I want to filter by getting the top 12 exprs values (rows in exprs, nrow() or length())

Check the link to a question I submitted on stackoverflow with a simple example:

[https://stackoverflow.com/questions/67509595/r-sorting-list-by-number-of-rows-in-nested-list](https://stackoverflow.com/questions/67509595/r-sorting-list-by-number-of-rows-in-nested-list)

&amp;#x200B;

Any input would be helpful","[x-post r/rlanguage] - R, FlowCore Help: How to filter flowset by exprs values?",1620868920
datascience,"I've got a Python Keras Sequential model that I would like to use Early Stopping on as soon as the test mse gets out of hand (to prevent overfitting), but I'm not seeing any way to feed Keras the test data and tell it to calculate a metric off that.",How to use training data in Python Keras Sequential metric?,1620865040
datascience,"I'm currently learning Support vector machines and I have the theory there, including the quadratic programming, but when i go in to the sklearn package I feel like it's so hard to understand what the heck is going on. First of all when I code I never use objects so class and methods are already a little weird to me, but I feel like the package using different files is also confusing. If I were to want to tweak something about the code I wouldn't be able to. Does anyone have a recommendation on how to understand the code better? Am I missing something?",Not being able to understand sklearn code,1620862782
datascience,[removed],Some beginner-friendly tips on landing data science internships from a recent college grad,1620861640
datascience,"I’m a current full-stack Software Dev (C#, .NET, React, etc.) who may have an opportunity as a Data Scientist.  I enjoy my work but spent much of my time in school learning Data Science (ML, Deep Learning, Data Analytics).  I’m trying to decide if diving into Data is worth the risk of leaving my comfort zone.  Has anyone here made a similar transition or can anyone offer insight on whether or not this is a good idea?",Data Scientist vs Software Dev,1620860685
datascience,"Hello,

I am UK graduate hoping to enter the field of Data Analytics. I've come across a data product consultant job whose role is vaguely : using a blend of technical and business analytics skills to develop and data solutions to companies, that would train me in relevant skills I would expect in data Analytics (SQL, Python, Tableau, Alteryx) 

However, although I am aware of what a ""data product"" is, they have said that it is not really that much of a ""technical job"" and this has thrown me for a loop.  Trying to read up on Data products, I'm flooded with carriers in  Product Manger, which seems to be a more managerial and administrative then analytical , and has left me overall a little confused.

Would Reddit recommend pursing a carrier as a Data Product Consultant with the end goal of a career in the data industry( preferably analytics) , or is it setting me up for Product Management ?

any information on Data Products and Data Analytics and their relationship would be greatly appreciated.

I have a keen interest in Data and analysis and less so with a high level ( a little is fine ) communication and a managerial position.

Thanks.",What is a Data Product Consultant?,1620858351
datascience,Hello to all specialists! I am programming as a hobby but studying to be a metallurgist Can I combine these activities and how?,Hobby and specialty,1620856535
