subreddit,selftext,title,created_utc
datascience,[removed],What pc do i buy?,1618001701
datascience,[removed],Easiest way to change regression predictions into ranges?,1618000915
datascience,[removed],Disconnect between MS curriculums and in demand skills,1618000163
datascience,"Hello. 

I'm interested in learning data science and was wondering if free code camp is a good option. They have the following 3 courses each lasting 300 hours. 

Scientific computing with python 

Data analysis with python 

Machine learning with python


I was wondering if those courses alone would allow someone to learn the basics of data science and get a job to start in the industry. 

I'm also wondering if you guys happen to have a course for sql for free since it doesn't seem to be included in free code camp. 

Thank you very much for your help.",Is free code camp a good resource,1617999620
datascience,,Predicting which NFL QB is least likely to throw an interception next season,1617998670
datascience,[removed],"Systems Engineer looking to switch careers, am I wasting my time?",1617998020
datascience,"I am a CS student in my final year and I have some skills in python since I am currently working as a testautomation engineer in python and I also finished a Deep Learning class at my university which is heavily based on the Andrew Ng course(almost the same). I have fairly deep knowledge in maths so I don't need courses created for delivery guys who want to change their carreer.  
Which specialization should I choose from theese? Can you maybe recommend me something better from coursera?  
[https://www.coursera.org/specializations/jhu-data-science](https://www.coursera.org/specializations/jhu-data-science)

[https://www.coursera.org/professional-certificates/ibm-data-science](https://www.coursera.org/professional-certificates/ibm-data-science)  


JHU is top rated on most sites but I'm afraid of R since I think I could do better in python even if I have a statistics class with R. The IBM one seems prettier for me but I haven't seen ratings on major forums, idk why.  
Thanks for your help!",Which data science course should I choose?,1617996810
datascience,"I recently had an interview and I answered $70k+ CAD and it was a start-up company based out of San Francisco. 

My husband found it incredulous that I answered with that and told me I should have answered $100k USD because that is the base salary for a data engineer in the valley. 

What do you guys think?",What would you answer as your salary expectation as a new data scientist?,1617994214
datascience,"I've always been interested in helping people/animals since as long as I could remember. I'm a Data Analyst in my current role (Tableau, SQL, Excel, learning Pandas) and don't deal with any complex Data Science projects/models, but I am self-teaching myself and having a blast.

Does anyone know of any ways we/I could use Data Science/Analytics to help people, and not just organizations, Even if that means volunteering?

Thanks!",How can I use data to help people?,1617983953
datascience,"AI systems are widely adopted in several real-world industries for decision-making. Despite their essential roles in numerous tasks, many studies show that such systems are frequently prone to biases resulting in discrimination against individuals based on racial and gender characteristics.

A team of researchers from MIT-IBM Watson AI Lab, the University of Michigan, and ShanghaiTech University has explored ways to detect biases and increase individual fairness in ML models. 

Full Summary: [https://www.marktechpost.com/2021/04/09/researchers-from-mit-ibm-watson-ai-lab-the-university-of-michigan-and-shanghaitech-university-study-ways-to-detect-biases-and-increase-machine-learning-ml-models-individual-fairness/](https://www.marktechpost.com/2021/04/09/researchers-from-mit-ibm-watson-ai-lab-the-university-of-michigan-and-shanghaitech-university-study-ways-to-detect-biases-and-increase-machine-learning-ml-models-individual-fairness/) 

Paper 1: https://arxiv.org/pdf/2103.16714.pdf

Paper 2: https://arxiv.org/pdf/2103.16785.pdf","Researchers From MIT-IBM Watson AI Lab, the University of Michigan, and ShanghaiTech University Study Ways to Detect Biases and Increase Machine Learning (ML) model’s Individual Fairness",1617983752
datascience,"Partially because of my profession (photojournalist), and partially because of sheer curiosity, I started thinking about some sort of media index.

What would be some good indicators of media development to compare countries? Newspaper circulation? Number of newspaper titles? Number of television stations? Internet news analytics? Per capita?

There definitely are countries where there are more newspapers to choose from. There are also countries where people give less shit about news and media. How to find the most news-obsessed and media-curious country?",Media pluralism and media development ranking for countries?,1617983500
datascience,"Hi All, I'm interested in web development and creating middleware between databases and web (queries/REST apis). So far, mostly using python and sql, but am open to new tools.

My employer wants to utilize my skills more, and so has offered to pay for some classes to help me learn more (\~ $500/class max).

Any suggestions for what would be helpful? I'm open to anything.",Employer wants to pay for a course,1617983500
datascience,"I will admit, my question does not make sense now.  But CS was a relatively new field, and most older software engineers I have met do not have CS degrees, but degrees in math, engineering, physics, or are even self-taught.





Now, it seems like we see less self-taught programmers and more programmers with CS degrees.  Couldn't the same happen with data science?","With the growing number of undergraduate majors and MS degrees in data science, will employers expect data science degrees in the future?",1617981722
datascience,[removed],Good practice of Data Extraction,1617981241
datascience,"Hi all, I just finished a first round 60 min interview at Oracle. It was with the hiring manager and a technical team member. Most of the questions were standard get-to-know-you interview questions, but when I mentioned some of my past projects with coding, the technical guy seemed to get annoyed and started drilling me about specific R and SQL functions. It was kinda insulting, like he was gatekeeping me or something. I'd heard if a company wants to test your tech skills, they'll schedule a separate tech interview or even a coding test (I've had those before), but since this was a first round interview, I wasn't prepared. Maybe that's on me, but have you had this experience before too? Where you say you can do something techy and the interviewer tries to trip you up with really specific questions out of the blue?",Technical Questions in First Interview?,1617981149
datascience,,Why should SMEs consider making Decisions on the basis of data?,1617980256
datascience,,"Simple question, do you NEED a degree to become a data scientist (CONTRACTOR UK)?",1617979580
datascience,,"One of our creators just finished their PhD and got a job in satellite remote sensing. He made this video introducing the physics of data acquisition and processing, to explain how satellites are used for sustainable development and climate change monitoring. Enjoy!",1617978715
datascience,,"Deep learning vs advanced case based reasoning vs advanced computer vision vs time series analysis’s vs machine learning for IT security, What one should take as a student?",1617977965
datascience,"Hello. I was hoping that maybe would be able to help me with this problem.

I am trying to apply normalization and de-normalization to my classification models. 

I 've normalized the data (X\_train, X\_test)  with MinMaxScaler after split:

(Logistic regression is one of my models, I know that I don't need to apply normalization to certain models, It was just the first on the list :)) 

    normalizer= MinMaxScaler()
    X_train = normalizer.fit_transform(X_train)
    X_test = normalizer.transform(X_test)

Than I've trained the model:

    log_reg = LogisticRegression()
    log_reg.fit(X_train, y_train)
    log_reg_pred = log_reg.predict(X_test)

Now I would like to inverse\_transform the predictions to test it with ""not normalized"" y\_test but when I try this:

    real_pred = normalizer.inverse_transform(log_reg_pred)

I get an error:   
""Reshape your data either using array.reshape(-1, 1) if your data has a single feature or array.reshape(1, -1) if it contains a single sample."" 

Now when I try this:

    log_reg_pred_reshape = log_reg_pred.reshape(-1, 1)
    real_pred = normalizer.inverse_transform(log_reg_pred_reshape)

I get: "" non-broadcastable output operand with shape (1022,1) doesn't match the broadcast shape (1022,18) ""

I understand the error but I simply don't know what to inverse. X\_train? Something else? Or should I apply normalization to y\_train as well?

Thanks in advance for any help.",How to inverse_transform classification model predictions.,1617977397
datascience,[removed],UChicago MS Analytics,1617977265
datascience,[removed],Anaconda alternative,1617975147
datascience,I’m graduating in April I am going to get my masters of science in applied analytics starting in September I want to get ahead of the game and just teach my self more. I love data science so much. I am thinking about taking googles data analytics course as soon as I’m done with classes so at the end of this month I’m also thinking about doing imb data science certificate as well it goes over python google goes over R I’d get the best of both worlds this summer should I take them both if I’m not going to be doing anything until my masters starts in September? All opinions and welcome! Thanks guys,Opinions???,1617974308
datascience,,Hearing from data &amp; analytics leaders firsthand. Episode 25 = Firas Khnaisser (Standard Life Aberdeen),1617973722
datascience,,Schleppin on a Friday.,1617973660
datascience,[removed],Process Data Analysis Question,1617972809
datascience,,Looking for tips and tricks about the new data science internship you want to apply for?,1617967228
datascience," Hi /r/datascience,

We're Mark and Cameron and we're working on a tool to help Analysts be more productive by going ""full stack"" without needing support from a data engineering team.

Analysts have to use so many tools to do three key things: explore data, build queries and create pipelines. Arkwright will let you do all of this from a clean and simple IDE, without months of onboarding.

We're really keen to gauge interest in this, so please let us know what you think and when we launch you'll be the first to know.

Find out more about Arkwright here: [https://arkwright.io](https://arkwright.io/).

Cheers,

Mark and Cameron",Arkwright - the IDE for full stack analysts,1617964522
datascience,[removed],Collecting historical data from job postings,1617955787
datascience,I think it's run by trilogy. It's this a scam program? They have a lot of buzzword on their website. Anyone here did this particular program at Columbia? What are your thoughts? Do you think it was worth it for the price?,How is the Columbia Engineering FinTech Boot Camp?,1617955394
datascience,[removed],Finishing a PhD in AI at 39 (no previous related experience)... Would I be able to get a job?,1617954555
datascience,"My previous experiences are in sustainability and climate change. Now I’m pursuing Udacity DS Nanodegree and building my portfolio in Github.
My question is should I do a project based on the industry I want to work in ( to build on domain knowledge) or should I pick up project based on popularity like typical classification problems. 

Any help would be appreciated.
Thanks .",Need advice to break into new industry,1617953826
datascience,"Hello, redditors i am looking for a step-by-step tutorial to install a  jupyterhub installation with kubernetes on VM with centos 7+ in  enterprise setup. Any help in pointing me to resources would be greatly  appreciated.",JupyterLab implementation on Enterprise hardware on VM non-cloud,1617951256
datascience,"I am part of a data analysis R&amp;D team in my company that deals with developing ML solutions for our products ( large scall manufacturing equipments). My background is not data analysis but electronics circuit design. The problem at hand is that everytime I do a progress report about the project I am working, my team lead expects me to elucidate every little background information of the project before entering into the topic being researched and the results. His reasoning is that since he is management I can't expect him to know all these first hand knowledge about the project. For example the things he never seems to remember:  the kind of data we are currently dealing with, why we chose the method A to test, the kind of parameter we are using to test the model efficiency and why, etc. 
It's not like I never tell him these. I always explain things when they're brought up for the first time. But he wants me to recap these things every single report. We do progress reports every week and he wants me to spend the better part of report bringing him upto speed.. is this normal ? He handles 3 different project teams. Am I the one being unreasonable here ? I want to hear experiences of other data scientists/analysis.",Data science projects and reporting results,1617946457
datascience,"In my efforts to move towards a career in data science, I am being fortunately afforded an opportunity to propose a set of deliverables for a 3 month Data Science PoC for a customer.

Requirements are:

\- Define metrics / what data points we want to grab

\- Develop Data Pipelines to collect data (real time sourced from the internet + static data pre-loaded)...

\- Store data in a cloud data store (AWS/Google/Azure/Snowflake)

\- Analyze data and present to customer on front end tableau dashboards

I am thinking of the following tools:

**Data Sources:** Depending size, either API calls to social media/news data, or pySpark Streaming. Automated, running 3-4 times a day

**Data Cloud Store:** Aggregates data sourced from real time sources, with static sources (S3 buckets or something similar)

**SciKit Learn + Pipelines:** Automated modelling and analysis 

**Tableau:** Receives output of SciKit Learn models + grabs data directly from Cloud Data Stores for interactive visualizations

There are probably many things I am overlooking, but this is my rough solution at this time. It will be delegated between 3 guys, but I just completed my MS of DS so I hope this will be a good hands on oppty for me to do as much as I need to....I don't think I need a serious Data Engineering stack (Kafka/Hadoop/Airflow etc.), because I don't believe that aspect is important at this phase....it's more to demonstrate feasibility of modern data stack to solving analytical problems. 

Please critique (Gently :) ) ,

Thank you",An End-To-End Analytics Process - What tools to consider?,1617943420
datascience,[removed],Career Benefit Of Data Science,1617941618
datascience,"Hello, I am a junior student at a small university in Korea and I'm currently a newbie in the data analytics field. While I do have hands-on experience in analyzing and visualizing financial data using python, I do have little knowledge about running an in-depth analysis of the data using data analytics skills.

My question is - how many math skills do I need to have to do data science/analytics? Also, I would like to ask you whether it is better to study through books or to learn by doing projects directly through Kaggle.  
Also, is background knowledge about computer science(algorithm, data structure) vital when it comes to analyzing data?",Skillset for data science,1617939131
datascience,,How Data Selection Impacts Model Performance: An AMA with SiaSearch,1617936205
datascience,"Title says it all. I accidentally accepted too many friend requests without thinking. 

Now I'm getting bombarded with ""do you have a moment to chat (about our aWeSoMe eTL PrOdUcT)?"" messages. 

Do I just ignore them? Unfriend them? Or politely decline?",How do you deal with Data Pipeline/Engineering sales people on LinkedIn?,1617936155
datascience,"Hi everyone. I am relieved to finally have some kind offer to (at the very least) to what seems like a stepping stone for starting a new career. However, I've never heard of such an offer before but then again this is a new career/world for me. 

Things I'll be actively using/learning how to do, specific to analyzing \*future\* or upcoming threats:

\-   OSINT data analysis   
\-  data mining and analytics   
\-  security/threat/risk management   
\-  threat and vulnerability mitigation techniques   
\-  GIS, Terra Explorer, MapBox   
\-   international affairs, enterprise risk management or business management  
\-  Data research, mining, tool usage, threat analysis and predictive threat/trend analysis   


It all sounds super interesting and very exciting...HOWEVER, I've made this mistake before (taking the first thing that comes my way) and it's completely steering my career in the wrong direction. My BS is in geology, and the last 6 years of experience have all been several flavors of engineering thanks to my first job out of school being for a civil engineer. Good pay, but that's not at all what I went to school for and I don't know why people kept hiring me for $100k/year lol. Like alright I do it but only because you're paying me so well....ANYWAYS I don't really want that happen to again because it's been nothing but frustration for me and feeling awful about myself because all my friends and colleagues are working the geology jobs I was dying for. 

So please help me out...

Is this an actual stepping stone to data science, even if I have to add a few extra years of analyst roles to get there?

If it's not, is this at least a lucrative path? 

Is data analysis/science so saturated that we're back to unpaid internships? Ughhh

I also asked what they expected the salary to be if I were to be hired full time (or even the fulltime unpaid position they were advertising) and it was $15/hr, and $45k/yr for more experienced people. They said ""there are tons of people willing to work for $15/hr for this type of role right now and it's more for the exit opportunity"" and ""this job won't be about the salary, people are coming to us because they believe in the mission and they want the stock options as new employees"". I don't know why but that really threw some red flags for me but like I said, I don't know if this is normal or not. 

Thanks for any help, and sorry it's so long. I wish I had asked questions like this before accepting past jobs!

TL;DR - There was a job posting for an unpaid intelligence analyst position. I'm not experienced enough for it, but I asked for an internship and they said yes. I want to make sure this is normal and an actual stepping stone to data science before I hastily accept.",Internship offer for Intelligence Analyst for a startup...but no salary. Is this normal? Does this lead to better things?,1617932063
datascience,"Howdy!

We've just added another few free dataset downloads to our project (Gourdian), this time from the EPA Air Quality System, daily levels of the following pollutants from measuring stations throughout the US, going back to 1980:

* Carbon Monoxide (CO): https://gourdian.net/g/eric/epa_aqs.co_daily_summary
* Nitrogen Dioxide (NO2): https://gourdian.net/g/eric/epa_aqs.no2_daily_summary
* Ozone (O3): https://gourdian.net/g/eric/epa_aqs.ozone_daily_summary
* Sulfur Dioxide (SO2): https://gourdian.net/g/eric/epa_aqs.so2_daily_summary

This dataset is only updated twice per year.

Why should you care about these things? Well, they're pretty nasty pollutants, which frequently affect human health, especially over long exposure periods. Perhaps concentrations should affect where we build homes more than they do, for example? They're also useful proxies for various types of human activity.

**Carbon monoxide** can be deadly in high concentrations, as it binds to hemoglobin, and makes it so that one's blood can't carry as much oxygen. Created via combustion of fossil fuels.

**Nitrogen dioxide** is one of the results of road traffic and other fossil fuel combustion, is one of the precursors for other harmful pollutants such as ozone and particulates, and plays a role in the formation of acid rain (it becomes nitric acid). It's also generally correlated with exposure to other byproducts of road traffic, many of which have been linked to respiratory illnesses and systemic inflammation, which can lead to a whole host of other health issues.

**Ozone** is a powerful oxidant, which makes it so that it can cause damage to respiratory tissues. It also attacks various polymers like rubber, eventually causing it to crack. It's formed primarily from photochemical reactions between nitrogen oxides (like NO2) and volatile organic compounds (VOCs). High concentrations aren't limited to urban areas, however, and it can travel hundreds of miles downwind from the source.

Finally, **sulfur dioxide**. Formed largely by the combustion of fossil fuels with high levels of sulfur, as well as volcanic activity. It's a precursor to acid rain (it becomes sulfuric acid). Sulfur dioxide is known to be at least mildly toxic, and can be hazardous in high concentrations. Long term exposure to low concentrations can also be problematic. The amount of sulfur in fossil fuels vary widely by type - automotive gasoline has much less than bunker fuel commonly used by container ships, for example.

If you'd like to download any part of these, you can filter down to the parts you care part via the lat/long filter (button on the map to select area) or by year, via sliders. As you do this, the download size noted on the download button in the upper right should change. When you've got the part you want, click download, and you should get a CSV.

A bit about our goals and what we're trying to build:

* Filter (optional), click the button, CSV arrives on your hard drive
* Downloads are always a single CSV, no bundles with weird directory structures, no other formats
* CSVs are indexed and filterable by a few column types (lat/long and date/time at the moment), so you can download just the parts you want
* Open licensed datasets are free to download
* No signup required for downloading open datasets
* Search within and across datasets

Feedback welcome! If there are any datasets that you'd like to see added, let us know!","Gourdian Free Dataset Download: EPA Air Quality System Daily CO, NO2, O3, SO2 Concentrations since 1980",1617931943
datascience,"I am completely to new to nlp/text mining and am interested in learning more about it (on an applied side). Suppose I have a dataset with 1000 doctor comments (no ""labels"", i.e. I don't know if they are positive or negative) for different restaurants. The question is now, what can I do? 

Just by doing some google searches, it seems like the two popular things to do with this data is LDA and sentiment analysis. Just by looking how to do this in R, this looks doable. But what are some other popular algorithms that can done on this kind of data? I assume that through LDA and sentiment analysis, you can ""cluster"" these doctor comments together? If you have a new comment, you can see which from clustering which cluster this comment belongs to? 

In this example, how would the newer BERT algorithm come into play? Is there a main way to extract ""insights"" from these comments? Based on the text in these comments, are there algorithms that can determine if its possible to see which medical conditions  are more lethal, which age groups/demographics of patients are healthier, which medications are people taking, etc. ? Or is this a very advanced problem?

Thanks",Intro to NLP and Text Mining,1617931245
datascience,,"In my recent video, I use my knowledge of data science and physics to solve the Fermi Paradox. For people who know about the Fermi Paradox, I believe there is currently enough data to prove that the ""Great Filter"" is behind us, which is really good news. Do you agree? What are your thoughts?",1617929658
datascience,"This sub has been very helpful in the past so I am hoping I can get some feedback. For my project, I am essentially trying to find a way to detect changes over time to a news narrative. At this stage I have applied an algorithm to successfully group together the stories that follow the development of the same event. So now I need to find a way to track, analyze, and maybe quantify how the events (and their coverage changes) . My current approach is using topic modeling to find important keywords in each of the articles. Then, I use those key words to map how the stories change overtime. So in the most basic of terms, I am identifying key words in the first article in each narrative chain and then comparing how those keywords change and are different from key words identified in subsequent articles about the same event. Does this approach sound reasonable? Is there anything else I should be trying instead? Thanks everyone!",Feedback requested on nlp project related to news story chains changing over time,1617928059
