subreddit,selftext,title,created_utc
datascience," Hi everyone,

If you saw a project on a new grads resume which is basically a song recommendation system for Spotify, would you think its a good project or bad one? I only ask as I see many projects with the same premise and I want to know if its been done to death already.

I'm really interested in the project but I don't have time as I have to start preparing for job interviews soon and I don't want to waste time doing a project which won't help me get an interview. Any thoughts and advice on what projects I can do to stand out as a new grad entering the industry will be greatly appreciated! Thanks!",Bother with a Spotify Song Recommendation project?,1621036619
datascience,"If you saw a project on a new grads resume which is basically a song recommendation system for Spotify, would you think its a good project or bad one? I only ask as I see many projects with the same premise and I want to know if its been done to death already. 

I'm really interested in the project but I don't have time as I have to start preparing for job interviews soon and I don't want to waste time doing a project with wont help me get an interview. Any thoughts and advice on what projects I can do to stand out as a new grad entering the industry will be greatly appreciated! Thank!",Bother with a Spotify Song Recommendation Project?,1621036161
datascience,"Hi, I hope everyone is doing well in these testing times! 

I am an Electronics and Communications engineer and have been working as a data analyst for the past 3 years. Most of my work also entails predictive models like XGBoost and recently I have also picked up some NLP. 

Now I am looking to apply for a Masters degree. I feel that there are other MS in CS vs MS in DS reddit posts out there but my confusion is a bit more deep, so I'll try my best to structure it well. 

1. I do not have a background in CS, most of the folks I've seen do well in Data Science (Analytics or ML Engineer) usually have a bachelor's in CS. So should I do a MS in CS. 

2. Almost everyone with a MS in Data Science is able to get a job as a data scientist. So I should apply to MS in DS, but it'll blow away my cover for Software Engineering roles which I would not like but are a good backup in the long run. 

3. Since most software Devs or data scientists will be in management positions later on in their career, it does not matter that I don't have backup software engineer roles because I will be a manager.

4. MS DS programs are few in number and my overall profile is not that good to get into great programs. My background is not in CS so it also limits my options for MS CS. 

5. I applied to a mix of MSCS and MSDS programs this year and got into UT Dallas MSCS and USFCA MSDS. I am considering building a stronger profile and applying again but only in either MSCS or MSDS. 

As you can see I'm using a lot of variables to think about this. I am probably overthinking, yes. But I seriously want to make a good decision. 

I would really appreciate perspectives that would help me think and opinions that don't digress a lot from the mentioned points. 

Thankyou so much for reading through, I really appreciate your help! Thanks!",Please help me prune my career decision tree,1621035461
datascience,"Hey Everyone! I hope this is allowed to be posted here. I work for a company that looks at review ratings across several websites to create a score from 0-100 for apartment complexes. I was given a project to look at this score in comparison to some other variables to show how score increase correlates to the other variables.

I have a csv file (happy to share if I need to) that has this company rating for several apartment complexes. It also has traffic, leads, and close ratios for several months. I know that the company rating will have no direct correlation with the rest of the data because it is based on all the reviews for the property.

I am wondering how to approach this or what you may start with looking at. 

I hope this made sense and can be posted here. If not I will clarify or post somewhere else.",Analysis of Property Management Company,1621032173
datascience,"Hi All,

Are there any data scientists here working in manufacturing (food and beverage ideally)?

I'm part of a new startup data science teams and we're looking for good use cases

Thanks all from Dublin, Ireland",Data Science Projects in Manufacturing,1621031693
datascience,"I was just recently hired to help a manufacturing company use machine learning for machine maintenance and quality control however no one there knows python / R. Everyone on my team uses KNIME (basically just to plot data as if it were excel or minitab) and there is a chance that they won't allow me to use Python/ R. 

I get that it can be cool for some people who are inexperienced or new but really, just fuck Knime. I don't know what makes me more sad, that tools like this are so popular or that someone decided to spend time making these tools which in my experience just makes it harder to do things right because most decision makers fall in love with this stuff...",I really hate KNIME but my coworkers love it...,1621030071
datascience,[removed],Does Anaconda support M1 natively?,1621029090
datascience,[removed],UT Austin Post Graduate Program in Data Science and Business Analytics - Scam?,1621027829
datascience,"+ There are many ways of improving machine learning model performance.

+ One such is feature selection.

+ Amongst many feature selection techniques, genetic algorithm is one.

+ I have created a python library that helps you perform feature selection for your machine learning models.

+ It helps you identify the best set of features for your model. Feel free to use it.

pip install EvolutionaryFS


Example notebook: https://www.kaggle.com/azimulh/feature-selection-using-evolutionaryfs-library",Genetic algorithm for feature selection,1621026993
datascience,[removed],Best Data Science/Analyst jobs as a petroleum engineer,1621024062
datascience,"I'm working as a market research professional from last three years and i want to change my career to data science for better future opportunities.

How can i start. From learning to getting a job.

Please someone help.",Career Change Advice,1621023542
datascience,,Data science competition: California real estate prices,1621021525
datascience,"Hello,

I wanted to ask you guys what specific does a Data Scientist’s work look like? Also, what type of programming does a Data Scientist do? Anyways, it would be great if you could describe the general work specifics to me.

Thanks to everyone immensely in advance!",General question,1621021279
datascience,"Let's say I've built a model using past bank data that predicts which customers will apply for an auto loan with us.  I now have a potential email list with our current customer data that I want to check which specific members who are most likely to apply for a loan and a predicted agg count of how many will apply for a loan, what would be the best way to do so? Can I have it read a CSV file or connect to a SQL table to do this?  I've read a little bit about FLASK, but I haven't seen anything like I'm wanting done in flask. Not looking for a step-by-step or for someone to do the work for me, more of a ""yes/no this can be done"" and maybe a link that might assist me. Thank you",Best Way to Deploy a Model into Production,1621020257
datascience,[removed],Career Switch From Operations/Analytics role (with an MBA) to Data Science.,1621019184
datascience,[removed],"Tips for Begginers, please?",1621018677
datascience,"Let me first say that I am not a data scientist, or even a college degree holder. I'm just someone who thought of something but has no idea how to do it - which I am going to ask how to do here.

Pretty much I run a Minecraft server, and want to show player activity over the course of the last 6 months that I have had it. Every 50 or so seconds the console log outputs the following line:

\[ {Day of Week}, {Numerical Day}. {Month} {Year} {Hour}:{Minute}:{Second} UTC INFO\] There are {# of players} of a max of {Max # of players} players online: {Player names seperated by ,}

For example: 

 \[Fri, 14. May 2021 05:15:34 UTC INFO\] There are 0 of a max of 15 players online: 

 \[Fri, 14. May 2021 14:51:30 UTC INFO\] There are 1 of a max of 15 players online: Player1

 \[Fri, 14. May 2021 03:40:22 UTC INFO\] There are 3 of a max of 15 players online: Player1, Player2, Player3 

&amp;#x200B;

Is there a program out there that I can use to look at those lines of text, and convert them into a graph that can show for how many minutes or something of the sort in a single day a player was on for each day over the last 6 months all the while ignore every other line? And, if possible, how I can make the program do that?

Any and all help is appreciated!",Silly Question,1621018310
datascience,,In your experience what were the questions the interviewer asked that made you realise you shouldn't work at this company (or under the interviewer)? (Or do you have any questions to ask that help you decide whether the company/interviewer is good),1621017146
datascience,"Hi guys 
I just completed my graduation in commerce with good background in maths 
I have taught myself statistics distribution CLT glm linear model correlation and all 
I have some knowledge of R like I know how to apply stat topics in R 
Now I'm confused what to do 
How to start with projects 
Any more prerequisite other than I mentioned 
It'll be great if you can help 

Thanks in advance!!!",Starting with data science,1621013625
datascience,[removed],Can anyone please review my CV,1621008539
datascience,[removed],Review my CV please,1621008068
datascience,I really need a structure. I'm fumbling between the resources I could choose to prepare from. I'd really appreciate if anyone could exactly mention what schedule to follow because I'm honestly too indecisive.,How exactly to prepare for a data analyst interview?,1621007870
datascience,"A client produces 6-12 spreadsheets each quarter.

They have an excel guru put together a big document that visualizes the data. The document contains things like bar charts and descriptive statistics.

I would like to prepare a dashboard that is hosted online or could be shared (via email or cloud) as a standalone application.

The application should be able to accept the data sets as input (ideally, with a drag-and-drop graphical interface), COMBINE the data sets behind the scenes, and produce the necessary data viz.

Goal is to automate the data viz process, and the mechanics should be straightforward since the data sets have the same structure from year to year.

CHALLENGES:
• The data sets are company sensitive. I cannot host a web application on any old web server. I need some contractual guarantee the data isn’t being spied on. My understanding is that most companies have freedom to intercept online info. Maybe then I don’t host the application online at all?
• Client has restrictions on what kind of software they can install. I may be able to install PowerBI or Tableau on my system, but client may not be able.

I am aware that Tableau can easily visualize data from multiple sources. I.e. it would be simple for ME to organize the spreadsheets, visualize key metrics, and host it online. What I would like is a freestanding application where the CLIENT drags and drops the spreadsheets and an application spits out some visuals.

Thoughts?

Is this too advanced for PowerBI/Tableau? Do I need Shiny/Dash?","Can dashboard software (Tableau, PowerBI) help with this business case?",1621007617
datascience,"I work as a data analyst at my current job. I know I could get a data scientist position later this year as I have been spending lot of time on data science projects and professional development so far as data science has always been my goal.
However at the moment I have an opportunity to go and work with data engineers for 6 months in their team and I can’t decide if that would be a good career option if at the moment my aim is to become a machine learning engineer.

I come from an academic background and have a decent mathematical and statistical knowledge. I am proficient in python, sql but compared to software/data engineers my coding skills are poor. I know data engineers at my company are great at using the best practices to write maintainable and clean code, create pipelines and productionalize machine learning models. In my mind I see this as a great opportunity to learn more about data engineering however I am not sure if this is a good route if my future aspiration is to be a ml engineer.",Would working as a data engineer for 6 months help me to become better data scientist or ML engineer in the future?,1621006457
datascience,,There Will be a Shortage Of Data Science Jobs in the Next 5 Years?,1620999739
datascience,"Hoping to leverage the expertise of this community. My ultimate goal is to become a BI consultant—Here is my ‘order of operations’ for Business Intelligence development. 

1.) Tableau expertise (finishing my final cert. now)

2.) SQL

3.) Python 

Am I missing anything here? Any other areas I should focus on? If anyone has any relevant courses or certifications I should pursue in addition to what’s listed above, I’d love to hear it.  Thanks in advance!",How to become a Business Intelligence Professional,1620998454
datascience,[removed],These Hoodies and Sweatshirts Can Fool Surveillance Algorithms and Make You “Invisible”,1620996273
datascience,"Hello I have a background in academia and have experience with SAS and SPSS but from what I can tell these are seldom used outside of academia. The two most common in industry seem to be Python and R.

Which is more commonly used in industry (Python or R)?  

Which is the better language to focus on learning? 

Is there an advantage to learning both? 

Is there an advantage to continuing to develop me skills with SAS and SPSS?

Recommendations for resources is appreciated too. Thank you so much!",R or Python for an Academic Aiming to a First Data Science Job?,1620995629
datascience,[removed],Want to know about the Q/A on Azure Data Engineer [DP-203]?,1620995151
datascience,,Olive Oil Benefits,1620995131
datascience,"Check this blog post

https://medium.com/@maboelez/probability-and-statistics-for-data-science-34ca206dc7e2?sk=418508273cce8007743277b64b2e0906",What level of Probability and Statistics needed for Data Science,1620992728
datascience,,How does differencing leads to stationarity in time series ?,1620992390
datascience,,Probability and Statistics for Data Science,1620992388
datascience,"Just curious as to peoples' experience with training classification models on highly imbalanced data. You often hear about the imbalanced class problem and the various approaches to 'tackling' it — SMOTE, ADASYN etc — but in my experience working with highly imbalanced datasets, I find that these techniques rarely lead to any significant improvement in model performance, and most of the time an out-of-the-box XGBoost or LGBM model will perform just as well.

Perhaps this is just because I basically always use GLMs and tree-based methods, but in my experience the vast majority of models will do just fine on highly imbalanced data. Does anyone else find that to be the case too?

For context, I'm at a tech company and most of the problems we try to model have some form of extreme class imbalance (e.g. we might have X million users in our training set, with a \~thousand users in the positive class).",DAE find that the 'Imbalanced Class Problem' is rarely an actual problem?,1620989571
datascience,,Efficient SQL on Pandas using DuckDB,1620988834
datascience,[removed],"Hey data folks, we're hiring!",1620986688
datascience,,Efficient SQL on Pandas with DuckDB,1620986602
datascience,"Check this blog post of how we modified the face recognition approach to calculate face similarity between children and their parents.  


And, no we didn't just use cosine similarity over output from the last activation layer.",Adaptation of face recognition algorithm to face similarity between children and their parents,1620986557
datascience,"\-Also referring to - [https://www.reddit.com/r/datascience/comments/h8bz3b/anyone\_working\_in\_conservation\_wildlife/](https://www.reddit.com/r/datascience/comments/h8bz3b/anyone_working_in_conservation_wildlife/)

Anyone working in nature conservation (wildlife, deforestation, ..) AND also working on the field would like to elaborate how much is beneficial to have a background in data-science ?   


Do you use DS frequently, or manage team making use of DS ?  
How much is valuable for engaging in outdoor activities and negotiate opportunities to go on the field for part of the job ?  
What kind of activities do you do ?

\-   

Possibly, I'd like to hear about opportunities of fieldwork in the EU - and possibly, if only volunteering pops up, at least volunteering activities offering full cover of costs and relocation.  


My situation is that I'd like to gain a relevant background for PhD making use of tech (e.g. ML) and in perspective aim for jobs where I can live outdoor part of the time. In order to apply for a PhD, I need to get a MSc first (at least in the EU), and due to my background it may be easier to get a MSc in a tech domain rather than a knowledge-related domain (e.g. biology / natural science / ethology, .., that would require prior related academic background in these disciplines).  


I'd like to hear from other experiences to think about appropriate expectations and tips to consider - in perspective, I don't want to stay 130% of my time in front of a computer, while I find very motivating the possibility to match direct observations and outdoor activities with the part for processing.   


In perspectives, I think tech will open up for new opportunities also in this field, and again I wonder how a tech background would be considered and leveraged VS knowledge domain backgrounds or direct on-field experience.",On-the field jobs with DataScience - wildlife / nature conservation ?,1620978888
datascience,"I've put my train and test data into the scaler, and decided to plot it to just see what it looks like. That's what happened: [https://imgur.com/FV0TLsT](https://imgur.com/FV0TLsT) (blue is train, orange is test). Is this normal? Original data is continuous timeseries.

If this isn't normal - how do I fix it? 

If it is - why is so, shouldn't that affect my results? In my understanding, the model will use this train data to predict test data, and since it's all scaled like this, those predictions are going to be off by a long shot.

The code looks like this, nothing fancy (both X and Y are independent since it's a timeseries, and represent location in 2D space):

    from sklearn.preprocessing import StandardScaler
    
    scaler = StandardScaler()
    scaler = scaler.fit(train[['x', 'y']])
    
    train[['x', 'y']] = scaler.transform(train[['x', 'y']])
    test[['x', 'y']] = scaler.transform(test[['x', 'y']])
    
    plt.plot(train.x)
    plt.plot(test.x)

Hopefully it's not a stackoverflow kinda question. I tried googling similar cases, but couldn't find anything - maybe just couldn't figure out the right search query.",Why does scaled test data from Scikit-learn's StandardScaler look so different from scaled test data?,1620974217
datascience,"Hey everybody,

Please please please fill out my survey so I can graduate!

Link to the [SURVEY](https://erasmusuniversity.eu.qualtrics.com/jfe/form/SV_a5x9eEFWUtcBS98) &lt;--

I’m doing my master's at Erasmus University Rotterdam. 
To be able to graduate I’m currently trying to collect data from people who work with or study predictive analytics, machine learning, or something connected to the topic.
My research is about underlying biases in algorithms that discriminate against minority groups. 

There are many articles concerning the issue I will leave them here if you’d like to read them:

- [Reuters - Amazon scraps secret AI recruiting tool that showed bias against women](https://www.reuters.com/article/us-amazon-com-jobs-automation-insight-idUSKCN1MK08G)
- [Healthaffairs - Discrimination By Artificial Intelligence In A Commercial Electronic Health Record—A Case Study](https://www.healthaffairs.org/do/10.1377/hblog20200128.626576/full/)
- [Reuters - U.S. government study finds racial bias in facial recognition tools](https://www.reuters.com/article/us-usa-crime-face-idUSKBN1YN2V1)

I am so close to acquiring the required amount of responses so each response is greatly appreciated! :)",Looking for a little help with my survey,1620973888
datascience,[removed],Book related to stock market analysis using Data Science tools,1620972454
datascience,"I'm working as a market research professional from last three years and i want to change my career to data science for better future opportunities.

How can i start. From learning to getting a job.

Please someone help.",Career Change Advice,1620969596
datascience,"Hello! I hope everyone’s day is going well. I am currently a data science student pursuing a bachelors of science and concentrating in computer science. 

I worry a lot about my success in this field, for some background, I was never quite good at mathematics and I never even knew what coding was until I took a class at my university and thought it was super cool and interesting. I am also a girl in a male dominated major and everyone just seems so impeccably smart. I sometimes feel like I’m not smart enough even though I’ve held a 3.2 gpa. I try really hard and try to study a lot but sometimes I worry that I won’t be smart enough to be successful on this path. 

I’m really interested and wanting to continue with data science but I constantly feel like I am always worried about not knowing enough. I worry that I don’t know enough programming languages, or that my statistic background isn’t as strong as companies / it should be, and the list goes on and on. 

I’m also really intrigued by data architecture and engineering especially building data pipelines etc. I know that I have a lot to learn and I have to be okay with constantly learning for the rest of my life. However, I feel like my fear of not knowing enough or being prepared is almost hurting me and driving me crazy. I can’t stop thinking about it!! 

If you have any tips on what helped you as a student and what helps you know I’d appreciate it. 

Also, if you have tips on some books that are related to data science / informational then also please feel free to recommend them :) thanks!",Currently a Data Science student but need advice,1620965195
datascience,[removed],Is a university grad certificate in data science worth much?,1620959702
datascience,"10 years later. 25 years later.

Been hearing that Data Science is a volatile career and might end tomorrow or might end 100 years later.

Confused.",Can you comment on the job security of Data Science jobs?,1620956734
datascience,"Currently I’m in my third year of my bachelor data science. I’m planning to graduate next year after I have done my graduation project. There is the possibility to do this at a company, and I so happen to find an application for an internship data science at a profesional football (soccer) club, with the possibility of doing a graduation project there. Since I’m unsure whether they would provide me with a project, and the application is rather vague of what the intern would exactly be doing, I’d like to go in as prepared as possible and have some ideas of my own.

I also have no concrete idea of what the data I might be working with consists of. However, the application tells me that, among other things, I would be supporting the monitoring and collecting of data at training and matches, as well as conduct mental and fysical tests on the players. I thus assume that the data will consist of for example each pass, shot and foul of a match or training, and health data to monitor a player’s fitness.

One RQ I came up with already is along the lines of: ‘What is the possibility of a player getting injured in the next match?’. While I think this is an important aspect of the game, I’d also like some ideas where the focus lies on the more tactical part of the game, like finding the best pass or position to shoot for example. I’m unsure however how to formule such a RQ, and to be able to give a concrete answer to that. 

Thus, my question, if anyone has an idea for a possible research question for a graduation project on football data science, a paper that I should read, or any other tips, I’d love to hear them. Thank you.",Football (soccer) data science research question,1620946736
datascience,"I don’t want to say much more than that but I was at an online conference a few days ago, and in the chat I said I was totally stoked to be thinking about data analytics all day, and they blocked me from the chat because they thought I was sarcastic.

I just love me some data is all.  So I reposted saying that I meant it, and then the organiser thanked me.

I am just too hard core. Data data data.  Nom nom nom.",I got blocked from an online data conference for loving data too much,1620943509
