subreddit,selftext,title,created_utc
datascience,"Hey everyone! Hoping to get some thoughts on a new position I was just offered. I received my BA in pure Mathematics and am halfway through an MSc. in Data Science at a university in the US with a relatively new program (~5 years old). I’m just finishing an internship with one of the largest software companies in the world where I worked with a title of data analyst. The company decided not to keep me on afterwards, which is fine, but a bit disappointing. 

I applied to a position somewhat local to me at a hospital as a data analyst and was just offered a job! To be honest, I’m pretty burnt out with school and ready to go part time with that and work while building skills. The hospital is starting a brand new data analytics team which it has never had before and expanding their staff from two data analysts who worked under a separate department, to 9! I have been selected to be part of this team. I’m wondering if this is a solid move and to get some feedback on how it might be working as an analyst at a hospital like this? I know they have major ambitions for this team and what they want us to do. 

I was also hoping to get some feedback on the salary they’re offering me, which is $58k US. I know this isn’t what I’d make at a much larger company or even larger hospital but for a pretty rural healthcare system and a new team, does this sound reasonable? I’m honestly very excited about this and about taking some time to work and do school on the side so I’m stoked nonetheless. Thanks!",New job offer thoughts..,1620855710
datascience,[removed],Model evaluation with multiclass.roc and Matthew Correlation Coefficient,1620853495
datascience,"Hey everyone,

I'm far enough in my DataCamp class that I want to start my first projects. All the classes were in the built in shell in my browser but when I start working my first projects I want to get used on doing it on Linux.

I'm a Linux nooby and just dabbled into it a few times. Do you have any recommendations? Certain tools/ SW that I should look into?","Trying to make a switch to Linux for Data Science, what is your experience?",1620852214
datascience,"Hello all!

Let me start by saying I've been relentlessly Googling for the past few days to find a good answer to this question and have found related, albeit tangential solutions.

Here's my question: I have a large public health dataset (~ 500k rows) that I'm analyzing in R studio and have found through eda that an outcome variable that I'm interested in regressing on a handful of predictors is missing roughly 40% of the data. My first inclination was to use complete cases, but given that the question was related to mental health, a potentially sensitive subject, I suspected that there would be a systematic response bias. So I created some plots to investigate and sure enough, the percentage of missing data for this variable seems to vary systematically across levels of age, sex, and income suggesting that individuals who are more affluent, male, Caucasian, etc. are less likely to respond.

So...given this information, how can I replace these missing data? For instance, if I model the missing data using the demographic variables (age, sex, income) I mentioned (e.g., train a regression model on the complete cases and use it to predict the missing data) would I then be double dipping if I include those same predictors in a subsequent analysis with the updated data set?

I apologize if this question has been covered elsewhere or if I'm overlooking a simple solution and I appreciate your patience and feedback.  

Hopefully I've explained this clearly, but feel free to let me know if I haven't or if you need more info.

Cheers!

-J",How do you impute missing data that is clearly a result of selection bias?,1620851732
datascience,"Acne

https://apps.apple.com/us/app/sri-acne/id1559085660

Hey all! We are all trying to win this fight against acne, so right now our team is trying to collect as much data as possible so we can come up with the best service and products for everyone. 

For those with Iphone 10’s and higher, would you all be willing to go through this app which will take just 3 min, to help us win this war? 

Message me directly if you have any questions!

Thank you!",Help! Acne data pics needed!!,1620851514
datascience,[removed],We made a Data Science Job Hunting guide to help aspiring data scientists get a job. We offer it for free during this week.,1620849635
datascience,"May sound stupid but basically I have an engineering background and work in energy. I'm looking to potentially switch and am still at a point in my career where I'd be looking for a junior role, but am not proficient in coding. Luckily my company sponsor me for a data science course online but that'll take a year to complete and even then its not all about coding but more just Data Science 101. 

So should I wait to finish that or do you guys reckon landing a role is possible if you show enough passion/potential and show you can pick it up in the role. 

Thanks for any advice!",If I cant code can I still land a data science/data analyst role?,1620849497
