subreddit,selftext,title,created_utc
datascience,"Kind of an abnormal post around here I’d guess, but I’m currently a second year masters student in Strength and Conditioning with a huge interest in sports science and working with data. Early on I’ve made the mistake of collecting too much data from my athletes and getting lost in it.

Now I’m super passionate about learning all I can about the art of drawing meaning from data.

What are either some basic skills, base knowledge areas (statistics, math etc) and resource recommendations for really diving deep into data science?

For context I took basic stats in my undergrad, and am taking graduate statistics now (which is more aimed at research, whereas I’m an applied practitioner). I’m currently learning python and the majority of the data I’ll see will be performance KPI’s, and GPS workloads for field sport athletes. So lots of time series data and tracking things over time to look for significant changes.

Things I’ve done in excel are rolling standard deviations/averages, exponentially weighed moving averages, a bit of smallest worthwhile change and CV.

I’m definitely a noob relative to you folks, but any guidance on pursuing this new passion of mine is much appreciated!

P.s. huge goal is to someday incorporate machine learning to give training/nutrition recommendations based on past patterns and responses (lofty goal I know haha) but very determined about this!","Sports scientist/data scientist education must knows, resources and skills.",1603939431
datascience,"Hi guys! So I was studying Economics with Stats in college for a year then changed to Finance. I will definitely graduate with a Finance degree. My original goal was to become a finance analyst, but now I want to do some thing with data science. I took a few IT and Data Science courses, but the path is still relatively hazy for me, considering I don't have Stems background. Any advices on how to reach that goal?

Also I think it would be nice if I can know more about opportunities for Summer interns related to finance. Should be around OH - PA.",Finances to Data Science,1603938333
datascience,"Looking to collect thoughts on the pros/cons of Python and R. More specifically, in the following context:
    1. Data management (merging, cleaning, etc)
    2. GLMs / predictive modeling
    3. Graphing

I have some experience in using both. I find Python graphing to be more cumbersome than R. More experience using R for data management and experience building predictive models in both languages.

Trying to figure out where I should focus my time.",Python vs R,1603937212
datascience,"I am not a statistician by training. At work, however, I am attempting to tease out the effects of a 'treatment'. So rather than simply performing some statistical tests with the treatment group vis-a-vis the entire population, I decided to use propensity score matching to create a similar 'control' group to match my 'treatment' group. With this subset (treatment + control sample via propensity scores), I am now performing simple statistical tests and regressions.   

In brief, I'm quite pleased with the results. The relative simplicity of the methods makes interpretation and communication easier for someone like me. But I'm also a little suspicious (and worried) that I don't see this technique used elsewhere. What are some of the limitations of this approach? Which techniques might be better?",Propensity Score Matching + Basic Statistical Inference?,1603936581
datascience,[removed],Is there alternatives for Apache Spark ?,1603935295
datascience,[removed],memory helper when programming,1603934911
datascience,[removed],Alternative libraries for Apache Spark,1603934621
datascience,"I have a python kernel for a project I'm doing for my undergrad senior research. I was wondering if anyone would be willing to look at it and give me some tips and advice of where I could go with it? Can comment or send me message. 

&amp;#x200B;

(i'm a math major/data analyst self-teaching datascience)",Looking for someone to help me with kernel?,1603933807
datascience,"Hi all. I'm looking for a data mentor who can occasionally receive guidance from.

I know the job market isn't great right now but I'm trying to figure out how I can better prepare myself for interviews and the role. Right now I have a small portfolio of projects, and I'm kind of fluent with most of the basic data analytics skills and knowledge.

Let me know!",Looking for data analytics mentor,1603931233
datascience,"Do most of you prefer keras? Or does it depend on the data/industry? 

The Saint Mary University AI certificate uses Keras but I want to make sure the cert is legit.  https://onlineprograms.smumn.edu/artificial-intelligence-certificate",Is Keras the way to go?,1603929945
datascience,[removed],Coworkers conversations dataset,1603927727
datascience,"Hi,

Simple and straightforward, any fun ideas for a data science project with R? A project that would demonstrate my R and visualization skills, and show that I can interpret and analyze data.",Any ideas for a Data Science project with R?,1603922990
datascience,"I got a degree in Statistics, not too long ago and my ultimate goal is to go into Biostatistics. I wasn't able to do any internships during my undergrad in college because I was trying to obtain a minor in Biology and I didn't want to stay too long in undergrad. I am very concerned about not having the work experience because it is very critical to have work experience especially during this era. Should I get a certificate in Data Science or a certificate in specific languages such as SAS, Python, etc. and try to get a job afterwards?

Or should I just apply for a Masters in Biostatistics and find internships to do while I'm obtaining my Masters?",What should my next steps be in order to obtain work experience/internship?,1603922117
datascience,"High schooler here. I started learning data science because it's a popular field and will be very useful in the future - will help me get a high paying job etc., . So anyway I found this post on quora on how to get started and this madlad William Chen told exactly what to do- learn some maths then learn some programming - . So I did a couple of lessons of python from various sites. Understood the basic syntax etc.,but I find it very difficult to push myself to learn it.",Really want to learn data science but everytime I try to I get bored. It's because I dont know why I am learning it. I dont know where i will use this skill. Why did you start learning data science? What motivated you?,1603918763
datascience,Is there any great RSS feed for the state-of-the-art AI/ML research and papers?,RSS feed for AI/ML Research?,1603918704
datascience,"Hi all! 

I'm a third year university student majoring in economic who is looking to get into data analytics role after graduation.

I have an option to combine my econ major with statistics.

I was wondering how valuable it is to combine major in econ/stat compare to graduate straight from economics major and adding a certificate in data analytics from a local college.

I'm torn between the two because I would have to spend fairly similar additional time and money on doing both combine major or a certificate.

&amp;#x200B;

So my question is

If it cost same money and time, what would be a better option for landing a first data analytics job?

University degree in economics and statistics combine major

vs University degree in economics + data analytics (associate certificate) from a local college

&amp;#x200B;

Thank you!",Major Decision ECON (+certificate from college) VS ECON/STAT,1603918567
datascience,"I remember I was talking with a co-worker about the differences between working with column-stored data (like data stored in parquet) or row stored (eg avro.) We briefly discussed how when writing spark sql, using where might be inefficient because our data was stored column-wise vs. row-wise. 

I've began to work with spark sql a lot more and wanted to see if there were any resources on how to write code to better interface with both types of datasets.",Looking for tips and tricks for working with row-stored data vs. column-store data,1603917290
datascience,"At my old job, it seemed like every few weeks I’d have a new project with a new dataset. The hardest part of my job was understanding the data not completing the project. I created a tool to solve this and I’m hoping to find beta users to give it a spin! It’s one location to store meta-data, common questions, and analysis associated with a data table. It requires manual uploads in the current state so it’s ideal for smaller teams.

If anyone is interested in trying it please let me know. :)",I made a modern data catalog tool as an alternative for anyone using a word document or excel sheet as a data dictionary. I’m curious if anyone would like to try it out!,1603917086
datascience,"My industry (a sub field of marketing analytics) has a very complicated data structure tracking disparate time points, finding proxies for the real information needed for analysis, and jumping through strict regulatory loops. only someone with extreme domain knowledge would understand what something is measuring, why, and how that data is stored and accessed. I mean, the data warehouse my team uses  probably has over 50 databases with hundreds of tables each. I estimate it will be a year until I’m confidant I can explain what data we use why and how to use it. What are some industries with even higher or maybe even lower learning curves for working with their data?",How long did it take for you to feel comfortable working with your industries data as well as querying and managing your data warehouse?,1603917006
datascience,,Julia REPL - Part 1: Introduction,1603914496
datascience,,The Zynga Analytics Platform in 2020,1603914399
datascience,"Have you done anything highly technical, or have a need for some graduate level math? Complex Analysis, functional analysis, etc? If so, what and why?",Mathematicians now data scientists...,1603913554
datascience,"Flookup is a suite of functions for data cleaning inside Google Sheets by using advanced fuzzy matching techniques. It can be used to:

* Search for and match data regardless of whether it contains typos.
* Highlight and remove duplicates duplicates even if the data has spelling variations.
* Calculate the percentage similarity between strings.
* Extract unique values from any column based on percentage similarity.

Because of its versatility, Flookup can be instructed to return the best match, the next best match, etc. until the minimum percentage similarity is reached. This feature avoids weaknesses other fuzzy matching algorithms have because it Keeps the power in your hands, and **you are the best judge of which data matches and which does not**.

Another great feature Flookup has is that it can combine lookup values. This is particularly helpful when your data has too many similar strings and you want to add extra information to your lookup value to increase the specificity of your query.

Finally, Flookup is good for more than just fuzzy matching; it is the improved replacement for VLOOKUP and INDEX/MATCH that you have been looking for.

All are welcome to try Flookup for free today; no risks or strings attached. You can find out more by heading to [https://www.getflookup.com](https://www.getflookup.com/).

**Flookup around the web:** [Product Hunt](https://www.producthunt.com/posts/flookup) and [LinkedIn](https://www.linkedin.com/in/getflookup/)","Show Reddit: Flookup - Compare, merge, highlight and dedupe your datasets",1603913421
datascience,"Hey Data Scientists of Reddit,

I’m a 19 year old college sophomore who is highly considering a career in data science. I’m just looking for any general advice you’d give to someone interested in the field, and maybe someone can help me answer some questions.

- How do you like your job in general? 
- How much schooling did it take you? I’m in my second year of my BS and I want to know if it would be worth looking into grad school/master’s etc. Or should I just put that time &amp; energy into finding internships?? 
-I’m about a year into my undergrad, majoring in Psychology. I definitely want to switch to another major, but data science isn’t available at my university. Any suggestions on what major I should switch to?
-What programs should I learn to better prepare myself? I have some basic coding experience, and know how to use SPSS software, but if I need to know Python/Java in this career I’d love to get a head start on learning.
-Due to never having taken calculus, I am not extremely confident in my general math skills. I do, however, excel in statistics and find it very enjoyable. Would this be a bad career path for me if I’m unsure of my calculus skills, or could I overcome this? 


Thanks to all who answer, it is greatly appreciated - I am overwhelmed to say the least when it comes to finding out what career path I should choose!!",Path to Becoming a Data Scientist??,1603912014
datascience,"I wanted to understand the best way to transition into data science from academia.

A bit about me: Projects in my PhD did not have a lot of data analysis stuff and mostly paper and pen stuff with simulations on Mathematica. I do have some coding background and not a novice in that regard.

I have heard about the Insights Fellow program but given that they are charging 24K for that, I do not know whether that is the best approach. I am still in the penultimate year of my PhD and can polish my resume with data science courses and related things.

Any help would be appreciated.",Jumping into Data science from a Physics PhD,1603911663
datascience,"My friend Rikin ([https://www.linkedin.com/in/rikinmathur/](https://www.linkedin.com/in/rikinmathur/)) and I wrote a book about Data Science for young kids and adults. [https://theabcsofdatascience.com/](https://theabcsofdatascience.com/) . 

By actual Data Scientist, for Future Data Scientists. 

Part education, lots of satire. 

&gt;""- M is for Machine Learning. The most over used term in Data Science, since Artificial Intelligence."" 

This started off as a joke... and then friends were like we would buy that! So we decided to write it.

Love to hear what you think :) 

\- Funny? / Educational?",Data Science for Babies -- The ABCs of Data Science - https://theabcsofdatascience.com/,1603910852
datascience,Do you find data lakes easy to execute?,Data lakes,1603907282
datascience,"So I'm a newly minted Data Scientist/Predictive Analyst using R.  I did a 26 week course through Datacamp ([www.datacamp.com](https://www.datacamp.com) in case anyones wondering - not affiliated at all), and got my first set of problems to solve.  I learned a lot, to the point that I'm paralyzed on where to even start.

The problem being theyre trying to predict the future.  I work at a hospital and I was given a dataset of past surgical data since beginning of 2020 and want to predict future surgical data up to the end of 2020.  Initially I started a time series analysis using Rob Hyndman's books, but the more I googled, I thought maybe it could turn into a regression problem with all the additional variables I was given, where we can pick what a day's volumes would be if we can predict a few other data points.  Finally, as I searched through this sub, some folks mention KNN (which I need to read up on!).

I'm at the point where I feel like there's so many ways to go about solving this - where do I even start?

My question:  How do you determine where to start?  Do you just throw the kitchen sink at it and see which method may be best to solve your solution.  What distinguishes a problem from being a regression vs a clustering problem vs a time series analysis vs a classification tree or any other way of going about solving a problem.",How do you decide where to start to solve a problem?,1603904389
datascience,"I’m currently a sophomore statistics Major and double minoring in economics and statistics. I had chosen to choose minor in economics because it is one of my favorite subjects, but also has an intersection with statistics, with interesting topics such as econometrics. Now my goal isn’t to get into economics heavily, but thought it would be a good supplement. I chose to minor in computer science, thinking it would give me some sort of added value when applying for data science positions later on. However, throughout this semester and computer science coursework I’m not enjoying it as much, and feel as though the classes I will be taking aren’t going to be an added benefit if I become a data scientist. I know how to code, and code well enough where I can implement data science/cleaning tools and run statistical simulations in python with numpy/pandas etc. however the things I’m learning right now, (creating a compiler, low level programming) aren’t things I would need in the future, as opposed to the rigorous statistical + quantitative knowledge I’m taking from my math classes such as probability, calculus 3, Bayesian statistics, linear algebra etc. I’m thinking about dropping the minor solely based on the fact that at the end of the day, the courses I would have taken I feel like wouldn’t add as much benefit/credibility if I was applying for data scientist roles. The only real reason I’ve thought about keeping the cs minor is because I also have a interest in machine learning/deep learning, so if I ever want to go that route I’ll need a software background. Ik you all can’t explicitly say what I should do but what are your thoughts on this matter?",Is the computer science minor worth it?,1603902091
datascience,"# What I want and why

I want:

* An intuitive way to think in matrices and vectors
* To manipulate regression arguments vectors through loops of layered operations
* To generate beautiful custom data tables for stakeholders presentation without resorting to others’ table programs
* Support within Stata's ""platform"" (others should be able to work on it) 
* Extensibility with object-oriented programming, but not OOP being the exclusive way to think about arrays and programs
* To build and share packages 

# What I already have

I am:

* Paid to wrangle and analyze data in Stata, R and Python (in decreasing order)
* Well-versed in control flows
* All too locked into the imperative language mindset
* Frustrated with Stata’s array language, Mata
* Confused with various implementations of arrays across languages

# Where do I go and how do I get there?

Looking at my words up here, it sounds like Python and `numpy` might fit the bill. Do you agree? If not, what do you recommend instead? If so, what should I look into to go beyond imperative programming?

Thanks!",How do you develop an array programming mindset?,1603899771
datascience,[removed],Disrupting the Energy sector with Open Innovation (for social good),1603898321
datascience,I have 10 rows with a binominal attribute male/female. How do I get the percentage of females from this?,Noob question for rapidminer,1603898148
datascience,"Dear all, 

I conducted an analysis of qualitative data, which captures the change process of an organization. I have different classes of events and those events are interdependent. That means without event A, event B would not take place. Since there are a lot of events, I would like to find a way to visualize these events and interdependencies, similarly to a dependency diagram. 

However, I would at the same time like to store data for each of the events (interview excerpts that provide first hand information about the event). It would be amazing to create such a dependency diagram and if I click on an event, the program provides me the additional information that I stored about the event. 

So, what I am basically looking for is a tool that is somehow a mix between a Gantt chart maker and a tool that makes dependency graphs. Do you know something that could help me?",Looking for a suitable software for data visualization,1603894220
datascience,,Can I Grade Loans Better Than LendingClub?,1603893224
datascience,,Introduction to My Computer Vision Project: ArtLine,1603892308
datascience,,What skill Required to become a Data Scientist,1603886045
datascience,[removed],Blog on Data Cleaning,1603885128
datascience,,Due Date Tracker | Conditional Formatting Using Formula,1603883576
datascience,"I'm currently doing my graduation assignment. For this I want to find out what variables can indicate the robustness of a coalition in our house of representatives (NL). 

I had in mind that a dcGAN can be used for this. But not in a normal way. Normaly dcGAN's are used with CNN and it is used to create fake generated images of whatever thing you want to create and have data of. But instead of using the fake generated images I want to find the features it uses to most to create these fake images. 

  
I understand that I don't have to use a CNN as the backbone of my dcGAN but i'm struggling to find what other models I can use and how I can extract these features which are found somewhere in the proces of generating the fakes. 

If people got any tips, links or other helpfull comments I would be very happy :)",Using a GAN for feature selection on data that isn't,1603881535
datascience,,Top 10 Projects for Machine Learning and Data Science,1603877015
datascience,,Top 10 Free Books for Machine Learning and Data Science,1603876939
datascience," I'm looking for an eCommerce dataset, which works with implict data and should be suitable for a neuronal network. This dataset should be equivalent to Spotify Million Playlist Dataset Challenge.    
Instead of the tracks, there should be the order with different articles. The dataset that I'm looking for should be: 

     ""order"": [
            {
                ""orderid"": ""01"", 
                ""order_at"": 1493424000, 
                ""num_articels"": 5,
                ""price"": 120.85 
                ""articels"": [
                    {
                        ""pos"": 0, 
                        ""articel_name"": ""Apple"", 
                        ""articel_id"": ""articel1545"", 
                        ""price"": 12.45, 
    		    ""amount"": 2, 
                    }, 
                    {
                        ""pos"": 0, 
                        ""articel_name"": ""Banana"", 
                        ""articel_id"": ""articel1585"", 
                        ""price"": 5.45, 
    		    ""amount"": 1, 
                    }, 
                   ...
               }

Does someone know a dataset that is similar to what I'm looking for? Thanks for suggestions, ideas and answers!  It doesn't matter if json, csv, ...",Looking for an eCommerce dataset,1603873727
datascience,[removed],Why the model is behaving like this?,1603872381
datascience,"Out of the hundreds of applications (and counting) that I’ve sent, only one company has set up an interview with me. The recruiter mentioned that I will be given a dataset and problem statement and asked to code an ML algorithm. I will be coding on my local machine and sharing my screen for this interview. To prepare, I’ve been reviewing my graduate machine learning course notes and homework and watching videos of mock interviews. Even if I think I know the material pretty well, I’m still pretty nervous. I’ve only been job hunting for a little over a month now, but I’d hate to go back to square one if I don’t pass this interview before at least getting another. My lack of a PhD and industry experience makes the job search hard enough. I’m not necessarily asking for advice but rather just venting. I would love to hear more about your experiences during the job search process.",Nervous about first data science coding interview tomorrow,1603871782
datascience,"Hi,

Over the course of the last few years I've grown a bit distant from my original joy of data and discover-ability.  I've found that as the time has passed by I'm less and less interested in advancing a career aimed primarily at increasing the bottom/top-line of whatever company I'm working on.

&amp;#x200B;

I've dabbled with the idea of branching out to NGO(s), primarily in the Civil Rights sector. The issue I am running into is simply finding a starting place.

&amp;#x200B;

I'm wondering if any fellow redditors work in a Data Science/adjacent role in NGOs and could share some insight on where to start?

&amp;#x200B;

Thanks for listening to my late night spiel.",Data &amp; NGO(s) Career - Any Advice/Resources on where to start?,1603868869
