subreddit,selftext,title,created_utc
datascience,"Currently have a chess dataset that gives me different info about ratings, moves, etc. When training my model, I have a weird thing happen where by dropping a column, my specificity goes from 50-&gt;80%, but the AUC drops to 67%, but then another where sens/spec is about 68% each, but the AUC is at 73%. Also, I have dummy variables for all my objects, but I'm not understanding how they help the RandomForest work? Lastly, of all the visualization packages for python, which do you prefer and why?

Please DM me if you're willing to look at my project!","What is the best python visualization package (in your opinion), and where can I find more information about machine learning algorithms (why sensitivity/specificity) change?",1604013285
datascience,"Hey guys, 

I am a fourth-year student at the University of Calgary studying business analytics and finance and I am very strongly considering doing a Masters in Data Science from a University here or potentially in the States. I wanted to know what you guys thought would be reputable programs for me to pursue and would me to work with ML, AI and predictive analytics after I graduate. I didn't know I wanted to data science until earlier this year and I find it intensely fun and engaging (bye - bye law school I guess). 

I have a good academic average of 3.9 GPA and I have a considerable amount of experience with R (I absolutely love R), SQL, Tableau, PowerBI, and RapidMiner. I am currently looking for a 12-month position in the analytics field in Calgary so hopefully, I will have some work experience in the field before I apply. I want to get more advanced knowledge of this field after I finish my undergrad and I am looking for what is considered the top programs in Canada or the States (dependent on the tuition). The two programs that really piqued my interest were the MDSAI program at Waterloo and UBC MDS (especially the computational linguistics one). I wanted to get input on which programs will be likely to admit me as I don't have a pure STEM background and which ones would be the best to equip me to work with Artificial Intelligence and Machine Learning technologies. 

Alternatively, I was thinking about delaying graduation a bit to take some advanced stats courses to better prepare me for the MDS program (Waterloo seems to have very strict requirements for entry).  The classes would relate to linear regression, stats in R, and statistical experimentation along with linear algebra and multivariable calculus. Is there potential to do an MS in Stats that would offer more lucrative opportunities if I choose to go this path?

Any input is appreciated!",Canadian Masters of Data Science Programs,1604008100
datascience,"Curious what languages are used most commonly by the DS workforce on the job. Personally, I use Stan most frequently but the community seems to be a little small.

[View Poll](https://www.reddit.com/poll/jkirqf)",What Probabilistic Programming language do you use (most if multiple)?,1604005610
datascience,"I know those are two different things but I was just wondering why don't I come across more posts about ARIMA , ETS. I am just entering into ML area at work so I don't have much experience.
Are forecasting models such as ARIMA less used in the industry or they are not good enough to be put in use?
Also, wondering if there's less demand in the market for people who use such modeling techniques.
Would love to read your thoughts on this",Why aren't time series forecasting methods as popular as traditional ML methods?,1604003959
datascience,"Does anyone here have any experience using Quicksight in an enterprise environment, and if so, were there any major drawbacks encountered?",Thoughts on Amazon quicksight?,1604003582
datascience,"What are some of the key metrics and product features common in B2B companies, that are different from B2C companies?",How is B2B Data Science different from B2C?,1604001550
datascience," 

I've recently started pursuing a masters program in Data Science while working part time for my already Data Science job (been working as a DS for 2.5 years now) and I'm seriously struggling to find the motivation to stick with it.

I mostly started because of pressure from my parents (my dad calling me at least once a week and asking when I will finally get a masters degree) and because I thought it would open some doors for working internationally.

It's two months into the program now, and with working part-time and then Uni in the evenings, it's draining my life energy. I would much rather spend some time applying myself creatively, taking dance and art classes (as far as the pandemic allows), but I do not have the time during most of the week and then on my days off I'm either supposed to study or I'm just too exhausted to get off the couch.

Everyone says that it's only a two year program and I should just stick it out, but honestly it's making me lose interest in both my job AND the degree. It's just so much sitting in front of a PC being productive in the eyes of capitalism and there's like a million things I would rather do. But yeah I'm having second thoughts if not having a masters will make my future career more difficult or whatever.

Does anyone have some advice or wants to share their experience from a similar situation?",I don't know if I can keep it up with my masters program.,1604001239
datascience,"Hi All, I'm fairly new to SQL and need to learn presto SQL specifically. I've been looking for a course entirely in Presto SQL or something as close as possible to Presto so that I can get some practical experience on writing queries.

Can anyone recommend some great Presto courses that are clear to follow that I can try? I tried 3 different udemy courses but they weren't hands-on where I can practice queries myself.

Or, if there aren't any good ones, what other form of SQL is the closest in syntax to Presto?",Any Presto SQL courses that are cheap / free?,1604000593
datascience,,How to Predict the Perfect Horror Movie through Data Science,1603999811
datascience," Hi guys I was finishing my data analyst course on dataquest and found out that my subscription ended, I had just one mission left and I refuse to pay the full monthly subscription for just, at most, one day of working on it. Thankfully I just discovered the referral program they have so if anyone is considering to purchase a dataquest sub use my link ([app.dataquest.io/referral-signup/x1vhmsak/](https://app.dataquest.io/referral-signup/x1vhmsak/)) so that you can get $15 off and also help me get my certification.",Help! Needing just one day to finish my dataquest course,1603999794
datascience,[removed],SKO Data Science &amp; AI Professional Certificate - Inviting Applicants for User Testing,1603999259
datascience,"Hello, was wondering what kind of chart this is?

[https://imgur.com/a/6Q6A2uB](https://imgur.com/a/6Q6A2uB)",Chart Type Question,1603996601
datascience,"I am having a second round interview with an insurance company for a ""big data""  internship position. This is my first interview ever for a big data role. The first round interview was a take home exam about generic data science stuff with Jupyter Notebook. However, the big data tools like Spark are a mystery to me.

The comapny collects massive amounts of data from vehicles and they work with distributed, parallel technologies like Hadoop, spark and Kafka to analyze the data. The interviewers will probably ask me how I would make a distributed framework to digest and analyze millions of rows of data. I only know basic stuff about Hadoop and AWS.

What are the typical questions that the employers ask for an entry level position like this in big data? How can I better prepare myself? What should I review?",How yo get ready for a 'big data' engineering internship interview?,1603995011
datascience,"Hey everyone,  I'm currently trying for a junior position (analyst/scientist) I've been having problems starting personal projects, I see a lot of people saying I should do something that never has been done before or that I should be advertising my projects. But I'm having real problems finding original stuff to do or add on top of, is doing projects on top of solved datasets really frowned upon? Is a yolo implementation and experimentation not interesting enough? What should I be aiming for?",Problems with personal projects,1603994358
datascience,"I am trying to switch my career from Mechanical Engineering to Data Science. Doing few free online courses. They touch on the statistical subject but don’t go into depth. So, can someone please suggest a good book?",Data Science with Python book recommendations,1603994349
datascience,"Hello everyone, I'm trying to find a good idea for a project that combines both data science with business intelligence or business analytics to present to my professor for my thesis. Any suggestions are helpful, thank you",Project ideas that combines data science with Business Intelligence or Business Analytics for my thesis,1603992893
datascience,"Hi guys I was finishing my data analyst course on dataquest and found out that my subscription ended, I had just one mission left and I refuse to pay the full monthly subscription for just, at most, one day of working on it. Thankfully I just discovered the referral program they have so if anyone is considering to purchase a dataquest sub use my link ([app.dataquest.io/referral-signup/x1vhmsak/](https://app.dataquest.io/referral-signup/x1vhmsak/)) so that you can get $15 off and also help me get my certification.",Help! Needing just one day to finish my dataquest course,1603991051
datascience,,What Is Data Science? Future Scope &amp; Career.,1603990416
datascience,,What skill Required to become a Data Scientist,1603990348
datascience,,"I asked AI expert friends of mine working at DeepMind, MILA, OpenAI and more their advice to those just starting out in AI or thinking of pursuing a career in the field. Thoughts? What would you add?",1603990010
datascience,"I have a degree in economics and politics, but for the last several years have worked as a live sound engineer and in event production in general.

I am working towards a career in data science. I have been self studying maths and programming since March, and want to get a job as a junior analyst as soon as possible. I'm just finishing up a course on SQL Server, and will have my  MTA Database Fundamentals 98-364 in a few weeks. The plan then is to take some more short courses on Tableau and Excel and try get a job early next year.

If that all works out, I will do an MSc in Data Science or something similar 18 months later and past that point would be willing to emigrate to anywhere in the world in order to get work.

This is my loose plan for how to advance my career. How realistic is it? Would you recommend any changes? I am 35 and have been self-employed for most of my adult life, so I'm definitely at a disadvantage and need to make the right choices now in order to be taken seriously as a candidate.

Any advice would be very welcome.",How realistic is my goal? Changing career at 35,1603987318
datascience,"Hi guys. I’ll keep it short.

I keep hearing about how stale the job market is getting, and with COVID getting worse, we can only imagine how much the job market will be affected. 

I graduated in May with BS degrees in both Electrical Engineering and CS. I currently work as a Jr. Machine Learning Engineer at a decent sized company in the midwest. Within the next year, I wanna leave for grad school to pursue a Masters (I will be applying in the coming weeks). I already have graduate credits that will allow me to get my MS in a year. I want to do this to be Data Scientist, or work in the DS field. 

Does my plan sound legitimate? For those working as Data Scientists, how bad has the outlook gotten for an  aspiring Data Scientist like myself? Thanks for any outlook!",Is it worth considering the Job Market,1603986623
datascience,,"Defining ""Data Intuition""",1603986068
datascience,"Dear fellow redditors,

I have a bachelor degree in Finance and management. I'm planning to apply for a master Programme in AI with electives in :
-AI and robotics
-AI and life sciences 
-Reasoning and knowledge 
I have no knowledge of machine learning and no experience with programming. I barely know the basics of python/c++. Luckily the programme has intensive courses for students with non-tech backgrounds to catch up. However, I fear that getting a 2 year degree in an another field is gonna be worthless or hinder my career opportunities as many employers (specifically in tech) would probably require both bachelor's and masters be in CS/IT....
I plan to work as financial analyst /data analyst maybe even developper although that might require years of experience in many languages.

I need your honest opinion on this should I enroll in this programme or should I apply for CS bachelor?",Is getting masters in AI worthless without a bachelor of CS/IT (employment perspective)?,1603984247
datascience,"Hi all,

Sorry if this question has been asked before but I'm looking for a list of the top universities offering a data science/analytics type program that is also rolling admission. 

I know that the general consensus here is that you don't need a masters to succeed in this field and for the most part, I would agree with you. It's just that with my current background and generally new experience in the data world, I'm not getting the looks I want from certain companies. 

So far, I've found that the Columbia Applied Analytics program has rolling admission. I'm looking to start school in Fall 2021 with a plan on taking the GRE in the early March timeframe. 

Thanks for your help in advance!",Top Online Data Science/Analytics Masters Programs w/ Rolling Admission,1603984062
datascience,"Good morning! I am working with very large CVS files and I was wondering if there is a trend within Data Science to try to use another better format. 

That it establishes what type of data is each column (numeric, str, date...), that it natively comes compressed and that it is fast to read and write. Does anybody know anything about that? 

It seems to me that the flat text CSV is too limited as to be the standard, I do not find it very logical","CSV files are not good for huge datasets, is there any better standard?",1603983387
datascience,[removed],Looking for some interested Data Analysts to check out/review a prototype,1603980380
datascience,"I standardized my dataset for a project using the StandardScaler method. All my variance values are one and my graphs are correct but the mean is not equal to zero. Instead, I am getting these values for each of the columns, anybody can explain why and what I can do to change it? 

  

**MEAN AFTER STANDARDIZING**

Distance -1.951203e-11

MaxSpeed 3.414646e-11

AvgSpeed -9.756090e-12

AvgMovingSpeed -4.878050e-11

FuelEconomy -3.146535e-16

TotalTime 4.878048e-12

MovingTime 3.902437e-11

Please help me out :'(",Mean is not 0 even after standardization,1603979215
datascience,I'm working on a research project and would like to know how one would go about quantifying the importance of events like these.,How would you quantify the importance of events like orientation and graduation to a student/their family?,1603978743
datascience,"I know a lot of people like to use notebooks because they let you execute code interactively in 'chunks', which is nice when you don't want your session aborted after waiting 3 hours for that model to run. However, the whole notebook setup isn't very conducive to actually building more complex things (like a library) with a structured directory.

In PyCharm, if you go to settings, there is an '[Execute Selection in Console](https://www.jetbrains.com/help/pycharm/using-consoles.html#load-code)' keybinding which lets you highlight the code you want to run, and execute it. The same option exists in [VScode](https://stackoverflow.com/questions/38952053/how-to-run-the-select-code-in-vscode). This allows you to run your code interactively and be \_very\_ flexible in your development, as well as having access to a fully fledged IDE.

I thought I would post this here because a lot of the people I talked to who used notebooks didn't know this functionality exists in other IDEs, and were happy to switch knowing it does exist.

If you use R, you probably already know this exists in Rstudio ;)",PSA for anyone who uses Notebooks and wants to transition to Pycharm/VSCode.,1603977948
datascience,"Yo, fuck that. 

I spent over an hour filling out a job application form with work experience, doing their little stats quizzes and math quizzes, to receive the e-mail, ""we found a candidate with better suited EXPERIENCE""

fuck me right? 

Key word here: experience. So, all of these quizzes and filling in fuckin boxes that my CV already explains, is unnecessary. After all, they found a candidate with a CV that explains this. 

Man, fuckin... just... can I just not submit my CV? By all means, boot me out if I suck, but what is the fuckin point of going the extra length if you're going to cut a candidate short?

Is this normal for DS jobs? 

So sick of this bullshit.

Stay safe everyone.","Stop giving extra tests, filling out lengthy applications, just to throw 80% of it in the trash when the optimal candidate arises [RANT]",1603977515
datascience,"The pay is roughly the same, and there are many more jobs in data engineering.",Why isn't data engineering a more popular field?,1603975914
datascience,"Hello, Im a student and i have spend the last few months learning various data science skills, mainly in python for EDA, data cleaning, and machine learning. I never got around to it, but I’ve heard SQL is a really good tool for data cleaning and data preparation as well, and I’m looking to learn it to add it to my skill set. My question is, how does data cleaning in SQL differ from in python? Before, I would clean the dataset, do EDA,  and prepare it for modeling in one python notebook itself, and use pandas and numpy for this, but once I learn SQL will it allow me to clean a dataset quicker and prepare it so when I pull it into my python notebook I can get straight to EDA and ML modeling? Wondering if this is something which will improve the efficiency of my workflow.",SQL vs Python data cleaning workflow?,1603974770
datascience,,Data Science Course,1603972750
datascience,,OSIRIS-REx and the Future of Asteroid Mining,1603972294
datascience,,I built an open-source site for Easy Use Python pandas recipes,1603969086
datascience,"Hey I am new here and have a little question or need some help.

I am just finishing my studies and next semester I have to write my bachelor thesis. I would like to write it in the field of Data Science. 

Of course I also have experience in Data Science, Analysis and Machine Learning. 

But somehow I don't know what good topics for a thesis would be. Can you help me there? What kind of topic can you suggest to me?",Thesis Topic,1603968965
datascience,,The Most Popular Databases - 2006/2020,1603964284
datascience,,11 Best Data Science Books (&amp; Analytics) to be read in 2020,1603961067
datascience,,A Not-So-Secret Ballot - A Bayesian perspective on how differential privacy could maintain voters anonymity,1603959061
datascience,"This years Data Natives conference will be taking place online. We are seeking volunteers to help out with a range of tasks, most of which can be supported from the comfort of your own home.

Apply here: [https://datanatives.io/volunteer-dn20/](https://datanatives.io/volunteer-dn20/)

We are looking for:

* **Stage managers:** You will be responsible for managing one of our conference stages in Zoom/Remo (supporting speakers, moderators, and attendees with technical questions, sending announcements &amp; ensuring the smooth running of the production).
* **Speaker support:** You will assist our speaker manager by making sure our speakers will be on time for their speaking slots and keep the conference agenda up to date. You will be working closely together with the stage managers. 
* **Social media/marketing support:** You will assist our social media/marketing team with live-coverage and other marketing activities during the conference on our social media channels.
* **Tech support:** You will help out our tech team with the conference live stream.
* **Participant support:** You will be responsible for sending announcements and answering questions of our participants on our Conference Slack channel and in our LinkedIn group. 

Vollunters will receive:

1. A Volunteer certificate confirming your involvement in the conference

2. A small gift from Data Natives: T-shirts, beanies, tote-bags

3. Opportunity and introduction to potential employees, partners, clients

4. A VIP ticket for the conference

5. Special discounts and offers from our partners",Looking for volunteers for the Data Natives Unlimited Conference from 17-19th of November!,1603958483
datascience,,How xsv is ~1882x faster than csvkit (51ms vs. 1.6min),1603955777
datascience,"Hey guys, im new to data analytics/science and currently working on some open datasets on kaggle and using their editor to make my work public, but ive faced an issue using the histplot function. It says: module 'seaborn' has no attribute 'histplot' 

when I try histplot in jupyter and in colab it works fine, but im facing an issue in kaggle. Stackoverflow gave an option of replacing it with displot but that too gives me the same error.  Any help would be appreciated.",histplot (seaborn) not working in kaggle,1603955486
datascience,Hey! I want to make a map to visualize the changes in the number and spread of polling places using a series of maps. What mapping tool is best suited to doing that? I’m mainly looking for a tool which allows me to add multiple tabs to the same tab so users can scroll through the years and compare. Any suggestions would be much appreciated!!,Question: want to visualize how the number of polling places in the US has changed over the years,1603954824
datascience,"After my bachelors I got a couple of internship as an associate data scientist. Although i had a breadth  , i was frustrated with only shallow knowledge of the field in general even though i had my bachelors in CS. After that  i was able to get Masters in AI in good enough college , however now i feel i shouldn't have choosen academia that quickly , i see many of my friends who got the job as Assoc Data Scientist/ML engineer and it really makes me feel that whether I did the right to choose academia and due to no job expierence and extra degree did I shot myself in the foot 

Kindly help me in this, I m feeling really demotivated",Academia or Industry?,1603951333
datascience,,20 Latest Data Science Jobs For Freshers,1603949969
datascience,"Hello,

My place of work has been expanding over the past several years. An unintended consequence of the expansion is a messy CRM. Our IT team has customized SalesForce significantly for our end users. There are several different teams of end users that have all requested features and new fields in the CRM at one time or another.

I currently work as a director of mail and telemarketing, but I've always had a dream of breaking into data. My team lead, the COO, has asked me if I want to build a new team that would responsible for database cleanup, data hygiene, and potentially reporting down the line. 

My main responsibilities would be:
- Standardization and cleanup of the fields in our CRM
- Creation of business rules and SOPs
- Bridging the gap between the end user and IT
- Bringing multiple end users together and resolving any conflicts as it relates to the CRM
- Data hygiene, monitoring where data is coming in and cleaning it up for reporting

My questions are:
1. Is there a job title that closely relates to the responsibilities that are outlined above?
2. Does this position open future opportunities in the data world? I really want to become a data scientist.

Thank you for your help, I know this is a long post.",Bridge Between IT and End Users,1603949831
datascience,,Unsupervised Learning in Machine Learning,1603947475
datascience,,Understanding Basics Of SVM With Example And Python Implementation,1603947429
datascience,,The Path to Becoming a Data Engineer in 2021,1603947406
datascience,,Learn Machine Learning,1603947361
datascience,,Best programming language to learn in 2021,1603947289
datascience,[removed],Looking for moral support - experienced DS feeling atrophied and unqualified in interviews,1603943837
datascience,"I’m a senior in college and I’m pursuing a statistics and data science degree and was wondering what more I could or should be doing as an undergrad. I want to do something regarding data analysis as a career (at least that’s what i’m thinking now) but I have a small amount of coding experience and no work experience. I want to be proactive and do what I can to ensure my future success, I’m just not exactly sure what to do and am very confused. Any piece of advice you guys have would be extremely helpful. Thank you!",advice for senior in college,1603942971
datascience,[removed],Software Engineer to Data Scientist Advice,1603941393
