subreddit,selftext,title,created_utc
datascience,"By CLTV I mean customer life time value.

I recently started a project to profile our customers. Essentially I'm trying to segment them based on behavior as well as create CLTV around each customer.

This is the second time I encounter this type of project and much similar to the last time, I don't have a good use case for segmentation and CLTV, other than looking pretty on the report.

In logic, high value customers should get better service, but in practice we don't differentiate customers because they all receive the best service we could (or try to) offer. And if we hope to identify potential high CLTV, then we run into the chicken-and-egg thing. Is it because we go the extra mile that turn a customer into high CLTV?

So I'm just curious if anyone also does CLTV and customer segmentation and what the use case for them would be.",How do you make use of CLTV?,1592075453
datascience,,Florida fired its coronavirus data scientist. Now she’s publishing the statistics on her own.,1592074675
datascience,"I'm looking to move into the field (learning R and Python for People Analytics purposes), and my current hardware is most likely not going to cut it, so I'm looking at options that can allow me to get a head start on things. I currently have a Dell Latitude e5530 with a shitty processor (i3 3rd) but decent ram (8gb) and about to get a SSD (WD Blue), which I'm guessing will do as I learn the ropes. If you don't have a specific equipment in mind, just mentioning what kind of hardware I would need to make this work is also helpful.

I'm planning on saving up around 500 to $600 for a decent upgrade later on and I'd like some suggestions from people in the field.

Some notes:

- it has to be a laptop. Mobility is a must for me, and relative independence from the power grid on occasion (power outages and power surges are somewhat frequent in my country)
- I can get it in the US and ship it in, since most of the products available are bought and shipped similarly and it wouldn't make a material difference.
- I can wait out until supply becomes more readily available.

I tried r/suggestalaptop and got some valuable feedback there, but I wanted an opinion from people in the field as to get a sense of what I'd need, requirements wise, and Google/Quora is a bit all over the place.

Thank you if you read this, and I hope you have a great day",Suggestions on a starting laptop to get into Data Science (HRIS),1592074442
datascience,,"Actuarial science, data science, and OMSCS",1592070999
datascience,What inspired you to work with animals and how did DS play a role?,Anyone working in conservation / wildlife?,1592070117
datascience,[removed],Who wants to sh*t on my resume,1592069650
datascience,,Do you sometimes wish you could do data science as a hobby rather than a job?,1592066382
datascience,[removed],Which undergrad major between Physics and Maths would help in an eventual Data Science Career?,1592063729
datascience,[removed],Help:: Buying a ThinkPad | Dual boot Linux windows 10 and Data science,1592063008
datascience,,"imdb.com databases were officially available for free (zipped .tsv format), but they are no longer. All data now is behind a paywall of $50000-$600000 USD with only ""free samples"" available.",1592062693
datascience,,Help:: Buying a ThinkPad | Dual boot Linux windows 10 and Data science,1592059943
datascience,,Help:: Buying a ThinkPad | Dual boot Linux windows 10 and Data science,1592059688
datascience,[deleted],What are the pros and cons of Adam optimizer?,1592058793
datascience,,TIME’s “Superforecasters”... See if you can make it through without an eye-roll,1592056965
datascience,[removed],Have you guys joined hackathons before?,1592053874
datascience,[removed],Opinions and Thoughts on BSc in Data Science (long thread),1592051579
datascience,[removed],Opinions and thoughts on DS Bachelor Degree (long thread),1592050766
datascience,[removed],[OC] Data Viz Project: How Much Trump Disbursed For Running For The US Presidency?,1592042911
datascience,[deleted],Where can we find the solution of assignment on compjournalism ?,1592038407
datascience,,"Does any data scientist here have an unusual job? Scientific research, weird company...",1592034139
datascience,"Hi all, I will be doing a MSc in Data Science and Machine Learning this September. I have an undergrad in Physics, currently I am self-studying Statistics and doing the Deep learning courses by Ng.

What areas in Data Science and Machine Learning do you think I should pay attention to during my masters, so that it can be beneficial for my career as a Data Scientist? What advice would you give me in general to maximize my future prospects? I have been applying to DS and ML jobs for the past months with no success, thats why I am asking.",Advices for MSc Data Science,1592034106
datascience,[deleted],"Does any data scientist has an unusual job? Scientific research, weird enterprise...",1592034067
datascience,[removed],HOW DECISION TREES IN DATA SCIENCE ARE BEING USED IN REAL-TIME?,1592029950
datascience,"**Background**

I'm a software dev trying to transition into Data Science.

One of my morning routines has always been to do one or more challenges on codewars.com to keep sharpening my coding skills.

But that site is very heavily focused on traditional software engineering: Working with arrays, strings, algorithms and data structures.

Are there any similar resources but for data science packages and libraries such as pandas, numpy, tensorflow, scikit-learn etc?

**What I want**
I would love to be able to choose a package such as pandas and then be presented with challenges like:

1. Load a CSV into a DataFrame and OneHot encode the ""Grade"" column.

2. Fill all empty values in the ""Age"" column with the mean of the ""Age"" column

3. ... and so on","Is there any code challenge resources like Code Wars for Data Science libraries like pandas, numpy, tensorflow etc?",1592029677
datascience,[removed],"If you have to go back and learn Data Science as a beginner now, where would you start? What courses would you take online?",1592026081
datascience,"I have around 5000 sensors that are independently collecting data. The data I'm collecting is something like:

    ts TIMESTAMP
    humidity FLOAT
    temperature FLOAT
    etc...

I'm currently using BigQuery for this project, and over the last 24 hours my sensors collected around 300mb worth of data.

For my use case, I need to be able to make charts (resampled to 30 minutes, always up to date) about metrics that each sensor collects. My naive implementation involves streaming the data from every sensor into the same table (as they all collect the same type of data), and making a query (every 30 minutes, per sensor) like:


    SELECT ts, humidity, temperature
    FROM &lt;my-only-table&gt;
    WHERE sensor_id = @sensor_id
    -- AND &lt;ts within last 24 hours&gt;

I made a python script to run this query for every sensor, and had the following issues:

- Each query was kind of slow (I think querying 300mb every single time is very inefficient)
- I racked up about $10 worth of costs on my GCP account (just making charts for each sensor _once_)

The inefficiency I've experienced in terms of performance and cost makes me believe that there's a better way. I have found the experience of streaming data into BigQuery phenominal and so I would like to keep using it, however I think there's a lot of room for improvement with how I'm consuming the data for my use case.

On top of general recommendations, I would like to know:

- Would it be a good idea for me to make a table per sensor?
- If I want to make queries to generate charts over timeframes longer than 24 hours, what should I consider?","In BigQuery, what is the recommended approach for storing time series data collected by many (thousands) of independent sensors?",1592024160
datascience,[removed],How to get into Data Science?,1592023314
datascience,[removed],I need to learn about Reinforcement learning in couple of weeks. Any good books or MOOC which I can use to get equipped with at least the basics.,1592016809
datascience,"I am just getting into a data science researcher position after graduation from a maths and cs degree. Just wanted to know what the career paths usually look like for a data science guy when he reaches 40 or 50. Do you move into consultancy/management then? Or just move out of data science to software engineering? 

I ask this as several people burnout due to coding and generally get upgraded positions in terms of time and money. 

I would also love getting some advice to build a stronger career. Taking advantage of the Covid situation to learn the math behind GAN’s and VAE’s right now. Thanks!",Data Science Career Paths,1592015041
datascience,[removed],Multi-threaded efficient preprocessing language?,1592014862
datascience,[removed],Credibility of this Course?,1592013231
datascience,[removed],"1 year of experience, strong technical skills, out of job for 6+ months",1592010872
datascience,[removed],What after ISLR?,1592006409
datascience,,What technical skills did you have when you first became a data scientist?,1592005738
datascience,,What are the best practices to deal with NaN in a dataset?,1592005554
datascience,[removed],How much of your job is building apps?,1592001761
datascience,"I will be working at a HFT firm in August out of undergrad as a data scientist and want to prepare myself by studying Time Series Analysis. The company uses python pretty unanimously and it is also my preferred language, so it would be helpful to have a textbook or some sort of resource that teaches both the theoretical fundamentals of Time Series Analysis as well as implementation using Python.

Is there anything out there like this? As far as math/stats goes, although im decent at math, i'd prefer a book that isn't too advanced. If there isn't a great resource out there, would there be a good one for R that I can use? More concerned with the theoretical steps than the programming since I can always google which libraries to use.

&amp;#x200B;

P.S. I took intro and intermediate level stats courses (and was a TA for intermediate stats) as well as practical Linear Algebra and probability courses. Unfortunately none of these covered much Time Series material other than some basic stuff like DW tests, ACF, patterns (cyclical, seasonal), etc;",Any great textbooks/resources on Time Series Analysis for Python?,1592000346
datascience,[removed],Best resources to learn Topic Modelling?,1591997066
datascience,[removed],Web Scraping and API,1591996009
datascience,[deleted],Best resources to learn Topic Modelling?,1591989660
datascience,[removed],How do I actually get real interview feedback?,1591989027
datascience,[deleted],NLP,1591988259
datascience,[removed],"If we can predict data without training and test why do we train, test and split",1591985702
datascience,[removed],Can you only be a data scientist as an older person?,1591984364
datascience,[deleted],Advice on recruiting DS engineer as partner,1591983967
datascience,"I'm in the process of building a python training program for some non-software engineers. I can make a really solid case for why they should learn Python + Numpy +Matplotlib, but I'm having a really hard time making the case for Pandas.

What are some killer features of the Pandas library that aren't easily achieved with python, matplotlib, and numpy?","Python + Matplotlib + Numpy + Pandas, but why Pandas?",1591981050
datascience,[removed],"Why do you need huge amount of experience to get a job in big data as per the job ads and the book ""Getting a Big Data Job for Dummies""?",1591980273
