subreddit,selftext,title,created_utc
datascience,Resources for learning and creating elegant visuals.,[Question] Does anyone know any good resources for wavelet analysis?,1593907134
datascience,"I start MSc in business analytics in September. Now I have a lot of free time but I don't want to restudy material again. I've taken a few r courses on Udemy and edx but I just get the feeling that I'll be redoing them in college. 


I'm interested in data science, have time to study, just don't know what to study.",What to study before masters starts?,1593903445
datascience,[removed],Can I get Spyder IDE like features in Visual Studio?,1593890215
datascience,[removed],Can I get Spyder IDE like features in Visual Studio?,1593890003
datascience,"When I use a random sample of my dataset, about 10-15% of its size, T-SNE algorithm repeatedly produces visualisations having a shape of a mesh. This behaviour vanishes when I use a bigger sample or whole dataset.

Example figure: [https://i.imgur.com/9a1Eazy.png](https://i.imgur.com/9a1Eazy.png)

The items in my set are represented by an n-dimensional vector, which is a product of a concatenation of two vectors from two different spaces. My guess is that a variation of items from one of the spaces is significantly higher than a variation of items from the other space. I mean that the later one (low) describes items from a more generalised standpoint. Therefore, the apparent clusters are inferred from the low-variational space and the items inside clusters might be organised based on the higher-variational space. I do not know how to verify this hypothesis, though.

Please do not mind colour in the figure, it says nothing.",Is there any particular reason why T-SNE produces a mesh-like visualisation?,1593886523
datascience,"
Okay so hear me out, 2 years ago I stepped into the realms of Data. Now it was an exponential growth from what I was exposing myself towards the field during my college years, and as the adage goes when the going gets tough, well the tough gets going. However I was no tough back then (now? debatable) and I would just get easily lost in the realm of data science studies and kept bookmarking left right anything that I got my hands on to get back ""later""

So what? 

You see I am not a person of structure and for me to review whatever I had collected in a day was like searching for a key in a football ground (real incident, no kidding). I had to solve the problem to build something out that gives me some sense of direction and voila!

[Takkoara](http://www.takkoara.com)

This website enables everyone to grow their knowledge for everything data! (and has all the good stuff on the internet)

P.S. - If you like what you read, I am starting to write stats blog too from a very beginner perspective. And yes I keep adding em into it^ 



TL;DR : Got frustrated with keeping track of multiple bookmarks, created an alternative



Any ideas suggestion on making it better/any feedback in general?",An alternative to bookmarking...errr maybe?,1593886381
datascience,,"If we were not battling an infectious disease, is it bad for your career to NEVER attend holiday parties and other company social events? Does it send a bad message, assuming you are pleasant to work with and are good at your job?",1593885819
datascience,I have a data analytics interview coming up in two weeks and would like to know if there are any resources that would help me to prepare well. Thanks!,Interview preparation,1593883869
datascience,[deleted],PyCharm vs Spyder vs VS Code. Which do you prefer and why?,1593883213
datascience,,I want to become a Data Scientist/Data Analyst.,1593882506
datascience,,How to start with Data Science?,1593881696
datascience,[removed],Data Science Start Up,1593879100
datascience,"Recently I have started to teach myself Probability and trying to build a career in Data science. I haven't had problems picking up Statistics, Linear Algebra, Calculus, Python etc. But I feel utterly hopeless trying to learn traditional Probability. I have always struggled with the subject throughout school and no matter how hard I try, I just don't ""get"" it. (permutations, combinations, cards, balls, arrangements etc). I am totally frustrated with the subject now. It's like I have suddenly hit a wall. Surprisingly I understand Bayesian well though. So, I was wondering how much probability is actually needed to build a career and progress in Data Science domain. I will have to learn it if I totally have to. And if you think it is important can you suggest some good materials which I can read without banging my head against the wall?","How much of probability theory is required for Data Science, ML and Deep Learning?",1593876285
datascience,"Suppose I have variable A that has 2000 entries, Variable B that has 800 entries, and Variable C with 200 entries. How do I assign a weighting scale to these 3 variables such as to give more importance to Variable C than Variable A? I am trying to combine all these variables to calculate a metric which is dependent and based on these 3 Variables but I can't figure out a proper way to distribute them equally.

Edit: This is assuming that the other values for B and C are zero and not null",How to assign weights to multiple variables having different frequencies of occurrence?,1593875542
datascience,https://youtu.be/nlsd2LO-S50,I built a machine learning model and used it with encrypted data using homomorphic encryption. What’s your take on the future of data and privacy?,1593875506
datascience,"In one of Stanford’s CS229 lecture by Andrew Ng (https://m.youtube.com/watch?v=tw6cmL5STuY), he talks about a factor analysis “model” in which is to deal with situations where you have a lot more features than samples in your dataset. He even said he used a modified version of this factor analysis “model” in some recent work he did for a manufacturing company in the lecture.

Now my understanding of factor analysis is just a dimension reduction technique. So how did Andrew used factor analysis to build a “model” which deals with datasets which has a lot more features than samples?",Factor analysis “model” in CS229,1593874294
datascience,"Hi Guys,

I recently switched from Jupyter notebooks to Pycharm and I'm loving it so far.

Was wondering if there are other pycharm users on this sub and what the data science community thinks of the IDE.

Also, what are some interesting add-on's (for ex. Kite) that boost productivity/aesthetics",Any PyCharm Users here?,1593873628
datascience,,Podcasts from world’s leading Data Science and AI experts,1593871134
datascience,"They have an RND backend that deals with databases and infrastructure and then data scientists positions

Thing is, I have little expectations regarding pay or day to day or what I should bring to the table.

Currently I am a sysadmin/application developer.
I think I have a decent chance at the job, as I shadowed and talked to the manager.

Any ideas or thoughts? Not even sure I’d like it!

Thanks",What can I expect in terms of work and pay from a jr. quantitative strategy position?,1593871111
datascience,"My background is different than most data scientist which I am sure will be a major hurdle in my job search. 

My background:

I have a B.S. in mechanical engineering. 
Where I got heavily into programming with Matlab and published so research on a program that measured tendon stiffness.

My grades stood-out and a professor familiar with my interest ask me to come get my masters at a school he was transferring to. 

I am currently getting my MS in transportation engineering, I am conducting research on ML application to traffic data and some deep learning projects for the Georgia department of transportation. I have punished research on ML application.

I wanted to know how likely it would be for my to land a data science job and how I could best prepare?

I am experienced with large data management and cleaning. What else can I do?",I am really interested in data science and I am trying to gear my career towards this field.,1593870812
datascience,[removed],Where can I find geotiff drone images for agricultural purpose,1593870130
datascience,,Elon Musk and Jack Ma debate on artificial intelligence and future technology,1593869225
datascience,"One I was asked at a job interview and didn't do particularly well:

&amp;#x200B;

&gt;A media company makes its money from monthly subscription fees. The company is considering entering the podcast space. How would you measure the impact on customer lifetime value of such a move?

&amp;#x200B;

I guess the trick here is that there's some self selecting behaviour here... you can't really look at the LTV (lifetime value) of users who use the new feature and compare it to users that don't use it, because arguably users who will use podcasts are a-priori different than those who don't. Alternatively, you can say that having this new feature would attract a certain type of (new) subscribers, and hence again it's unfair comparison.

Some ideas I floated:

\- holdout group

\- synthetic controls

&amp;#x200B;

Eager to hear your thoughts!",How to estimate the impact of a new product feature on lifetime-value ?,1593864281
datascience,,Python Data Structures: Beginner Intro,1593856058
datascience,,Shape Your Future with Data Science Masters Degree,1593854323
datascience,"Hi, I have done Bachelor in Economics from La Trobe in Melbourne, Grad Diploma in Accting, Master of Business Analytics (focused on SAP) from Victoria University.I worked for sometime in a financial consulting company before Masters degree and went on to do Data Science certification from Jigsaw Academy. Afterwards, I worked in Data Analyst role utilising Python, SQL, Excel and building on management skills. I have been recently laid off and am considering to upgrade my mathematical knowledge and skills. Apart from Micro + Macroeconomics, I did subjects on Introductory + Intermediate Stats for business, Intro to Quantitative Analysis, Applied forecasting for Economics &amp; Finance, Intro to Time Series Econometrics, Managerial Economics, Financial Risk Management, International Financial Management, in my undergraduate degree. I am looking to connect with senior analytics professionals who could advise me regarding courses to improve my math/stats skills

Would really appreciate your advice. Thanks in advance :)",Build math/stats knowledge &amp; skills for Economics grad,1593852120
datascience,"Hi, I have done Bachelor in Economics from La Trobe in Melbourne, Grad Diploma in Accting, Master of Business Analytics (focused on SAP) from Victoria University.I worked for sometime in a financial consulting company before Masters degree and went on to do Data Science certification from Jigsaw Academy. Afterwards, I worked in Data Analyst role utilising Python, SQL, Excel and building on management skills. I have been recently laid off and am considering to upgrade my mathematical knowledge and skills. Apart from Micro + Macroeconomics, I did subjects on Introductory + Intermediate Stats for business, Intro to Quantitative Analysis, Applied forecasting for Economics &amp; Finance, Intro to Time Series Econometrics, Managerial Economics, Financial Risk Management, International Financial Management, in my undergraduate degree. I am looking to connect with senior analytics professionals who could advise me regarding courses to improve my math/stats skills

Would really appreciate your advice. Thanks in advance :)",Build math/stats knowledge &amp; skills for Economics grad,1593851978
datascience,[removed],PROMINENT ANALYTICS JOB ROLES IN DATA SCIENCE,1593849777
datascience,,Do data analyst/business analyst or consultants use deep learning,1593847222
datascience,,Spotify: Most Streamed Songs (June 2020),1593846059
datascience,Is anyone aware of public data sets where it contains transaction data? Has anyone tried creating a model to predict future spending based on transaction data and if so how did it turn out?,Has anyone tried to use Transaction data to predict future consumer spending behavior?,1593839835
datascience,"Is it normal that the weighting for simple and logistic regression is usually 1/variance? 

Can edit to provide context.",Weighted regression,1593838495
datascience,[removed],"Is it good to go with a master's in data science, when I had completed my bachelor in statistics, and likely to pursue my career as a data scientist. And have scratch knowledge of ML and good at python.",1593836979
datascience,[removed],I Don't Have a Deep Math Background - But I Still Do Apply ML Sometimes,1593833508
datascience,[removed],Help please to find US presidential election polling data by state and nationally,1593832312
datascience,"As in the title, I (24m) am wondering how difficult would it be to get a data scientist job paying 120k+ CAD straight out of Oxford MSc Statistical Science. I have 1 year of experience in a top economic consulting firm's data science division. I took 3 algorithms and software classes while majoring in econ, and math at a top 3 uni in canada.",How difficult would it be to get a data scientist job straight out of Oxford MSc Statistical Science,1593826899
datascience,[removed],Data Science Certification or short term degree,1593826752
datascience,"I am trying to rank feature’s importance in a dataset by calculating its correlation with the target. Interestingly,  after calculating pearsons correlation and the mutual information coefficient and ranking feature importance according to both methods, the 2 rankings seem to be completely uncorrelated. I understand that there are nuances that one method is able to grasp that the other isn’t nevertheless when I run spearmans correlation test on the 2 resulting ranks, the result vividly indicate the data comes from 2 distinct distributions. Anyone has any idea why might this happen?",Best say to rank data using correaltion,1593823998
datascience,"Hi all,
I’m currently finishing up my Bachelors in CS and right after I will do my Masters in Data Analytics. 
Would it be possible for me to get an entry level data scientist or data engineer job right after grad school or is it more likely that I’ll have to start as a data analyst and eventually transition to data scientist or data engineer?",A job after Masters in Data Analytics?,1593822699
datascience,"What's the best way to enter into this field? A bachelor's degree from a school like the University of Oregon, where they offer a data science major with five different domain areas? OR, if you're in a hurry to get to work, already have some programming, calculus, statistics and linear algebra experience, would it be best to pursue the bootcamp route? Would a boot-camper be a valued hiring prospect as an entry level data scientist? Or would you rather have someone on your team with a bonafide college degree? Asking for a good friend.",Data Science Degree or Bootcamp?,1593820635
datascience,[removed],Application for Master's in Machine Learning and Data Science,1593818987
datascience,"I've been researching different masters programs and all seem to have good perks and downfalls.

I'm more interested in the actual science behind data and using it to draw conclusions/predictions.  Im just concerned that if the masters program im currently considering, Texas University at Austin online MSDS, is a good choice overall for what I would like to do career wise. I have very little background in the data field but I do have a B.A. math degree and I'm thinking getting my masters would help me break into the industry. Any and all advice is appreciated.",Is a MS in Data Science a good choice?,1593818167
datascience,"I have been struggling to find implementations for python of K-Medoids.

I only found the pyclustering which lets me precompute a dissimilarity matrix, I am using Gower distance, instead of a inbuilt distance metric.

This would be fine but there are no inbuilt metrics that I can use to evaluate these K-Medoids results. There is the silhouette score but I can't find an example of how to use it with a precomputed distance instead of the euclidean distance, nor the docstrings help to find out how.

Ideally what I wanted was a impletation that would give me the Inertia(within clusters sum of squares) and the silhouette score so I could evalute the number of clusters, instead of having to build my own.

Any suggestions?",K-medoids implementation with python,1593812710
datascience,,"A browser extension that automatically finds code implementations for machine learning papers anywhere on the web (Google, Arxiv, Twitter, Scholar, and other sites)!",1593812618
datascience,[removed],Master Degree,1593808792
datascience,"Someone close in my family recently died of Covid and we all as a family had our mind's just shut-off for days, mine is still numb.

Meanwhile, in parallel, the company which I work for is a digital news platform and has a sudden need to figure out a way to increase engagement in their comments, they want a pure quantitative analysis of past data to tell them a way out and since they are on a loss spree they have threatened to fire me if I don't come up with an analysis in 3 days, I have tried many ways out of this HR wise, but it doesn't bode well for me in long run.

I only have their full-fledged Google Analytics 360 access, and have to use it to somehow to draw some conclusions.

I still am in my blank mind phase with absolutely no creative juices, because of the incident, and thus plead the community to give me some ideas to draw up a story using data, only the optics of the analysis should look good for me to save my job.

I will go to professional medical help **later**, but to pay that bill too I need help on this guys asap.",I need help from all of you at this.,1593806867
datascience,[removed],The term “data science” is embarrassing,1593806133
datascience,[deleted],"Career-wise, how can I pivot?",1593805693
datascience,https://techradicals.wordpress.com/2020/07/04/some-cool-projects-using-tensorflow/,Some Cool Projects Using Tensorflow for Beginners,1593805564
datascience,"I am looking for a career change from mechanical engineering to data science. I have a BS in mechanical engineering, and have been working as a quality engineer for 4 years. I have some programming experience in MATLAB and JavaScript from my engineering coursework. I have strong math, statistics, and communication skills.

I have done some research, and it seems that the most important skills are proficiency in Python, R, &amp; SQL. I am looking for a program that will get me that experience at an affordable cost.

Would a bootcamp program such as udemy be enough with a BS in mechanical engineering to get a job? Or would a master's degree be needed?

My biggest interest is working on the data side of sports statistics or sports gambling. 

Any help would be much appreciated. Thanks!",Looking to Start Data Science Career Path,1593803275
datascience,"**Main Goal:** Be in a position to get software engineering, data scientist, and ML engineering job offers after I leave management consulting.

  
**Secondary Goals:** Spend more time building skills that I can apply to my consulting work, avoid making my colleagues suspect that I want to leave consulting, and get enough product engineering skills to develop my own platform / app. 

&amp;#x200B;

**Timeframe:** 2-3 years

  
**Plan Steps (while working full-time):**

1. I'll continue my [applied ML course ](https://emeritus.org/university-courses-online/applied-machine-learning/) (not self-paced) until it's over in September, taking additional side courses in linear algebra as necessary.
2. After that, I'll take 2 other important python courses to close knowledge gaps - [Python to Access Web Data](https://www.coursera.org/learn/python-network-data?specialization=python) and [Accessing Databases with Python](https://www.coursera.org/learn/python-databases?specialization=python) \- simultaneously (not self-paced, 4 weeks) 
3. After that, I'll resume my [web developer bootcamp course](https://www.udemy.com/course/the-web-developer-bootcamp/) (self-paced), which I started a year ago and I'm halfway through. No ruby, but it covers javascript pretty thoroughly.
4. After that, I'll enroll in a [ML Engineering course](https://www.udacity.com/course/machine-learning-engineer-nanodegree--nd009t) (self-paced but estimated \~3 months) which ideally would build on what I've learned in the previous courses.
5. After that, I'll work on a portfolio of projects that apply web development and machine learning.",Feedback on my plan for upskilling and career transition,1593801236
datascience,,A interactive visual tour of probability distributions,1593798930
datascience,,Interactive Probability Distributions,1593798721
datascience,[removed],Help on CV data science resume,1593794864
datascience,[removed],Is a PHD required to work as a data scientist?,1593794738
datascience,,How to Learn Data science from scratch,1593794217
datascience,,Data scientist/statistician - help with CV/resume,1593793936
datascience,[removed],Is it PhD or no PhD? Is there demand or is it saturated?,1593793832
datascience,[removed],Coding vs WordPress,1593793779
datascience,"Hello. I have this dataset and I would like to apply HDBSCAN.

For learning, I implemented HDBSCAN on a noisy sklearn blobs simulation and it looks great, but I noticed that the cluster assignment is different each time I fit the model, and there doesn't seem to be a \`random\_state\` parameter. I saw [a github issue](https://github.com/scikit-learn-contrib/hdbscan/issues/326) where this point was raised and it was suggested that setting `approx_min_span_tree=False` deals with the issue, but in my own testing this doesn't seem to be true. Is there a way to ensure reproducible results with this?

As a side note, I know it's questionable but what are some recommended evaluation metrics for HDBSCAN?

&amp;#x200B;

Thanks!",HDBSCAN reproducibility?,1593793529
datascience,,How is linear regression applied in Data Science ? I know it is a very broad question but give me simple example. Thanks.,1593792594
datascience," 

Hey guys,

Hope you are doing well. I got laid off from my job due to COVID-19. Please give me any tips/pointers on my resume. I have 2 years of work experience and I am looking for Data Analyst/Data Engineer/ BI Developer roles.

Stay safe. Thanks :)

[Resume Link](https://docs.google.com/document/d/1nfO85WWC8rmfqov5813IAxN57SCuYYUi_6a9yrZO_28/edit?usp=sharing).",Please give your feedback on my resume.,1593792150
datascience,"I am trying to find a standard test for machine learning knowledge. I have a course that I need to develop a basic test for on the following topics:

* Regression
* Classification (logistic only)
* Clustering and document retrieval (measures of similarity, KNN, and K-Means)
* Recommenders (including matrix factorization)
* Deep learning (basic network architecture and transfer learning)

Does anyone know of a good resource out there with a broad set of exam questions that target these topics?",Standard test of ML knowledge,1593791973
datascience,"I started learning data science for two months, did a variety of projects and this week my friend was able to get me into a data science internship, and that's when I realized how much I don't actually know and how daunting it can be. Which is at the same time, fun to keep up with and learn on how to implement a process. Was I wrong to choose this internship this early into learning the subject or should I keep my motivation going with the work that's thrown at me? I hate disappointing people so I'm just hoping things go smoothly for me here","Very new at data science, but luckily got into an internship on a startup company",1593791891
datascience,"Tried plotly but it looks like unless I use the ipywidgets library, I'm stuck with one dropdown. Looking for something that is aesthetically pleasing, interactive and embeddable. Any help would be appreciated, thank you",Python plotting library which allows for multiple dropdowns/widgets to filter data?,1593791660
datascience,"I am almost done with Jose Portilla's Data Science course on Udemy but I am still very unsure and not very confident in Data Science concepts. I hear that most people here are self taught so I thought I'd ask for help. What was the road map you used to completely grasp the concepts? How can I be more intuitive in my approach to projects? How important is it learn the math behind it all? I am basically looking for a roadmap which will allow me to completely understand the concepts instead of just fitting a Dataframe to a model and calling it a day.
Thank you.",Help becoming a Data Scientist,1593791118
datascience,[removed],MacOs or Windows?,1593790814
