subreddit,selftext,title,created_utc
datascience,"Hi! hope you're all doing well

well, my story: I applied for a position as a Data Analyst Intern at a startup, I was given a really long and difficult assessment (Which I was told that I nailed it), and after that, I had 3 interviews, first with the recruiter, short, 15min, the next one was 45 min long with the technical chief (I don't know how it's called, the one who would be my future boss) and the last one 45 min too, but with no other than the COO himself, imo I did well in all of the interviews, I said that I liked to read things like philosophy in my free time besides coding and exercising and my dad told me that's not something I should say but whatever.

I had the last interview december 14th, almost a month ago, And I received no answer, should I still wait? I sent two emails (by a 2 week difference) to the recruiter, with no response at all, although I do get that the recruiters are busy people, I literally don't know if I should still wait or not, I'm still applying for jobs and stuff, but I really really want this internship, is it normal to wait this long?, What I heard was that the program for interns wasn't really planned yet so that may be a reason?, they told me they were going to choose 3 interns but I didn't know how many people make it this far, I assumed that the 3rd interview was just a formality but I don't know now, what do you think?.",1 month since last interview for an data analyst internship at a startup,1610590373
datascience,[removed],Will a Masters in Analytics help my career if I already have six years of work experience?,1610588837
datascience,"Suppose I have a dataset (not literally what I have, but it is very analogous) on library users. So for each user I know what library they use, their gender, age, response to a survey on how happy they are with their library, and number of books in each of several categories they borrowed. There are about 9000 library users spread across a bit more than two hundred libraries, and somewhere between thirty and forty columns (e.g. gender, age, satisfaction with computer services available...), so not a huge dataset, but not so tiny nothing can be done either.

Now there are three complexity levels of the problem at hand:

**Problem 1**: I know there are different types of library -- some are next to a university, and most of their borrowers are students who check out course literature, some serve poorer communities with access to computers, and so on -- but these categories are a little bit fuzzy and I don't have labels for them in the data anyway.

So I'd like to use the data on what categories of book the users are checking out in order to cluster the libraries. The simplest approach would of course be to consider the data of each library along with its mean and variance of all the observations in that data, but this approach seems to waste a whole lot of information in the summarizing step that could have been useful for clustering.

Are there any better approaches to this?

**Problem 2**: Suppose I additionally have some data on each library -- its total budget, number of employees, and size of collection, say. How does the answer change if we want to use this information as well?

**Problem 3**: Suppose I additionally know which municipality each of these libraries is in. This of course unlocks an absolute ton of census data to attach to each municipality -- total population, average incomes, and so on. I figure this really doesn't make it any different from problem 2, but perhaps there are some issues with several libraries sharing the same municipality data? Plus of course the fact that there's a potential deluge of census data, where it's not obvious what is relevant and what isn't.",What is the best way to cluster sets of data?,1610587855
datascience,"I work with REDCap as an administrator on the user support side and have been working on a lot of high level projects at my institution including COVID projects. In order to advance positions will basically need to be created for me and this has already occurred once. My job includes more than just REDCap but it is my primary duty right now and in the future my position may include more data management work especially supporting researchers (mostly clinical for me and this is likely to be where my career path is) and operational support for the institution. 

In order to advance I will also need to earn a Masters degree. 

Would it make sense to pursue a MS in data science with a focus in health analytics? I am considering University of West Florida’s online program which makes sense financially for me.

Due to my circumstances relocating is not an option.",Masters degree program?,1610587660
datascience,"I'm given a fairly high-dimensional dataset (150 columns x 1000 observations) to attempt to model a particular problem. The variables are a combination of continuous and categorical variables. Thus, my task is to select features and create a statistical model (something like general linear model or general linear mixed model).

As I'm in a fairly regulated industry, interpretability is important. Additionally, most of my colleagues are trained in classical statistics but not ML so they'd be more comfortable with an inferential model rather than a predictive model.

I was wondering how feature selection in ML could apply. A simple example would just be to run a decision tree and select the most important features based on GINI. Another could be something like wrapper or embedded methods.

Are these 'acceptable' methods for feature selection in the statistical space? 
Thanks!",ML Feature selection for statistical inference?,1610587483
datascience,"I’m currently working in a very “immature” company when it comes to all things data. I’ve been tasked with some ETL work recently that involves picking up some data and dropping it into a SQL Server dB that they’re calling a data lake. Unfortunately this is the kind of work we have to knock out before getting into more “data science-y” stuff.

I have data ingestion scripts written in Python, and I was wondering what is the best way to put these scripts on an automated schedule and monitor them? I looked into Apache Airflow, but apparently it’s not Windows-friendly. 

I’m looking into Luigi now, could that be viable? Any help would be appreciated.",Python ETL Script Scheduling,1610587065
datascience,[removed],Best online courses for MSc application?,1610586888
datascience,"Can someone please explain to me how this works?

Suppose i have 3 variables: earnings, savings, debt

I have these 3 variables recorded for 1000 people. 

1) How do you check if this data is normally distributed? For a single variable, I could use the kolmogorov-smirnov test. But how would you check if these 3 variables are jointly normally distributed?

2) Assuming that this data is normally distributed, how do you calculate the joint multivariate normal distribution of this data? For a single variable, assuming a normal distribution, i could take all the observations:

Mu = sum(xi)/n .. for all values of n

Sigma = sqrt((sum(xi-mu)^2) / n) .... for all values of n

But if there are 3 variables:

Mu vector: (mu1, mu2, mu3)

Sigma-covariance matrix: (sig11, sig12, sig13, sig21, sig22, sig23, sig31, sig32, sig33)

Is this how you would define the multivariate distribution for this example?

3) does the concept of z score still apply here? Foe a given point (x1, x2, x3) could you define a z-vector : (z1, z2, z3) and take the norm of this vector z = sqrt((z1^2 + z2^2 + z3^2)) ... and define how far this point is away from the center of the multivariate distribution, thus more likely this point is an outlier?

Thanks",Multivariate normal distribution,1610585859
datascience,[removed],Data Science Intern Salary,1610584141
datascience,"I've looked at 5 different implementation on github for a basic Siamese Net (any loss function, any dataset, whatever) and all of them either literally don't train (loss never really drops), or they are so old, the code refactor would be similar to starting from scratch.

Anyone know why this particular network seems so poorly supported by the community? Has everyone just moved on to SimSiam or whatnot?",Can't find any good examples of a Siamese Net anywhere. Why?,1610581798
datascience,[removed],I need some guidance for a school project.,1610580870
datascience,,I need some guidance for a school project.,1610579474
datascience,"Hi all,

I just graduated with my PhD in Chemical Engineering, but my research was in soft matter physics and revolved around using analytic theory, large-scale computer simulation, and machine learning to solve problems. I've published a few applied ML papers in physics and mat. sci. journals,  but I am having difficulties conveying that although my degree is in chemical engineering, I am not a chemist by any stretch of the imagination.

I did a lot of programming during my PhD (making simulations, analysis scripts, and all the ML work), but I am self-taught. So far I have had difficulties with the timed programming test-styled interviews. Should I focus on applying to places where my domain knowledge will be of more use so I can get some experience in the field? Or am I just looking at the wrong job postings? Does anyone know of companies that may be interested in someone like me? Also, are there recommendations on how I should split my time between working on projects, actually filling out applications, and practicing for the programming interview? Any recommendations on prep material would also be greatly appreciated (currently working through Cracking the Coding Interview).

I would appreciate any suggestions, recommendations, or even just hearing your own experiences. I have been going at this kind of blind since I am the first in my group to do ML work and COVID pushed my graduation a bit sooner than expected.

Thank you in advance!

Apologies if this is the wrong place for this type of post.",Recent PhD (Chemical Engineering) trying to bridge into DS/ML.,1610578313
datascience,[deleted],Recent PhD (Chemical Engineering) looking trying to switch to a career in DS/ML.,1610578236
datascience,"In the following video - we demo how you can set up a Plotly graphs at live public url endpoints which are reading data from excel spreadsheets. These spreadsheets can be updated / edited in real time with python code. Here is the output: [https://37493.wayscript.io/](https://37493.wayscript.io/)

Tutorial - [https://youtu.be/2P8qcQQHOeI](https://youtu.be/2P8qcQQHOeI)","Build Hosted Interactive Graphs from Excel Data with Python, Plotly, and WayScript",1610578027
datascience,[removed],"Build Hosted Interactive Graphs from Excel Data with Python, Plotly, and WayScript",1610577828
datascience,,Distributed Machine Learning Applications to Production using Ray &amp; MLflow,1610576665
datascience,,Has anyone here gone through VCU’s Decision Analytics program?,1610575568
datascience,[removed],Best data science route instead of Trilogy?,1610574314
datascience,,Can Apple's M1 help you train models faster &amp; cheaper than NVidia's V100?,1610572345
datascience,"First, I know this industry is flooded with lots of new talent/people trying to get into it without much experience, so I truly apologize for being just another one of those folks. I’m about to graduate and have taken up interest in data analytics/science in the past year. I currently am a teaching assistant for a modeling and simulation course in Python. I have about 3 years working in and visualizing data in Excel and R each (I am not an IT major, but my concentration involves data manipulation, visualization and interpretation).

My problem is that I would like to enter the work force instead of pursuing a masters (right now) because I would like to work on paying down my student loans. At job fairs I have heard that data science internships are usually for college juniors or those in post-grad programs. I think and internship would be both a great/fun way to get more experience in a field I’m interested in and also a way to bolster my resume.

Have you all heard of data science internships for people with a bachelors degree, and who are not entering a post-grad program? Any advice/comments are helpful!",Internship,1610572178
datascience,"Hey all, I have a question I’ve been trouble googling so hopefully someone here could shed some light on it. 

I’m trying to summarize a really long report but I only need the parts where the report mentions certain keywords. Is there a python summarization library that allows the use of keywords as inputs?

All I’ve found online so far are libraries that do keyword extraction.

Thank you all for the help!",Text summarization using Keywords as inputs,1610571658
datascience,"Machine Learning at university:

* Eigenvalues, eigenvectors
* Lagrange multipliers
* KKT conditions
* Optimization in function spaces

Machine Learning at work:

    from sklearn.linear_model import LogisticRegression",University vs Work,1610569199
datascience,"Coming from an Econ background, I'm under no illusions that I'm anywhere near qualified to do real ""data science"", although I've been trying to learn PowerBI/Python/SQL over the last few years to augment my degree and maybe achieve a business/data analyst flavour role when I graduate. Likely I won't land any of these but I'm trying to learn nonetheless for a transition perhaps in the future. 

I've got one semester left and have so far balked at making my degree too stats heavy. Previous to my interest in data, I've been shielding my GPA through more qualitative classes. 

I, however, have already covered in mandatory classes;
* Hypothesis theory
* Correlation analysis
* Bivariate and multiple regression analysis
* OLS
* Model specification
* Analysis of regression disturbance problems, such as autocorrelation and heteroscedasticity
* A fair bit of calculus, etc. that you encounter in microeconomics

Next semester, I'm already registered for a ""Big Data"" course, but also have the option of Applied Econometrics, studying;
* analysis of time series data with particular reference to unit root testing
* cointegration and dynamic modelling
* use of models with limited dependent variables (eg the probit model)

Bit stuck on how to proceed. One one hand, the more qualitative modules are a bit more interesting and give me a greater chance of achieving a high grade. However, econometrics is clearly more useful and I'd probably benefit from real university module rather than learning these skills from a Udemy course. 

What I'm not experienced enough to know is whether this one extra course is worthwhile to make a difference? Without advanced statistics/math/CS, will one more econometrics module even make a difference? I'm lacking any modules in applied math/statistics/etc. Or would such a module be a really good idea while I have the opportunity and could help my future prospects?

Hope my confusion is clear.",How useful is Applied Econometrics?,1610569168
datascience,Like if youre not trying to work at a FAANG,Is this field big on school prestige?,1610564256
datascience,,Thoughts on holding Data Scientists to a higher standard when it comes to basic programming tenets?,1610563234
datascience,"[removed]

[View Poll](https://www.reddit.com/poll/kwmpre)",How many of you do you use Apache Kafka in your job?,1610562924
datascience,[removed],Best Online Data Science courses,1610560356
datascience,[removed],I need advice. Building a career in data science) as a Public Health worker,1610558698
datascience,[removed],Data Engineering - Jobs in Europe for foreign workers?,1610556428
datascience,[removed],Data Engineering - Masters or professional experience to advance career?,1610556229
datascience,"I am considering going back to school online at American Military University. I can pretty much get a degree for free there since I am in the Air Force.

I am posting here because they have a bachelor’s in data science. 

To my knowledge, the majority employees who work in data science hold advanced degrees.

Would getting a bachelor’s degree in data science be beneficial or should I just do something easier/quicker since I will more than likely not end up being a “data scientist.” 

Other options being general information technology or cloud based specific computer technology",Should I get a Bachelors in Data Science?,1610554685
datascience,[removed],Free coupons,1610554075
datascience,[removed],Does salary of a data scientist depend on the sector?,1610554053
datascience,"Been a data engineer for a while now after graduating with a BSc in CS and a MSc in AI, looking to head back to academia for a while before jumping back into the job market. 

I have a really interesting offer from a top tier Geography program where I'd be doing some geographic information science stuff in support of their Urban Studies department, and while I personally am really interested in the project I'm a bit concerned about career prospects. 

The position is less computationally and more geographically focused than I would like but think I'd be able to get a lot out of it regardless given a heavy focus on network science and a possibility I'd be able to leverage some deep learning work as well, even if supervision on that front wouldn't be top tier. Is there a general attitude towards Geography PhDs in the data science industry? Anyone with a similar degree able to comment on how I'd fare after graduation?",How are Geography PhDs viewed in industry?,1610553170
datascience,"I have just finished a few courses of Data Science on [kaggle.com](https://kaggle.com) and Udemy. I am now lost and confused as to what I could do to practice Data Science now. Aside from kaggle competitions, I would like to practice on my own with my own sets of data.   


What do you do to practice DS?  


Any advice would be greatly appreciated",What is the best way to practice Data Science?,1610548294
datascience,"With the drumbeat for big data across the industries getting louder due to the COVID-19 crisis, aspiring data professionals must come to terms with working in the data realm.

Despite people losing jobs during the pandemic, the data science industry still managed to pull through the year successfully as compared to the other industries. The industry had lesser pay cuts, furloughs, and fewer layoffs. One of the major reasons is because most professionals had access to the tools and technologies despite work from home implementation.

As data keeps generating in massive amounts, it is clearly evident that a data science career is a great option to keep your future secure. A report by Analytics Insight states the global big data market is estimated to rise to USD 301.5 billion by 2023 from USD 179.6 billion in 2019.

data science industry, data science career, data science professional, data science programming skills, Deep Learning Algorithms, data scientist skills, data science and big data analytics, best data science certification

[http://www.c-sharpcorner.com/blogs/top-10-musthave-skills-you-need-to-build-a-data-science-career](http://www.c-sharpcorner.com/blogs/top-10-musthave-skills-you-need-to-build-a-data-science-career)",Top 10 Must-Have Skills You Need To Build A Data Science Career,1610543697
datascience,"I am a working profession in an analytical field. My background is in economics but I was always interested in the more statistical oriented components of it. I am interested in pursuing a master in statistics but I would like to keep working.

Are you aware of any online master in statistics or a graduate certification that you can do in part time and is not too pricy ?

Thanks in advance.",Online masters in statistics recommendations ?,1610543471
datascience,,The Python Panda Package Tutorial,1610542409
datascience,"Which regression method causes the ordered coefficients to decrease quickly in absolute value? Lasso lets the coefficients shrink to zero, but I don't know if that has to be in the order of the variables. I also thought about Principal Component Regression, but I'm not sure if you can conclude that the coefficients decrease with the principle components.

Thank you in advance!",Which regression method causes the ordered coefficients to decrease quickly in absolute value?,1610541981
datascience,"Hello there people of r/datascience. I am a computer science engineering graduate from india. I have a coding test with Uber for a business analyst position due in ~48hours. I am proficient in python, R and SQL. After reading blogs and forums it has come to my notice that Uber tests candidates on SQL, excel and G Sheets for their BA roles. Any links/resources to understand the basics of Excel and g sheets for a BA interview would be much appreciated.",Tips for learning Excel in 48 hours.,1610539686
datascience,"1. Define Your Questions
2. Set Clear Measurement Priorities
3. Collect Data
4. Analyze Data
5. Interpret Results
6. Use [**SmartWindows**](https://smartwindows.app/?utm_source=Reddit&amp;utm_medium=Organic-answer&amp;utm_campaign=Web%20Link&amp;utm_content=anna-smith-Reddit-post) to boost productivity",The Data Analysis Process: 5 Steps To Better Decision Making,1610539253
