subreddit,selftext,title,created_utc
datascience,"Hi everyone, I am two years out of undergrad and I work as a data analyst in the finance department of a large tech company (Not a top tech company we just have a lot of employees). I enjoy what I do, which is use R to automate financial reports, do simple time series forecasting on our product revenue, and help with other basic data needs/reports. My end goal was always to use these experiences to get a masters in data science/analytics, but I am not really sure if I am cut out for pure data science positions. I am not a brilliant coder (just do enough to get by and write decent code for what I do), and I’m not sure if I’d ever be comfortable writing custom machine learning algorithms or if I’d even want to. The issue is I don’t want to cap my potential salary, and I’m not sure what the pathways look like after senior data analyst roles. 

My question is has anyone ever gone a different route after senior data analyst/ grad school and not gone the data science route? What would that path look like if there is one?","I enjoy my data analyst position, but I’m not sure if I want to transition into data science later on in my career so what are my career options?",1617926994
datascience,"Does anyone work in event tracking and designing them?

I was wondering if any other data scientists work on eventing (designing schemas) and qa(ing) the events (GTM, Google Analytics, Snowplow etc...) and how much of the job is doing said task?",Does anyone do event tracking at their job?,1617923667
datascience,"I'm going through my MSCS and I'm trying to decide how I want to approach a focus in ML. I have two options: one is to take more generic CS ML and stats courses and the second is to take one or two generic CS ML courses and then take a few more from my school's financial engineering department. The FE department's courses are part of their ""ML in Finance"" grad cert (not going for the grad cert) and they are first and foremost ML and stats courses, it's just whenever there are projects or assignments, we are using financial, economic, market, demographic, etc data. The topics covered in the CS variants and FE variants are nearly identical with some small differences and both departments are well respected.

On one hand I'd thinking staying broad in the masters, covered a few difference domains could be beneficial. One the other hand, I'd like to stay primarily in finance or fintech (not opposed to general tech either) so maybe picking up some domain knowledge could be beneficial and might help me potentially stand out a little.

Are there any pros and cons to pursuing either option? Is there one you'd recommend? Thanks!",MSCS Focus: ML or ML in Finance (FE),1617922700
datascience,[removed],NLP Module - Problem/Solution,1617920566
datascience,"I come from CS, but I have a friend who is in a data science masters program at a no-name school and the program seems to be allergic to unix systems. All their classes are taught assuming Windows is the only OS anyone is using and thus my friend never bothered to learn any unix. 

I've told he should be learning at least how to work around a bash terminal for when he needs to ssh into a server, but I am wondering if that is all he'd need to worry about. Coming from CS, I told him he should just drop Windows all together and install linux but I began wondering how many data scientists actually use or need linux proficiency since I know many need to use Microsoft tools like Excel. 

So it is actually important for data scientists to be proficient on a unix system?",Who here uses Windows as their primary work OS?,1617920253
datascience,"The torchvision.transforms library is used in almost all pytorch CV projects but the documentation is a bit hard to visualize. I threw [an app together](https://pytorch-transforms-builder.chriszhu.me/) for myself that some of my teammates also found useful so I figured I'd share it with the community.

It's built with Streamlit and hosted on google cloud run, which I've found to be a nice way to deploy these kinds of things.

See it [here](https://pytorch-transforms-builder.chriszhu.me/)

Let me know if this is useful for anyone else. I'm happy to spend a few weekends making it better / more helpful!",A Torchvision transforms visualizer,1617919069
datascience,I started working my first job as a data scientist at a small startup and was wondering if other companies developed their own style guides or conventions for producing plots within jupyter notebooks. Something for stylistic consistency as exploration is being done and could be shown off to other team members. Is that something that's done more on an individual basis?,Style Guides for Jupyter Notebooks,1617918210
datascience,"hi all! I want to deepen my undrstanding on Cloud computing and in particular in AWS for what concerns the ML-DS side, so principally SageMaker-SageMaker studios- Endpoints-Training Jobs etc etc

I am almost a complete noob in this field and I would like to get some suggestions about a good tutorial-course-book-blogpost about doing ML-DS in this framework!

Thanks a lot to everyone will help!",SageMaker study material,1617914734
datascience,[removed],Pareto plot,1617913447
datascience,This sub really motivated me to take my undergraduate degree in biomathematics/statistics and turn it into a masters in data science. I use to think I wouldn't have the programing background or that I wouldn't have the technical skills people wanted. It took a lot of my moving past my imposter syndrome as a women in stem and working on my skill set but I've gotten this far. Thank you all so much.,I just got offered a data science internship with Amazon. I've been lurking on the sub for 3 years and just wanted to thank the folks who put together stats/ml cheat sheets.,1617909736
datascience,[removed],Florence the Data Scientist and Her Magical Bookmobile: Children’s Book on Data Science,1617907812
datascience,"
From my last post I learned that data analysts do work in education. Thinking about it now—duh of course they do because how can we improve education without analyzing data? I do have some experience in education as a substitute teacher and academic tutor, but now work in clinical research. I love reading people’s stories about how they entered the field, so can y’all tell me what industry you work in? Why do you like working in that industry? How do you feel you’ve made an impact? Also, how’d you get into the industry you work in?",What industry do you work in?,1617907184
datascience,[removed],Broken Phone Data,1617906056
datascience,"Does anyone know what is the  best or effect way of learning data cleaning and feature scaling?
 It will be really helpful if you give any video link or book suggestion.",How to learn?,1617905392
datascience,"# Udemy instructors giving some of their courses for free. Free Coupon applied at checkout and One-time use only. Offer valid for 2 days Only, [Main Article](https://rajmalhotra-2822.medium.com/premium-python-courses-for-free-from-udemy-151e34fe30ab)

**Share with everyone who doesn't know. Here are the courses:**  


1. *Python 3 Master Course for 2021*
2. *Develop A Covid-19 Live Web App With Python Django*
3. *Python Developer: Python/Django/Flask/PostgreSQL/MySQL/API*
4. *Python for beginners — Learn all the basics of python*
5. *Data Analysis Real-world use-cases- Hands-on Python*

**More Details:** [**Main Article**](https://rajmalhotra-2822.medium.com/premium-python-courses-for-free-from-udemy-151e34fe30ab)",Premium Python Courses for FREE from Udemy. Instructors have made some of their Courses FREE for 2 days due to COVID-19,1617903895
datascience,"Hi all,

I'm in an advantageous yet difficult situation. I have the opportunity to choose between computational dissertation project (Ph.D. in Pharmacology) and an industry role as a Data Analyst at a logistics company where I will be the first of this role and able to direct the initiatives and grow. If I leave for the industry role, I will receive a terminal M.S. degree in Pharmacology on my way out.

 I want to know what is going to serve me better in 5 years if my goal is to be in a position where I get to input on the right questions for the business, manage a team underneath me, perform hypothesis testing, and be able to explore some modeling to predict business relevant metrics (i.e. I'm thinking more straightforward models like predicting project duration, costs, profit -- not some ensemble or super boosted model). In my mind this role exists with the title of Data Scientist/Senior Data Analyst depending on the company (which does not need to be bio-related). *Please correct me if I'm off*. 

To describe my timeline briefly:

1. I entered grad school with the goal of getting my PhD and becoming a medical science liaison (communicates scientific findings and technical knowledge to other researchers, MDs, etc.)
2. This became less attractive after talking to some MSLs -&gt; existential crisis -&gt; recommendation from a professor that I pick up useful skills -&gt; started learning R programming, exploratory data analysis, shored up on inferential statistics, etc. (and found that I really enjoyed the lot)
3. Research into the DS career and communication with many Bio PhD folks turned DS led me to believe that a Bio PhD is only relevant/useful for obtaining at DS job *if* it is accompanied by a project that involves the application of advanced statistics or actual machine learning techniques to the project. *This is my opinion so far.*
4. I struggled with my Advisor A to come up with a project that allowed me to develop those skills and work toward his lab goals
5. I began applying for jobs (DS and Data Analyst, DA).  Around this time, my plight became known to other professors, and one of them offered to be my new Advisor (Advisor B) and let me work on a heavy computational project in his lab. Additionally, one of those jobs has progressed to a final round interview, and I am fairly confident that I will be offered the position.

My question re-stated is **which of these opportunities will be better for me in the long run?** I have described each opportunity more in-depth below if you would like more information.

Other questions for professional data folks in the field: 

* What is your opinion of the usefulness of a PhD that is not in CS, Statistics, Math, DS when applied to a DS or senior DA role? 
* What is your opinion of colleagues with Bio PhDs whom you work with in the DS role?
* @ Bio PhD people who now work DS, what does the landscape look like? Has your PhD benefitted you in *any* way (i.e. useful domain knowledge, stats, ability to get an interview, the way you are treated by colleagues, increased/decreased opportunities, payment and benefits)?

**My current opinion:** 

I have not taken the webscrape LinkedIn or Indeed for data related to all DS/DA jobs approach. My research into these roles, however, suggests to me that an M.S. degree may be sufficient long-term. Most roles ask for either a Ph.D. or an M.S. + X years of experience. I think I may be better off taking an M.S. and getting years of actual experience in the field. Moreover, if I need to do some self-learning to cover machine learning concepts or whatever, I will have more free time to do this with an industry position compared to my Ph.D. work. I'm leaning toward accepting the offer. However, I welcome any comments, suggestions, or insight you all have with the exception of the first bullet below.

**To note:**

* I'm not interested in arguments that fit the sunk cost fallacy -- no one can get any time already spent back, and the time spent is not worthless because of the experience and insight gained
* I'm 26 if that helps
* All my professors are in the know about these opportunities, and steps have been taken to give me the ability to make either decision
* I do not know how long the dissertation project would take if I accepted that project nor do I know where they Profs want to publish -- they do know that I am interested in leaving ASAP and seem amenable to that
* I think both opportunities are equally interesting, and I'm trying to ignore the fact that the industry position comes with a pay increase and likely a better work-life balance. I'm trying to view it through the lens of which is better long-term.

**More information about both opportunities (*****if you're interested*****):**

The industry position is a Data Analyst role on their continuous improvement team. This company is in a position where they are growing and doing well selling machinery and software to improve logistic methods for other companies that move products (i.e. warehousing). They are accumulating data but do not have the know-how to best utilize it. They are even lacking ETL pipelines that pull data from different departments to a centralized data warehouse and then send that data to dashboards or reporting tools (i.e. what I'd call low-hanging fruit). They also have not entirely determined what KPIs to track or what they want to measure moving forward. They have one person with the title ""Master Data Specialist,"" and I would work with this person, *potentially* giving me someone who could mentor me in this role. **What I see** is a great opportunity to direct how they organize and use their data, to have input on what questions are being asked, and the opportunity to say that I helped build up the Data team within the continuous improvement group.

The dissertation project is a project where I will lead the analysis of data from a large multi-omic study.  *Omics is basically an approach where tissue is taken from a sample, put through a big scary bio machine, and hundreds to thousands of X (where X is proteins, genes, lipids, metabolites) are identified and quantified.* *These quantities are comparable across disease groups.* The advisor and his collaborators have multiple tissue types from hundreds of samples categorized by disease group. They have data for proteins, lipids, metabolites, etc. Their idea broadly is to use a network analysis approach to analyze the covariance between these X and determine clusters of related X \[WGCNA\]([https://horvath.genetics.ucla.edu/html/CoexpressionNetwork/Rpackages/WGCNA/](https://horvath.genetics.ucla.edu/html/CoexpressionNetwork/Rpackages/WGCNA/)). These clusters are then summarized using databases of X IDs and their known functions/significance to determine what biological process that cluster broadly represents. These ""scores"" for these clusters can then be compared across disease groups to produce biological insight. Additionally, clusters drawn from each X can be compared to each other X. This project also involves many use cases of hypothesis testing like linear modeling, ANOVA and t-test (or their non-parametric analogs), hypergeometric tests, etc. **What I see** is the opportunity to do some cool research, have experience with advanced statistical techniques albeit mostly used in biology, and obtain my Ph.D. I worry though that this network analysis approach isn't translatable (or more importantly, won't be viewed as translatable) outside of the biological context. I already have lots of experience doing hypothesis testing, so that is covered.

If you've made it this far, I appreciate you reading my novel and thank you for any suggestions you may have.",Which opportunity will be better for me in 5 years? 1) Pharmacology Ph.D. doing a project using WGCNA/network analysis/differential expression on multiple 'omics data or 2) a Data Analyst role with a lot of opportunity to control the direction of the team and learn full stack skills,1617901987
datascience," 

Hi guys,

Need advice on the analytics use case. I have around **60** odd BI reports (cloud based data reports for employees across globe). I need to identify similar ones so that the reports can be merged and number of data models can be reduced.

Data:

Excel sheet with following columns:

Column 1: Report ID (60 reports)

Column 2: Sub category -( reports have been categorized into 4 sub-parts based on usage )

Column 3: Table names which from which data is being fetched Can be more than 1.

Column 4: Names of users who use the report ( not more than 10)

Column 5: Report Field names - SI, CI etc = final columns that we arrive at, after using function etc on the data

Based on these columns/Data for each report, is there a way I can find similar or merge-able reports to reduce the number of data models.

Somebody suggested clustering, but wasn't sure about it.

So is there a Data Science way/method that i can apply here with good enough accuracy. Any advice would be a huge help.

Thanks &amp; Regards",Requesting guidance for a use case,1617901486
datascience,"Hi guys,

Desperately need advice on the analytics use case. I have around **60** odd BI reports (cloud based data reports for employees across globe). I need to identify similar ones so that the reports can be merged and number of data models can be reduced.  

Data:

Excel sheet with following columns:

Column 1: Report ID (60 reports)

Column 2: Sub category -( reports have been categorized into 4 sub-parts based on usage )

Column 3:  Table names which from which data is being fetched Can be more than 1.

Column 4: Names of users who use the report ( not more than 10)

Based on these columns/Data for each report, is there a way I can find similar or merge-able reports to reduce the number of  data models.

Somebody suggested clustering, but wasn't sure about it. 

So is there a Data Science way/method that i can apply here with good enough accuracy. Any advice would be a huge help.

Thanks &amp; Regards",Need advice on the analytics use case,1617901122
datascience,"So I'm currently enrolled in [Eastern University's online MS in Data Science](https://www.eastern.edu/academics/graduate-programs/ms-data-science). I haven't finished the degree yet, but I'm far enough into it that I can give an honest assessment for those interested in enrolling.

# First, the good stuff:

* Eastern University puts their students first. The professors, administrators, and admissions staff at EU have it together when it comes to solving problems and interacting with students. They usually respond to my emails within an hour and give helpful feedback.
* EU is *super* military-friendly. I'm using the Post-9/11 GI Bill to fund my studies. If you have 100% GI Bill, then you get a degree for free and pocket *at least* $15k in stipends. Even if you only have 60% GI Bill like I do, you'll still net around $6k. At Eastern, you only need to take *one class* at a time to qualify as a full-time student, so you can collect that $894/month stipend while only enrolled in a single class. They also offer a $30 per credit discount for veterans and active duty personnel. If you're using tuition assistance while serving, the *whole program* will only cost you $500 out of pocket, which is an *insanely* good deal for a graduate degree.
* Everything is self-directed. No weekly modules. If you burn the midnight oil, you can finish an entire seven-week course in just a week or two! That's quite convenient if you're a full-time working professional with an unpredictable schedule.
* The professor's videos give a clear description on how to use programming languages. I enrolled with *zero* programming experience, but they hold your hand through the whole thing and explain in detail how it all works at a theoretical level. I usually have the instructional videos open in one window and my Python editor open in another so I can pause and play around with it. It's an effective way to learn.

# And, there are a few drawbacks:

* Academically, it's not super challenging. For example, all the assignments can be retaken until you get the grade you want. Also, as an online program, it's possible for an unscrupulous student to cheat their way through, although I have no idea why someone would spend all this money on a degree to learn data science and then just ""coast"" through the program. If you want to gain proficiency with Python, R, statistics, etc., you'll have to practice writing code and crunching numbers on your own in addition to the class assignments. They do, however, provide you with all the learning materials you need to gain proficiency.
* The student account website isn't the most user-friendly. Simply signing up for a new class is a drawn-out, cumbersome process that took me a while to figure out. The learning management system they use, Brightspace, isn't the most efficient either.

# The bottom line:

I know this sounds cliche, but **you'll get out of this program what you put into it**. If you only do the bare minimum to pass each course, you can pay all this money just to get a fancy diploma, but lack the data science knowledge to succeed in the real world. If you go the extra mile and take time to master the material on your own, you'll have a strong enough foundation in data science to get into the industry, gain experience, and build a successful career in a lucrative field. EU's program is a convenient and affordable option for working professionals who want to branch out into data science and have the motivation to work for it.

# And now, I'll answer a few Frequently Asked Questions:

**How much time per week would I need to put in as a student?**  
It varies depending on how much time you need to practice and how many classes you take. Each course is seven weeks long. I've been taking one course per term while working full-time as a civil engineer, part-time as a national guard officer, and taking care of my 9-month old daughter and I still have had plenty of time to finish each class with a few weeks to spare. If you plan ahead each week, it's possible to balance this program with a full-time job.  


**Eastern University isn't as prestigious/high-ranking as (for example) UT-Austin or Georgia Tech. How will employers judge a degree from EU?**  
I wouldn't worry too much about university rankings. Once you're in the industry and have experience, no one cares where you got your degree. You'll also find that many data scientists are completely self-taught and have degrees in unrelated subjects. Some of them don't have degrees at all! For example, my brother attended a bottom-tier, open-enrollment university and studied computer science for a few semesters before dropping out. Even though he never finished his degree, he became proficient at writing code and now makes six figures as a software engineer. All you have to do is get good enough at writing the code to pass a technical interview to make yourself marketable.  


**Do I even need a degree for this career field? Isn't it possible to learn data science simply by watching YouTube videos?**  
Yes, it is possible to learn data science on your own, but the structure of a degree program makes it easier to keep a consistent study schedule. It also gives you something palpable to list on a resume when you start applying for jobs. As I've stated earlier, many private sector tech companies are loose on degree requirements, *however* government and military jobs stipulate certain degrees for their applicants. I currently work for DOD as an engineer, and every time I apply for a new position within our department, I have to submit my transcript along with it. An MS in Data Science can help you land a federal job as a data engineer, operations research analyst, statistician, etc. 

If you have further questions, don't hesitate to ask!",Eastern University - MS in Data Science | My review,1617898846
datascience,"I am a data analyst with 2 years of experience in the industry. Currently working for a large social network. As part of my job, I have been doing quite a few ETL tasks through Airflow. My boss is pushing me to improve my data engineering skills and wanted to know if anyone has any recommendations for tech stacks that I should be adding up. 

&amp;#x200B;

Thanks a lot for sharing your thoughts.",Data Engineering Training Recommendations,1617896319
datascience,"I've been watching the youtube channel Primer for a long time now along with other datascience channels and math channels like 3B1B. 

Question: What kind of role and education would be best for me to get a job doing the things that Primer makes their videos about? I've always felt like my passion was combining CS, Math and some domain but it seems like I lack experience, expertise in a domain, as well as lack the skills in both CS and Math to make myself competitive. 

Context: I have a BS in Math and CS and am currently working in a SWE adjacent position utilizing neither Math or SWE skills on a daily basis. I feel like my production level code has always lacked and try and grind projects on my time off but after a year it(my skills have absolutely grown) seems like i've exhausted myself. I've taken breaks from SWE to work on my math skills(reading datascience/stats papers) but it seems like I get stumped at all the notations and that their is a serious education barrier between understanding what i'm reading(I will say that I do get a general idea of the concept but not mathematical implementation). Basically my issue is not enough skills, education or time to solve the former. My plan was to go to grad school but got a good job offer and took it. I've realized since working that I still absolutely plan on going to grad school but do not want to do it at night/part time. I want to go to a good program and do it right via full time and actually learning the material well. Basically my goal is to become equally lethal in the stats/math and swe side of solving problems. What should a general 5year plan be to get me into the right track and what should that track be?",Determining path - Primer Learning,1617895835
